date,user,text,retweets,favorites,mentions,hashtags,geolocation
2020-04-24 18:15:28+00:00,photoorganizing,"Photo Organizing Solutions ""COVID-19 Pandemic Update"" ",0,0,,,
2020-04-24 18:08:09+00:00,sportsidiocracy,Breaking news: no one who tried the Tide Pod Challenge has contracted Covid-19. Probably.,0,0,,,
2020-04-24 18:05:23+00:00,cgzx,Ok #GÜEE #NMG #Guee Lysol and Dettol manufacturer tells customers not to inject disinfectants as possible treatment for COVID-19 ,0,0,,#G #NMG #Guee,
2020-04-24 18:03:32+00:00,FrederickLangjr,We need congressional calls for investigation of Trump’s handling of the coronavirus.,0,0,,,
2020-04-24 18:02:59+00:00,OsegueraSpencer,"If you had to sacrifice one College Football Team to end Coronavirus right now, which one would it be and why Texas A&amp;M?",1,13,,,
2020-04-24 18:01:38+00:00,Boomer_Patriot,"@washingtonpost reporter notes that isopropyl alcohol, which President Trump says can kill coronavirus on surfaces, costs $2,375 on Amazon ",0,0,@washingtonpost,,
2020-04-24 18:01:16+00:00,cgzx,"Lmao #NMG #Güee #Guee Officials counter Trump’s suggestion that heat, light and disinfectants could be coronavirus treatments ",0,0,,#NMG #G #Guee,
2020-04-24 18:00:43+00:00,cgzx,¡Güee!!!#nmg COVID-19 updates for the US #covid19,0,0,,#nmg #covid19,
2020-04-24 18:00:06+00:00,AnthonyALaurie,"While I agree that face covers are essential to limiting the spread of COVID-19, I do not agree with fining those who do not wear them. Dallas County struck down the fine. Harris County should do the same. Many are out of work as it is and would not be able to afford it. ",0,1,,,
2020-04-24 17:53:43+00:00,Boomer_Patriot,@JoeBiden: Coronavirus ‘Wake Up Call’ To Push ‘Climate Justice’ https://thepoliticalinsider.com/biden-coronavirus-wake-up-call-to-push-climate-justice/ via @TPInsidr Define “climate justice”,0,0,@JoeBiden @TPInsidr,,
2020-04-24 17:51:17+00:00,sharell_marquis,A dude that I’ve been friends with forever had COVID-19! He’s recovered but mannnn,0,1,,,
2020-04-24 17:49:33+00:00,soleplier,How did everyone do on today’s Supreme x Takashi Murakami COVID-19 Relief Box Logo drop? Were you lucky enough to secure one? @SOLEPLIER https://www.instagram.com/p/B_X2HszgVvV/?igshid=1vcbifj66zi7p,0,0,,,
2020-04-24 17:46:43+00:00,emifitz,"Fwiw, I’ve done bleach baths (small amount of bleach in a full bath tub) for EXTERNAL infections from severe eczema as recommended by a dermatologist. Suggesting it could help with covid... ",0,0,,,
2020-04-24 17:39:23+00:00,jeffmarketing1,Everyone Survive Social Media Business Marketing Free 30min Consultation https://jefferysocialmarketing.social5.net/packages/ #contentmarketing #Digitalmarketing #SEO #blogging #marketing #branding #marketingtips #marketingstrategy #coronavirus #covid19 #startup #b2bmarketing #sale #goals #growth,0,2,,#contentmarketing #Digitalmarketing #SEO #blogging #marketing #branding #marketingtips #marketingstrategy #coronavirus #covid19 #startup #b2bmarketing #sale #goals #growth,
2020-04-24 17:24:19+00:00,jordanmbryan,"If you’re looking for ways to take up @POTUS’s cause in exploring the internal use of disinfectants to treat/destroy COVID, go for it. This product is for you! Just insert straw and enjoy! I’ll be the control in this experiment and we can compare results. ",0,0,@POTUS,,
2020-04-24 17:15:51+00:00,EricWFAA,"(2/2) Some on the city’s social media pages call the decision irresponsible and disappointing. Cafe owner Benny Polisi says even 2-3 open tables will help him stay in business. Workers are wearing masks, gloves and distancing tables to prevent the spread of COVID-19. @wfaa – at Benny’s Cafe",5,16,@wfaa,,
2020-04-24 17:07:03+00:00,Alcast10,"""Lysol and Dettol manufacturer tells customers not to inject disinfectants as possible treatment for COVID-19"" ",0,0,,,
2020-04-24 17:06:38+00:00,Dosmuzic,"WTF. Seriously....this your dude huh...silly silly man...@GOP @realDonaldTrump's coronavirus disinfectant comments &amp;quot;dangerous&amp;quot;, doctors say https://news.yahoo.com/trumps-coronavirus-disinfectant-comments-dangerous-111840790.html?soc_src=community&amp;soc_trk=tw via @Yahoo",0,0,@GOP @realDonaldTrump @Yahoo,,
2020-04-24 17:02:10+00:00,LauraHarrisNBC5,"SIGNED | President Trump signs $484B bills to aid employers and hospitals under stress from the coronavirus pandemic in the US Plus updates on coronavirus, including new warming: ",0,1,,,
2020-04-24 16:58:32+00:00,Sethbiley,"Just to put that number in context, 58,000 Americans died in the Vietnam war. People shouldn’t be taking COVID lightly.",0,0,,,
2020-04-24 16:56:37+00:00,Alex_MaldonadoS,+ ¿Tendrás un par de minutos? Comparto colaboración de hoy en “Milenio” @milenio_edomex Búnkers vs covid-19 https://www.milenio.com/opinion/alejandro-maldonado/en-corto/bunkers-vs-covid-19 via @Milenio,0,1,@milenio_edomex @Milenio,,
2020-04-24 16:53:23+00:00,HeyBranielle,My job gave us an additional week of personal time due to covid 19 &amp; still had to have a conference call because people are barely taking off.,0,3,,,
2020-04-24 16:52:36+00:00,ALeSKY21820058,Cause a corona is better with a lime #coronavirus #COVID19 #coronabeer #limedisease – at Walmart Pharmacy,0,0,,#coronavirus #COVID19 #coronabeer #limedisease,
2020-04-24 16:47:08+00:00,Osito1034,High Off My Covid-19 (ft. Ariana Grande) It’ll sound great vocally but the lyrical content... https://twitter.com/dayfrancamacho/status/1253429596508176384,0,0,,,
2020-04-24 16:45:29+00:00,_UrSoREPLACED,Ima need the coronavirus ,1,0,,,
2020-04-24 16:35:20+00:00,tblakeholland,"New video from our Bob Hallmark at the mobile COVID-19 testing site in Carthage. Bob tells us, ""there's not an overwhelming number of people coming to get tested, and perhaps that is a good thing."" You must meet criteria and register before showing up. ",0,7,,,
2020-04-24 16:26:48+00:00,txbaggett,Please wake up @POTUS quit listening to these liberal scientist that have embedded themselves in the #coronavirus task force! They’ve been proven wrong by modeling and now are using fear &amp; misinformation as a weapon to keep you from being re-elected! #bringbackTrump,0,0,@POTUS,#coronavirus #bringbackTrump,
2020-04-24 16:18:51+00:00,DrLynNation,"She sitting there like ""I hope stupidity is not like COVID-19, if so I might be infected. What treatment is there for stupidity. "" ",0,1,,,
2020-04-24 16:05:53+00:00,iamvivekpaudel,It just amazes me how pretentiously the president speaks out about something that he might has no idea. Funny enough injecting bleach will kill the virus which the president is accurate about but with terms of own life? #DisinfectantDonnie #injectingdisinfectant #COVID,0,1,,#DisinfectantDonnie #injectingdisinfectant #COVID,
2020-04-24 15:56:06+00:00,TimR_Jr,Y’all President is telling people to inject Lysol in our bodies to kill coronavirus... ,0,4,,,
2020-04-24 15:50:33+00:00,reid__9,Iconic COVID-19 ft. Lady Gaga @ladygaga lets get it,0,1,@ladygaga,,
2020-04-24 15:40:16+00:00,jvanblargan,BBC News - Coronavirus: Outcry after Trump suggests injecting disinfectant as treatment ,0,0,,,
2020-04-24 15:39:01+00:00,omarmuniz9,Coronavirus: New York Governor Andrew Cuomo delivers daily briefing #Coronavirus ,0,0,,#Coronavirus,
2020-04-24 15:24:46+00:00,jgjaxon,Daylight savings time 2020 is gonna be on Halloween on a Saturday night. If COVID hasn't killed me by then I'm calling in sick. #COVID #Halloween #daylightsavings,0,1,,#COVID #Halloween #daylightsavings,
2020-04-24 15:22:46+00:00,williamliam,"“Go ahead...make my day” said COVID-19. #coronavirus #covid19 #global #pandemic #2020 @Lake Highlands, Dallas https://www.instagram.com/p/B_XlUgeJUQqSg76IplU8Jdm4jAZhc9d8Ha2r2U0/?igshid=iqy2uprb51l9",0,0,,#coronavirus #covid19 #global #pandemic,
2020-04-24 15:22:42+00:00,_UrSoREPLACED,COVID for sure lol ,1,0,,,
2020-04-24 15:21:01+00:00,david_lippman,"The State of Texas just announced a waiver to give money to people who can’t pay their #rent because of #coronavirus. Go to https://www.tdhca.state.tx.us/texans.htm, click “long term rent help,” out in your location, and it will show programs in your area.",0,0,,#rent #coronavirus,
2020-04-24 15:17:55+00:00,DuncanvillePD,"If Covid-19, social distancing, employment, stay at home, or just the constant daily changes and updates are stressing you out then help is available. Please call if you need any assistance. #duncanvillepd… https://www.instagram.com/p/B_XkxAOlhOc/?igshid=1oougwb011jia",0,1,,#duncanvillepd,
2020-04-24 15:17:42+00:00,AgAguerrero50,Lysol and Dettol manufacturer tells customers not to inject disinfectants as possible treatment for COVID-19 ,0,1,,,
2020-04-24 15:11:31+00:00,t_bow20,"Graves Flooding to the Coronavirus, my term has been eventful ",1,28,,,
2020-04-24 14:56:37+00:00,CoachStew06,#Coronavirus cleansing on the go. ,0,0,,#Coronavirus,
2020-04-24 14:54:44+00:00,JeffreyWidyn,This is all the left is looking for. MSNBC’s Nicolle Wallace: Coronavirus ‘Silver Lining’ Is Damage to Donald Trump ,0,0,,,
2020-04-24 14:51:28+00:00,derickijohnson,"I think that if a pandemic can ever be said to have a silver lining, it’s that Covid-19 is deadly enough to take seriously—but not an extinction event. Maybe what we learn will help us survive something much worse, almost certainly just a little further down the road! Nice mask ",0,0,,,
2020-04-24 14:47:52+00:00,tammycv,Help me with a quote for this gif! #disinfectant #Clorox #BLEACH #DonaldTrump #COVID #DisinfectantInjection #PressConference #Covid_19 #TidePods #TidePodTrump #DeborahBirx,0,1,,#disinfectant #Clorox #BLEACH #DonaldTrump #COVID #DisinfectantInjection #PressConference #Covid_19 #TidePods #TidePodTrump #DeborahBirx,
2020-04-24 14:40:39+00:00,kingsam0121,"""Coronavirus: Spain records lowest daily death toll in a month"" #Coronavirus ",1,2,,#Coronavirus,
2020-04-24 14:37:58+00:00,qmuser,There’s so much truth to this. #Covid_19 #DisinfectantDonnie,0,0,,#Covid_19 #DisinfectantDonnie,
2020-04-24 14:34:04+00:00,Tome_Gross,@realDonaldTrump you are so dumb it’s dangerous. You are a national security threat. #IdiotInChief Lysol and Dettol manufacturer tells customers not to inject disinfectants as possible treatment for COVID-19 ,0,0,@realDonaldTrump,#IdiotInChief,
2020-04-24 14:24:50+00:00,NextGenAction,The current risk of contracting COVID-19 in jail has created circumstance in which poverty can lead to a death sentence for someone who hasn't even been convicted of a crime. Continuing to detain individuals in… https://www.instagram.com/p/B_XesC9pxgx/?igshid=q6jmpjds8k2n,0,0,,,
2020-04-24 14:24:38+00:00,Marknovakusa,After the most moronic and dangerous suggestion yet in the latest #TrumpPressBriefing about injection of #disinfectant to kill the #coronavirus and possibly the patient too. Trump is posting a bunch of tweets about world leaders and his high standing. We are bot impressed.,0,0,,#TrumpPressBriefing #disinfectant #coronavirus,
2020-04-24 14:23:30+00:00,claytonsmithlaw,Daily COVID-19 jail count around Texas. https://www.tcjs.state.tx.us/wp-content/uploads/2020/04/TCJS_COVID_Report.pdf – at Lew Sterrett Justice Center,0,0,,,
2020-04-24 14:23:10+00:00,jenhsampson,We are incredibly grateful for the leadership and generosity of Tom and Karen Falk and the @kccorp Foundation! Thank you for your $1 million gift to our #Coronavirus Response &amp; Recovery Fund. https://fal.cn/37BBe #LiveUnitedNTX,1,2,@KCCorp,#Coronavirus #LiveUnitedNTX,
2020-04-24 14:20:10+00:00,Shea_Birdwell,"Austin Bound! #covid_19 #texas #nationalguard #medical #army #sheabirdwellmusic @Dallas, Texas https://www.instagram.com/p/B_XeJ8BBk4M/?igshid=193tvfzxsq5f4",0,2,,#covid_19 #texas #nationalguard #medical #army #sheabirdwellmusic,
2020-04-24 14:19:14+00:00,Heezus35,Pretty fake that I woke up and this covid shit is still here.,0,7,,,
2020-04-24 14:09:19+00:00,ruthellaowens,BBC News - Coronavirus: Disinfectant firm warns after Trump comments ,3,4,,,
2020-04-24 14:07:22+00:00,qmuser,"This definitely proves that you got your PhD out of a Cracker Jack box. That’s the only explanation for you still worshipping at the Alter of Trump after he suggested doctors start researching ultraviolet light, and disinfectant treatment for people with #Covid_19.",0,8,,#Covid_19,
2020-04-24 14:07:18+00:00,tblakeholland,Defense has filed a motion for continuance due to another conflicting case. “We have fallen behind in both cases because of COVID-19.”,0,0,,,
2020-04-24 14:03:24+00:00,qmuser,Are you going to be helping them by making sure they have plenty of supplies for light and disinfectant treatment? #IdiotInChief #Covid_19 #NotADoctor #DisinfectantDonnie,0,0,,#IdiotInChief #Covid_19 #NotADoctor #DisinfectantDonnie,
2020-04-24 13:44:51+00:00,trinnail,"Good morning, you know what time it is? Time for me to research proof against COVID-19 conspiracy therories so I can get into a fight w my mom later when I get bored ",0,12,,,
2020-04-24 13:42:49+00:00,CoolKidMitch,Got scheduled for COVID testing today at 1:30 with Matt. Gotta get strep and flu on top of that so that's exciting. Can't wait to cough and gag all over the poor providers. But it's for the good of the realm!,0,7,,,
2020-04-24 13:40:21+00:00,kattystrite,"If you inject yourself with #disinfectant. . . we can’t be friends but, then if you do— it makes sense now. #Covid_19 #COVIDIOT",0,0,,#disinfectant #Covid_19 #COVIDIOT,
2020-04-24 13:38:41+00:00,RedBootChicken,The Red Booted Chicken Have a blessed morning #FridayFeeling #Texas #FridayMorning #COVID #ArborDay #StayAtHome #FridayMotivation #FeelGoodFriday,1,2,,#FridayFeeling #Texas #FridayMorning #COVID #ArborDay #StayAtHome #StayAtHome #FridayMotivation #FeelGoodFriday,
2020-04-24 13:38:33+00:00,bellesnsunflwrs,"Hey ladies Due to shipping delays affected by COVID, it’s affected my ability to continue projects. I’ll continue to keep y’all updated! My expected launch date was originally April but will be pushed back to mid-May! Thanks for the love, support, and patience ",1,20,,,
2020-04-24 13:36:56+00:00,imrickylamar,Y'all president told y'all to drink bleach and bathe in bleach to not get #Covid_19. What a fuckin dummy,0,0,,#Covid_19,
2020-04-24 13:34:49+00:00,RedBootChicken,The Red Booted Chicken Have a great Friday #FridayFeeling #Texas #FridayMorning #ArborDay #FridayMotivation #COVID #FeelGoodFriday,0,1,,#FridayFeeling #Texas #FridayMorning #ArborDay #FridayMotivation #COVID #FeelGoodFriday,
2020-04-24 13:34:36+00:00,WaylonTate,"In case you need proof that the suggestion of injecting your body with disinfectant to treat #coronavirus weren’t made by the leader of the free world, here’s the receipt. #Clorox #disinfectant",0,1,,#coronavirus #Clorox #disinfectant,
2020-04-24 13:31:45+00:00,A_ARockwall_TX,So UV light and bleach.. hmmm . Just found a tanning bed that will fit in my bathtub. So all I need now is a 55gal drum of bleach. Then I can bathe in bleach and Tan at same time. Problem solved. CoronaVirus Cure . Disclaimer: kids don't do this at home without supervision.,1,1,,,
2020-04-24 13:29:59+00:00,A_ARockwall_TX,So UV light and bleach.. hmmm . Just found a tanning bed that will fit in my bathtub. So all I need now is a 55gal drum of bleach. Then I can bathe in bleach and Tan at same time. Problem solved. CoronaVirus Cure . Disclaimer: kids don't do this at home without supervision.,0,0,,,
2020-04-24 13:29:26+00:00,mbrinkerhoff,Five things to know about the latest #coronavirus relief bill ,0,0,,#coronavirus,
2020-04-24 13:26:07+00:00,ToLivesToLove,I’m interested in knowing how many Muslims that cover their faces have developed COVID-19.,0,0,,,
2020-04-24 13:18:33+00:00,A_ARockwall_TX,So UV light and bleach.. hmmm . Just found a tanning bed that will fit in my bathtub. So all I need now is a 55gal drum of bleach. Then I can bathe in bleach and Tan at same time. Problem solved. CoronaVirus Cure . Disclaimer: kids don't do this at home without supervision.,0,0,,,
2020-04-24 13:17:47+00:00,jvanblargan,A partisan pandemic: How Fox News shaped Trump's coronavirus response https://www.smh.com.au/world/north-america/a-partisan-pandemic-how-fox-news-shaped-trump-s-coronavirus-response-20200423-p54mre.html via @smh,0,0,@smh,,
2020-04-24 13:15:14+00:00,rodeorosary,Virginia wants to allow COVID-19 research with aborted fetal tissue https://www.americanthinker.com/blog/2020/04/virginia_wants_to_allow_covid19_research_with_aborted_fetal_tissue.html#.XqLmLz0BQUE.twitter,0,0,,,
2020-04-24 13:04:52+00:00,D_TheNarcissist,"I agree. My 90 year old mother lives and breathes for Trump. Jesus is on top, Trump is right underneath. I talk to her every morning. Today I know I'm going to have to tell her NOT to drink bleach if she gets coronavirus",0,0,,,
2020-04-24 13:02:09+00:00,DallasAnalytics,Sounds like many more deaths than by COVID-19,0,2,,,
2020-04-24 12:58:30+00:00,jwclark,"From this story: 50,000 Americans have died from COVID-19, and Trump can’t even be bothered to order the flags lowered to acknowledge those that have died ",0,0,,,
2020-04-24 12:50:17+00:00,ordbillw,@GregAbbott_TX Liberate Texas! CoVid is not going away! Open the state and focus on dealing with the virus and stop destroying our lives! #BoycottDemocrats,0,0,@GregAbbott_TX,#BoycottDemocrats,
2020-04-24 12:46:17+00:00,ira93352566,"Tried the Solar Ray's cure, nude, to kill Covid-19 = horrible sun burn on places light don't shine so now... maybe Covid-19 will never get me but neither will sex for 6 months when 3rd degree burns recover. Tomorrow may try gussling boiling water. Peroxide turned my hair white. ",1,1,,,
2020-04-24 12:38:22+00:00,claytonsmithlaw,Dr. Philip Huang said there are currently 118 inmates and 10 jail employees at the Dallas County Jail that have tested positive for coronavirus. ,0,0,,,
2020-04-24 12:21:41+00:00,chestnut_daniel,"""Health Care Workers In Mexico Are Being Attacked Amid COVID-19 Fears"" ",0,0,,,
2020-04-24 12:20:40+00:00,DallasAnalytics,COVID-19 or fear around going to the hospital that is unwarranted outside the hotzones ,0,0,,,
2020-04-24 12:17:44+00:00,chestnut_daniel,"""Officials counter Trump’s suggestion that heat, light and disinfectants could be coronavirus treatments"" ",1,1,,,
2020-04-24 11:59:53+00:00,VctorAcero1,"Acaso la Mineducacion no es del mismo cartel del terrorista del Uberrimo que la Cabal? Siendo así por que estás burócratas no se sientan a hablar. La científica Cabal manifiesta que el COVID 19 no es ni siquiera una gripa fuerte, contradiciendo al Sr. Trump y a la OMS.",0,0,,,
2020-04-24 11:59:48+00:00,GQue2_1911,Retail To Go? Who came up with this shit? The cookie monster #coronavirus #texas,0,0,,#coronavirus #texas,
2020-04-24 11:55:12+00:00,DallasAnalytics,This is true and will take a higher toll but not all SNFs are having a terrible time and they cant just not take COVID-19 patients as hospitals need to discharge their patients somewhere.,0,1,,,
2020-04-24 11:53:22+00:00,ftworthasianmal,"COVID-19 advisory Due to restrictions and precautionary measures in Dallas, TX. I will be available to provide services today at this time. Please contact me directly by text regarding availability T:… https://www.instagram.com/p/B_XNWz3DO4i/?igshid=1xwm6ecgk5n0s",0,0,,,
2020-04-24 11:34:08+00:00,VersusTexas,Inmates testing positive for the coronavirus skyrocket at Fort Worth federal prison ,0,0,,,
2020-04-24 11:14:49+00:00,jdmiddleton55,"Today, you can expect @PressSec to explain why he wasn’t suggesting suicide as a cure for coronavirus. In light of that, I’m re-upping this Facebook post from October 2015: ",0,0,@PressSec,,
2020-04-24 11:12:38+00:00,jdmiddleton55,"Today, you can expect his hangers-on to explain why he wasn’t suggesting suicide as a cure for coronavirus. In light of that, I’m re-upping this Facebook post from October 2015: ",0,0,,,
2020-04-24 08:57:51+00:00,shelleyresists,"You really should STFU at these daily briefings on COVID-19 and let your science and medical experts speak to their respective subjects. You are absolutely revealing your idiocy, even to your fans. BTW, did you have your nightly dose of Clorox before you went to bed last night? ",1,0,,,
2020-04-24 06:57:40+00:00,MikeZiemer,Obviously we all want artists to make as much as possible but I’m gonna let Spotify have this one with the donations. It’s helping and they matched a ton of the first donations. They also are helping with covid-19 relief and doing more than expected.,0,0,,,
2020-04-24 06:43:23+00:00,katdesheva,"is anyone still in shock with what’s happening out in the world? like covid-19, the masks, the protists, no school, no sports, no concerts, no traveling... like...",1,50,,,
2020-04-24 06:19:17+00:00,DemDawson2,This is an excellent insight into the progression of coronavirus in the US. ,0,0,,,
2020-04-24 06:13:05+00:00,dtcc_AF, “One million respirators acquired from China unfit for coronavirus fight..” This is no mistake. #ChinaLiedPeopleDied,0,1,,#ChinaLiedPeopleDied,
2020-04-24 05:54:28+00:00,DemDawson2,This is very informative show of today's coronavirus https://youtu.be/4DJtjyB1gvE,0,0,,,
2020-04-24 05:48:59+00:00,kiirstennicole,"Dear Texas, I know we all want to go back to work, but please please please be aware that it is too soon to open back up. There hasn’t been a lot of improvement regarding COVID-19 and it’s going to cause the cases of the virus to skyrocket. Please I’d rather be safe and healthy.",6,8,,,
2020-04-24 05:18:48+00:00,h_rosie_,If people start putting disinfectants into their bodies to try to combat covid... it’s natural selection luv,0,1,,,
2020-04-24 05:11:10+00:00,ScottGordonNBC5,Arlington Plans Cuts to Make Up For $20 Million in Lost Taxes Due to Coronavirus ,1,0,,,
2020-04-24 04:57:36+00:00,md_kita,What have you Learned during this COVID 19 Pandemic??,0,0,,,
2020-04-24 04:47:16+00:00,iamyourtruelove,This rule is ridiculous. We need every recovered person's plasma to help save lives. #coronavirus #gayrightsareequalrights,1,2,,#coronavirus #gayrightsareequalrights,
2020-04-24 04:33:40+00:00,RCWoodson1,#coronavirus #CoronaCrisis #WorstPresidentInHistory,0,0,,#coronavirus #CoronaCrisis #WorstPresidentInHistory,
2020-04-24 04:28:30+00:00,Ricardomendiola,Did you know leaving debt on your credit cards lowers our credit score? When your scores decrease we become a higher risk. Some credit-card issuers are starting to lower customer spending limits as the coronavirus pandemic leaves millions jobless. ,1,0,,,
2020-04-24 04:25:36+00:00,strawbmommy,"Except under @realDonaldTrump #covid19 health bill, all testing and medical expenses due to the #coronavirus are in fact covered by the government. If you already have out of pocket medical expenses, the government will reimburse. ",0,0,@realDonaldTrump,#covid19 #coronavirus,
2020-04-24 04:19:09+00:00,goyal_rakshit,मकान में नहीं घर में रहो! #TheShamelessIndian #CoronaVirus #covid19 #IndianInAmerica #JustIndianThings #YQ #YourQuote #BeingAnIndianInAmerica Read my thoughts on @YourQuoteApp at https://www.yourquote.in/rakshit-goyal-lrm/quotes/agr-iintt-ptthr-kii-imaart-ko-ghr-bnaayaa-hotaa-shaayd-aaj-795em – at The University of Texas at Dallas (UTD),0,0,@YourQuoteApp,#TheShamelessIndian #CoronaVirus #covid19 #IndianInAmerica #JustIndianThings #YQ #YourQuote #BeingAnIndianInAmerica,
2020-04-24 04:18:37+00:00,PFWRIGHT,Credit Card Companies should be required to lower interest rates! #coronavirus #Congress! #Extreme interest in a low interest rate environment? @realDonaldTrump,0,2,@realDonaldTrump,#coronavirus #Congress #Extreme,
2020-04-24 03:56:23+00:00,cfraze3,Can y’all send my disinfectant injection by way of 5G tower? #COVIDIOTS #covid19 #coronavirus,0,2,,#COVIDIOTS #covid19 #coronavirus,
2020-04-24 03:56:08+00:00,Trito92,A todo esto la señora ya se habrá ido a someter a la prueba del #Covid_19,1,5,,#Covid_19,
2020-04-24 03:53:28+00:00,RunningWaldo,#goodnightworld #darkside #covid_19,0,0,,#goodnightworld #darkside #covid_19,
2020-04-24 03:51:51+00:00,_CoachIrvin,"The only reason for tracking cases is because of the highly contagious nature of #Coronavirus Does the former Mayor understand that #Covid19 is contagious?? I’m no doctor but I don’t recall Cancer, heart disease, or Obesity being contagious?",1,0,,#Coronavirus #Covid19,
2020-04-24 03:51:42+00:00,rob_g12,POST MALONE-NIRVANA TRIBUTE..... FRIDAY!! donations go to United Nations Foundation’s COVID-19 Solidarity Response Fund for the World Health Organization #PostMalone,0,0,,#PostMalone,
2020-04-24 03:29:41+00:00,NiuSanford,"It’s true, and most days I am hoping more people knew our specialty existed...but not in the context of pseudoscience healing rays for COVID...",0,7,,,
2020-04-24 03:17:58+00:00,DemDawson2,It sucks to be pregnant with coronavirus ,0,0,,,
2020-04-24 03:10:00+00:00,jon2bad,A lot of people are saying coronavirus is caused by an imbalance of the humours ,1,0,,,
2020-04-24 03:04:02+00:00,TonysC3DWorld,"Interested how sports athletes not playing but getting pay!How!!!! Are their lives more important than our? #coronavirus #COVID19 @FoxNews @foxandfriends"" the working class that watch them on tv, pay for tickets, and merchandise make them rich.",0,0,@FoxNews @foxandfriends,#coronavirus #COVID19,
2020-04-24 02:56:54+00:00,drchassidygreen,If UV light can cure Covid-19 then I need the government to go ahead and open up the nail salons.,0,7,,,
2020-04-24 02:55:16+00:00,jon2bad,"I can no longer sit back and allow Coronavirus infiltration, Coronavirus indoctrination, Coronavirus subversion and the international Coronavirus conspiracy to sap and impurify all of our precious bodily fluids.",0,0,,,
2020-04-24 02:45:45+00:00,jchoate1,Will you shake hands post COVID-19?,0,0,,,
