date,user,text,retweets,favorites,mentions,hashtags,geolocation
2020-04-25 23:58:03+00:00,emceecram,"And you're Q-ANON, so there's that. My husband is a 30 year resp therapist. Yes the therapies you reference are a thing for very specific needs. There is zero evidence they work against Coronavirus, scientists do not support Trump comments.",0,0,,,
2020-04-25 23:52:57+00:00,BayzWeysi,Before i go in walmart since covid i people watch lmao,0,0,,,
2020-04-25 23:49:34+00:00,EnsPulver1958,Because I just need to get my head out of Trump or COVID-19 for a little while. ,0,1,,,
2020-04-25 23:35:46+00:00,DaVlogtweets,"DRIVE-THRU BANQUET?!? Yes!!! #GoPro #ProSpirit @evan3fitzy @goprospirit #coronavirus #problemsolving #production!! #cheerleading #cheer #working @Pro Spirit, inc. https://www.instagram.com/p/B_bCiEsFz5d/?igshid=1bzgcwvp2al5t",0,0,@goprospirit,#GoPro #ProSpirit #coronavirus #problemsolving #production #cheerleading #cheer #working,
2020-04-25 23:25:56+00:00,tweesoh,either i’m in the wrong profession or just the wrong hospital. i’ve been taking care of covid pts for WEEKS and we’re still not getting any hazard/covid pay. my mom doesn’t even want me to work anymore. at least give me something to pay for my funeral if i don’t make it out alive,0,22,,,
2020-04-25 23:05:05+00:00,FortWorthPapa,States looking for US Legal Taxpaying Citizen bailout. The states that haven’t been able to handle their state budget with overtaxing and continued overspending want a 500+ bl. dollar federal bailout in the next relief package blaming their failure as states on COVID-19. NO! NO! ,0,1,,,
2020-04-25 22:55:30+00:00,mexitaliana777,#truth “ I think #coronavirus may have caused him to swerve into that 18 wheeler.” Cause of death: #covid19 #lies #FakePandemic,0,0,,#truth #coronavirus #covid19 #lies #FakePandemic,
2020-04-25 22:47:48+00:00,Boomer_Patriot,@CNN Strikes an Irony Chord By Having Former Planned Parenthood Head Talking Coronavirus Safety... with Kids ,0,0,@CNN,,
2020-04-25 22:44:32+00:00,Boomer_Patriot,Potential Wuhan Coronavirus Treatment Uses UV Light to Disinfect Lungs ,1,0,,,
2020-04-25 22:44:10+00:00,Boomer_Patriot,Anti-Gun Activist: Gun Purchases Will Cause More Wuhan Coronavirus Deaths or Something ,0,0,,,
2020-04-25 22:43:22+00:00,Boomer_Patriot,@neilpatel Keeping Score: Coronavirus Heroes and Villains ,0,1,@neilpatel,,
2020-04-25 22:39:34+00:00,Boomer_Patriot,Whitmer Sent Unpleasant Text Messages To Dem Lawmaker Who Thanked Trump for Her Coronavirus Recovery ,0,0,,,
2020-04-25 22:38:26+00:00,johnson411david,Random shit you see. @lasalmasrotas #covid_19 #dallas #deepellum #fairpark @Las Almas Rotas https://www.instagram.com/p/B_a7-dOFql7/?igshid=1rqzla6w993s6,0,0,@LasAlmasRotas,#covid_19 #dallas #deepellum #fairpark,
2020-04-25 22:37:55+00:00,Boomer_Patriot,@SecPompeo: China Still Not Cooperating on COVID-19 ,0,0,@SecPompeo,,
2020-04-25 22:35:31+00:00,EnsPulver1958,So sorry about your mom. I hope she is recovering. As the article said these were young healthy people with few if any preexisting conditions. So that is awful. Along with the other lasting complications they are finding with COVID-19.,0,1,,,
2020-04-25 22:29:09+00:00,Boomer_Patriot,Pennsylvania Takes Hundreds of 'Probable' COVID Deaths Off Books After Coroners Come Forward ,0,0,,,
2020-04-25 22:28:27+00:00,Boomer_Patriot,@MSNBC’s Nicolle Wallace Says The ‘Silver Lining’ To Coronavirus Is That It Could Hurt Trump Politically https://thepoliticalinsider.com/msnbcs-nicolle-wallace-says-the-silver-lining-to-coronavirus-is-that-it-could-hurt-trump-politically/ via @TPInsidr,0,0,@MSNBC @TPInsidr,,
2020-04-25 22:26:51+00:00,MootePoints,Weird that the coyote didn’t notice the cameraman stalking him the whole time #StayHome #coronavirus ,0,3,,#StayHome #StayHome #coronavirus,
2020-04-25 22:24:22+00:00,Its_Chavo,Realistically I’m thriving both mentally and physically. Down 57lbs since the beginning of November. I’m actually happy. Despite the Covid bullshit a lot of my plans are following through. I have my goals set and and I haven’t stopped working towards them. ,0,9,,,
2020-04-25 22:21:16+00:00,mexitaliana777, Better not say #KimJongUn died from “surgical” #coronavirus #covid19 #FakeNews,0,0,,#KimJongUn #coronavirus #covid19 #FakeNews,
2020-04-25 22:21:05+00:00,bigkingcole,Enjoying a illusionecigars cruzado that's been aged to absolute perfection What are y'all smoking during this covid quarantine? #cigaroftheday #cigars #cigarsociety #cigarnerd #cigarfetiche #cigarlifestyle… https://www.instagram.com/p/B_a5_MCpZuO/?igshid=1kq7bul6bmx39,0,0,,#cigaroftheday #cigars #cigarsociety #cigarnerd #cigarfetiche #cigarlifestyle,
2020-04-25 22:19:07+00:00,MichaelHugg2591,From The Economist Espresso: The novel coronavirus: life imitates art ,0,0,,,
2020-04-25 22:15:55+00:00,Boomer_Patriot,@AndrewCuomo Admits Trump Was Right to Blast WHO for Poor Handling of Coronavirus [Video] ,0,0,@andrewcuomo,,
2020-04-25 22:00:28+00:00,ethex01,"2020 has been the most historically insane year of our lives: Covid, Australian Wildfires, Trump Impeachment, Kim-Jong Un, treaties breaking, Brexit, Kobe... It’s still April ",1,2,,,
2020-04-25 21:54:11+00:00,JEPHERSONCONH,Hoy es Sábado y hay que mantenerse sano del Coronavirus #SabadosSensuales ,0,0,,#SabadosSensuales,
2020-04-25 21:43:57+00:00,ClaytonNeville,The group Open Texas holds rally in Frisco encouraging the reopening of businesses while #coronavirus restrictions are in place. @570KLIF @WestwoodOne @WBAP247NEWS,0,1,@570KLIF @WestwoodOne @WBAP247NEWS,#coronavirus,
2020-04-25 21:30:05+00:00,Takka_Jordan, What AMC Theaters likely to file for bankruptcy due to COVID-19 shutdown ,0,0,,,
2020-04-25 21:24:40+00:00,ClaytonNeville,These men practice their right to open carry at Open Texas rally in Frisco as some businesses remain closed under #coronavirus restrictions. @570KLIF @WBAP247NEWS @WestwoodOne,0,1,@570KLIF @WBAP247NEWS @WestwoodOne,#coronavirus,
2020-04-25 21:21:00+00:00,CardenMark,"My #afternoonsnack #jellybeans #water att russellstoverus #lifeatatt #weekened #connectedtogether #covid_19 #stayhome @Dallas, Texas https://www.instagram.com/p/B_azHP2DAVg/?igshid=qu3ag2i44dpz",0,3,,#afternoonsnack #jellybeans #water #lifeatatt #weekened #connectedtogether #covid_19 #stayhome #stayhome,
2020-04-25 21:04:36+00:00,foodbitch,"Yesterday I received a press release from an actual company for a product and this was the subject line: “A Sans Bleach Drink that Can Build Your Immunity from Coronavirus, and Won’t Even Kill You” cc: @SeeJaneMarie 1/3",0,1,@SeeJaneMarie,,
2020-04-25 20:59:39+00:00,GoatCarter_,Boys don’t see the severity of this coronavirus still ppl looking at shit they missing out on.,0,0,,,
2020-04-25 20:54:42+00:00,ConservBabes,"Traveling during coronavirus pregnant. We got this baby! Quick question, do you think this is going to become the new norm? Do you think years from now travel and large social gatherings will still require a face… https://www.instagram.com/p/B_awGeXj-Pg/?igshid=25pizasdgac6",0,3,,,
2020-04-25 20:41:13+00:00,GoatCarter_,This how I looked at a woman that told me I wasn’t exactly 6ft away from her. I started to say bitch if you worried about the coronavirus you should’ve stayed your heffalump ass at home ,0,0,,,
2020-04-25 20:23:24+00:00,Mr_Business23,Credit score average and I can change with all this Covid-19 and not spending money. Bout to make some major moves,0,0,,,
2020-04-25 20:18:56+00:00,tomkozlik,"2/2 “Otherwise, we will continue to fly blind through this crisis, a crisis that might last longer than it needs to,” wrote @FareedZakaria #CoronavirusOutbreak #coronavirus #COVID19 #WhenCoronaVirusIsOver #OpenTheEconomy",0,1,@FareedZakaria,#CoronavirusOutbreak #coronavirus #COVID19 #WhenCoronaVirusIsOver #OpenTheEconomy,
2020-04-25 20:17:52+00:00,FriendlyAshley,"With apologies if you may have covered this in an earlier tweet that I might have missed, have you by chance been tested for the coronavirus? ",0,0,,,
2020-04-25 20:13:46+00:00,chestnut_daniel,"""The coronavirus stimulus has $174 billion in tax breaks for the rich"" ",1,1,,,
2020-04-25 20:13:04+00:00,chestnut_daniel,"""People in their 30s and 40s with COVID-19 are dying of strokes, Washington Post reports"" ",1,2,,,
2020-04-25 20:10:38+00:00,_UrSoREPLACED,"Thank God amazon was able to re deliver my package. I hope whoever stole my package gets Coronavirus from it, not die from it though.",0,0,,,
2020-04-25 19:34:00+00:00,rickyraper2014,"Wuhan has seen 50,000 fleeing the scene of the Coronavirus. The trains and planes are packed to leave. The closest nations will see a possible increase of virus.",0,0,,,
2020-04-25 19:24:25+00:00,brooklynbaaby,i really believe covid is going to reach 1 million deaths by the end of the year and that is terrifying,0,1,,,
2020-04-25 19:23:09+00:00,HygiaHealth,"We had a huge COVID care package give away drive-thru for our first responders and clinical team members this past week. It was a huge success. We gave away 500 care packages that included hand sanitizers, mask and… https://www.instagram.com/p/B_aln8-hKkI/?igshid=1slu8pjdjug01",0,1,,,
2020-04-25 19:17:59+00:00,TravisLofley,Very interesting read. Lately this is the part of recovery and mitigation of COVID-19 that has been on my brain the most. How the U.S. will handle any sort of sure of surveillance and contact tracing without unrest is tricky. ,0,0,,,
2020-04-25 19:16:21+00:00,mbusicoflight,Thank you @FoundationWA for lifting our spirits and supporting WA educators! We are all in this together &amp; this stroke of kindness helps plough through this. We will come out stronger and better on the other end! #distancelearning #covid_19 #teachersofinstagram #waexcels,0,4,@FoundationWA,#distancelearning #covid_19 #teachersofinstagram #waexcels,
2020-04-25 19:12:51+00:00,djwaglmuffin,They put a giant mask on the iguana statue at the @FortWorthZoo We just laughed. #COVID19 #coronavirus #CoronavirusLockdown #QuarantineLife,1,1,@FortWorthZoo,#COVID19 #coronavirus #CoronavirusLockdown #QuarantineLife,
2020-04-25 18:53:54+00:00,dramakidstx5,Enjoy this beautiful day.. at this time there is not one part of my body or face I can use to put in this photo thanks a lot Covid-19 ,0,3,,,
2020-04-25 18:46:22+00:00,mffl1224,Maaaan this is dumb! Let's say McKinney open back up you going to see ALOT of Dallas county going there then a week later BOOM coronavirus. ,0,1,,,
2020-04-25 18:43:12+00:00,Tavioso_Rex,"Stay safe and blessed through out these troubling times. #tavioso_rex_u_mf #covid_19 @Dallas, Texas https://www.instagram.com/p/B_ahDYnHvTi/?igshid=1oxi0zodaskjr",0,0,,#tavioso_rex_u_mf #covid_19,
2020-04-25 18:38:18+00:00,daniellestraus,Top Texas Father and Daughter Chefs Open Up About Owning Restaurants in Coronavirus Pandemic https://www.papercitymag.com/restaurants/perini-ranch-steakhouse-easy-slider-texas-restaurants-coronavirus/ #saturdaysmiles #dfw #hospitalityindustry #coronavirus @PaperCityMag,0,0,@PaperCityMag,#saturdaysmiles #dfw #hospitalityindustry #coronavirus,
2020-04-25 18:28:41+00:00,wesco57,Seniors With COVID-19 May Have Unusual Symptoms https://www.newsmax.com/Health/health-news/seniors-symptoms-appetite-fatigue/2020/04/23/id/964353/ #Newsmax via @Newsmax,0,0,@newsmax,#Newsmax,
2020-04-25 18:27:05+00:00,eldarbasically,Coronavirus: I love America,0,0,,,
2020-04-25 18:26:06+00:00,RayCer7,Found a couple of trails in @carrolltontx for me to put my trekbikes to good use! #goodvibes #mountainbiking #covid_19 @Carrollton's Blue Trail https://www.instagram.com/p/B_ae0cgJHD_/?igshid=1u4ji3k91hzvi,0,0,@CarrolltonTX,#goodvibes #mountainbiking #covid_19,
2020-04-25 18:24:30+00:00,maribel_hill,"Grocery store by 7 AM Making more masks- getting there. this is a new simple mask I designed. It’s much faster to make then the COVID-19 pattern. I’ve got a back order, so this is my day. hope you’re having… https://www.instagram.com/p/B_aePgfh4eR/?igshid=vvj63w6y164m",0,0,,,
2020-04-25 18:20:50+00:00,DonJuan9211,When you trying to go out on this coronavirus pandemic lol Game: #DeathStranding Developer: @HIDEO_KOJIMA_EN #VirtualPhotography #VGPUnite,2,2,@HIDEO_KOJIMA_EN,#DeathStranding #VirtualPhotography #VGPUnite,
2020-04-25 18:15:57+00:00,TJ40in1975,Top DHS scientist is now saying Coronavirus slows under heat and high humidity and UV Rays..... so remind us again why parks are closed and we are banned from outdoor activities ,1,2,,,
2020-04-25 18:10:30+00:00,Rosalbaig,"Trump sugiere inyectar desinfectante a enfermos con Covid- 19 y consumir hidroxicloroquina para matar al virus, pero no legaliza la cannabis a nivel federal, porque ""aún no se ha investigado con suficiente profundidad"" ",2,6,,,
2020-04-25 18:04:39+00:00,Toni_Snow_,"Ain’t nobody died from shit else but COVID these last few months. Diabetes, cancer, murder just disappeared in thin air. I smell stat padding.",0,1,,,
2020-04-25 17:59:26+00:00,SlickSlickNick_,Lol mfs in FW don’t give a damn about COVID,1,2,,,
2020-04-25 17:38:13+00:00,mdltx1,"A result of receiving one's M.D. from Trump University! ""Officials counter Trump’s suggestion that heat, light and disinfectants could be coronavirus treatments"" ",0,1,,,
2020-04-25 17:35:27+00:00,dustysdenton,"$5 Mini-burgers are back! AND for covid time only, mini-dillas are STILL HERE TOO! #getyousome #burger #burgers #gourmetburgers #dentoning #denton #dentondelivery #dentontexas #downtowndenton #supportlocal… https://www.instagram.com/p/B_aY2pvnM7g/?igshid=dliunefsimyq",1,1,,#getyousome #burger #burgers #gourmetburgers #dentoning #denton #dentondelivery #dentontexas #downtowndenton #supportlocal,
2020-04-25 17:33:47+00:00,tblakeholland,COVID-19 update from Panola County: Six (6) additional positive cases Cumulative total: 94 Deaths: 6 Recoveries: 7,1,2,,,
2020-04-25 17:32:21+00:00,MPTSonjaABrown,"We now have 18 confirmed cases of CoVID-19 in Glenn Heights; 14 in Dallas County and 4 in Ellis County. Of these 18 confirmed cased, 7 individuals have recovered and 11 are still being monitored. We can stop the spread. Please #StayHome and stay healthy. #WeAreStrong",2,1,,#StayHome #StayHome #WeAreStrong,
2020-04-25 17:28:40+00:00,rohan_khera,"Numbing to think of the magnitude of death w #COVID. Kudos @washingtonpost to not let it just be a statistic While sad, always comforting to get to know the person, not just patient, dying from illness Highlights also what’s at stake here w/o lockdown",1,5,@washingtonpost,#COVID,
2020-04-25 17:21:05+00:00,CdrScottJ,"All those who are so afraid of the Coronavirus that they surrender their natural rights to the state for the illusion of security. Based on my Twitter feed, these are legion.",0,0,,,
2020-04-25 17:04:08+00:00,ladonna_bruce,Saturday morning #coronavirus lockdown with my dog &amp; a good book Reading #AnnRichards biography #LetThePeopleIn ‘The Life and Times of AR’ by #JanReid &amp; reminiscing about the one time I saw her give a speech! @CecileRichards @AnnRichardsSF @AnnRichardsPlay @RRSFIRM,2,3,@CecileRichards @AnnRichardsSF @AnnRichardsPlay @RRSFIRM,#coronavirus #AnnRichards #LetThePeopleIn #JanReid,
2020-04-25 16:45:43+00:00,HOOD_ENT,"COVID-19 ..... Lemonhead Saturday...... #safefashionchoice .... #MomentOfClarity ..... @Lake Highlands, Dallas https://www.instagram.com/p/B_aTm4xn1SIXuAzzIb7rphO7nDR9yPPfEAC6-M0/?igshid=1vzz26syraeri",0,0,,#safefashionchoice #MomentOfClarity,
2020-04-25 16:41:33+00:00,pnelson_bracane,Hydroxychloroquine or Chloroquine for COVID-19: Drug Safety Communication - FDA Cautions Against Use Outside of the Hospital Setting or a Clinical Trial Due to Risk of Heart Rhythm Problems ,0,0,,,
2020-04-25 16:36:57+00:00,TexicanKen,The U.S. officials were aware of COVID-19 but our Orange Prez did nothing. He later joked about it and lied his seditionist head off. ,0,0,,,
2020-04-25 16:30:26+00:00,mojoeherb,"Are these people serious? WTF wrong with people? Eh? C'mon people, don't you have a brain? A spike in New Yorkers ingesting household cleaners following Trump’s controversial coronavirus comments ",0,0,,,
2020-04-25 16:18:17+00:00,NicholeManna,April 25 JPS - 43 patients being treated for COVID-19 - 6 people user investigation - 1 death - 17 employees tested positive at some point. - 165 samples tested positive - 822 negative - 66 pending,1,2,,,
2020-04-25 16:17:21+00:00,Fritzr3309,That is exactly what Trump has advocated for getting ride of coronavirus! From his lips to your glass!,0,0,,,
2020-04-25 16:16:57+00:00,trentsmithsales,I hear COVID time is 10 am. Just sayin...,0,0,,,
2020-04-25 16:16:01+00:00,Fritzr3309,The ones I’ve seen are more like Trump Campaign speeches than coronavirus informative speeches! Equal time shoukd be given the Democratic Candidate!,0,0,,,
2020-04-25 16:12:52+00:00,brianpeters23,"February 28th- President Donald Trump accused Democrats of “politicizing” the deadly coronavirus during a campaign rally here on Friday, claiming that the outbreak is “their new hoax” as he continued to downplay the risk in the U.S. ",0,0,,,
2020-04-25 16:04:50+00:00,TJ40in1975,@ChrisCuomo “I don’t want some fat tire biker getting in my face with his bullshit”. Chris harasses an older man because the man dared ask if Chris should be out since he had coronavirus at the time! We all know this isn’t Chris’s first time losing it ,0,0,@ChrisCuomo,,
2020-04-25 15:58:13+00:00,myemc36,What's your excuse for posting right wing propaganda. That boat was specifically NOT for COVID 19 patients. Big help that turned out to be for those nursing homes.,0,0,,,
2020-04-25 15:57:17+00:00,jeffmarketing1,This is not the End Social Media Business Marketing Free 30min Consultation https://jefferysocialmarketing.social5.net/packages/ #contentmarketing #Digitalmarketing #SEO #blogging #marketing #branding #marketingtips #marketingstrategy #coronavirus #covid19 #startup #b2bmarketing #sale #goals #growth,0,1,,#contentmarketing #Digitalmarketing #SEO #blogging #marketing #branding #marketingtips #marketingstrategy #coronavirus #covid19 #startup #b2bmarketing #sale #goals #growth,
2020-04-25 15:50:52+00:00,gesselleolivaa,Im tired of hearing about the coronavirus,0,1,,,
2020-04-25 15:49:37+00:00,chestnut_daniel,'The sea is stormy and the captain is dancing on the deck': A view from Italy in the time of coronavirus ,0,1,,,
2020-04-25 15:47:02+00:00,TheLeahFrazier,And good morning to the over 30 people in NYC who actually ingested bleach and disinfectant trying not to catch coronavirus.... ,0,1,,,
2020-04-25 15:44:55+00:00,chestnut_daniel,Georgia starts to reopen but nervous mayors warn that coronavirus crisis isn't over ,0,3,,,
2020-04-25 15:39:37+00:00,chestnut_daniel,'They are trying to steal everything.' US coronavirus response hit by foreign hackers ,0,0,,,
2020-04-25 15:34:01+00:00,chestnut_daniel,"No evidence that people who had coronavirus are immune from second infection, WHO warns https://cnn.it/3eQVwrh",0,0,,,
2020-04-25 15:31:52+00:00,chestnut_daniel,"Coronavirus has killed at least 51,000 people in the US, over a quarter of the world's deaths ",0,2,,,
2020-04-25 15:21:35+00:00,CdrScottJ,"While the government response to the Coronavirus is a great evil, our God is able to use it for good.",0,0,,,
2020-04-25 15:15:35+00:00,kayleeeturnerrr,i can’t believe a women cane into my work and told me face to face that she has coronavirus.. wtf is wrong with people. and she told me she’s going on a plane tomorrow,0,1,,,
2020-04-25 15:13:40+00:00,DylanJFoster,An y’all want me to stand out in the COVID and vote for this guy? ,2,2,,,
2020-04-25 15:03:45+00:00,JMACTICKETS,"COVID-19 #ChineseCommunistPartyVirus has CURED MANY DISEASES! No one is DYING from Diabetes, Heart Disease, Obesity, High Blood Pressure, Lung Cancer, AIDS, Vaping or slew of other medical conditions and/or lifestyle choices! Amazing! @DC_Draino @RealJamesWoods @SteveKuclo",0,1,@DC_Draino @RealJamesWoods @SteveKuclo,#ChineseCommunistPartyVirus,
2020-04-25 15:00:10+00:00,AlDiaDallas, | #Coronavirus | Estos números muestran como ha cambiado la vida en #Dallas y #FortWorth. Aquí detalles. https://www.dallasnews.com/espanol/al-dia/dallas-fort-worth/2020/04/23/coronavirus-estos-numeros-muestran-como-ha-cambiado-la-vida-en-dallas-y-fort-worth/,0,1,,#Coronavirus #Dallas #FortWorth,
2020-04-25 14:48:04+00:00,EnsPulver1958,At least this stops him from recommending bogus and potentially deadly COVID-19 cures...at least for a little while.,0,1,,,
2020-04-25 14:42:23+00:00,ClaytonNeville,Long line waiting to get haircuts at Salon A La Mode in Dallas despite cease and desist orders over #coronavirus restrictions. @570KLIF @WBAP247NEWS,9,19,@570KLIF @WBAP247NEWS,#coronavirus,
2020-04-25 14:37:30+00:00,devenpatel0031,News don’t even tell us the weather no more they be like good morning CORONAVIRUS,1,2,,,
2020-04-25 14:31:00+00:00,DallasAnalytics,Growing body of evidence in US suggests many such excess deaths may be result of people who dont have COVID-19 but have other issues like heart attacks and are too scared to go to hospital due to COVID fears and die at home instead,0,1,,,
2020-04-25 14:20:26+00:00,GrProject43X,Jog or Run this coronavirus away... not effective Flush it out... very effective Sweat it out... not effective Rest it out... super effective Pray it out... it does help Good music... boosts your immunity Positive vibes... boosts your immunity #SlapDashSat #AmWriting,2,7,,#SlapDashSat #AmWriting,
2020-04-25 13:57:13+00:00,RichWilliamsGo,"Thank you, — @MarcusEMitchell — @mslindsaypearce — #LaurenAdams — @conradricamora for reading #WashYourHands In The Water my poem, for #COVID19 charities. Music by @Lyle_Workman and talent by @BookCameo and #CameoCares. #StopTheSpread #StayAtHome #StaySafe #coronavirus ",0,0,@MarcusEMitchell @mslindsaypearce @conradricamora @Lyle_Workman @BookCameo,#LaurenAdams #WashYourHands #WashYourHands #COVID19 #CameoCares #StopTheSpread #StayAtHome #StayAtHome #StaySafe #coronavirus,
2020-04-25 13:47:31+00:00,GrProject43X,It’s not safe to think heat (cranking up the heat) or sunlight or shining UV lights on yourself kills coronavirus. What kills the coronavirus mostly is time. -Stay inside if you’re ill -Hydrate -Rest -Treat your fever with an over the counter med #SlapDashSat #AmWriting,0,5,,#SlapDashSat #AmWriting,
2020-04-25 13:43:34+00:00,jon_haley,#advice #SaturdayThoughts #COVID #faith #hope #love #COVID19 #wisdom #wisewords,0,1,,#advice #SaturdayThoughts #COVID #faith #hope #love #COVID19 #wisdom #wisewords,
2020-04-25 13:28:56+00:00,Urbvn_Ghxst,Yeah they did. I stayed in contact with them to via email just so I'd know when to expect it. It did take longer than usual but they worked with me best they could considering all the craziness going on cuz of Covid.,0,0,,,
2020-04-25 13:26:43+00:00,GrProject43X,What no one talks much about is the potential that populations affected by coronavirus are next susceptible to a piggybacking viral attack like the flu or something else. The body gets pummeled by COVID and then bammmm! Staff infection! Or Strep Throat! #SlapDashSat #AmWriting,1,7,,#SlapDashSat #AmWriting,
2020-04-25 13:21:36+00:00,tliou,It’s a beautiful Saturday in Dallas. A mother’s unconditional love for Dallas Police Officer Kevin Thomas. Cheryl spent all morning inflating balloons to celebrate her son’s return to work after a tough battle with COVID-19. He is her hero. @wfaa #COVID19 @DallasPD,14,182,@wfaa @DallasPD,#COVID19,
2020-04-25 13:11:53+00:00,StraussKiesha,For those weddings cancelled due to COVID-19. God is giving you a second chance to think about it ,0,1,,,
2020-04-25 13:11:14+00:00,cakikeith,The comment you made about the decision to take the bullet being based on the groups most affected by Covid 19 was SPOT ON !!!!,0,0,,,
2020-04-25 13:09:20+00:00,NicoleTimerson,"Before COVID, my daughter would get excited for a ""home day"" aka weekend. Now she gets really pumped when it's a ""no work day."" #QuarantineLife",0,0,,#QuarantineLife,
2020-04-25 13:08:56+00:00,GrProject43X,"Don’t drink cleaning and disinfecting products. This will not help you cure the coronavirus. On the other hand, drinking copious amounts of tequila does seem to cure things up. I’m still running my experiments with tequila. #AmWriting #SlapDashSat",0,4,,#AmWriting #SlapDashSat,
2020-04-25 12:55:12+00:00,TVPromoGuy,"This is how my Saturday is going... how ‘bout you? @krispykreme #covid_19 #coronavirus @Dallas, Texas https://www.instagram.com/p/B_Z5OqQnjRf/?igshid=1732uuwuxjvtt",0,0,@krispykreme,#covid_19 #coronavirus,
2020-04-25 12:46:58+00:00,GaryLanePeters1,"Keep in mind people, DOCTORS and NURSES, AND FIRST RESPONDERS caught covid 19. Hospitals we short on masks, gowns, breating machines . EMERGENCY ORDERS were requested to fight this unknown virus that quickly spread accross the world America was prepared for the flu, not both",0,0,,,
2020-04-25 12:37:03+00:00,GaryLanePeters1,Be aware there are scients sayi ng covid 19 stats are similar to the flu. Covid 19 sourrounded the world quickly. A virus noone had seen during the anticipated flu season. The combination of both created the shutdown forcing social distancing. There is no vaccines or cures yet.,0,0,,,
2020-04-25 12:21:27+00:00,thethomasedwin,"One would assume anally inserted ultraviolet lights, and/or Clorox injections would not be recommended for mental/physical ailments or sexual gratification. If you feel this conclusion an error, please DO NOT VOTE. #SavingLives #Power #DoThis #KAG #Covid_19 #GeneralFlynn",0,1,,#SavingLives #Power #DoThis #KAG #Covid_19 #GeneralFlynn,
2020-04-25 12:20:06+00:00,txsportsdoc,Proud of my brother in law an Emergency Medicine doc in California Dr Dan Erickson providing front line perspective on COVID-19 ,82,257,,,
