date,user,text,retweets,favorites,mentions,hashtags,geolocation
2020-05-06 22:20:43+00:00,TheStaceyMonroe,#COVID19 #Coronavirus #Dallas #StayHomeStaySafe #SocialDistancingSavesLives #Transgender #Advocate #LGBTQ #TransIsBeautiful #GirlsLikeUs #TransRightsAreHumanRights,0,1,,#COVID19 #Coronavirus #Dallas #StayHomeStaySafe #SocialDistancingSavesLives #Transgender #Advocate #LGBTQ #TransIsBeautiful #GirlsLikeUs #TransRightsAreHumanRights,
2020-05-06 22:20:42+00:00,TheStaceyMonroe,"For the meantime, she told me to avoid using my nebulizer and try the inhaler instead. She explained that the nebulizer breathing treatments can easily spread covid-19 in the the apartment to my roommates. Instead, I’ll be using my rescue inhaler.",0,1,,,
2020-05-06 22:20:05+00:00,rybaroxaban,So um....Clorox enemas are also not a cure to COVID-19. ,0,0,,,
2020-05-06 22:13:56+00:00,lilcurryboytor,“Hi i lost my job bc of COVID and i’m going through a divorce. What are y’all doing for someone in my situation?” ,0,2,,,
2020-05-06 21:57:52+00:00,GwensListParty,"Covid Traveler #DFW I found yummy taco salad &amp; bubbly. Phew! Drank 4 liters of water, and thought I would not find food until #Nashville in 6 hours. #HappyTraveler",0,2,,#DFW #Nashville #HappyTraveler,
2020-05-06 21:55:23+00:00,Miwahe30,"Released hardened criminals so the jails wouldn’t become over run with Covid, yet she opened her salon to directly defy a judges orders... precedent set for all those who remained closed...",0,0,,,
2020-05-06 21:52:48+00:00,CrestviewCo,"The #BlueAngels showed up and showed out today!! What an incredible salute to all our brave #Covid_19 healthcare professionals, first responders, and essential workers on the front lines! Thank you to all our #HealthcareHeroes! ",0,0,,#BlueAngels #Covid_19 #HealthcareHeroes,
2020-05-06 21:27:56+00:00,theGAVER,Ive watched how you've handled this covid and def lost respect for you. Do better.,0,0,,,
2020-05-06 21:16:26+00:00,BrienRea,"Joining in to thank #TheRealHeroes, and all our healthcare workers on the front lines battling COVID-19, today on #NationalNursesDay. Decided to update the framed jersey name bar hanging on our #GoStars wall...",2,16,,#TheRealHeroes #NationalNursesDay #GoStars #GoStars,
2020-05-06 21:13:09+00:00,blacksooner,#QUARANTINEHAIRCUT #THEJETT #FADEDUP #Covid_19,0,3,,#QUARANTINEHAIRCUT #THEJETT #FADEDUP #Covid_19,
2020-05-06 21:12:21+00:00,jtyoung18,@niro60487270 “The secretary of health says there are about 270 people who may take part in the HCQ clinical trial. She says this was geared to people who were hospitalized due to COVID-19 or the more serious cases.” ,0,0,@niro60487270,,
2020-05-06 21:03:55+00:00,jfu_amy,"Then your choice, your responsibilities! Sign a waiver that you won't trouble the healthcare system when you are infected with Covid 19. You do not need to protest anymore. ",0,0,,,
2020-05-06 20:55:12+00:00,kathylintexas,@POTUS @realDonaldTrump @DavidMuir Y So the Covid-19 tests from the previous administration were broken! This just happened in December of 2019. We are not all stupid like your gullible supporters. #LiveAndLetDie #TrumpLiesAmericansDie #karenkolbsehlke,0,0,@POTUS @realDonaldTrump @DavidMuir,#LiveAndLetDie #TrumpLiesAmericansDie #karenkolbsehlke,
2020-05-06 20:48:34+00:00,JoshDeluna_,Got to see the @BlueAngels loop around Downtown Dallas today in a salute to our frontline workers fighting covid. #AmericaStrong,0,0,@BlueAngels,#AmericaStrong,
2020-05-06 20:37:30+00:00,avabird42,They will find a way to say people didn’t actually die from covid. Groundwork already being laid with number disputes of cdc numbers being inflated.,0,1,,,
2020-05-06 20:35:57+00:00,avabird42,"Yes I’ve had people telling me the “real” death from covid numbers are around 12,000. It’s really sad.",0,3,,,
2020-05-06 20:35:02+00:00,Thalassatx,About 2% of the population is a low estimate for COVID.,0,1,,,
2020-05-06 20:28:59+00:00,AdamBazaldua,For weeks I have expressed our need for more testing & for a conscious effort to provide more resources to our brown & black communities given data of the disproportionate impact by COVID-19. Thanks @DallasCityMgr &amp; @kroger making this happen! #equity,9,18,@DallasCityMgr @kroger,#equity,
2020-05-06 20:27:26+00:00,michael_lummus,"Good, I hope she has to use that money to pay for the healthcare costs of her clients who get COVID-19. Or at least pay for their funerals.",0,1,,,
2020-05-06 20:25:53+00:00,IlaBWilliams1,In addition to the Coronavirus. There are so many other issues the American voters have with Trump.,0,0,,,
2020-05-06 20:22:31+00:00,IlaBWilliams1,"I think the deaths related to the Coronavirus is much, much higher.",0,0,,,
2020-05-06 20:13:17+00:00,WillTCee,"Coronavirus, killer hornets, meat shortage.. 2020 wild.",0,4,,,
2020-05-06 20:13:11+00:00,tmebulldogs,We absolutely love our @tmebulldogs teachers and appreciate how they go above and beyond everyday to meet the needs of students! Happy Teacher Appreciation COVID-19 version @RISDACE #risdsaysomething,2,13,@tmebulldogs @risdace,#risdsaysomething,
2020-05-06 20:10:29+00:00,IIILindsay,"And once again @RepJerryNadler shows what a fuckwit he is. Heres a thought Herry, GIVE THEM YOUR SALARY AND ALL THE BRIBES U HAVE COLLECTED!! House Dems drafting new 'multitrillion-dollar' coronavirus relief bill ",0,0,@RepJerryNadler,,
2020-05-06 19:56:08+00:00,kingsam0121,"""Coronavirus: WHO warns nations against lifting lockdown restrictions too hastily"" #Coronavirus ",3,3,,#Coronavirus,
2020-05-06 19:55:30+00:00,TheNPCWorldwide,"By tx_bodybuilding --------------------------------- DALLAS HAS BEEN RESCHEDULED We are saddened at the fact that Covid-19 has affected so many of us, including the Dallas UBU Expo &amp; Europa Games. Unfortunately,… https://www.instagram.com/p/B_2-EaGjqnY/?igshid=wucz72goajz4",1,1,,,
2020-05-06 19:46:29+00:00,pedallas49,"Want to keep those numbers of COVID-19 low, hoping to get Trump reelected.",0,0,,,
2020-05-06 19:45:40+00:00,beyoncefanacct,"like, they said my order was gonna be delayed due to covid and the spring sale but i didn’t think they meant ~this~ delayed",0,1,,,
2020-05-06 19:27:40+00:00,Thalassatx,And I don't think the first two months of the Civil War killed as many people as we've lost to COVID in it's first 2 months.,0,0,,,
2020-05-06 19:26:27+00:00,MemphisGrand,We Were Fortunate to Have a Beautiful Flyover by The Blue Angels today in Fort Worth! A Salute to Frontline COVID-19 Responders! @usnavyblueangels #AmericaStrong #GoAmerica #GoUSA #MadeInUSA #MadeInAmerica #FortWorth,0,2,,#AmericaStrong #GoAmerica #GoUSA #MadeInUSA #MadeInAmerica #FortWorth,
2020-05-06 19:16:43+00:00,Tigerpug,Anyone discussing the coronavirus and its potential complications with knowledge of the subject is preferable to that moron.,0,2,,,
2020-05-06 19:16:17+00:00,pedallas49,"Here's the counter: While COVID-19 started in China, Trump is responsible for how it's being mishandled in this country. Shame on him for always blaming others for his failings.",0,0,,,
2020-05-06 19:11:14+00:00,RonHearne,Some of these conspiracy theories are so crazy... guessing the next one will be that COVID-19 is a vegan plot to shut down meat processing plants and force us all to non-carnivorous diets...,0,3,,,
2020-05-06 19:09:26+00:00,AlexMoosePerez,Might Mo Hooker dont fk around when it comes to #coronavirus He will straight up Jack that #corona ass up here in #dallas for us! #art #mural #graffiti @Trinity Groves https://www.instagram.com/p/B_24zTCnRpT/?igshid=pzuaxwzq0jx6,2,0,,#coronavirus #corona #dallas #art #mural #graffiti,
2020-05-06 19:04:23+00:00,maddogblues,#ExposeCBS Michigan Health Center Workers Stage “Fake Patients” In COVID... ,2,2,,#ExposeCBS,
2020-05-06 19:00:18+00:00,los_maestros,I have a friend who was on a ventilator and sedated two weeks; hospital for 4 weeks. He has recovered. It was touch and go for a while. He had COVID-19.,0,0,,,
2020-05-06 18:59:41+00:00,keith72504,"Yes, my cousin had the coronavirus. Fortunately, he recovered and he's doing well now.",0,1,,,
2020-05-06 18:58:24+00:00,williamtincup,It was a sharp departure from the borrowed posh Ritz Carlton robe that I wore for the first month of COVID. Sharp.,0,1,,,
2020-05-06 18:57:02+00:00,Tigerpug,He’s already bored with the coronavirus. He needs to see what else is out there in the world that he might know something about.,0,0,,,
2020-05-06 18:54:32+00:00,jurysch,"The only thing I can think of to address this is the fact that 9/11 was a very visual thing, with the towers falling, the planes themselves. We could easily understand all the devastation. COVID kills as many people every day, but we can’t see their last breaths on TV. ",0,0,,,
2020-05-06 18:29:57+00:00,laaaura10,Soooo over these online classes online classes &lt; classroom class. Thank you COVID ,0,0,,,
2020-05-06 18:27:32+00:00,stretchc19,"US Navy Blue Angel flight demonstration squadron fly by over Euless this morning as a tribute to health care workers during #covid_19 #pandemic. #blueangels #flyover #VikingBeard #thebeardstruggle @Euless, Texas https://www.instagram.com/p/B_20AQUjANH/?igshid=12qk8ndxwyszt",0,0,,#covid_19 #pandemic #blueangels #flyover #VikingBeard #thebeardstruggle,
2020-05-06 18:17:02+00:00,winecrimee,"I like personally knowing front-liners i.e. paramedics in my family, friends that are doctors who are sharing their covid snaps with me, firefighter uncles who tell heartbreaking stories with me on what they’re seeing. Y’all help me not look like a 5G paranoid schizophrenic.",0,0,,,
2020-05-06 18:12:58+00:00,LorieBlair22,"Listening to Dallas City Council budget talks. Life, spending and services available in this city are going to change. Blame it on COVID-19! The city has tried to support the citizens but things will have to change.",1,2,,,
2020-05-06 18:12:28+00:00,hayden_pdga,Great talk with @PaulUlibarri on the impact of COVID-19 on #discgolf for the summer issue of DiscGolfer. Of course I had to ask him about #TheLastDance too.,0,3,@PaulUlibarri,#discgolf #TheLastDance,
2020-05-06 18:11:59+00:00,MSMSLib,Apparently Texans( Roanoke ) are immune to Covid. I wear one every time I leave my home but I am not seeing others do so. And some places are crowded! I’m looking at you Costco! ,0,0,,,
2020-05-06 18:10:47+00:00,actingclipz,Wake up folks. Your rights end where the next person's nose begins. Get over your selfishness... See how a mask affects how a cough travels https://www.cnn.com/videos/health/2020/05/04/cough-coronavirus-masks-kaye-pkg-vpx.cnn ***** Here's why some people are not wearing masks during the coronavirus crisis http://a.msn.com/05/en-us/BB13Ek25?ocid=st,0,0,,,
2020-05-06 18:10:22+00:00,MyDallasHyundai,"Today the Blue Angels' flew over North Texas to honor health care workers, first responders and other essential roles in the COVID-19 pandemic. #bobstallingshyundai #blueangels #inthistogether #americastrong… https://www.instagram.com/p/B_2yCighlS1/?igshid=9be13d2cuvqr",0,0,,#bobstallingshyundai #blueangels #inthistogether #americastrong,
2020-05-06 18:07:15+00:00,SportsDocGarff,Really helpful graphical summary of cardiac evaluation of athletes post COVID-19 #SportsMedicine #COVID19,2,2,,#SportsMedicine #COVID19,
2020-05-06 18:06:53+00:00,RitaCook13,Watched the #blueangels fly over #downtowndallas this morning while standing on the #margarethuntbridge - the flyover was in honor of all the #covid19 #coronavirus frontline workers. The wetlands below the bridge… https://www.instagram.com/p/B_2xlTkpDIy/?igshid=18gs8e4ed02mv,0,0,,#blueangels #downtowndallas #margarethuntbridge #covid19 #coronavirus,
2020-05-06 18:06:49+00:00,bensemchee,What if there was a cure for all Covid virus’s? How would you deliver to the masses without telling them they have been poisoned by their Government for generations? ,4,24,,,
2020-05-06 18:04:42+00:00,RitaCook13,Watched the #blueangels fly over #downtowndallas this morning while standing on the #margarethuntbridge - the flyover was in honor of all the #covid19 #coronavirus frontline workers. The wetlands below the bridge… https://www.instagram.com/p/B_2xY_rJMoO/?igshid=1aa5zxaco25ri,0,0,,#blueangels #downtowndallas #margarethuntbridge #covid19 #coronavirus,
2020-05-06 18:03:55+00:00,jerrybo98140307,How about the judge going to jail to show how safe it is . They have hundreds of coronavirus cases so isn’t that cruel and unusual punishment ?,0,0,,,
2020-05-06 17:59:45+00:00,tedforbes,The @BlueAngels Fort Worth flyover honoring workers on the Covid-19 front. – at Foster Park,1,41,@BlueAngels,,
2020-05-06 17:56:47+00:00,SharonR63261163,"My sister in Arlington, TX was able to record the Blue Angels flyover today for tribute to frontline workers during this time of Covid 19. – at Bowman Springs Park",0,1,,,
2020-05-06 17:55:03+00:00,shelbykay29,I just went to the testing site that I was directed to on our States Covid web site after @JohnCornyn tweeted that we have plenty of tests. Guess what? It was an out of business ER. I guess Cornyn is just another lying @GOP,0,0,@JohnCornyn @GOP,,
2020-05-06 17:54:51+00:00,Texican24,"My daughter & grandson had the opportunity to see the @BlueAngels fly over downtown Dallas! Hope this inspires my grandson! And God bless our medical personnel on this Covid-19 frontline! I feel the need, the need for speed! ",0,1,@BlueAngels,,
2020-05-06 17:51:15+00:00,jeffmarketing1,"Key Word, “TOGETHER” Social Media Business Marketing Free 30min Consultation https://jefferysocialmarketing.social5.net/packages/ #contentmarketing #Digitalmarketing #SEO #blogging #marketing #branding #marketingtips #marketingstrategy #coronavirus #covid19 #startup #b2bmarketing #sale #goals #growth",1,1,,#contentmarketing #Digitalmarketing #SEO #blogging #marketing #branding #marketingtips #marketingstrategy #coronavirus #covid19 #startup #b2bmarketing #sale #goals #growth,
2020-05-06 17:38:58+00:00,GSiVed,Curious to get your hands on the Covid tracking app that @rc_says showcased in his session at #MSBizAppsSummit?! Checkout the amazing soln @rezadorrani built with geo spatial map components!,4,10,@rc_says @rezadorrani,#MSBizAppsSummit,
2020-05-06 17:37:12+00:00,happyplacetrvlr,"Blue Angels, Dallas flyover honoring healthcare workers saving lives during this COVID-19 outbreak. May 6, 2020. Beautiful tribute to beautiful people. ",4,13,,,
2020-05-06 17:33:02+00:00,sidelinepros,"The Navy’s Blue Angels fly over the Dallas-Fort Worth area to honor health care workers, first responders and other essential roles in the COVID-19 pandemic. Copyright © 2020 by Steven Leija/Sideline Pros #navy… https://www.instagram.com/p/B_2txANgkze/?igshid=18c5f1dw3viem",0,0,,#navy,
2020-05-06 17:32:06+00:00,sidelinepros,"The Navy’s Blue Angels fly over the Dallas-Fort Worth area to honor health care workers, first responders and other essential roles in the COVID-19 pandemic. Copyright © 2020 by Steven Leija/Sideline Pros #navy… https://www.instagram.com/p/B_2tqOCA4bk/?igshid=py8upu4wui1h",0,0,,#navy,
2020-05-06 17:31:44+00:00,sidelinepros,"The Navy’s Blue Angels fly over the Dallas-Fort Worth area to honor health care workers, first responders and other essential roles in the COVID-19 pandemic. Copyright © 2020 by Steven Leija/Sideline Pros #navy… https://www.instagram.com/p/B_2tnnwgiIP/?igshid=1wofslyqjnkxv",0,0,,#navy,
2020-05-06 17:27:52+00:00,Skillz_DC4L," Not the Best picture but this is the shot I got of the Covid-19 Response Blue Angel flyover in Duncanville, Tx #BlueAngelFlyover #COVID19Response #Duncanville #Texas",0,0,,#BlueAngelFlyover #COVID19Response #Duncanville #Texas,
2020-05-06 17:23:25+00:00,imegarcia,En otros países la gente sale a los balcones a aplaudir al personal médico que combate el coronavirus o les llevan serenata afuera de los hospitales. En Estados Unidos sacan sus aviones militares a hacer un mini-desfile en honor a los trabajadores de la salud Muy interesante. ,1,3,,,
2020-05-06 17:11:35+00:00,Dosmuzic,Bahahahahaha..sorry..she was asking for it..Dallas salon owner who reopened in defiance of Texas' coronavirus restrictions sentenced to 7 day... https://news.yahoo.com/dallas-salon-owner-reopened-defiance-034153336.html?soc_src=community&amp;soc_trk=tw via @Yahoo,0,0,@Yahoo,,
2020-05-06 17:11:03+00:00,Ilovearltx,We Love the fly over @blueangels gave to salute all our frontline Covid-19 workers in our community! We’d like to thank all our first responders and healthcare workers that have been working none stop during the… https://www.instagram.com/p/B_2phu3lYTY/?igshid=187hiu28q8kgx,0,0,@BlueAngels,,
2020-05-06 16:55:34+00:00,AbyTorresJr,NY Gov. Cuomo says it's 'shocking' most new #Coronavirus hospitalizations are people staying home ,0,0,,#Coronavirus,
2020-05-06 16:54:45+00:00,PediaPlexDFW,An amazing flyover today by the @BlueAngels to salute all of the frontline #COVID-19 responders! Thank you all for everything that you are doing! #HealthcareHeroes,0,0,@BlueAngels,#COVID #HealthcareHeroes,
2020-05-06 16:53:24+00:00,DallasFireRes_q,Check out the view from the roof of @DallasFireRes_q #Station1!!! Thank you so much to the @BlueAngels for this awesome show of support to the Frontline workers during these unprecedented times of the #coronavirus pandemic. @CityOfDallas @DallasCountyTx,14,78,@DallasFireRes_q @BlueAngels @CityOfDallas @DallasCountyTx,#Station1 #coronavirus,
2020-05-06 16:51:28+00:00,myspiritrejoice,"Well, not exactly. They live in very close proximity to other people & it has been shown that nearly 40% of covid deaths are those who live in elderly facilities. They are extremely short staffed even in better times, even moreso now, and can't have employees leaving ....",0,0,,,
2020-05-06 16:47:37+00:00,AACenter,The view from the top of the Lexus Garage at American Airlines Center during the U.S. Navy Blue Angels flyover. The flyover was a salute to all of the frontline COVID-19 responders. Thank you #BlueAngels for this display and thank you to all of the frontline workers! – at American Airlines Center,12,62,,#BlueAngels,
2020-05-06 16:46:18+00:00,pbalyta,Thank you @BlueAngels for your special salute to all of the incredible frontline COVID-19 responders today. ,1,14,@BlueAngels,,
2020-05-06 16:38:25+00:00,NicholeManna,"May 6 JPS update: - 74 patients current being treated for COVID-19 at JPS - 1 patient under investigation - 9 deaths - 26 employees tested positive at some point - 328 samples tested positive - 1,395 negative - 26 pending",2,1,,,
2020-05-06 16:34:57+00:00,Staceyme06,"Blue Angels flying over our beautiful city. Salute to frontline COVID-19 responders. @Uptown-Knox-Henderson, Dallas https://www.instagram.com/p/B_2nEbbJsPD/?igshid=aojiutgeq1mk",0,0,,,
2020-05-06 16:30:01+00:00,StevenDialFox4,"Here are some pictures from @Q_Fox4 showing the @BlueAngels DFW flyover in Downtown Dallas, recognizing frontline workers during the coronavirus pandemic. @FOX4",19,111,@Q_Fox4 @BlueAngels @FOX4,,
2020-05-06 16:29:39+00:00,omarmuniz9,Coronavirus: More than 1.2 million people have recovered globally #Coronavirus ,0,0,,#Coronavirus,
2020-05-06 16:28:49+00:00,kentfischer,Just flew over the neighborhood in Keller. I gues this means we won and our #coronavirus is Mission Accomplished?,0,0,,#coronavirus,
2020-05-06 16:25:44+00:00,HudsonMBA,Texas Supreme Court says coronavirus restrictions on business 'may not survive judicial scrutiny' ,0,0,,,
2020-05-06 16:24:44+00:00,mbrinkerhoff,Texas Governor Abbott caught on recording saying reopening will escalate coronavirus spread on same day state businesses open ,0,0,,,
2020-05-06 16:19:48+00:00,ClaytonNeville,Blue Angels fly over Dallas Medical district to pat tribute to #coronavirus front line workers. @570KLIF @WBAP247NEWS,4,4,@570KLIF @WBAP247NEWS,#coronavirus,
2020-05-06 16:19:09+00:00,jenhsampson,North Texas Thunderous Salute honoring front line workers fighting COVID-19. God Bless America. @USNavy @BlueAngels #Dallas #Texas,2,29,@USNavy @BlueAngels,#Dallas #Texas,
2020-05-06 16:17:03+00:00,erinjonesnews,Blue Angels flying over #DFW! Part of their salute to #COVID-19 first responders. Thank you @BlueAngels!,5,29,@BlueAngels,#DFW #COVID,
2020-05-06 16:16:57+00:00,MikeZiemer,I can’t believe they killed the coronavirus with the Blue Angels and we are all healthy and safe now. ,4,41,,,
2020-05-06 16:13:08+00:00,linapelucita,"Dice mi #bebeGael que se va a poner a trabajar como papá muero de amors #stayathome #covid_19 #cuarentena #quarantine #homework hace llamadas y trabaja en su computadora en Far North Dallas, Dallas https://www.instagram.com/p/B_2kn07j0SN/?igshid=n2shr8dwpi08",0,0,,#bebeGael #stayathome #stayathome #covid_19 #cuarentena #quarantine #homework,
2020-05-06 16:11:22+00:00,WeAreDCPH,"Today is National Nurses Day, an amazing day to celebrate all that nurses do! The Denton County, Texas Courthouse-on-the-Square has been lit blue for the past few weeks to support the amazing work of these first responders during COVID-19. #NationalNursesDay",5,26,,#NationalNursesDay,
2020-05-06 16:09:09+00:00,gamesuwan,ฝูงบินสาธิตการบินกองทัพเรือสหรัฐอเมริกา The Blue angels บินพ่นข้อความให้กำลังใจในช่วง COVID-19 – at Buddhist Center of Dallas (วัดพุทธดัลลัส),15,12,,,
2020-05-06 16:05:02+00:00,MichaelHugg2591,From The Economist Espresso: Come closer: South Korea and covid-19 ,0,0,,,
2020-05-06 15:58:29+00:00,NotPorn,"My #grandpa #gangsta #bobross #when #covid is #over #hotmess @Paris, Texas https://www.instagram.com/p/B_2i8mJgaqJ/?igshid=1p50b72a2fz94",0,1,,#grandpa #gangsta #bobross #when #covid #over #hotmess,
2020-05-06 15:56:21+00:00,phollowpeople,"The shelter-in-place orders designed to slow the spread of COVID-19 slowed home selling nationwide, but local experts are sure the market will rebound. https://www.peoplenewspapers.com/2020/05/06/not-easy-seeking-new-shelter-while-sheltering-in-place/",0,0,,,
2020-05-06 15:51:23+00:00,Cryodaddy,Congress won’t even work! They wanna stay home from their essential job. This covid thing is getting out of hand. PPP not coming to small businesses. Bankers are calling their good customers that don’t need the ppP and getting them approved for it !,0,0,,,
2020-05-06 15:47:20+00:00,HudsonMBA,"She needed a facial after quarantine. #WildnOutWednesday #Wednesday #HumpDay #LumpDay #FaceLumpsDay #LooksLikeAKnotOnYourForehead #YouBetterKnotMentionItAgain #COVID #igers @Dallas, Texas https://www.instagram.com/p/B_2hVj3JcP-/?igshid=179qhbtjx73bj",0,0,,#WildnOutWednesday #Wednesday #HumpDay #LumpDay #FaceLumpsDay #LooksLikeAKnotOnYourForehead #YouBetterKnotMentionItAgain #COVID #igers,
2020-05-06 15:46:01+00:00,emilytrchalek,Covid #19 ,0,1,,,
2020-05-06 15:37:05+00:00,FlipperGal,The U.S. Navy Blue Angels and U.S. Air Force Thunderbirds honored frontline COVID-19 first responders and essential workers with formation flights over Atlanta. ,0,0,,,
2020-05-06 15:30:08+00:00,GrProject43X,"As a zombie #outbreak #survival expert, I’ve been asked, what’s a safe distance for social distancing. My answer: A mile. Keeping a mile away from other people is about what you need to survive. #SocialDistancing #COVID19 #Coronavirus #AmWriting #CDC #FEMA #Virus #Safety",0,4,,#outbreak #survival #SocialDistancing #COVID19 #Coronavirus #AmWriting #CDC #FEMA #Virus #Safety,
2020-05-06 15:15:52+00:00,ClaytonNeville,Protesters calling for Shelley Luther’s release from jail in downtown Dallas. She is serving 7 days for keeping her salon open amid #coronavirus restrictions. @570KLIF @WBAP247NEWS @WestwoodOne,6,3,@570KLIF @WBAP247NEWS @WestwoodOne,#coronavirus,
2020-05-06 15:15:14+00:00,allycelebrates,Just found out my cousin in Ecuador has covid-19. She’s on a ventilator. Just sucks.,0,0,,,
2020-05-06 15:13:16+00:00,confusedabout,It's May 6th and Chuck Schumer still hasnt been test for Covid-19.,0,2,,,
2020-05-06 15:10:14+00:00,PajakDamon,Thank you to all the nurses who put themselves in harms way to protect humans in the battle against COVID19 #COVID19 #coronavirus #ThankYouNurses #ThankANurse,0,0,,#COVID19 #coronavirus #ThankYouNurses #ThankANurse,
2020-05-06 15:05:17+00:00,MichaelWoodsDBA,German top flight set to become Europe's first major soccer league to resume playing amid coronavirus pandemic http://www.espn.com/soccer/german-bundesliga/story/4092272/coronavirus-bundesliga-to-become-europes-first-major-league-to-resume http://espn.com/app,0,0,,,
2020-05-06 14:57:49+00:00,AtletSports,All Summer Training Camps Start May 26th. Spaces Are Limited for COVID-19 Compliance. Payment Plans are available as well as group discounts for school partners. Register at http://Atletsports.com/Camps Email… https://www.instagram.com/p/B_2cALvJzaP/?igshid=1rfapgba8xw8,0,0,,,
2020-05-06 14:57:24+00:00,Atlet_Baseball,All Summer Training Camps Start May 26th. Spaces Are Limited for COVID-19 Compliance. Payment Plans are available as well as group discounts for school partners. Register at http://Atletsports.com/Camps Email… https://www.instagram.com/p/B_2b88rABx7/?igshid=vmohyerg3all,0,1,,,
2020-05-06 14:56:54+00:00,RedArmyBandCHHS,#RedArmyBand step outside this morning to see the Blue Angels fly over in honor of Covid-19 First Responders. (Between 11-11:15) ,0,0,,#RedArmyBand,
2020-05-06 14:46:38+00:00,ChefOlobe_BCS,#backtobusiness #covid-19package #stayhomestaysafe #dallascaterer #freedelivery #5%off #COVID19 #orderonline,0,0,,#backtobusiness #covid #stayhomestaysafe #dallascaterer #freedelivery #COVID19 #orderonline,
2020-05-06 14:44:26+00:00,SHONiLaFLARE,"Anywho we go on to talk about Covid and how everyone’s doing , I plan a visit and we hang up lol ",0,0,,,
2020-05-06 14:37:10+00:00,gene4192,Why are you wearing a mask while driving your car? Do you think you or your vehicle will spread coronavirus?,0,4,,,
