date,user,text,retweets,favorites,mentions,hashtags,geolocation
2020-05-05 20:29:48+00:00,omarmuniz9,Why COVID-19 death predictions will always be wrong https://twitter.com/i/events/1257666311175503872,0,0,,,
2020-05-05 20:28:42+00:00,DavidSchechter,"TEXAS issues guidelines for reopening hair, nail, tanning salons on Friday. Next Friday it’s gyms, office buildings and manufacturing. Surge Response Teams will react to #COVID19 hotspots that pop up at jails, senior homes and meat plants. #coronavirus @wfaa @GregAbbott_TX",1,1,@wfaa @GregAbbott_TX,#COVID19 #coronavirus,
2020-05-05 20:26:45+00:00,omarmuniz9,A study says mutant coronavirus has emerged and it's more contagious ,0,0,,,
2020-05-05 20:23:56+00:00,legofrog_,bro gyms are opening on the 18th lmao I know y’all dirty mfs don’t be cleaning between machines. Saw it alot before covid so I can only imagine ,0,9,,,
2020-05-05 20:16:38+00:00,DavidSchechter,"Gyms and exercise facilities may reopen in #Texas on May 18, at 25% capacity. Showers and locker rooms must remain closed. All equipment disinfected after each use. Customers must wear gloves. @GregAbbott_TX #coronavirus",2,1,@GregAbbott_TX,#Texas #coronavirus,
2020-05-05 20:15:23+00:00,chestnut_daniel,"The really surprising thing is that last bit of data reported by the NYT: ""Thousands of them flew directly from Wuhan,"" the original epicenter of the COVID-19 outbreak, per the NYT.",0,0,,,
2020-05-05 20:14:02+00:00,DavidSchechter,"TEXAS GOVERNOR: Barbershop, hair, nail and tanning salons allowed to open on Friday. Both customers and service provider must wear masks and follow health and safety restrictions. #coronavirus #COVID19 #Texas",7,10,,#coronavirus #COVID19 #Texas,
2020-05-05 20:08:58+00:00,book_loving_mom,"@GovAbbott While the positive test ratio on 4/20 for COVID-19 was higher than yesterday, the testing restrictions were also more narrow. The people who were being tested were required to have symptoms, so of course the positive rate was higher then.",0,0,@GovAbbott,,
2020-05-05 19:59:04+00:00,TORlSSECRETS,coronavirus isn’t gonna disappear in thin air if we stop talking about it,0,4,,,
2020-05-05 19:58:15+00:00,BladeCraftBA,Creativity in the time of COVID. Please follow @PugsRule_PPBEnt for a very intention filed series... @Blade Craft Barber Academy https://www.instagram.com/p/B_0ZleqHLuw/?igshid=tpfi1fatbltl,0,1,@PugsRule_PPBEnt,,
2020-05-05 19:53:02+00:00,DavidSchechter,"The goal, per White Coronavirus Task Force, is to test 600,000 Texans per month. @GregAbbott_TX",0,1,@GregAbbott_TX,,
2020-05-05 19:51:59+00:00,FrederickLangjr,Coronavirus has now killed 0.021% of the U.S. population...,0,2,,,
2020-05-05 19:50:53+00:00,DavidSchechter,"Governor: Texas is now testing about 19,000 people a day, aided in part by efforts of National Guard. #coronavirus",0,0,,#coronavirus,
2020-05-05 19:50:40+00:00,LauraHarrisNBC5,WATCH LIVE | Gov. Greg Abbott Giving Update on COVID-19 Response in Texas ,0,1,,,
2020-05-05 19:37:33+00:00,domestic36,Did my pre-op. That Covid test sucks we’ll self quarantine till surgery day,0,1,,,
2020-05-05 19:31:35+00:00,mgalownia,"In honor of the first responders and health care workers fighting against Covid-19, the Blue Angels will be flying over North Texas! Enjoy the show! #blueangels #plano #dallas #texas #thankyouhealthcareworkers @… https://www.instagram.com/p/B_0WigmHt3a/?igshid=1c3pyg8ho4f57",0,0,,#blueangels #plano #dallas #texas #thankyouhealthcareworkers,
2020-05-05 19:27:02+00:00,Jonnoe44,P is passing credit that doesn’t affect your GPA due to the coronavirus pandemic,0,0,,,
2020-05-05 19:19:11+00:00,Crowe65,"my hubby and I got tested for the COVID antibody yesterday He had it with 2.9 reading and i didn't and my reading was 0.1. i think it's the botox! we think there should be a journal written up about us... ""Texas Mom defeates Covid with Unique botox and wine combo"" @Bethenny",0,2,@Bethenny,,
2020-05-05 19:17:16+00:00,TCS_Knights,"Covenant Knights: WE NEED YOU! Today is #NTxGivingTuesdaynow, a special day of giving to help non-profits continue their good work in the community. Please consider making a gift to Covenant for COVID-19 relief… https://www.instagram.com/p/B_0U5wvHqqi/?igshid=18nb6fcu5u8ql",0,1,,#NTxGivingTuesdaynow,
2020-05-05 19:13:52+00:00,imSeeRaw,can your guac cure covid tho? ,0,1,,,
2020-05-05 19:10:24+00:00,PinaTaylotta,"Feeling a little hopeless & worrisome during these highs & lows of Covid. So I stuck my toes in the wet ground, sucked up some sun, &amp; played some Townes Van Zandt till I got over it. Also saw the world’s smallest bee next to my toes so it was definitely a win-win. ",2,22,,,
2020-05-05 19:10:10+00:00,VictorMataV,Perfect and beautiful lyrics #StayHome #sofitukker #housearrest #coronavirus #COVID19 #Quarantine #lockdown #animaltalk,1,3,,#StayHome #StayHome #sofitukker #housearrest #coronavirus #COVID19 #Quarantine #lockdown #animaltalk,
2020-05-05 19:06:07+00:00,AlDiaDallas, | #Dallas | @JudgeClayJ aplaude a residentes del Norte de #Texas pero advierte sobre apurar los tiempos. Máxima autoridad del condado anunció cuatro nuevos sitios de pruebas de covid-19 en entrevista con ‘The Dallas Morning News’. Aquí detalles. https://www.dallasnews.com/espanol/al-dia/2020/05/05/dallas-clay-jenkins-aplaude-a-residentes-del-norte-de-texas-pero-advierte-sobre-apurar-los-tiempos/,1,0,@JudgeClayJ,#Dallas #Texas,
2020-05-05 19:04:35+00:00,HarvestTexas,"It's National Teacher Appreciation Day! Teachers have one of the most challenging & fulfilling jobs—literally shaping and changing lives. Today, we want honor our teachers & the parents who became teachers during COVID-19. Thanks for raising up the next generation of leaders! ",1,0,,,
2020-05-05 18:44:38+00:00,vtbirkenstock,Cotton: All Evidence Points to Coronavirus Coming from Wuhan Labs https://www.breitbart.com/clips/2020/05/05/cotton-all-evidence-points-to-coronavirus-coming-from-wuhan-labs/ - except Dr Fauci is backtracking! We have a problem with Fauci! @SenTomCotton,2,2,@SenTomCotton,,
2020-05-05 18:43:18+00:00,LauraHarrisNBC5,"TARRANT CO CORONAVIRUS UPDATE Tarrant County Confirms 6 COVID-19 Deaths in Fort Worth, Keller, Grapevine; 62 New Cases ",1,0,,,
2020-05-05 18:38:13+00:00,FosterExteriors,"Stuck at home? Covid-19 got you down? Cheer up! It is window-opening weather! Let in that fresh air! If your windows are ugly and hard to open, or you just need better protection against the murder hornets, give us a… https://www.instagram.com/p/B_0Qa1pF1cV/?igshid=6gahd7o7fsh9",0,0,,,
2020-05-05 18:37:31+00:00,jmejst,"Apparently the travel insurance @Allianz will NOT cover trips cancelled for COVID-19 unless YOU actually contract it. So, if a travel ban gets extended or the people you’re visiting get it and you can’t go - Sorry!!! This is why people call insurance companies crooks. #travel",0,2,@Allianz,#travel,
2020-05-05 18:35:23+00:00,FrederickLangjr,10 more American just died of Covid-19 since my last tweet. You were saying?,0,0,,,
2020-05-05 18:31:02+00:00,marychrish,The vaccine is urgently needed! Fingers crossed for success. Coronavirus: Human trials for experimental vaccine begin in the US #Coronavirus ,0,0,,#Coronavirus,
2020-05-05 18:26:43+00:00,omarmuniz9,COVID-19 updates for the US #covid19,0,0,,#covid19,
2020-05-05 18:17:24+00:00,_thalitamay,é difícil de acreditar que em dezembro de 2019 eu tava em NY e que COM CERTEZA o covid já estava circulando por tudo quanto é lugar e FEVEREIRO desse ano eu tava na Disney????? eu to trancada dentro de casa já faz tanto tempo que às vezes parece que essas coisas nunca aconteceram,0,1,,,
2020-05-05 18:17:20+00:00,UnleashedLGBTQ,Staying Busy and Slaying Henny! Quarantine is not gonna slow down @StevieB0i one bit! #StevieBoi #UnleashedLGBTQ #quarantinedLGBTQ #coronavirus https://www.unleashedlgbtqexpo.com/blog/stevieboi,2,2,@StevieB0i,#StevieBoi #UnleashedLGBTQ #quarantinedLGBTQ #coronavirus,
2020-05-05 18:11:46+00:00,MichaelHugg2591,From The Economist Espresso: Mouse trap: Disney and covid-19 ,0,0,,,
2020-05-05 18:05:51+00:00,vtbirkenstock,Do you trust this dude? Dr. Anthony Fauci: Coronavirus Likely Wasn’t Created in Wuhan Lab ,1,8,,,
2020-05-05 17:59:05+00:00,mamabr33zy,This covid-19 has no race nor a color preference it affects everyone even animals ,0,0,,,
2020-05-05 17:49:14+00:00,Alex_MaldonadoS,"+ Acá en el norte de #Dallas #Texas hay empresas, como #Costco que piden a todos usar #mascarillas #Masks4All y otras como #HomeDepot @HomeDepot que no piden ni a empleados, ni a clientes utilizar mascarillas. El relajamiento en la lucha contra el #coronavirus es peligroso. ",0,1,@HomeDepot,#Dallas #Texas #Costco #mascarillas #Masks4All #HomeDepot #coronavirus,
2020-05-05 17:43:37+00:00,kunmuth,"Parkland Hospital in Dallas’ COVID-19 Unit Sees Encouraging Results For Patients On Ventilators. Almost 80% of Coronavirus patients on ventilators are expected to recover. In fact, almost half have already gone home. ",0,1,,,
2020-05-05 17:41:02+00:00,thelibrarywitch,Day 40 of our COVID-19 Fashion Show ft the giant-ass tent I accidentally ordered ,0,5,,,
2020-05-05 17:39:47+00:00,RamonMunozz,soo mask are required along w/ covid related questionnaire followed by temp. check and topped w/ the waiting room turning into waiting for a text alert from the inside of my car in the parking lot,0,0,,,
2020-05-05 17:30:47+00:00,vtbirkenstock,The CDC has a truth & leaking problem! Maybe it’s time 4 leadership change. My bet -lots of Obama left overs trying 2 harm the economic recovery. Donald Trump: CDC Study Predicting Coronavirus Death Spike Lacks Social Distancing Data https://www.breitbart.com/politics/2020/05/05/donald-trump-cdc-study-predicting-coronavirus-death-spike-lacks-social-distancing-data/ @realDonaldTrump,2,1,@realDonaldTrump,,
2020-05-05 17:29:15+00:00,jenny2x,what is covid-19 era interview etiquette?????! like do i wear a mask????? do i not shake the interviewers hand????? wtf someone help me,1,2,,,
2020-05-05 17:28:06+00:00,Chelsea_Leigh33,Today I’m writing postcards to voters for @candacefor24. What are you doing during #COVID life to make a difference outside of your home? I’m going to #WorkFromHome for the candidates that I have no doubt will stand up for families like mine. #TX24,1,3,@candacefor24,#COVID #WorkFromHome #TX24,
2020-05-05 17:27:37+00:00,luisskywalk3r,Somebody on Facebook called the coronavirus a liberal hoax... I’m.... hmmm,0,9,,,
2020-05-05 17:24:44+00:00,Nancy_McCoy,Pfizer Starts U.S. Trials of Experimental Covid-19 Vaccine ,0,1,,,
2020-05-05 17:17:52+00:00,chestnut_daniel,"Coronavirus patients have been identified in USA (California) and now France from as early as December (so far) Shows how important early reporting and prior, in-place, safety protocols are in prevention of worldwide spread of highly contagious diseases ",0,1,,,
2020-05-05 17:16:04+00:00,IC_Homecare,Are you or someone you love experiencing difficulties due to Covid-19? Inclusive Community Homecare is Help! Contact us today to learn more information on how to keep you or hour loved ones safe during this pandemic. ,0,1,,,
2020-05-05 17:08:08+00:00,AlDiaDallas," | #Dallas | Más de 16,000 personas presentan solicitud a la alcaldía de ayuda para renta o hipoteca. Ayuntamiento cuenta con un fondo de $13.7 millones para ayudar a familias afectadas por crisis del #coronavirus. Aquí detalles. https://www.dallasnews.com/espanol/al-dia/dallas-fort-worth/2020/05/05/dallas-mas-de-16000-personas-presentan-solicitud-a-la-alcaldia-de-ayuda-para-renta-o-hipoteca/",0,0,,#Dallas #coronavirus,
2020-05-05 17:00:37+00:00,COzerdim,"Dude he has Coronavirus, stop being blind like him, you are endangering yourself",0,1,,,
2020-05-05 16:48:01+00:00,jeffmarketing1,We can take care of all your Social Media Businesses Marketing needs. Ask Me How https://jefferysocialmarketing.social5.net/packages/ #contentmarketing #Digitalmarketing #SEO #blogging #marketing #branding #marketingtips #marketingstrategy #coronavirus #covid19 #startup #b2bmarketing #sale #goals #growth,0,1,,#contentmarketing #Digitalmarketing #SEO #blogging #marketing #branding #marketingtips #marketingstrategy #coronavirus #covid19 #startup #b2bmarketing #sale #goals #growth,
2020-05-05 16:47:47+00:00,6679Coachkyle,"We’re leading the world with 1.2 million coronavirus cases, dipshit. If the rest of the world is watching, it’s seeing your blueprint of what NOT to do!",0,0,,,
2020-05-05 16:45:31+00:00,ClaytonNeville,North Texans call for quicker reopening in Texas ahead of @GovAbbott #coronavirus update. @WBAP247NEWS @570KLIF,3,2,@GovAbbott @WBAP247NEWS @570KLIF,#coronavirus,
2020-05-05 16:40:05+00:00,JustCallM3Luigi,"Lmao this shit is stupid how does slavery have to do with covid 19 and protecting urself, y’all believe anything y’all see ",0,0,,,
2020-05-05 16:35:00+00:00,williamtincup,COVID only lasts on plastic lids for like a month or so. No worries.,0,1,,,
2020-05-05 16:18:19+00:00,omarmuniz9,Coronavirus: NY Governor Andrew Cuomo provides daily update #covid19,0,0,,#covid19,
2020-05-05 16:17:40+00:00,NavarroOEM,"To all Navarro County residents: In conjunction with tx_dem, Texas Military Forces, Texas Department of State Health Services, and cooperating agencies, a mobile COVID-19 testing site is available to the public on… https://www.instagram.com/p/B_0AV7tA1Hy/?igshid=rmy74eqfbtoc",1,3,,,
2020-05-05 16:16:00+00:00,T3MP3STT,A study says mutant coronavirus has emerged and it's more contagious ,0,0,,,
2020-05-05 16:02:37+00:00,vtbirkenstock,"@RepAdamSchiff - no we would have saved billions and millions of people would have died. You &amp; Pelosi own this. Your distraction killed Americans! Schiff: If Trump Were Removed by Impeachment, Coronavirus Deaths Would Not Be at Daily 9/11 Levels ",0,0,@RepAdamSchiff,,
2020-05-05 15:34:19+00:00,williamtincup,".@ChrisCuomo did COVID make you go gray? Last night, your hair looked lighter than pre-COVID. No hate. Just curious. Could have been the lightning or my memory. Your hair looks fine just seemed lighter last night. cc: @NYGovCuomo @CNN @CuomoPrimeTime",0,1,@ChrisCuomo @NYGovCuomo @CNN @CuomoPrimeTime,,
2020-05-05 15:21:43+00:00,nbanks__,"January -Wild fires and locust spread across several continents. Death of Kobe & Gigi February- Foreign Leader assassinated, Pop Smoke killed March- WHO names coronavirus COVID-19- Country advices shutdown April- Economy crashes-Confirmation aliens exist May........ ",0,0,,,
2020-05-05 15:13:31+00:00,kendallsowers,"Happy Cinco de Mayo! #coronavirus #covid19 #cincodemayo2020 #tacotuesday @Dallas, Texas https://www.instagram.com/p/B_z5AZhHStr/?igshid=w7mmnvin6osz",0,1,,#coronavirus #covid19 #cincodemayo2020 #tacotuesday,
2020-05-05 15:10:46+00:00,SaveRockyDane,"Today is #GivingTuesdayNow! We have had an increased amount of surrendered danes during COVID-19, causing a significant amount of vet bills and etc. to mount up! Also, we've had many families reach out for aid! Help support us by donating or sharing! https://www.facebook.com/donate/708275703056799/?fundraiser_source=external_url",1,1,,#GivingTuesdayNow,
2020-05-05 15:10:11+00:00,214Princess_,I don’t think these covid numbers accurate,1,2,,,
2020-05-05 15:00:34+00:00,DominicGBrown,No #conspiracy here move along #Russia needs to lock their #Windows 3 #Russian #Doctors treating the #Coronavirus have recently fallen from windows https://twitter.com/i/events/1257417886584299520 #COVID19 #Coronavirustruth #CoronavirusLiar #conspiracyagainstdoctors #Russiainvestigation,1,1,,#conspiracy #Russia #Windows #Russian #Doctors #Coronavirus #COVID19 #Coronavirustruth #CoronavirusLiar #conspiracyagainstdoctors #Russiainvestigation,
2020-05-05 14:59:30+00:00,StevenDialFox4,"Per @john_jwitt, @GovAbbott will meet with President @realDonaldTrump at the White House Thursday to discuss coronavirus developments in Texas. @FOX4",11,35,@john_jwitt @GovAbbott @realDonaldTrump @FOX4,,
2020-05-05 14:58:28+00:00,chestnut_daniel,"""President Trump lashes out at ad criticizing his response to coronavirus"" ",1,1,,,
2020-05-05 14:57:40+00:00,tamenebeyene,"COVID-19 Live Updates: Dallas County Reports 237 New Cases, Its Highest Daily Total ",0,0,,,
2020-05-05 14:56:34+00:00,ayokasystems,"#startups win billions virtually as virus shifts Silicon Valley riches to video pitches, “If we are able to contain...coronavirus &amp; get economy moving...we could see a fairly robust IPO market in late summer,” Nelson Griggs, Nasdaq president told @CNBC https://www.cnbc.com/2020/05/05/start-up-hits-1-billion-virtually-as-virus-shifts-silicon-valley-riches.html?__source=iosappshare%7Ccom.apple.UIKit.activity.PostToTwitter",1,3,@CNBC,#startups,
2020-05-05 14:50:03+00:00,myopic72,As usual KERA has continued giving us just straight facts and constantly updating their site to help us navigate through this Covid weirdness as well pushing out a bunch of at home… https://www.instagram.com/p/B_z2UaSnbkLzXmmzjqHc5Hp_GRFtCyH6wN5JcY0/?igshid=41gmofna8m1x,0,2,,,
2020-05-05 14:38:18+00:00,DFW_Humane,"Today is the day to spread some kindness and compassion. Across North Texas, people like you are working together to support nonprofits like @DFW_Humane during this critical time. COVID-19 has affected all of us… https://www.instagram.com/p/B_z0-THHo_K/?igshid=f98qowuzc6gj",0,0,@DFW_Humane,,
2020-05-05 14:36:51+00:00,clarencehilljr,‘They’re all LOSERS’: Trump lashes out at conservative critics over new coronavirus ad https://politi.co/2A4kMuh via @politico,0,0,@politico,,
2020-05-05 14:28:37+00:00,Boomer_Patriot,Wisconsin Shows That Mail-in Ballots Are Not Necessary to Stop the Spread of the Coronavirus ,0,0,,,
2020-05-05 14:23:28+00:00,cakikeith,"People are not taking into consideration the fact that our healthcare system will be overrun with covid patients and will be unable to function, healthcare workers will die and thousands will be left severely debilitated and unable to work. #COVIDー19 #StayHome",0,2,,#COVID #StayHome #StayHome,
2020-05-05 14:21:29+00:00,Boomer_Patriot,Leave It to Whitmer to Break a Public Health Rule While Lecturing Residents on Coronavirus Safety Measures ,1,0,,,
2020-05-05 14:20:57+00:00,Boomer_Patriot,The Media Racket And The Coronavirus Numbers Game ,0,0,,,
2020-05-05 14:10:16+00:00,TA_Morris,How many schools in Texas will acknowledge Cinco de mayo? So cultural relevance is lose during this COVID-19 crisis.,0,1,,,
2020-05-05 14:02:39+00:00,randyrial091463,Really appreciate you Ron! God has really blessed me so I just want to help in some small way for those that are really struggling through this coronavirus,0,0,,,
2020-05-05 13:59:35+00:00,ashtonsometime1,"Happy Cinco de Stay-at-Home Drinko on Taco Tuesday! Today, in Isolation Station (aka my home), I will be wearing my “feed me tacos & tell me I’m beautiful” shirt while I over-serve myself margaritas to wash down the depression. Livin the COVID-19 dream. #CincoDeDrinko",0,1,,#CincoDeDrinko,
2020-05-05 13:57:31+00:00,DSNDenton,"I'm proud of the fact that through this whole Coronavirus situation, I have only had to knock off one person from my Zombie Apocalypse Team. #COVID19 #Denton #supplements #shoplocal #workout #weightlifting – at Denton, TX",0,0,,#COVID19 #Denton #supplements #shoplocal #workout #weightlifting,
2020-05-05 13:50:18+00:00,chestnut_daniel,Epidemiologist believes coronavirus may have been in Sweden as early as November ,0,0,,,
2020-05-05 13:47:50+00:00,Atlet_Baseball,"Atlet summer training programs will start Tuesday, May 26th. Covid-19 protocols for capacity and cleaning are in place. We will also host training for our team partners until the UIL allows for on-site school… https://www.instagram.com/p/B_zvMvygwQr/?igshid=jluqdjbiokm5",0,1,,,
2020-05-05 13:45:59+00:00,AtletSports,"Atlet summer training programs will start Tuesday, May 26th. Covid-19 protocols for capacity and cleaning are in place. We will also host training for our team partners until the UIL allows for on-site school… https://www.instagram.com/p/B_zu-7DHxQJ/?igshid=xxxbyevu9dud",1,1,,,
2020-05-05 13:40:49+00:00,FirstTeeDallas, TODAY is the day #ntxGivingTuesdayNow This special fundraiser is to show North Texans that COVID-19 may cancel spring events and programs but it can't cancel community kindness and generosity! Thank you for your… https://www.instagram.com/p/B_zuZQrlgBv/?igshid=lfen7krpp6b3,0,1,,#ntxGivingTuesdayNow,
2020-05-05 13:32:30+00:00,DallasAnalytics,@StevenDialFox4 no COVID antibodies for me. Pretty easy test at Quest Labs ,0,0,@StevenDialFox4,,
2020-05-05 13:30:29+00:00,peculiarbirdtx,How it feels being an empath n COVID ,1,0,,,
2020-05-05 13:28:33+00:00,BabyyyAja,"You know what Cam, that’s so true. Fuck these people. I’m COVID Free &amp; staying that way...*cancels bday house party*",0,2,,,
2020-05-05 13:28:00+00:00,IncJtc,"JTC Giving Tuesday Covid-19 Campaign Since our inception In 2009, JTC has been a asset in bringing Aid to individuals and families who needed a helping hand. Through our Community Outreaches, we have been able to… https://www.instagram.com/p/B_zs7bkBpB1/?igshid=5pnk444a5mfx",0,0,,,
2020-05-05 13:26:43+00:00,Meggie272,I wonder how protestors are gonna blame Obama when they start getting coronavirus over the next few weeks.,0,2,,,
2020-05-05 13:21:14+00:00,gamesuwan,วันนี้ ที่ดัลลัส จะมีฝูงบินสาธิตการบินกองทัพเรือสหรัฐอเมริกา The Blue angels จะบินพ่นข้อความให้กำลังใจในช่วง COVID-19 ไปทั่วพื้นที่ดัลลัส - ฟอร์ตเวิร์ เวลาประมาณ 11:00 am ,11,9,,,
2020-05-05 13:18:19+00:00,YesseniaYoYo,• CINCO DE MAYO • -1862 Model: triverab : Me @_StyledByYoYo . #cincodemayo #batalladepuebla #puebla #méxico #viva #covid_19 #quarantine #strongertogether #stayhome #stayathome #staysafe #stayhealthy… https://www.instagram.com/p/B_zr0jnnMIh/?igshid=14ey1gsh9c6c8,0,0,@_StyledByYoYo,#cincodemayo #batalladepuebla #puebla #m #viva #covid_19 #quarantine #strongertogether #stayhome #stayhome #stayathome #stayathome #staysafe #stayhealthy,
2020-05-05 12:55:30+00:00,GaryLanePeters1,China Mocks U.S. Coronavirus Reaction In Animated Video ,0,0,,,
2020-05-05 12:40:11+00:00,GaryLanePeters1,Five rashes have been linked to coronavirus in a new study ,0,0,,,
2020-05-05 12:34:54+00:00,LorieBlair22,All about COVID-19 swab and antibody testing ,0,0,,,
2020-05-05 12:24:48+00:00,2zFbaby,If I die of COVID it is Donald Trumps fault.,0,3,,,
2020-05-05 12:00:10+00:00,BarryLCameron,"“COVID-19 may be around for a while but as a nation and as individuals, we have to learn to live with pandemics. We can’t hide in a cave until the world is free from every virus or threat.” @Franklin_Graham #FearNot",3,11,@Franklin_Graham,#FearNot,
2020-05-05 11:49:03+00:00,MakingTownsGuy,The Risk Of Exposure To COVID-19 In Georgia Has Increased By More Than 40% Since The State Reopened For Business!! ,0,0,,,
2020-05-05 11:14:23+00:00,ayokasystems,"#Pfizer begins human testing for experimental coronavirus #vaccine containing genetic material called messenger RNA, or mRNA a genetic code that tells cells to build an antigen to induce an immune response for the virus, latest clinical trial from @CNBC",1,1,@CNBC,#Pfizer #vaccine,
2020-05-05 11:12:04+00:00,Boomer_Patriot,"'Significant Breakthrough' for Coronavirus Antidote Developing In Israeli Lab, Says Report ",0,0,,,
2020-05-05 10:18:37+00:00,TVsRob_Official,"Well, my wife already does ... 54 percent of Americans want to work remote regularly after coronavirus pandemic ends, new poll shows ",0,1,,,
2020-05-05 09:06:27+00:00,BeyondDentalTX,Covid-19 UPDATE: We have been OPEN for Emergency patients only but will begin seeing non-emergent dental care beginning this week &amp; hygiene appointments beginning May 11th. We will reopen everything safely &amp;… https://www.instagram.com/p/B_zLzOfp5NU/?igshid=pexr1yuyemc3,0,0,,,
2020-05-05 08:51:05+00:00,GaryLanePeters1,"We are seeing the most dangerous people refusing social distancing, refusing to believe the covid 19 virus is serious and extremely dangerous. As a result, these people are going to create a doubling of current Death rate from 68,000 to136,000 Deaths by June 1st.",0,0,,,
2020-05-05 07:53:59+00:00,MtzDelilah,This Covid 19 break has stepped up my alcohol tolerance ,0,4,,,
2020-05-05 07:43:08+00:00,GaryLanePeters1,Royal College of Nursing chief exec admits “they didn’t infect enough people” with COVID-19 ,0,0,,,
2020-05-05 07:23:30+00:00,GaryLanePeters1,Researcher identifies four possible treatments for COVID-19 ,0,0,,,
2020-05-05 06:40:05+00:00,c_legoz1204,Florida has both of those things. And a low number of deaths. Guess @NYGovCuomo should’ve followed @GovRonDeSantis and not put covid patients in nursing homes #bluestatecovid,0,0,@NYGovCuomo @GovRonDeSantis,#bluestatecovid,
2020-05-05 04:56:36+00:00,joselizacarias,"May 04 2020. Un ciclo de 1 año en Mesero! Con la Pandemia COVID-19! 33 años! Soon to be married and A father! And here is when all begins............... @University Park, Texas https://www.instagram.com/p/B_yyZ3HJRd-/?igshid=1u8a2bihytbsr",0,0,,,
2020-05-05 04:54:32+00:00,patricelauren1,"""Supreme Court hears oral arguments by phone due to the COVID-19 pandemic"" ",0,0,,,
2020-05-05 04:54:07+00:00,patricelauren1,New York. #coronavirus ,0,0,,#coronavirus,
2020-05-05 04:36:31+00:00,maxmandel23,#coronavirus,0,0,,#coronavirus,
2020-05-05 04:20:49+00:00,GusBusVentura,Let’s get tickets to that game. (If covid lets it happen),0,1,,,
2020-05-05 04:19:01+00:00,WhatleyKayla,Probably won’t be back to the city for another few months. Gotta let that COVID chill out. Maybe my birthday I’ll come home ,0,0,,,
