date,user,text,retweets,favorites,mentions,hashtags,geolocation
2020-05-08 15:01:01+00:00,Boomer_Patriot,"'Shocking' Two-Thirds of NY Hospitalized COVID Patients Had Stayed Home, Defying Social Distancing Logic https://www.westernjournal.com/shocking-two-thirds-ny-hospitalized-covid-patients-stayed-home-diagnosis-defying-social-distancing-logic/?utm_source=Twitter&amp;utm_medium=PostTopSharingButtons&amp;utm_campaign=websitesharingbuttons",1,0,,,
2020-05-08 14:55:47+00:00,WBWhitson,Reading thru this it appears to be targeted for PreK - 5th graders and the presumptive loss of learning over the summer. COVID is the entry point for actually implementing year round school. That’s not a new thought. We’ll need to stay tuned.,0,3,,,
2020-05-08 14:50:15+00:00,Bilbrey_Carrie,Anyone on the conspiracy side of this situation have some points to make? #COVID,0,0,,#COVID,
2020-05-08 14:48:26+00:00,b_trussell,"""Hahaha your getting sick and we're in a bubble"" Trump is testing himself and those around him multiple times a day since his NAVY VALET became positive for the Coronavirus. He is in a bubble Meanwhile 72,500. People have died nation wide. This is treasonous, what he has done!!!",1,2,,,
2020-05-08 14:32:31+00:00,Dosmuzic,@realDonaldTrump what a joke!!!! Thats whay its popular funnay ass stupid people!!!!Reverses Course When He Realizes How Popular His Coronavirus Task Force Has Become https://www.yahoo.com/entertainment/trump-reverses-course-realizes-popular-035000299.html?soc_src=community&amp;soc_trk=tw via @Yahoo,0,0,@realDonaldTrump @Yahoo,,
2020-05-08 14:30:16+00:00,idolilysh,"Forgiving student loans has nothing to do with covid -19, woman.",0,0,,,
2020-05-08 14:27:02+00:00,Dosmuzic,@KellyannePolls but tested positive for being a faucking !! Gtfoh!!!Conway Says President Trump Has Tested Negative for the Coronavirus https://news.yahoo.com/kellyanne-conway-says-president-trump-203636118.html?soc_src=community&amp;soc_trk=tw via @Yahoo,0,0,@KellyannePolls @Yahoo,,
2020-05-08 14:19:25+00:00,ruthellaowens,BBC News - Coronavirus: Pandemic sends US jobless rate to 14.7% ,0,0,,,
2020-05-08 14:16:47+00:00,ruthellaowens,BBC News - Coronavirus: Meat shortage leaves US farmers with 'mind-blowing' choice ,0,0,,,
2020-05-08 14:06:58+00:00,WerderEdESPN,Free agency. The draft. The schedule release. Nobody has ever dominated anything like the #NFL has dominated the Coronavirus quarantine.,14,142,,#NFL #NFL,
2020-05-08 13:43:23+00:00,julie_wehmeyer,"I have a strong suspicion that covid-19 deaths are underreported in Texas. If you look at other states they have similar positive tests, their death rates are almost 30 to 50% higher than ours. Something stinks in Texas.",0,1,,,
2020-05-08 13:29:15+00:00,TheGeoffey,Husband and I scheduled Covid-19 antibody tests for later today. http://LabCorp.com/antibody-testing,0,2,,,
2020-05-08 13:25:49+00:00,JordanCcourtney,Literally having the worst cramps in my entire life. Thank you Covid for letting my birth control take 2 WEEKS (still don't have it) to be mailed. Brb while I die,0,2,,,
2020-05-08 12:52:55+00:00,stevelatimer,"Leading Cause of Death in U.S.? Hint: It Isn’t Covid-19 - WSJ Bob Anderson, Chief National Center for Health Statistics. “About 230,000 from heart disease, 200,000 cancer deaths, 61,000 chronic lower-respiratory diseases, 55,000 accidents, 52,000 are strokes.” @realDonaldTrump",0,0,@realDonaldTrump,,
2020-05-08 12:49:10+00:00,theHelpNet,Here's your chance to tell the #government directly that you want some of that #HealthCare tax $back for your own #selfCare use. This #WhiteHouse #Petition is requesting a $2k/mo. For 12 months #Covid19 #CoronaVirus… https://www.instagram.com/p/B_7W33bn3wo/?igshid=py4jw9klhrsa,0,0,,#government #HealthCare #selfCare #WhiteHouse #Petition #Covid19 #CoronaVirus,
2020-05-08 12:45:02+00:00,emcuhh,"I am Jose Cervantes, nickname Coronavirus in CNN social media fake social , do yo want to continue??!?????????????? Went to several times about forgiveness",0,0,,,
2020-05-08 11:49:00+00:00,saintdenniswall,"Well, well... Look who’s been hanging out with Dr. Fauci ! Nancy Pelosi knew about the COVID-19 before it was launched on the World! And she sure as Hell knew about it when she was trying to Impeach President Trump! She admitted it! ",0,0,,,
2020-05-08 11:48:37+00:00,Vegaz23,I wonder when the media will start talking about the frontline workers of the air who in direct line of COVID and are being affected and dying as well. The airline workers who are blamed for not social distancing yet the flights are packed. When are they protected?,0,0,,,
2020-05-08 10:36:44+00:00,saintdenniswall,As long as we have insane people like Nancy Pelosi in Office we will have devastating problems. She actually knew about COVID-19 &amp; did nothing to stop its spread because she was trying to Impeach President Trump! She MUST be UNSEATED! ,0,0,,,
2020-05-08 10:35:44+00:00,Bl6ckBette,I forgot to name my sim’s baby Covid ,0,0,,,
2020-05-08 10:09:01+00:00,island_girl214,This CoVid thing keeps causing my court day to be pushed back ugh ,0,0,,,
2020-05-08 09:10:58+00:00,CBarnumphoto,Untitled (The blue one) 36 x 48 Acrylic on canvas DM for price #painting #art #Arthistory #working #Covid19 #Coronavirus #Artist #Imreallyaphotographer #Texas #Fortworth #acrylic,0,0,,#painting #art #Arthistory #working #Covid19 #Coronavirus #Artist #Imreallyaphotographer #Texas #Fortworth #acrylic,
2020-05-08 08:12:27+00:00,mke13___,i love being in the covid “annex” at work ,0,0,,,
2020-05-08 06:33:01+00:00,TheOfficialBenX,The only good thing about 2020 is the music #2020 #coronavirus #MurderHornets #RIPKobe,0,0,,#coronavirus #MurderHornets #RIPKobe,
2020-05-08 05:41:57+00:00,williamtincup,"""I love the Chinese government"" *9mm trigger is cocked loudly* ""China is defeating the American born Coronavirus"" *brings in the next citizen*",0,0,,,
2020-05-08 05:34:30+00:00,seizethewhiskey,"Today, Texas opens nail salons. Yesterday, California announced their statewide coronavirus outbreak started in one. ",2,1,,,
2020-05-08 05:15:38+00:00,HearFortWorth,"#MatteBlackSound &amp; @Tequileno add Support to the @hearfortworth, @filmfortworth &amp; @uwtarrant’s Creative Industry Relief Fund, helping creatives during Covid-19 TWO Ways you can donate &amp; get something for yourself too! https://bit.ly/2SPc7lU",6,14,@Tequileno @HearFortWorth @FilmFortWorth @UWTarrant,#MatteBlackSound,
2020-05-08 04:59:58+00:00,thelibrarywitch,Day 43 of our COVID-19 Fashion Show she gettin all high fashion on me or something what is this ,0,3,,,
2020-05-08 04:51:29+00:00,laurendfoutch,Does a dinosaur hazmat suit protect against coronavirus and murder hornets,0,1,,,
2020-05-08 04:51:22+00:00,chestnut_daniel,"""China’s cyberespionage efforts have shown no sign of relenting globally and may be intensifying as tensions with Australia, the United States and other countries have risen over trade, technology and, more recently,disputes over the coronavirus pandemic."" ",0,1,,,
2020-05-08 04:26:51+00:00,derickijohnson,...daydreaming of the day she eats you? My cat Has me worried What she’s Thinkin bout She stares at me &amp; #shoestring Length of drool Trails from her mouth It makes me Wanna make sure That her cat food N’er runs out In case this Covid Craziness Goes a bit More south— #vss365 https://twitter.com/66human/status/1258515267686002688,5,56,,#shoestring #vss365,
2020-05-08 04:22:22+00:00,mdsmelser,NY Doctor Describes What It's Really Like In Hospitals #Coronavirus https://youtu.be/CNd7ml9VUAc via @YouTube,0,0,@YouTube,#Coronavirus,
2020-05-08 04:20:17+00:00,hajekzone,"Praying for him. I buried my Dad today in Dallas. Lost to COVID-19. My Mom, his wife of 68 years, is trying to recover from Covid and heartbreak. ",1,0,,,
2020-05-08 03:44:13+00:00,AlexAlmaraz25,"*El Covid 19 está arrebatando vidas, empleos, negocios* -La morra castrosa: “WEEEY YA NO AGUANTO” “WEEY MI FIESTA DE CUMPLEAÑOS” “QUIERO IR A CANCÚN”",0,7,,,
2020-05-08 03:20:08+00:00,JoyaElam,Figured I'd document it....rockin' that COVID-19 face mask while handing back school supplies. – at Woodrow Wilson Elementary,0,6,,,
2020-05-08 03:18:28+00:00,AmyLGo,"Bought @United ticket May 5 to attend funeral for a friend who died from COVID-19. Just found out the funeral has been cancelled, asked for a refund on May 7 but @United unwilling—past 24 hrs since ticketed—only offering travel vouchers. Come on @United.",0,0,@united @united @united,,
2020-05-08 03:10:46+00:00,JClaytonLawren1,"No jail time, no fines for not following @GregAbbott_TX COVID orders. So what’s the point of the orders? Oh, they are no longer orders, just suggestions. So what other orders do we get to ignore Governor? #WFAA #CNNPolitics",0,0,@GregAbbott_TX,#WFAA #CNNPolitics,
2020-05-08 02:59:38+00:00,JosephsATS,Getting ready to shake the COVID-blues this weekend! @Joseph's Auto Toy Store https://www.instagram.com/p/B_6TZ9HD1my/?igshid=ps3vw0lalevx,2,1,,,
2020-05-08 02:41:04+00:00,everydaysharday,Me to the Coronavirus: ,1,2,,,
2020-05-08 02:35:24+00:00,maddogblues,WHO Official It's Time To Remove People From Their Homes & COVID Task F... https://youtu.be/lTSPYqtIUdM via the evil elite! @realDonaldTrump get rid of them from around you!,1,1,@realDonaldTrump,,
2020-05-08 02:06:18+00:00,UNTAlphas,"Showing our appreciation to the Doctors, Nurses and medical staff at Medical City Denton. Thank you for treating patients and being on the frontline of this battle against COVID-19 #HEcares",19,76,,#HEcares,
2020-05-08 01:57:27+00:00,Grimaldo_Alexa,Some people don’t realize the severity of what is going on and they won’t understand until someone they know gets COVID It’s sad but true,5,8,,,
2020-05-08 01:51:10+00:00,Deuce2x___,Just found out that Unc has Covid-19. Prayers going up!,0,2,,,
2020-05-08 01:29:25+00:00,dtx_vale,Will Kylie Jenner give me 1k to help me out with all that’s going on with the coronavirus? Or will she promote my lash business ,0,4,,,
2020-05-08 01:27:02+00:00,NailStudioByTom,"Getting ready for reopening....My studio and I am officially a Barbicide COVID -19 certified .... We’re committed to helping you and we take pride in our cleanliness, communications, and talent. . . . . . . .… https://www.instagram.com/p/B_6Izt_gYuH/?igshid=j7ynkwd4qaxm",0,0,,,
2020-05-08 00:56:33+00:00,Bl6ckBette,"And now there’s developments about an evolved version of covid sending children to the hospital, but “let’s open back up!!!” ",1,1,,,
2020-05-08 00:49:18+00:00,Boomer_Patriot,New York City Royally Screwed Up In Their Coronavirus Response and It Created a Nationwide Outbreak ,0,0,,,
2020-05-08 00:47:01+00:00,chestnut_daniel,"@NYGovCuomo A follower sent me this by DM enquiring as to it's content, if it's true or not. It's the grossest BS Propaganda - NY hospitals killing people by medical malpractice, not Covid-19 I'm sending it in hopes you can get it removed from FB, etc https://m.facebook.com/terrencekwilliams/videos/592822351332008/?refsrc=http%3A%2F%2Ft.co%2FRQNnuLZx9b&amp;_rdr",0,0,@NYGovCuomo,,
2020-05-08 00:44:44+00:00,Boomer_Patriot,Survey: 66% Of New COVID Hospitalizations In NYC Were People Who Were 'Staying Home' ,0,0,,,
2020-05-08 00:42:19+00:00,its_YEMII,the way some y’all portrayed yourself before Covid-19 was so big people can’t event help you now cos you made yourself do big &amp; now y’all suffering deep down financially,0,0,,,
2020-05-08 00:27:18+00:00,gshevlin,What inalienable rights? You mean their right to spread Covid to others because they happen to be asymptomatic carriers?,0,1,,,
2020-05-08 00:21:06+00:00,robfwtx,Do you ever feel that you just don't fit in anywhere? I was isolated before this COVID stuff. Disability from chronic pain does that to you.,0,1,,,
2020-05-08 00:18:59+00:00,Boomer_Patriot,House Committee In Louisiana Has Voted To Loosen Coronavirus Stay-At-Home Order ,0,0,,,
2020-05-08 00:18:35+00:00,SirAustinOfDunn,"Had one before I was on probation. Been wanting to get it again, but since I’ve gotten off probation no one has been doing them around here because of covid bullshit. My old man is a Fed so he’s gonna look into it tomorrow for me as well as an attorney.",0,1,,,
2020-05-08 00:16:33+00:00,Boomer_Patriot,White House @PressSec Kayleigh McEnany Shreds Media When Asked About Her Past Statements On Coronavirus https://thepoliticalinsider.com/white-house-press-secretary-kayleigh-mcenany-shreds-media-when-asked-about-her-past-statements-on-coronavirus/ via @TPInsidr,0,0,@PressSec @TPInsidr,,
2020-05-08 00:04:27+00:00,kcampos9042,I’m so ready to book but damn this covid!! Schedule release for me pumped ,0,1,,,
2020-05-07 23:58:07+00:00,GailAScott65,"After just dealing with Trump morons on FB, YOU provided a respite. You are the proverbial oasis in the desert. (I would say “a breath of fresh air,” but with Covid-19, THAT might be in short supply these days.) Thanks Stone!",0,1,,,
2020-05-07 23:15:26+00:00,christoph7809,Shouldn’t he just be released to avoid CoronaVirus and make room for salon owners and others who try to work?,0,6,,,
2020-05-07 23:15:15+00:00,macybhermann,"graduating college during covid is so disappointing, like, you’ve worked your entire life for this moment just for you to not be able to celebrate. Didn’t think I’d be in my feels about the situation but now that I’m done I’m hella upset.",1,4,,,
2020-05-07 23:14:00+00:00,barbernataly,"It’s propaganda to illustrate COVID-19 deaths inaccurately to execute an agenda by instilling fear. The govt has a track record of this. The White House Task Force flat out admitted to ruling patients who died with COVID-19, as COVID-19 deaths. When there are many factors to",0,0,,,
2020-05-07 23:08:24+00:00,MichaelHugg2591,"""The Texas Department of Health reported 1,293 new positive cases of Covid-19 on Saturday, which is its second highest single-day infection rate. This also marks the first time Texas has recorded more than 1,000 cases three days in a row."" - CNBC",0,0,,,
2020-05-07 23:08:08+00:00,Tigerpug,And now he can play the coronavirus Russian roulette with the rest of the country. Welcome aboard captain.,0,0,,,
2020-05-07 23:06:11+00:00,_PerKINsON,Covid moving mad,0,1,,,
2020-05-07 23:00:47+00:00,CityOfFriscoTx,"FRISCO COVID-19 Update: One new Frisco COVID-19 case confirmed today. This brings Frisco’s total number of confirmed cases to 140, which includes 109 recoveries between the two counties. ",1,5,,,
2020-05-07 22:08:25+00:00,anadecimononica,¿También vas a querer que se tome fotografía con los enfermos de coronavirus? Saludos y sigue con las buenas ideas. ,0,0,,,
2020-05-07 21:56:24+00:00,StayHumbleMitch, During this pandemic stay masked up with StayHumbleClothing... Dm for mask &amp; t-shirt package... #Covid-19 #StayHumbleDaily ,2,2,,#Covid #StayHumbleDaily,
2020-05-07 21:56:22+00:00,StayHumbleMitch, During this pandemic stay masked up with StayHumbleClothing... Dm for mask &amp; t-shirt package... #Covid-19 #StayHumbleDaily ,1,0,,#Covid #StayHumbleDaily,
2020-05-07 21:25:54+00:00,InsertBlankHere,Imagine running an entire state and thinking praise from the idiot-in-chief is something to boast about. Apparently my governor is in a contest with Trump to prove who is the bigger moron. #GOP #coronavirus #lockdown #COVIDIOT @GregAbbott_TX #NotMyPresident #NotDyingForWallStreet,1,0,@GregAbbott_TX,#GOP #coronavirus #lockdown #COVIDIOT #NotMyPresident #NotDyingForWallStreet,
2020-05-07 21:22:04+00:00,cowboyshine,If you keep your body as clean as these boots it’s impossible to catch the Coronavirus! Right #cowboyshine #bootshine #canttouchthis #nocoronavirus #tooclean #boots #mensboots #bootlover #bootslover #bootlovers #mensfashion #menstyle #menstylefashion #brownboots #lifestyle,0,1,,#cowboyshine #bootshine #canttouchthis #nocoronavirus #tooclean #boots #mensboots #bootlover #bootslover #bootlovers #mensfashion #menstyle #menstylefashion #brownboots #lifestyle,
2020-05-07 21:08:36+00:00,tedxas,"Gang, we certainly owe so much to so many. Here’s a great tribute to all of you. #ThankfulThursday #COVID The Call - Let The Day Begin https://youtu.be/to2KasivROc via @YouTube",0,1,@YouTube,#ThankfulThursday #COVID,
2020-05-07 21:00:39+00:00,Anthony_Aleman_,It seems like we have accepted death for this coronavirus rather than staying in and being safe. That bugs the hell out of me man,0,0,,,
2020-05-07 21:00:10+00:00,NavarroOEM,"The COVID-19 mobile testing center will return to Navarro County Sunday, May 10th and Monday, May 11th at the I.O.O.F. Event Center in Corsicana. Hours of operation both days will be from 10:00 AM to 4:00 PM. If… https://www.instagram.com/p/B_5qRCQgTHH/?igshid=1iqi0wy9z6usb",0,1,,,
2020-05-07 20:49:57+00:00,7Mary42,Absolutely outrageous! Comrade @JudgeClayJ is drunk with power ... sending struggling business owners to the Gulags. #Dallas #Coronavirus ,0,0,@JudgeClayJ,#Dallas #Coronavirus,
2020-05-07 20:48:25+00:00,jms_ventures,Thursday report : Another 3.2 million people filed for unemployment for the first time last week — bringing the total number of jobs lost during the coronavirus crisis to at least 33.5 million.,0,2,,,
2020-05-07 20:45:57+00:00,ahscoltsoccer,Last goal.....literally the last goal of the year before the season was shut down by Covid-19. This header was courtesy of @germs66041585 once again. Nice serve by Edgar Aguirre. This team definitely had more goals to score. Hope y’all enjoyed all of them!,2,20,@germs66041585,,
2020-05-07 20:42:16+00:00,ByDigitalDash,this revelation might cure coronavirus ,0,1,,,
2020-05-07 20:39:55+00:00,ByDigitalDash,the worst thing about this covid shit is that idek when my birthday is now. usially it starts around now :/,1,4,,,
2020-05-07 20:35:53+00:00,IlaBWilliams1,A test swab is probably not the only thing Trump is sticking up his nose. Trump says he'll be tested daily for coronavirus after valet tests positive https://cnn.it/2WDowu6,0,0,,,
2020-05-07 20:17:48+00:00,alleypat,"Covid-19 found in semen of infected men, say Chinese doctors ",0,0,,,
2020-05-07 19:59:49+00:00,DallasDirtCandy,She defies a TRO and goes free Covid-19 has warped our minds ,0,2,,,
2020-05-07 19:52:20+00:00,Thalassatx,I'm glad you are aware of your ignorance. First step to getting better. Now try listening to doctors about COVID.,0,0,,,
2020-05-07 19:37:19+00:00,TheStaceyMonroe,#StayingStrong #COVID19 #Coronavirus #Quarantine #Isolation #SocialDistancingSavesLives #Dallas #StayHomeStaySafe #SocialDistancingSavesLives #Transgender #Advocate #LGBTQ #TransIsBeautiful #GirlsLikeUs #TransRightsAreHumanRights,0,1,,#StayingStrong #COVID19 #Coronavirus #Quarantine #Isolation #SocialDistancingSavesLives #Dallas #StayHomeStaySafe #SocialDistancingSavesLives #Transgender #Advocate #LGBTQ #TransIsBeautiful #GirlsLikeUs #TransRightsAreHumanRights,
2020-05-07 19:35:27+00:00,ceasar_alexx,"https://m.youtube.com/watch?feature=youtu.be&amp;v=DketPWFdJBk Watch this shitshow Dr.Mikovitz , could be true could not but damn . Doctor's being pressured to say it was Covid is like oof",0,0,,,
2020-05-07 19:18:15+00:00,Aus10PS,"New hobby is scrolling through all my boomer friends on Facebook, reporting their insane covid 19 conspiracy theory videos. It’s usually posted in their Facebook story with the caption “watch this before it gets taken down!”, you did it Keith you cracked the case.",2,25,,,
2020-05-07 19:14:34+00:00,lisadiane56,@TXWorkforce I was let go on March 20 due to Covid 19 filed still says 0 and no payment file every 2 weeks plus sent appeal what is going on ?,0,0,@TXWorkforce,,
2020-05-07 19:01:53+00:00,lynziekate,If the coronavirus messes up the nfl season at all I will cry,0,3,,,
2020-05-07 19:01:47+00:00,AgAguerrero50,Coronavirus: Researchers say travel from NYC seeded nationwide outbreaks #Coronavirus ,0,0,,#Coronavirus,
2020-05-07 18:58:29+00:00,Maria_NBC5,BREAKING: Shelley Luther is a free woman @NBCDFW When I asked if this was worth it: she said yes. Going to see her daughters now. Texas Supreme Court Orders Release of Dallas Salon Owner in COVID-19 Controversy https://www.nbcdfw.com/news/coronavirus/gov-abbott-removes-jail-as-punishment-for-coronavirus-restriction-violations/2365261/ – at Frank Crowley Courts Building,3,2,@NBCDFW,,
2020-05-07 18:49:39+00:00,jeprincipal,"COVID-19 Response Update - May 7, 2020 https://youtu.be/1rFD4Llkeks via @YouTube",2,2,@YouTube,,
2020-05-07 18:38:34+00:00,texasesc,Needed a break from #COVID so I'm taking a stroll thru Stars Hollow with @thelaurengraham @melissamccarthy @ScottGPatterson @alexisbledel and the rest of the fam. @GilmoreGirls = Comfort Television.,0,0,@thelaurengraham @melissamccarthy @ScottGPatterson @alexisbledel @GilmoreGirls,#COVID,
2020-05-07 18:24:00+00:00,chrissadeghi,"Stars fans, here’s you chance to beat the Blues. If you remember our story from a few weeks ago, @jeffk_stars and the @DS_Foundation are raising money for COVID-19 relief. Great #MothersDay idea, help fight the pandemic and whip St. Louis. Hat trick. #GoStars",4,5,@jeffk_stars @DS_Foundation,#MothersDay #GoStars #GoStars,
2020-05-07 18:14:21+00:00,Maria_NBC5,"Just saw Shelley Luther’s attorney & her boyfriend walk back inside county jail. She has to be released by 4, says TX Supreme Court. Texas Supreme Court Orders Release of Dallas Salon Owner in COVID-19 Controversy ",8,16,,,
2020-05-07 18:09:58+00:00,Is_This_Legal_7,"The reason he would become so forgotten is because he caught COVID recovered, re-Infected, recover, repeat",0,1,,,
2020-05-07 18:05:54+00:00,KRLDAndrewG,"Fort Worth Mayor @MayorBetsyPrice announces creation of Fort Worth Now, a task force aimed at economic growth and recovery from the COVID-19 crisis. ",0,1,@MayorBetsyPrice,,
2020-05-07 17:49:23+00:00,barbernataly,"Certain measures we are taking, even with the proof in science, may be essential to the shock of our healthcare system, however, will have cons to our immunity. In fact, make us more susceptible to COVID-19. There is an agenda. This isn’t Fauci’s 1st rodeo. Just do the research.",0,0,,,
2020-05-07 17:48:33+00:00,Carty,I am at a restaurant. Sitting. And eating. #COVID #coronavirus #Quarantine? – at Fernando's Mexican Cuisine,0,6,,#COVID #coronavirus #Quarantine,
2020-05-07 17:47:30+00:00,confusedabout,It's May 7th and Chuck Schumer still hasn't been tested for Covid-19. #Hypocrite,0,1,,#Hypocrite,
2020-05-07 17:46:43+00:00,cturullolsATT,"It’s not always about the big sale, it’s about taking care of our customers during these hard times. Thank you Mrs. Roberts! @mcollins_22 @thedoscarver @eddy_luster @Ocampo_ChrisJ @JenHufnagel @markbagri #att #CustomerExperience #CustomerService #Hallelujah #COVID #StayConnected",1,16,@mcollins_22 @thedoscarver @eddy_luster @Ocampo_ChrisJ @JenHufnagel @markbagri,#att #CustomerExperience #CustomerService #Hallelujah #COVID #StayConnected,
2020-05-07 17:42:36+00:00,KarenBrodr,COVID safe !! shopping ! @Home Grown Plants https://www.instagram.com/p/B_5TqM9F1xU/?igshid=1w5xxkctmgbd,0,0,,,
2020-05-07 17:40:41+00:00,JoseILeyvajr,Life hack #131 How to make #Atheists &amp; #Agnostics pray #Covid_19,0,0,,#Atheists #Agnostics #Covid_19,
2020-05-07 17:38:30+00:00,food_legacy,Just landed a 2015 Hill of Grace while in the Barossa “enjoying” a bout of Covid-19 with 20 friends! ,0,1,,,
2020-05-07 17:37:12+00:00,vtbirkenstock,Exactly how did you get into such debt? Cuomo Plans to Charge State Income Taxes to Hero Healthcare Workers Who Traveled to New York to Fight Coronavirus ,0,0,,,
2020-05-07 17:30:03+00:00,Maria_NBC5,Media & supporters standing by for moment Shelley Luther is released from jail. Maybe 1 hr to go. Her attorney is inside. @NBCDFW Texas Supreme Court Orders Release of Dallas Salon Owner in COVID-19 Controversy https://www.nbcdfw.com/news/coronavirus/gov-abbott-removes-jail-as-punishment-for-coronavirus-restriction-violations/2365261/ – at Frank Crowley Courts Building,1,1,@NBCDFW,,
2020-05-07 17:28:12+00:00,EdZman01,“Correct spelling” Let’s disbar him and toss off the bench for his lack of judgement. They let criminals out of jail so not to get COVID but put hard working person in. What is wrong with our country. ,0,0,,,
2020-05-07 17:27:59+00:00,NorthTxCoder,"But of the 7500 per day that die without COVID-19, a large percent of them are ‘before their time’ - whatever that means. Most would agree when it’s your time, it’s your time and that is just a fact of life. The folly is thinking we have control over that.",0,0,,,
2020-05-07 17:21:33+00:00,DeborahBee1959,https://www.bitchute.com/embed/UVxkawagVbLm/ It’s time the truth come out COVID-19 is to get everybody ready for complete Control,0,0,,,
2020-05-07 16:51:35+00:00,Maria_NBC5,BREAKING Shelley Luther will be released from jail in 2-4 hours We’re standing by for that. Texas Supreme Court Orders Release of Dallas Salon Owner in COVID-19 Controversy ,6,2,,,
2020-05-07 16:50:41+00:00,HudsonMBA,"Oh weird. #COVID #DontStayAtHome #YouOverEmotionalWastesOfSpace #tyrants #Freedom #Quarantine #WeAlreadyFlattenedTheCurveYouFuckNuts #ManImTiredOfBeingRight @Dallas, Texas https://www.instagram.com/p/B_5NtzSJHZb/?igshid=ipu9pkiv3opt",0,0,,#COVID #DontStayAtHome #YouOverEmotionalWastesOfSpace #tyrants #Freedom #Quarantine #WeAlreadyFlattenedTheCurveYouFuckNuts #ManImTiredOfBeingRight,
2020-05-07 16:39:59+00:00,LorieBlair22,Wrong! She is in contempt of court not violation of COVID-19 defiance!! She should respect the court and then be released. Paxton paying the fine and Abbot changing his order to remove jail further proves the point!,0,0,,,
2020-05-07 16:18:50+00:00,totallyFedUp,Covid-19 is named for the year it was discovered in there are multiple strains of Coronavirus where the issue lies is with an RNA sequencing with in the human body because this particular virus came from animals we are not able to fight it = pandemic,0,0,,,
