date,user,text,retweets,favorites,mentions,hashtags,geolocation
2020-04-23 16:11:54+00:00,ajaahp,CAUGHT RED HANDED: CORONAVIRUS MEDIA USING DUMMY DOLLS TO SPREAD FEAR! B... https://youtu.be/n8ZF-TkwQ0w via @YouTube,0,0,@YouTube,,
2020-04-23 16:10:24+00:00,LoganMartini_,some colleges are waiving the requirement for incoming students to have taken the SAT/ACT because of coronavirus and I-,0,4,,,
2020-04-23 16:10:09+00:00,Boomer_Patriot,‘Are you TOTALLY eff’d in the head?!’ CNN’s Bill Weir claims COVID has helped humanity and LOOKOUT that’s a lotta backfire ,0,0,,,
2020-04-23 16:09:33+00:00,justnikkinoland,"In Jesus’ name: Goodbye COVID, Hello EYBL . Amen. ",2,18,,,
2020-04-23 16:07:28+00:00,the0nlyDREW,"Idk what to believe about the actual covid virus, so I’ma keep doin what I been doin.",0,0,,,
2020-04-23 16:05:14+00:00,wolfiehernandez,"No te conviertas en una pieza de #domino, si tienes que salir a trabajar, a la tienda, a caminar, etc... Protégete y siempre mantén tu distancia. #Dame6 #covic19 #coronavirus #Dallas #Fortworth #metroplex #Tx… https://www.instagram.com/p/B_VEpXxjx8I/?igshid=nvir5ywhnx4n",0,0,,#domino #Dame6 #covic19 #coronavirus #Dallas #Fortworth #metroplex #Tx,
2020-04-23 16:01:55+00:00,jvanblargan,"COVID-19’s recent spread shifts to suburban, whiter, and more Republican-leaning areas https://brook.gs/2Vrc0yv via @BrookingsInst",0,0,@BrookingsInst,,
2020-04-23 16:01:31+00:00,vow3l,what do y’all think coronavirus actually is a cover up for,0,0,,,
2020-04-23 16:00:16+00:00,Boomer_Patriot,"Report: Obama Admin Funded China's Coronavirus Research, Gave Millions in Taxpayer Money to Wuhan Lab ",1,0,,,
2020-04-23 15:54:08+00:00,tomcnohonyc,How could anyone expect the MSM to understand the logistics of what the Coronavirus Task Force undertook. They are childlike most of the time.,0,0,,,
2020-04-23 15:48:17+00:00,TravisLofley,This will be the event Germany celebrates with upon defeating COVID-19. ,0,0,,,
2020-04-23 15:34:01+00:00,andrew73649349,49157 in 2018 the whole year.... what’s your point? The covid-19 pneumonia is viral and unless we are testing everyone then you can not dismiss the deaths as bacterial pneumonia just to make the #s better for your agenda!!!,0,0,,#s,
2020-04-23 15:32:26+00:00,BadgalJil,Lmaooo why my manager have the nerve to ask me “Why I filed for unemployment “ like my check wasn’t 77$for 2 weeks . Nigga obviously Covid has affected business so let me get my money,0,2,,,
2020-04-23 15:32:14+00:00,HilandWatts,@EllenBarkin what are your credentials for making these #coronavirus claims against @realDonaldTrump?,0,0,@EllenBarkin @realDonaldTrump,#coronavirus,
2020-04-23 15:27:15+00:00,GordyCarmona,@ewarren’s oldest bother Air Force veteran Donald Reed Herring has passed away three weeks after testing positive for the Coronavirus. ,0,0,@ewarren,,
2020-04-23 15:21:08+00:00,HollyLTaylor76,I’d rather sneeze than have covid any day!,0,0,,,
2020-04-23 15:13:52+00:00,3380P,He popped his head out of the basement to let us know that we will have 6 more weeks of Coronavirus! Well played “Groundhog Cuomo”!,0,0,,,
2020-04-23 15:02:57+00:00,omarmuniz9,France shows you can't fight coronavirus with money ,0,0,,,
2020-04-23 15:01:46+00:00,jimfritze,"Mika, You are not alone. Your show (and Joe’s) this morning reveals that Trump believes that he knows more about the Covid-19 than prominent medical researchers. ",0,0,,,
2020-04-23 14:58:10+00:00,omarmuniz9,An ER Doctor’s Diary Of 3 Brutal Weeks Fighting COVID-19 ,0,0,,,
2020-04-23 14:54:59+00:00,DPDCA,"Please register for the Teletown Hall with @ChiefHallDPD &amp; City Councilman @VoteOmarNarvaez on this Tuesday, April 28th at 1:10pm for a discussion on COVID-19 frauds and scams. #thursdaymorning",8,6,@ChiefHallDPD @VoteOmarNarvaez,#thursdaymorning,
2020-04-23 14:40:51+00:00,blissfullyorgan,"Who else has prepared a #COVID-19 care pack? thecontainerstore Tall Shoe Box is the perfect fit #labels #containerstore #beprepared #rona2020 @Dallas, Texas https://www.instagram.com/p/B_U7uh5HXOy/?igshid=jtj061rtq009",0,0,,#COVID #labels #containerstore #beprepared #rona2020,
2020-04-23 14:31:45+00:00,M4tthewHumphrey,My favorite silver lining from all of this Covid mess is that @JOHNNYSWIM and @amandasuramirez are producing some of their absolute best tracks ever via #songswithstrangers.,0,7,@JOHNNYSWIM @amandasuramirez,#songswithstrangers,
2020-04-23 14:26:09+00:00,Cumpartywitkane,"#coronavirus @Dallas, Texas https://www.instagram.com/p/B_U6DB9liZe/?igshid=1ub75dxnfitkx",0,0,,#coronavirus,
2020-04-23 14:25:50+00:00,CandiceQuarles,"Warren wants paid sick leave, 'premium pay' for essential workers in next coronavirus bill ",1,3,,,
2020-04-23 14:24:22+00:00,mhamtil,"Probably best known for her sports photos, my @dallasnews colleague @LandisImages has many other talents - long term feature stories and sensitive portraiture among them. Here is one of her final pieces before heading to @AP_Images in L.A. https://www.dallasnews.com/news/public-health/2020/04/23/a-painfully-long-farewell-to-papa/##coronavirus",5,20,@dallasnews @LandisImages @AP_Images,#coronavirus,
2020-04-23 14:23:06+00:00,jeffmarketing1,Never Forget Social Media Business Marketing Free 30min Consultation https://jefferysocialmarketing.social5.net/packages/ #contentmarketing #Digitalmarketing #SEO #blogging #marketing #branding #marketingtips #marketingstrategy #coronavirus #covid19 #startup #b2bmarketing #sale #goals #growth #hardwork,0,2,,#contentmarketing #Digitalmarketing #SEO #blogging #marketing #branding #marketingtips #marketingstrategy #coronavirus #covid19 #startup #b2bmarketing #sale #goals #growth #hardwork,
2020-04-23 14:19:37+00:00,gmkdmanushy,Boredom is mother of creativity.. Get bored from lockdown don't worry. Learn how to remove unwanted object from your actions photography https://youtu.be/spYX-wSYsco #bird #flycatcher #thursdayvibes #coronavirus #StayAtHome #USA #Texas #photography #naturelovers #StaySafe,1,2,,#bird #flycatcher #thursdayvibes #coronavirus #StayAtHome #StayAtHome #USA #Texas #photography #naturelovers #StaySafe,
2020-04-23 14:12:46+00:00,ayokasystems,#pets telehealth surges as first US pets test positive for #coronavirus - FDA temporarily suspends requirement for veterinarians to examine animals in person before beginning telemedicine to help limit human-to-human interaction &amp; spread of COVID-19 @CNBC,0,0,@CNBC,#pets #coronavirus,
2020-04-23 13:54:04+00:00,Boomer_Patriot,Horrible: This Woman’s Entire Family Was Wiped Out by the Wuhan Coronavirus in Three Days ,0,0,,,
2020-04-23 13:53:40+00:00,Boomer_Patriot,Puzzling Over African American COVID Deaths ,0,0,,,
2020-04-23 13:53:18+00:00,Boomer_Patriot,CDC Director Takes @washingtonpost to Task Over an 'Inappropriate' Coronavirus Headline ,0,0,@washingtonpost,,
2020-04-23 13:51:08+00:00,Boomer_Patriot,"I rode the roller coaster that is the oil industry for 40 years. This is the worst I’ve ever seen. It seems to me that this glut, along with the #COVID pandemic have been orchestrated by the climate cult to overthrow the whole world’s economy to force radical changes on humanity.",0,0,,#COVID,
2020-04-23 13:46:14+00:00,VictoriasFamil1,Israel Researchers Discover A Cure For Coronavirus https://sokodirectory.com/2020/03/israel-researchers-discover-a-cure-for-coronavirus/ in God we trust.,0,0,,,
2020-04-23 13:42:54+00:00,moderate2severe,@GovAbbott @TexasTribune @ProgressTX #MasksNow #Covid_19 The CDC requires masks NOW. Listen to science! #txlege @JohnCornyn,1,1,@GovAbbott @TexasTribune @ProgressTX @JohnCornyn,#MasksNow #Covid_19 #txlege,
2020-04-23 13:34:15+00:00,Boomer_Patriot,@JoeBiden Admits Coronavirus Catastrophe Has Him 'Excited' About Changing the US ,0,0,@JoeBiden,,
2020-04-23 13:32:05+00:00,PseudoNic,Mexican wrestlers tackle the coronavirus with 'Lucha Libre' face masks https://nypost.com/2020/04/22/mexican-wrestlers-make-coronavirus-lucha-libre-face-masks/?utm_source=twitter_sitebuttons&amp;utm_medium=site%20buttons&amp;utm_campaign=site%20buttons via @nypost ,1,2,@nypost,,
2020-04-23 13:29:40+00:00,moderate2severe,Lesson learned. One cannot bullshit their way out of the #Covid_19 #ThursdayThoughts #TrumpOwnsEveryDeath @JohnCornyn is complicit! #VoteBiden2020,0,0,@JohnCornyn,#Covid_19 #ThursdayThoughts #TrumpOwnsEveryDeath #VoteBiden2020,
2020-04-23 13:22:31+00:00,Trent_PhD,"Question for some folks. How strong is the economy where you live? Is it diverse? Is it only tied to one industry? How are you dealing with short term and long term impacts of Covid-19? If you’re safe, how long do you think you’ll be safe for?",0,0,,,
2020-04-23 13:16:54+00:00,navyred9031,He knew the danger in 2017. We are walking infection People the coronavirus is a bunch of bullshit the government wants you to believe we have the common flu every year and that’s all this shit is,0,0,,,
2020-04-23 13:15:33+00:00,IMPACTClubBHS,Mayor Eric Johnson is the best Mayor that Dallas can have to lead the residents through the Coronavirus Pandemic. His actions are having positive consequences. ,0,0,,,
2020-04-23 13:12:55+00:00,VictoriasFamil1,"Coronavirus: ""La vacuna israelí está muy pronta a salir y será por vía oral"" https://cristinaperez.cienradios.com/coronavirus-la-vacuna-israeli-muy-pronta-salir-via-oral/ Gracias a Dios que llega una nueva esperanza a nuestra vida ha sido un gran martirio para todos al ver que muchos se han ido en Dios confiamos que en dos semanas tengan la vacuna.",0,1,,,
2020-04-23 12:57:54+00:00,V_PhillipsNRH,"A few of our beautiful blooms that have been such a joy in our yard as we eat on the Patio in the garden during Covid-19 in Dallas Fort Worth area, Texas. ",0,0,,,
2020-04-23 12:57:06+00:00,Rajababu786,"There was no China cover-up of coronavirus, Chinese envoy says https://reut.rs/2xItTQw. So if there is no cover up why the international body of Media and UN investigators not allowed . Afraid",0,0,,,
2020-04-23 12:50:13+00:00,Rajababu786,China says Australia call for COVID-19 probe is political maneuvering https://reut.rs/34ZOkV9 All the countries in the World need to Boycott China . The Communist gangster has Screwed the entire Humanity . Chinese people over throw this regime.,0,0,,,
2020-04-23 12:47:36+00:00,michielrdewit,"Coronavirus takes toll on restaurants, as owners question if it's worth the red ink ",0,0,,,
2020-04-23 12:41:48+00:00,jimfritze,More Americans are now realizing that Trump is lying to us about the continuing Coronavirus into the fall. Trump must go. ,0,0,,,
2020-04-23 12:38:51+00:00,michielrdewit,Paul Batura: Earth Day during coronavirus pandemic – celebrate creation and the Creator as we shelter in place ,0,0,,,
2020-04-23 12:37:54+00:00,jimfritze,Trump is firing medical experts to prevent us from learning the truth about the Coronavirus. ,2,1,,,
2020-04-23 12:32:21+00:00,jimfritze,Trump is lying. He disagrees with medical experts about what to expect with Covid-19. ,0,0,,,
2020-04-23 12:25:32+00:00,the_best_uhl_c,"we should be in vegas for the draft today, and i should be hitting up west gate sportsbook to pregame the draft god damn this coronavirus",0,0,,,
2020-04-23 11:53:11+00:00,lastcrazyhorn,"However, I also had a time where I suspect I may have had covid back in early February, because I remember everything not tasting right and wondering if people were changing their recipes or something.",0,0,,,
2020-04-23 11:50:05+00:00,D0rian_Gray1,If #Coronavirus was a person #IYKYK,0,0,,#Coronavirus #IYKYK,
2020-04-23 11:32:26+00:00,DallasAnalytics,The other issue you may not understand is that when hospitals are super slammed they have to find a place to discharge patients in order to care for more acute patients. Some of these horrible overcrowded hospital situations are because SNFs wouldn't accept COVID patients,0,0,,,
2020-04-23 11:29:07+00:00,achalaugustine,"When commerce starts to widen, “there will be some level of expansion of the spread of the coronavirus.” But, he said, “We can handle that, as long as the expansion is very minimal.” ",0,0,,,
2020-04-23 10:56:29+00:00,TheJustJacobPod,"""Two pet cats in New York test positive for COVID-19"" ",0,1,,,
2020-04-23 10:06:54+00:00,redfoxinict,"Nothing like feeling like a gangster... #ladytrucker #workinggal #gettingitdone #docklife #sexygranny #truckerslife #Covid-19 @Haltom City, Texas https://www.instagram.com/p/B_UcYMPlQnBcb3DqifU9cINAXPYOr5SrEbl42A0/?igshid=1t3y3u65v2y5u",0,0,,#ladytrucker #workinggal #gettingitdone #docklife #sexygranny #truckerslife #Covid,
2020-04-23 09:27:15+00:00,Signor_1,"Hey guys, watch out for my new single dropping this weekend titled “Back Off Coronavirus”. Signor. ",0,0,,,
2020-04-23 08:51:19+00:00,claypwest,Extensive testing so far has proven this to be true. Take the example of the Navy and their testing; just 2% are being admitted to the hospital. An economic collapse would dwarf the deadly impact of the coronavirus. ,0,0,,,
2020-04-23 08:48:43+00:00,BraedenDLGarza,how is it that the people that are disgusted by 9/11 conspiracy theories are the same people who believe that the COVID-19 vaccine is the mark of the beast and that the antichrist created the coronavirus ,4,11,,,
2020-04-23 08:11:34+00:00,StrikeAPose2day,"""Here's why 'silent spreaders' are making the coronavirus hard to beat"" ",1,1,,,
2020-04-23 07:55:24+00:00,EspProd,both sides keep talking abt how their views are what will save the country. but the country was doing pretty well before covid-19 and we’ll be doing great after it. but nothing gets solved by a single party and their policies...,0,0,,,
2020-04-23 07:01:44+00:00,Debbie_NOSNIBOR,"lol , The Hollywood Reporter reports on the entertainment industry. So yes, I guess with COVID-19 it is a slow entertainment news day for them. ",0,0,,,
2020-04-23 05:57:48+00:00,strawbmommy,#WearAMask #COVID19 #CoronavirusPandemic #coronavirus #corona #mask #meme,0,1,,#WearAMask #COVID19 #CoronavirusPandemic #coronavirus #corona #mask #meme,
2020-04-23 05:32:45+00:00,Nakethia_E,"If #coronavirus testing were widely available would you be tested? ""A healthy woman died. She was first known coronavirus death in U.S."" ",0,0,,#coronavirus,
2020-04-23 05:32:15+00:00,Nakethia_E,"If #coronavirus testing were widely available would you be tested? #COVID19 #StayAtHome ""A healthy woman died. She was first known coronavirus death in U.S."" https://twitter.com/i/events/1253142329478639617",0,0,,#coronavirus #COVID19 #StayAtHome #StayAtHome,
2020-04-23 04:53:54+00:00,clarencehilljr,African American leaders want more White House outreach to reduce coronavirus deaths ,0,5,,,
2020-04-23 04:41:16+00:00,Sheila14881829,"""Two pet cats in New York test positive for COVID-19"" ",0,0,,,
2020-04-23 04:40:16+00:00,RyanSternMD,#TrumpOwnsEveryDeath #TrumpVirus #TrumpVirusCoverup der Führer Must be livid. His SS will “Deal” with discontents. Use Republicans for CoViD drug trials. ,1,1,,#TrumpOwnsEveryDeath #TrumpVirus #TrumpVirusCoverup,
2020-04-23 04:36:32+00:00,Bhristoo,that’s Covid 19 in a cup ,0,1,,,
2020-04-23 04:35:31+00:00,RyanSternMD,"#COVID19Update #ScienceWillWin for those of you without a degree in biology, this data does NOT mean that ventilators killed, but that CoViD patients NEED ventilators. ",0,0,,#COVID19Update #ScienceWillWin,
2020-04-23 04:28:39+00:00,beltex63,Anderson. You and I have a better chance at winning the lottery than dying of COVID. You are the ignorant one. 40k/330+mil. Do the math bud.,0,0,,,
2020-04-23 04:26:43+00:00,wordman54," reporting finally, and then what happens, why is there not an urgent push to address the disproportionate #of residents and staff infected with Covid - 19 in nursing homes across our country? ",0,0,,,
2020-04-23 04:20:43+00:00,LoveeMaribel,"Okay why does Covid Quarantine feel like I’m in a Toxic relationship... No going out with my friends, No drinking with Friends, No festivals..... hate it here ",0,7,,,
2020-04-23 04:19:10+00:00,RyanSternMD,#COVID19 #COVID19Update #CatsOfTheQuarantine today’s CVD update is cats can contract CoViD from humans! (One dog died in Hong Kong) multiple zoo confined big cats: tigers &amp; lions have tested positive. WHAT TO DO? Treat your cats like any member of your family. #StayHomeSaveLives,1,0,,#COVID19 #COVID19Update #CatsOfTheQuarantine #StayHomeSaveLives,
2020-04-23 04:08:32+00:00,abbyjanea_,I would risk getting COVID-19 just to hug you ,1,1,,,
2020-04-23 04:06:37+00:00,J_Stephens_CPA,Btw did you file with LWC for the Pandemic Unemployment Assistance? I forget which of the COVID acts includes aid for self employed like artists and speakers Not sure on Louisiana process particularly but TX has set up instructions for TWC,0,2,,,
2020-04-23 04:00:43+00:00,SMalayandi,Corona Lockdown self Haircut #coronavirus #CoronaLockdown #HaircutChallenge,0,1,,#coronavirus #CoronaLockdown #HaircutChallenge,
2020-04-23 03:54:31+00:00,92touchdown,Damn near a million coronavirus cases in the United States and yall niggas wanna open back up ? ,0,2,,,
2020-04-23 03:48:37+00:00,Correaashley10,"Today my boss coughed twice. She looks at me and says “I don’t have coronavirus, I’m just a smoker”. Just don’t cough on me boo",0,2,,,
2020-04-23 03:40:19+00:00,iamaustinbrody,This is what the covid protesters remind me of. ,2,1,,,
2020-04-23 03:22:23+00:00,curious2k,This doctor is a hero. Testing the homeless for Covid-19. https://www.facebook.com/113255143652452/posts/125378135773486/?vh=e,0,0,,,
2020-04-23 03:12:05+00:00,gisdcounseling,Our topic this Wellness Wednesday is Grief. Click the link to learn how to deal with grief during COVID-19 and how to connect with valuable resources #GISDAlwaysConnected,9,10,,#GISDAlwaysConnected,
2020-04-23 03:07:42+00:00,dwadley7277,Coronavirus: Trump ‘disagrees strongly’ with Georgia’s plan to reopen #Coronavirus ,0,0,,#Coronavirus,
2020-04-23 02:48:02+00:00,67dfm,Which is it?????????? The #coronavirus is no big deal so it's OK to open back up the economy or it's a big deal enough to stop immigration??????????????? #TrumpPressConference #TrumpPressBriefing #TrumpVirus,0,1,,#coronavirus #TrumpPressConference #TrumpPressBriefing #TrumpVirus,
2020-04-23 02:33:44+00:00,dfwinjurylawyer,When your President’s ego means the top person to help In the search for a vaccine to Coronavirus must be fired. ,0,0,,,
2020-04-23 02:32:58+00:00,dallasweekly,Be sure to check out this week’s Dallas Weekly! This week we talk about reentry groups response to the COVID pandemic with the early release of prisoners. . #iamdw #culturecurrent #reentrymatters #covidnews… https://www.instagram.com/p/B_TobRPJntN/?igshid=9fxt2t2fik32,0,0,,#iamdw #culturecurrent #reentrymatters #covidnews,
2020-04-23 02:24:19+00:00,clinicalswagg,Awww love you to the moon kiddo! There’s more just gotta wait till I’m allowed out of COVID quarantine so I can go get it. Saturday can’t come soon enough! ,0,1,,,
2020-04-23 02:23:51+00:00,alsup88,i still do Covid ain change shi dis way ,0,4,,,
2020-04-23 02:19:42+00:00,kunmuth,This San Antonio Artist Made COVID-19 themed Mexican Loteria Cards #latism,0,1,,#latism,
2020-04-23 02:14:31+00:00,GOminiFab,"A plan based on a date instead of data. Texas is 48 out of 50 in per capita COVID-19 testing and first for residents, children, and veterans without healthcare insurance. Only a stupid person would call this a smart move.",0,0,,,
2020-04-23 02:08:22+00:00,kingsam0121,"""Tiger Woods, Phil Mickelson, Tom Brady and Peyton Manning set to tee off for COVID-19 relief"" ",0,1,,,
2020-04-23 02:01:12+00:00,RossCSchumacher,Why do you think this is? Is their impaired humoral activity a protection against the symptoms of COVID? Or did I just drink too much prized margarita with my wife on my couch ?,0,0,,,
2020-04-23 01:51:05+00:00,brookleeh95,Thanks @SMUpresspass for sharing my story about the impact of the Covid-19 Pandemic on figure skating @AmberGlenn_ @MariahSk8rBell @jasonbskates,6,21,@SMUpresspass @AmberGlenn_ @MariahSk8rBell @jasonbskates,,
2020-04-23 01:36:23+00:00,RunningWaldo,#goodnightworld #coronavirus #redrum #deadpeople #notp,0,0,,#goodnightworld #coronavirus #redrum #deadpeople #notp,
2020-04-23 01:33:07+00:00,AlexBoyerFox4,North Texas doctor says it's important that people know how to perform at-home COVID-19 test correctly ,0,0,,,
2020-04-23 01:26:48+00:00,B_rad_ical_,Can you contribute right now to help food banks feed people in need during the COVID-19 crisis? ,0,0,,,
2020-04-23 01:21:17+00:00,DRyan327,"Ut oh, and they said our pets couldn’t get it! How? Two pet cats in New York test positive for COVID-19 ",1,0,,,
2020-04-23 01:20:41+00:00,chestnut_daniel,Why the CDC director wasn't misquoted on coronavirus -- no matter what the White House says ,4,4,,,
2020-04-23 01:18:43+00:00,vtbirkenstock,Trump Administration: No Coronavirus Aid to Illegal Alien College Students ,0,3,,,
2020-04-23 01:18:33+00:00,thatbobertguy,I hear flights are really cheap and that coronavirus doesn't exist anymore. I'll be on the last flight. ,0,1,,,
2020-04-23 01:13:23+00:00,1kjohnj,them “tl sleep?...” tweets probably worse than the Coronavirus,2,0,,,
2020-04-23 00:51:32+00:00,omarmuniz9,Coronavirus: Trump ‘disagrees strongly’ with Georgia’s plan to reopen #Coronavirus ,0,0,,#Coronavirus,
2020-04-23 00:32:53+00:00,anafg28,"Qué va... Esta crisis económica que tengo tiene que terminar pronto... Yo tengo que probar esa proteína de coco ... Son demasiados buenos comentarios y el coco es mi sabor favorito de toda la vida... Coronavirus, por favor, desaparece de la faz de la tierra, inmediatamente.",0,1,,,
2020-04-23 00:30:52+00:00,jeffanderson42,Nolte: Some Must Stay Quarantined with the Coronavirus Still Out There https://www.breitbart.com/health/2020/04/21/nolte-some-must-stay-quarantined-with-the-coronavirus-still-out-there/ via @BreitbartNews,0,0,@BreitbartNews,,
2020-04-23 00:27:21+00:00,CBlakeHelm,Been doing some introspection and have realized this pandemic has shifted the below percentages: Normal: self loathing 20%: loathing of others 80% Covid: self loathing 0%: loathing of others 100% #personalgrowth,0,1,,#personalgrowth,
2020-04-23 00:22:49+00:00,Nelson_MikeA,"Time Standing Still - - #dallas #stayhome #staysafe #alonetogether #workfromhome #time #coronavirus @Dallas, Texas https://www.instagram.com/p/B_TZiIOn3zs/?igshid=tw7kypm69r5f",0,0,,#dallas #stayhome #stayhome #staysafe #alonetogether #workfromhome #time #coronavirus,
2020-04-23 00:20:13+00:00,kayso_n_chips,Can’t stop singing wake me up when September ends but replacing it with when covid ends,0,4,,,
2020-04-23 00:08:41+00:00,bradd_pandey,"A foreign colleague today, “You are burning out with covid stuffs [referring to my workload on ongoing #COVID19 project] .. You should go to Yita Chapa.” I didn’t even know that #YitaChapa was Nepal’s ancient art of self-quarantine. You can learn from anyone even your enemy ",0,2,,#COVID19 #YitaChapa,
2020-04-23 00:08:26+00:00,DallasAnalytics,Notice you didn't do the ridiculous COVID Act Now model so many policymakers used,0,0,,,
2020-04-22 23:53:13+00:00,GeeksRoom,It isn't sophisticated like @CalvinZito mask.... but mine it's not bad... @HPE #HPEInfluencer #COVID19 #coronavirus - @laurasmackey,0,10,@CalvinZito @HPE @laurasmackey,#HPEInfluencer #COVID19 #coronavirus,
2020-04-22 23:46:33+00:00,goblue20082020,It’s probably still safer than Covid,0,0,,,
2020-04-22 23:41:49+00:00,jordancaballero," Join me tonight on Instagram #Live at 7:00pm (PST) with Marek &amp; Ko to discuss millennial money, covid-19 and the tiny house lifestyle. #TinyHouse #CNBC #MillenialMoney @CNBCMakeIt",0,0,@CNBCMakeIt,#Live #TinyHouse #CNBC #MillenialMoney,
2020-04-22 23:34:38+00:00,chestnut_daniel,"""Harvard University responds after Trump says it should pay back coronavirus relief money"" ",0,0,,,
2020-04-22 23:25:47+00:00,texasguy37,Don’t you dare attack nurses who are putting their lives at risk everyday to to take care of COVID-19 patients.,0,0,,,
2020-04-22 23:23:09+00:00,CityOfFriscoTx,"FRISCO COVID-19 Update: Three new Frisco cases of COVID-19 confirmed with 11 recoveries reported today. Also #ICYMI, Frisco Amends Emergency Ordinance to Align with Governor’s Executive Order offering 'Retail To-Go'.",3,12,,#ICYMI,
2020-04-22 23:14:09+00:00,w00k66,Kenneth Copeland COVID-19 Metal Remix https://youtu.be/9N0mMLBVgSQ via @YouTube,0,0,@YouTube,,
2020-04-22 22:57:42+00:00,cbs11doug,"You couldn’t be more wrong. Pre existing, things like asthma for instance. Young. Middle aged. Old. Pre existing covers an incredibly wide range of conditions that can be exacerbated with Covid. That’s what doctors say. I suppose you don’t believe them either? Get real.",0,0,,,
2020-04-22 22:55:36+00:00,chestnut_daniel,John Oliver takes aim at Fox News coronavirus coverage ,0,0,,,
2020-04-22 22:52:37+00:00,StevenDialFox4,Irving couple has spent past month battling COVID-19. @FOX4 https://fox4news.com/news/irving-couple-has-spent-past-month-battling-covid-19,2,6,@FOX4,,
2020-04-22 22:48:17+00:00,chestnut_daniel,"US coronavirus update: Latest on cases, deaths and reopening the country - CNN ",0,0,,,
2020-04-22 22:47:58+00:00,thelibrarywitch,Day 30 of our COVID-19 Fashion Show ,0,5,,,
2020-04-22 22:43:14+00:00,LauraHarrisNBC5,WATCH LIVE | @CityOfDallas Mayor @Johnson4Dallas to Addressing City’s COVID-19 Assistance Effort ,0,0,@CityOfDallas @Johnson4Dallas,,
2020-04-22 22:36:04+00:00,HyerHuskies,Hyer Huskies supported our #healthcareheroes working on the front lines during the Coronavirus pandemic by wearing Husky Spirit gear today. #healthcareheroes @hpisdschools @njwillia,0,2,@hpisdschools @njwillia,#healthcareheroes #healthcareheroes,
2020-04-22 22:29:57+00:00,JMRichardson1,Will someone tell this moron @realDonaldTrump that #Coronavirus response was not a contest or competition between countries? A real leader would be talking about international cooperation and humanitarian aspects of our global partnerships.,0,0,@realDonaldTrump,#Coronavirus,
