date,user,text,retweets,favorites,mentions,hashtags,geolocation
2020-04-22 11:47:23+00:00,kptsj,"This is my haircut. This is what it looks like now. It's a fricking mess. But, keep the hair salons closed. I don't want anyone working there to get coronavirus. And look at the clueless people protesting. You know they haven't been socially distancing. STAY HOME! ",0,2,,,
2020-04-22 11:43:49+00:00,__ravishing__,"Easy... In Jan, they knew covid-19 was coming. They bought back stocks instead of stocking up. See how easy that was?",0,0,,,
2020-04-22 11:25:44+00:00,clarencehilljr,Dallas Cowboys COVID-19 pre-draft process with Mike McCarthy more thorough than before ,0,3,,,
2020-04-22 11:20:39+00:00,jdmiddleton55,No way germaphobe Trump is leaving the safety of the White House to visit the front lines of the COVID battle. Coronavirus is the only force capable of making him give up his golf outings. ,0,0,,,
2020-04-22 10:38:29+00:00,BRMBug,Leaning Tower of Dallas Pizza America Covid Freedom Jetpack Ice Cream Cone #ivesnapped,0,1,,#ivesnapped,
2020-04-22 10:30:18+00:00,bearthepoet,Is...is it time to call the Covid-19 protestors crisis actors yet?,0,0,,,
2020-04-22 09:09:35+00:00,Boomer_Patriot,"Coronavirus Could Be ‘More Difficult’ In The Winter, CDC Director Says https://dailycaller.com/2020/04/21/cdc-robert-redfield-coronavirus-winter-pandemic/ via @dailycaller",0,0,@DailyCaller,,
2020-04-22 09:09:13+00:00,Boomer_Patriot,"Local Reporter Says Coronavirus Victim Died, But Then Changes His Mind Mid-Segment https://dailycaller.com/2020/04/21/local-reporter-coronavirus-victim-died-but-changes/ via @dailycaller",0,0,@DailyCaller,,
2020-04-22 08:26:08+00:00,ruthellaowens,I also read that COVID-19 patients bleed out.without warning. It is ugly when you find out how people suffer. Just horrific.,0,1,,,
2020-04-22 08:02:14+00:00,IMPACTClubBHS,Praying daily for your Mom Anne’s speedy recovery from Coronavirus and for your entire family to cope with her situation together. It’s a scary time. Hang in there to courageously support your Mom. ,0,0,,,
2020-04-22 07:05:47+00:00,5in5tar,But I'm getting @GameOverGreggy @Nick_Scarpino and @SethGreen to make Idle Hand 2: Idle Hand/Z (zombie hands brought to life from not washing them during the Covid Pandemic of 2020),0,0,@GameOverGreggy @Nick_Scarpino @SethGreen,,
2020-04-22 06:55:39+00:00,RonRuggless,AC spread #coronavirus? https://www.businessinsider.com/air-conditioning-spread-coronavirus-restaurant-can-service-industry-open-again-2020-4,1,2,,#coronavirus,
2020-04-22 06:22:01+00:00,Ricardo52837,Due to this whole Covid-19 I’m not going to school or work so I decided to start promoting myself see if it goes anywhere if you could retweet this it would help spread the word for me thank you if y’all have any questions feel free to dm me ,16,12,,,
2020-04-22 06:08:26+00:00,Honesty_Cook197,"Nope I don't agree. I'm in Fort Worth , TX and I don't know one person. Friend or family member that has been tested for covid-19!",0,0,,,
2020-04-22 05:46:14+00:00,lrs1122,A message from my family and friends to yours... Learn the Dos and Donts during this #pandemic. Let's fight #coronavirus together. #StayHomeStaySafe #BeSafe #BeatCOVID19 #LetsFightCoronaTogether,0,0,,#pandemic #coronavirus #StayHomeStaySafe #BeSafe #BeatCOVID19 #LetsFightCoronaTogether,
2020-04-22 05:24:34+00:00,Andrew_Frost_,Calling it COVID-19 sucks because it reminds me of a better time.... 2019.,0,1,,,
2020-04-22 05:04:54+00:00,jerrybo98140307,If you want to let thousands more die because she didn’t want to stop people from China or Europe entering the country . If you approve of her not letting a vote come up for funding a response to the coronavirus because of her-obsession with impeachment,0,1,,,
2020-04-22 05:03:39+00:00,MikeZiemer,@dickswayze productions coming back Fall 2020 after covid-19,0,0,@dickswayze,,
2020-04-22 04:55:50+00:00,iz4yah,"Honestly at the end of the day if you get COVID-19 you get it, you can be the most cautious and paranoid person with everything and you can still get it. Don’t let it control your life to the extent that it harms your mental wellbeing. Physically distance yourself from others,-",0,0,,,
2020-04-22 04:24:24+00:00,marychrish,WHO says evidence suggests coronavirus originated in animals and was not produced in a lab ,0,0,,,
2020-04-22 04:21:03+00:00,MyBelovedJC,A few of us from our church DFW New Beginnings went to thank and pray for the health care givers. #healthcareworkers #staysafe #stayhome #covid_19 #texashealth #dfwnewbeginnings #nbchurchoutreach @Texas Health https://www.instagram.com/p/B_RP_6wHTcR/?igshid=zuqk4e4imcri,0,0,,#healthcareworkers #staysafe #stayhome #stayhome #covid_19 #texashealth #dfwnewbeginnings #nbchurchoutreach,
2020-04-22 04:15:25+00:00,ladonna_bruce,True!! #coronavirus #StayAtHome #StayHome #Wereallinthistogether #BeSafe #smartandsafe #BeatCOVID19 #Biden2020,1,4,,#coronavirus #StayAtHome #StayAtHome #StayHome #StayHome #Wereallinthistogether #BeSafe #smartandsafe #BeatCOVID19 #Biden2020,
2020-04-22 04:03:58+00:00,Reillygator,"I know exactly where it is located. We will be there! We have an embarrassment of riches w/restaurants here in DFW. Hopefully, many are able to survive Covid-19. We’re trying to support &amp; tip well. Last place we ate before lockdown was Hudson House. So sad.",0,3,,,
2020-04-22 03:56:52+00:00,RunningWaldo,#goodnightworld #covid_19 #pandemic #stayathome,0,1,,#goodnightworld #covid_19 #pandemic #stayathome #stayathome,
2020-04-22 03:54:56+00:00,taehoonkim,"How does coronavirus kill? Clinicians trace a ferocious rampage through the body, from brain to toes ",0,1,,,
2020-04-22 03:53:53+00:00,realscooterric1,I GOT TO HIGH MAN it’s been 420 all 2020 #coronavirus #420allmonth,24,225,,#coronavirus #420allmonth,
2020-04-22 03:47:56+00:00,Rob_InterGen,Comorbidities = Higher RISK of progression to Severe Condition A recent study from researchers at Weifang Medical University in China published their first peer-reviewed meta-analysis about medical comorbidities and COVID-19 disease severity. Do u have data to help clients? ,1,4,,,
2020-04-22 03:40:10+00:00,AndreaNSmith111,"We have a honored tradition to remember those Aggies that are fallen comrades and one of us answers, “Here”. Today I wasn’t able to join friends in this honored tradition, but participated virtually due to Covid. To my Aggie friends - Softly Call The Muster.... ",0,1,,,
2020-04-22 03:40:00+00:00,OMG_ShaNay,I’m so sick of seeing the word COVID-19 ,0,0,,,
2020-04-22 03:25:10+00:00,jbplett,No YOU SPELLED IT WRONG! I think your Autocorrect messed you up. The correct spelling IS: CORONAVIRUS (with an A not an O).,0,3,,,
2020-04-22 03:23:41+00:00,shelbykay29,John Prine on Austin City Limits is something. We lost a great one to Covid and many more. My condolences to all who have lost a love one. #Covid_19,0,1,,#Covid_19,
2020-04-22 03:20:41+00:00,rachhy__,Getting sappy on IG... #tbt to before COVID-19,0,0,,#tbt,
2020-04-22 03:14:39+00:00,roberthz1960,"Everyday briefings, America sees & hears POTUS TRUMP working with Doctors & Scientist. As he & we learn about coronavirus. Still, fake news liberal people tell lies! fake news liberal people. Proven Losers! ",0,0,,,
2020-04-22 03:12:26+00:00,Dosmuzic,@GOP my thoughts are fauck All yall...more people are gonna die for your mighty dollar...seems to be your only motivation...shitty ass people...Who is behind the coronavirus social distancing protests? https://news.yahoo.com/groups-behind-coronavirus-social-distancing-protests-explainer-165437569.html?soc_src=community&amp;soc_trk=tw via @Yahoo,0,0,@GOP @Yahoo,,
2020-04-22 03:06:27+00:00,grover_moten,"I live live in south Dallas, which is the poor side of town. I don’t know of anyone with this coronavirus. I don’t know of anyone dying from this virus. I only wear a bandanna in the business that requires me to. We also don’t have 5G in this poor side of town.",0,1,,,
2020-04-22 03:05:20+00:00,HighTopLyricist,Covid coming into 2020 and me asking the same thing ,0,0,,,
2020-04-22 03:01:26+00:00,rickyraper2014,Obama gave a 3.7 million grant to the CCP and the Wuhan Level 4 Virus Lab thru Dr. Fauche. Thus Out sourcing & Avoiding a 2015 Coronavirus testing moratorium. Fauche knew he and Obama were breaking the Law &amp; Fauche admitted to a coming pandamic in 2017 as a result.They are libel,0,0,,,
2020-04-22 03:00:08+00:00,HildaHu84485411,@musicbyanz #GivingBack Thank you for helping those who can’t pay rent or buy food. My job I was going to start they said it’s on hold I needed that job. $Oshun59 #coronavirus sucks,0,0,@musicbyanz,#GivingBack #coronavirus,
2020-04-22 02:56:01+00:00,DallasAnalytics,How many died because of non-COVID healthcare utilization avoidance because you gave the impression hospitals were full of COVID-19 patients and dangerous? How many children were abused? How many additional cases of domestic violence? All because of your draconian measures.,0,2,,,
2020-04-22 02:55:46+00:00,jbird1032002,Media reports a man dying of Covid-19 when he actually walked out of the hospital alive and well. ,5,6,,,
2020-04-22 02:45:20+00:00,sistasonthesofa,I wasn’t feeling well for a week but didn’t tell anyone because ya know covid,0,0,,,
2020-04-22 02:37:02+00:00,isn_marie,I haven’t forgotten that y’all bought 24 cases of water when this Covid started,1,1,,,
2020-04-22 02:35:39+00:00,eripet02,"Covid response. But I must say, you were half right and I was half right. The mayor is 100 wrong",0,0,,,
2020-04-22 02:29:42+00:00,thatbobertguy,"Has he said anything similar to current covid-19 patients? Or to the families of those suffering or who have died? The answer is no, right? ",0,0,,,
2020-04-22 02:20:36+00:00,RBelembe,"La plu grande tragédie ce quand le pays est tellement consacré à combattre Covid-19 , c’est ainsi que #ELIANE recommence encore avec ce truc de; (( je fait Ça pour sauvé les âmes )) Yango Mwana mwasi oyo aza ndenge nini ",0,0,,#ELIANE,
2020-04-22 02:16:07+00:00,rickgman64,"Per cdc, 80% of deaths tagged as covid actually not covid deaths. This is all 80% politics. FED has already soicialized our monetary policy with bailouts we can’t afford. Unconstitutional. Headed to Supreme Court when dust settles.",0,0,,,
2020-04-22 02:15:53+00:00,alleypat,"Some coronavirus strains deadlier than others, Chinese study finds ",0,0,,,
2020-04-22 02:09:12+00:00,kathylintexas,U​.​S. House of Representatives: Ban corporate America from Coronavirus small business loans - Sign the Petition! http://chng.it/QP5FVpS7 via @Change,0,0,@Change,,
2020-04-22 02:06:53+00:00,nettie0818,Joeys in the middle of a money match It may not be today but I’ll have him DM you to reach out if you’re online I know he’s streaming tomorrow as well. During the day he was invited to compete in the MK11 fundraiser “Kombat for a Kause” for the COVID-19,0,0,,,
2020-04-22 02:03:21+00:00,ConstanceJackso,"Man, 60, who said COVID-19 lockdown was 'political ploy' dies of virus https://www.dailymail.co.uk/news/article-8239557/Ohio-man-60-blasted-COVID-19-lockdown-political-ploy-dies-contracting-coronavirus.html?ito=amp_twitter_share-top via @MailOnline",0,0,@MailOnline,,
2020-04-22 01:57:45+00:00,ManchArena,"Es la única explicación que encontré para que digan que lograron aplanar la curva de contagios del Covid 19 @PresidenciaSV @SaludSV. Nótese el sarcasmo""solo girar la imagen de la verdadera curva"". Seamos serios!! #BukeleDictador",10,20,@PresidenciaSV @SaludSV,#BukeleDictador,
2020-04-22 01:45:47+00:00,kingsam0121,"""Harvard University responds after Trump says it should pay back coronavirus relief money"" ",0,0,,,
2020-04-22 01:44:27+00:00,kingsam0121,"""Coronavirus: UK and Australia set to begin human vaccine trials"" #Coronavirus ",0,0,,#Coronavirus,
2020-04-22 01:43:26+00:00,xoDivx,Thanks Fati I miss you too!! Once this whole COVID-19 blows we gotta hang out more ,1,2,,,
2020-04-22 01:38:11+00:00,Boomer_Patriot,COVID PROTESTS: Citizens Speaking Out Against Total Shutdown Of Their States https://clashdaily.com/2020/04/covid-protests-citizens-speaking-out-against-total-shutdown-of-their-states/ via @Doug_Giles,0,0,@Doug_Giles,,
2020-04-22 01:37:26+00:00,Boomer_Patriot,"FREEDOM FOR ME, BUT NOT FOR THEE: Two COVID-19 Positive Journos Violate Quarantine https://clashdaily.com/2020/04/freedom-for-me-but-not-for-thee-two-covid-19-positive-journos-violate-quarantine/ via @Doug_Giles",0,0,@Doug_Giles,,
2020-04-22 01:09:33+00:00,ClaytonNeville,.@GovAbbott says Nearly 500k job openings are currently listed on http://WorkInTexas.com amid #coronavirus pandemic. @WBAP247NEWS @570KLIF http://bit.ly/2KkzSh3,0,0,@GovAbbott @WBAP247NEWS @570KLIF,#coronavirus,
2020-04-22 01:01:19+00:00,lilyr43,It’s so heartwarming having patients go from being on a ventilator & having an NG to getting off all tubes and to be able to be on room air and finally test negative for covid ,1,12,,,
2020-04-22 00:57:58+00:00,thesonofstan,‘Mask-on’ fashion shoots by Americana artists are my least favorite non-lethal byproducts of covid-19,0,4,,,
2020-04-22 00:56:50+00:00,GrinDKinGz,"Since we're repeating history a few yrs after the Spanish Flu of 1918, Black people flourished.. Later establishing ""#BlackWallStreet"" in 1920's #coronavirus",0,0,,#BlackWallStreet #coronavirus,
2020-04-22 00:54:17+00:00,SidneyTaylor_xo,$sidneychitwood me and my roommate are in the service industry and were laid off due to the coronavirus. We have rent coming up and some bills that need to be paid! Anything will help us! #JeffreeStarApproved,0,0,,#JeffreeStarApproved,
2020-04-22 00:47:57+00:00,NiuSanford,"All true. My kids are too young to understand COVID, so for them it means extra family time (we are fortunate to have relatively few cases in Dallas at this time) and pancakes every morning...interspersed w screen time .",0,3,,,
2020-04-22 00:47:47+00:00,david___a23,"UTA’s Emergency Assistance Fund has received over $20,000 in individual donor gifts since COVID-19 began. However, with that comes the need for those funds. | @UTAShorthorn",9,12,@UTAShorthorn,,
2020-04-22 00:34:12+00:00,mariafeliz96,"Asking for y’all to pray for my nieces and there step mom! My nieces step mom has tested positive for COVID and my sister is just really worried, one of my nieces is staring to get sick and they just keep calling my sister that they want to go with home with her but they can’t ",1,5,,,
2020-04-22 00:29:37+00:00,DallasAnalytics,@EmpowerTexans @RobbyMontoya Lori Brown with Fox4 Dallas is saying @JudgeClayJ hired political operatives to help with COVID-19.... please investigate ,0,1,@empowertexans @RobbyMontoya @JudgeClayJ,,
2020-04-22 00:24:39+00:00,dnstewart,"Beautiful day for a neighborhood walk!!! #covid_19exercise #seeingthebeautyinthesimplethings @Lakewood, Dallas https://www.instagram.com/p/B_Q08qOnlhrHHP6TJCDr6zoHPX-3a7cJtU0-v80/?igshid=1131ib3owubys",0,0,,#covid_19exercise #seeingthebeautyinthesimplethings,
2020-04-22 00:11:16+00:00,SidneyTaylor_xo,$sidneychitwood me and my roommate are in the service industry and were laid off due to the coronavirus. We have rent coming up and some bills that need to be paid! Anything will help us! #JeffreeStarApproved,0,0,,#JeffreeStarApproved,
2020-04-22 00:09:51+00:00,flicket,New U.S. Treatment Guidelines for Covid-19 Don’t See Much Progress ,0,0,,,
2020-04-21 23:59:44+00:00,SidneyTaylor_xo,$sidneychitwood me and my roommate are in the service industry and were laid off due to the coronavirus. We have rent coming up and some bills that need to be paid! Anything will help us! #JeffreeStarApproved,0,0,,#JeffreeStarApproved,
2020-04-21 23:52:15+00:00,SidneyTaylor_xo,$sidneychitwood me and my roommate are in the service industry and were laid off due to the coronavirus. We have rent coming up and some bills that need to be paid! Anything will help us! ,0,0,,,
2020-04-21 23:51:55+00:00,mellowdeeeee,Shout out to all those driving in their car by themselves WITH their mask on. You’re the real. #COVID19 #coronavirus #cdc #COVIDー19 #dedication #inspirational,0,1,,#COVID19 #coronavirus #cdc #COVID #dedication #inspirational,
2020-04-21 23:45:04+00:00,CityOfFriscoTx,"FRISCO COVID-19 Update: Five new Frisco cases of COVID-19 and four recoveries confirmed today in Collin County. Denton County reports none. This brings Frisco’s total confirmed cases to 122, with 77 Frisco residents having recovered. ",4,9,,,
2020-04-21 23:43:59+00:00,BudKennedy,"RT @lukeranker: FortWorth Mayor Betsy Price says she has tested negative for #coronavirus, but another city employee tested positive. She will remain in self quarantine. ""It is best to be overly cautious."" She's keeping a log of her symptoms. ",1,5,@lukeranker,#coronavirus,
2020-04-21 23:39:06+00:00,_ecalv,"Madrina got tested for covid-19. She said, I knew I didn’t have it. I’m Serrrrito something in San Luis Potosi nothing can touch me. Ohhh kay tía. Lol in all seriousness stay safe. Take it it seriously. Listen to the experts, those whom I am sure are stressed &amp; anxious too.",0,0,,,
2020-04-21 23:32:37+00:00,ftworthretro,$retro.aleigh I know I’m always putting it on here. But I own a small online pinup/rockabilly shop that has come to a screeching halt bc of #covid . This business is my baby and I hate to see it disappear bc it didn’t get a chance!! Anything helps!! Love you!,0,0,,#covid,
2020-04-21 23:29:27+00:00,disolis,"UPDATE: Fed officials now report 28 immigrants have tested COVID+ at Prairieland detention center near Dallas. Detainees’ families push 4 release. ‘They r not animals,’ 1 told me. ",21,11,,,
2020-04-21 23:24:28+00:00,Boomer_Patriot,‘Grotesque headline’: Media outlets report that coronavirus cases spike in Kentucky after lockdown protests ,0,0,,,
2020-04-21 23:23:21+00:00,mojoeherb,BBC News - Covid-19: Can 'boosting' your immune system protect you? ,0,0,,,
2020-04-21 23:22:51+00:00,ruthellaowens,Why Doctors Are Worried About Severe Kidney Damage In Some COVID-19 Patients - PBS Newshour ,2,3,,,
2020-04-21 23:18:57+00:00,Boomer_Patriot,President Trump says Harvard is going to pay back the millions it received in coronavirus relief ,0,1,,,
2020-04-21 23:12:59+00:00,AnyStepCommunit,Sending prayers and thoughts of gratitude to our frontline workers. A special shout-out to the ones who care for our aging population in assisted living facilities and nursing homes. #quarantine #healthcareworkers #nurses #doctors #gratitude #coronavirus #seniors #community,0,1,,#quarantine #healthcareworkers #nurses #doctors #gratitude #gratitude #coronavirus #seniors #community,
2020-04-21 23:03:03+00:00,OfficialOutro,"If you had to sacrifice one NFL team to end Coronavirus, who would it be? And why the cowboys?",1,2,,,
2020-04-21 22:59:46+00:00,TheMattYoung,Received my handmade #MarioKart #coronavirus mask from Rachel! ,0,1,,#MarioKart #coronavirus,
2020-04-21 22:58:45+00:00,catstorming,#coronavirus with sugar on top is still deadly. Screw Greg Abbott. ,0,0,,#coronavirus,
2020-04-21 22:53:27+00:00,TheKennyReeves,Covid got us all looking like Scorpion and Sub Zero in the grocery store. ,0,0,,,
2020-04-21 22:50:13+00:00,DanielMrClutch,Cuando volverán...ya no aguanto otra semana mas de tonterías de Jordan...y faltan 8 capítulos...maldito coronavirus ,0,0,,,
2020-04-21 22:42:23+00:00,trevoypointer,The growth over the past two weeks has been incredible. Ahavwnt attacked life and progression this hard ever to be honest. I think the sense of urgency drastically shifted with this coronavirus situation. Focus has increased intensely. I’m with it too. ,0,0,,,
2020-04-21 22:38:41+00:00,thelibrarywitch,"Day 29 of our COVID-19 Fashion Show (hey, I'm posting in the actual day again!) Kiiiiind of obsessed with this look and the light. ",0,8,,,
2020-04-21 22:34:25+00:00,Michael06270914,"My Wife and I were supposed to be going to Hawaii this week for my Birthday, however Covid-19 changed those plans. My Wife decided to bring a little of Hawaii to me. My view of our apartment door when I got off the elevator. #MyWifeisAmazing #HappyBirthdayEve #ILoveMyWife",0,0,,#MyWifeisAmazing #HappyBirthdayEve #ILoveMyWife,
2020-04-21 22:32:55+00:00,Boomer_Patriot,@WHO Gets Hit With a Class-action Lawsuit Over Wuhan Coronavirus Response ,0,0,@WHO,,
2020-04-21 22:25:12+00:00,Boomer_Patriot,Democratic Rep. Ayanna Pressley Says Trump's Coronavirus Response Is 'Akin to War Crimes' ,0,0,,,
2020-04-21 22:24:57+00:00,mayathecreator,Hearing it’s a whole “second wave” of the Coronavirus does not sit well with me ,2,7,,,
2020-04-21 22:18:40+00:00,Boomer_Patriot,Missouri Files Lawsuit Against China over Coronavirus ‘Deceit‘ https://www.breitbart.com/politics/2020/04/21/missouri-files-lawsuit-against-china-over-coronavirus-deceit/ via @BreitbartNews,0,0,@BreitbartNews,,
2020-04-21 22:16:44+00:00,TedBThompson,"Need a good read during COVID-19 stay at home? @Kathy_Valentine “All I Ever Wanted”. Fascinating story of growing up unconventionally, having a dream, seeing it realized, all the highs &amp; lows. There’s also an audio version &amp; accompanying soundtrack available! #All_I_Ever_Wanted",0,6,@Kathy_Valentine,#All_I_Ever_Wanted,
2020-04-21 22:12:18+00:00,Boomer_Patriot,Sweden Official: Coronavirus Strategy of Keeping the Country Open Seems To Be Working ,0,1,,,
2020-04-21 22:00:18+00:00,LiteracyAchieve,Check out our site http://www.literacyachieves.org and subscribe to our YouTube channel for resources. #literacy #care #covid ,1,2,,#literacy #care #covid,
2020-04-21 21:55:14+00:00,coll727,Total GREATNESS!! This guy set a goal at the beginning of the year and neither Covid 19 or school closures would stop him! Congrats Ameya!! #teampinkcisd #CISDPEatHOME #CISDTogetherAtHome @NicoleJund,2,14,@NicoleJund,#teampinkcisd #CISDPEatHOME #CISDTogetherAtHome,
2020-04-21 21:50:49+00:00,GBeaugh,Neighbors brought back their Christmas decor for covid season #mosthorribletimeoftheyear,0,3,,#mosthorribletimeoftheyear,
2020-04-21 21:45:53+00:00,MichaelHugg2591,From The Economist Espresso: Zero tolerance: New Zealand and the coronavirus ,0,0,,,
2020-04-21 21:45:49+00:00,6679Coachkyle,"No he’s not. We lead the universe in Coronavirus b/c of his incompetence. If you get impeached and have a recession, you’re the worst. Not best",1,0,,,
2020-04-21 21:45:11+00:00,phollowpeople,Just in: Dallas County reports 90 new COVID-19 cases and four deaths. We will have more tomorrow in our morning digest at http://peoplenewspapers.com.,1,0,,,
2020-04-21 21:26:58+00:00,DemDawson2,"Also,ask if they can try ivig and plasmapheresis.both have been approved by fda for previous coronavirus infections. ",0,0,,,
2020-04-21 21:21:52+00:00,kunmuth,Sad shopping news ... The Death of the Department Store: ‘Very Few Are Likely to Survive’ Shuttered flagships. Empty malls. Canceled orders. Risks of bankruptcy. The coronavirus has hit the behemoths of the retail world. ,0,0,,,
2020-04-21 21:20:26+00:00,vindenmed327,And that’s they way it should be and the way our constitution is set up if all these people don’t want to be exposed stay home @JudgeClayJ is a power hungry liberal and he needs to be defeated in his next election @GovAbbott @POTUS #COVID #day26oflockdown,0,0,@JudgeClayJ @GovAbbott @POTUS,#COVID #day26oflockdown,
2020-04-21 21:17:57+00:00,LyricisticSeph,I hope y’all know this virus is a hoax. Hospitals are being told to put COVID-19 positive on any and all death certificates. Plus bodies are not being given back to families. Issa movie.,0,0,,,
2020-04-21 21:16:08+00:00,SirFreebie75061,#coronavirus #COVIDー19,0,0,,#coronavirus #COVID,
2020-04-21 21:12:38+00:00,chaseca89072687,"Coronavirus ain’t stopping D-Block, we gone be ready for them boys @Duncanville_Fb @RamelBorner",7,18,@Duncanville_Fb @RamelBorner,,
2020-04-21 21:07:43+00:00,CharleeR_,"Never been a sad person, but this quarantine/covid-19 epidemic has me in my feelings.",0,7,,,
2020-04-21 21:00:31+00:00,DallasISDHEP,"dallasisd @dallasisdhep #resources for #families in #Dallas #covid #financialassistance #homeless @Dallas, Texas https://www.instagram.com/p/B_QdlpoH1cI/?igshid=se8vp3adpiv2",0,0,@DallasISDHEP,#resources #families #Dallas #covid #financialassistance #homeless,
2020-04-21 20:56:14+00:00,AbyTorresJr,#Coronavirus can last longer in air than first thought ,0,0,,#Coronavirus,
2020-04-21 20:54:22+00:00,GlobalSpaGirl,"Best Day Ever!! . . #coronavirus #sixfeetapart #SocialDistancing #DoingMyPart #WereInThisTogether #IMissYou #StayAtHome #WashYourHands – at Dallas, Texas.",0,2,,#coronavirus #sixfeetapart #SocialDistancing #DoingMyPart #WereInThisTogether #IMissYou #StayAtHome #StayAtHome #WashYourHands #WashYourHands,
2020-04-21 20:41:39+00:00,hicks_kyrsten,@andyblack Soooo what’s the status on the shows @blackveilbrides can’t play due to COVID-19? Like will they be pushed to a later date etc. I’m Dallas,0,0,@andyblack @blackveilbrides,,
2020-04-21 20:35:42+00:00,IlaBWilliams1,"Yes Ted, while you were self-quarantined, your great orange diety was at a rally calling the coronavirus outbreak a Democratic hoax. Donald Trump is a traitor and should be charged with treason.",0,1,,,
2020-04-21 20:29:19+00:00,MsJackieJMJ,"Thank you, President Donald Trump, for keeping us informed on the COVID 19. We look forward every day with enthusiasm to hear your report. God bless you. MAGA ",0,0,,,
2020-04-21 20:28:59+00:00,JakeHarris4,"I’m not working this week, but we started putting together a #coronavirus newsletter at WFAA last week that I’m pretty proud of. Subscribe here for a daily dose of quick updates on what’s happening in North Texas: https://www.wfaa.com/mobile/email And as always, support local journalism.",0,2,,#coronavirus,
2020-04-21 20:27:04+00:00,gusrueda66,Thanks a lot #coronavirus ,0,0,,#coronavirus,
