,id,text,date,retweets,favorites,mentions,hashtags,geo,region
2542,1302393053722931201,I was telling my mom my 5 year plan and she told me to relax and enjoy life... my African mom...told me...to relax... I gotta be in the upside down right now somebody save me,2020-09-05 23:47:55+00:00,0,23,,,,Dallas_Fort_Worth
2543,1302393050644217858,His island getaways with Epstein,2020-09-05 23:47:55+00:00,0,1,,,,Dallas_Fort_Worth
2544,1302393049926991872,"Next time we see each other in person, I'm gonna hug you tightly!",2020-09-05 23:47:55+00:00,0,1,,,,Dallas_Fort_Worth
2545,1302393047892799489,"I hope you are right. EVERY Catholic clergyman, Bishop, Priest or Deacon, should expose that ""certain Jesuit"", and warn the faithful. NOW. Father James Martin, SJ.",2020-09-05 23:47:54+00:00,6,19,,,,Dallas_Fort_Worth
2546,1302393043438448642,thots and prayers,2020-09-05 23:47:53+00:00,0,2,,,,Dallas_Fort_Worth
2547,1302393042037624832,"I saw that my HS ( Broken Arrow OK) played one of their big rivals ( Tulsa Union) last night & it’s on Youtube. Glad I checked the score before starting to watch. BA won, 14-7, but no scoring at all in 2nd half. Back to SMU vs TSU ",2020-09-05 23:47:53+00:00,0,2,,,,Dallas_Fort_Worth
2548,1302393041752412168,All well,2020-09-05 23:47:53+00:00,0,0,,,,Dallas_Fort_Worth
2549,1302393039357227011,Shouganai ,2020-09-05 23:47:52+00:00,0,0,,,,Dallas_Fort_Worth
2550,1302393037587460097,con el nopal en la frente ,2020-09-05 23:47:52+00:00,0,9,,,,Dallas_Fort_Worth
2551,1302393036673085442,I will drink to that...i need an excuse ,2020-09-05 23:47:51+00:00,0,1,,,,Dallas_Fort_Worth
2552,1302393036538818560,@DamianGcia ,2020-09-05 23:47:51+00:00,0,0,@DamianGcia,,,Dallas_Fort_Worth
2553,1302393036236881922, ,2020-09-05 23:47:51+00:00,0,0,,,,Dallas_Fort_Worth
2554,1302393036123656194,Sickening....they are....,2020-09-05 23:47:51+00:00,1,1,,,,Dallas_Fort_Worth
2555,1302393035980967937," stupidity reminds me to tell y’all that yesterday I have been accepted into getting certified to teach 4-13 Social Studies in TX BTW, Burr (duh) Cheney (shot a man),Breckenridge (forced to flee for treason), Pence(closeted catatonic ), and Agnew (duh) would like a word",2020-09-05 23:47:51+00:00,4,38,,,,Dallas_Fort_Worth
2556,1302393033611239424, I’m not gonna do it fr,2020-09-05 23:47:51+00:00,0,1,,,,Dallas_Fort_Worth
2557,1302393033590276096,"This made me think of my own decision to join, way back when. I wrote a blog post about it. https://mtweg.blogspot.com/2013/11/reflections-on-veterans-day.html No, I don't think we're suckers or losers, but we're not necessarily heroes, either.",2020-09-05 23:47:51+00:00,0,1,,,,Dallas_Fort_Worth
2558,1302393032327733249,Wow that’s exactly how we look great picture,2020-09-05 23:47:50+00:00,0,0,,,,Dallas_Fort_Worth
2559,1302393031400861700,Ça va vrmt pas bien dans ta tête,2020-09-05 23:47:50+00:00,0,0,,,,Dallas_Fort_Worth
2560,1302393028376768518,The pettiness is beautiful,2020-09-05 23:47:49+00:00,0,0,,,,Dallas_Fort_Worth
2561,1302393027080708096, ,2020-09-05 23:47:49+00:00,0,0,,,,Dallas_Fort_Worth
2562,1302393026061438976,,2020-09-05 23:47:49+00:00,0,0,,,,Dallas_Fort_Worth
2563,1302393025423970304,Pretty darn good !!,2020-09-05 23:47:49+00:00,0,0,,,,Dallas_Fort_Worth
2564,1302393022097829889,I feel absent today. Like I’m here but I’m not.,2020-09-05 23:47:48+00:00,0,1,,,,Dallas_Fort_Worth
2565,1302393021942571008,She’s fake. It’s a scam account. They will just send you a link to a fake dating site and steal your personal information. The person running @olivayoung21 account is a man using stolen photos from real women. Don’t get scammed.,2020-09-05 23:47:48+00:00,0,0,@Olivayoung21,,,Dallas_Fort_Worth
2566,1302393021766545408,Screaming ,2020-09-05 23:47:48+00:00,0,0,,,,Dallas_Fort_Worth
2567,1302393021158354945,Also that lmao,2020-09-05 23:47:48+00:00,0,0,,,,Dallas_Fort_Worth
2568,1302393015613493249,Venus in Sagittarius,2020-09-05 23:47:46+00:00,0,1,,,,Dallas_Fort_Worth
2569,1302393014585876481,Spaghetti spilling all over the field #smuvstxst,2020-09-05 23:47:46+00:00,0,0,,#smuvstxst,,Dallas_Fort_Worth
2570,1302393012778151937,I don’t know if I want this babe disqualified or her to be in the house till the last day and watch Laycon win,2020-09-05 23:47:46+00:00,0,0,,,,Dallas_Fort_Worth
2571,1302393008437030919,Tired of being silent. Tired of being complicit because I don’t want to start a fight with friends or family. Tired of seeing all these people justifying obvious injustice. Tired of people being treated differently because of the color of their skin. I’m done #BLACKLIVESMATTER ,2020-09-05 23:47:45+00:00,0,4,,#BLACKLIVESMATTER #BLACKLIVESMATTER,,Dallas_Fort_Worth
2572,1302393008269258753,I'm #streaming Persona 5: The Royal at https://www.twitch.tv/phoenixlightum Come hang out!,2020-09-05 23:47:45+00:00,0,0,,#streaming,,Dallas_Fort_Worth
2573,1302393007031885830,#TurnTexasBlue,2020-09-05 23:47:44+00:00,0,0,,#TurnTexasBlue,,Dallas_Fort_Worth
2574,1302393006771834882,I still have mine after all these years. It was a present to me for my 18th birthday. I still love it today no different from when it was released.,2020-09-05 23:47:44+00:00,0,0,,,,Dallas_Fort_Worth
2575,1302393005454888961,I've been following you ... please return the favor !!!,2020-09-05 23:47:44+00:00,0,0,,,,Dallas_Fort_Worth
2576,1302393005127733251,Koba mdrr,2020-09-05 23:47:44+00:00,0,1,,,,Dallas_Fort_Worth
2577,1302393003768717315,So yesterday my auntie said my uncle looks good in skinny jeans and wants him to wear em more. My guy is built just like this:,2020-09-05 23:47:44+00:00,0,0,,,,Dallas_Fort_Worth
2578,1302393003458297856,And when in doubt - bet on all of the Baffert horses.,2020-09-05 23:47:43+00:00,0,1,,,,Dallas_Fort_Worth
2579,1302393003202543616,nah,2020-09-05 23:47:43+00:00,0,1,,,,Dallas_Fort_Worth
2580,1302393001935663104,This is so disgusting. Ruining every single American tradition !,2020-09-05 23:47:43+00:00,0,0,,,,Dallas_Fort_Worth
2581,1302393001872896000, #NewProfilePic,2020-09-05 23:47:43+00:00,1,3,,#NewProfilePic,,Dallas_Fort_Worth
2582,1302392996353241089,@CharbokFGC check this one out,2020-09-05 23:47:42+00:00,0,1,@CharbokFGC,,,Dallas_Fort_Worth
2583,1302392995749265410,"If you mean playing against a bunch of suckers, then yes you are doing it right",2020-09-05 23:47:42+00:00,0,3,,,,Dallas_Fort_Worth
2584,1302392994146918400,"@IndiHome halo admin, internet saya statusnya LoS pagi ini, bisa dibantu?",2020-09-05 23:47:41+00:00,0,0,@IndiHome,,,Dallas_Fort_Worth
2585,1302392993291403264,Should of went to Cali,2020-09-05 23:47:41+00:00,0,0,,,,Dallas_Fort_Worth
2586,1302392993236889602,"I've been listening to TSSF the majority of the day so my male toxicity has been multiplied so much, it is only visible from the astral plane.",2020-09-05 23:47:41+00:00,0,0,,,,Dallas_Fort_Worth
2587,1302392993194876928,Saw her here in Dallas with The Who she put on a great show.,2020-09-05 23:47:41+00:00,0,0,,,,Dallas_Fort_Worth
2588,1302392993131962368,JUSTICE???,2020-09-05 23:47:41+00:00,0,0,,,,Dallas_Fort_Worth
2589,1302392993090023425,people with the least always doin the most,2020-09-05 23:47:41+00:00,0,0,,,,Dallas_Fort_Worth
2590,1302392992771305472,"As boat owner, I will tell you that a lot of people who own boats don’t know how to operate a boat. What these people did was downright foolish.",2020-09-05 23:47:41+00:00,1,7,,,,Dallas_Fort_Worth
2591,1302392989399089152,"We’re live from the @NextGenAction gathering at DPD headquarters over on http://Instagram.com/centraltrack, but @NotMySonDFW is currently gathering at Dallas City Hall for the 100th day of police brutality protests in Dallas, Texas.",2020-09-05 23:47:40+00:00,3,5,@NextGenAction @NotMySonDFW,,,Dallas_Fort_Worth
2592,1302392986639138821,disrespectful,2020-09-05 23:47:39+00:00,0,0,,,,Dallas_Fort_Worth
2593,1302392985439657984,Marc Gasol played 14 mins in the 1st half and scored the same amount of points as me. To be fair tho he did out-rebound me by 1 ,2020-09-05 23:47:39+00:00,0,0,,,,Dallas_Fort_Worth
2594,1302392985401909251,I think you might have left something over there on one of your tours. Or are you just full of Shhit? We have all heard what he has said about John McCain,2020-09-05 23:47:39+00:00,0,0,,,,Dallas_Fort_Worth
2595,1302392984894398464,Lord bless my brothers.,2020-09-05 23:47:39+00:00,0,0,,,,Dallas_Fort_Worth
2596,1302392984231710721,"When we're all trans, then no one will be. I sometimes think getting everyone to declare trans status and pushing that umbrella to the limits might be the best way to explode the issue.",2020-09-05 23:47:39+00:00,0,6,,,,Dallas_Fort_Worth
2597,1302392982465847297,"Nah fuck Florida actually, I’m going to Utah.",2020-09-05 23:47:38+00:00,0,1,,,,Dallas_Fort_Worth
2598,1302392981895499776,i realize it shows west of IL now that i zoom in. close enough haha. no idea of any close family past IL. i wonder who these texans are in my tree.,2020-09-05 23:47:38+00:00,0,1,,,,Dallas_Fort_Worth
2599,1302392979773153281,"Salt, pepper and butter. Cheese and eggs if you feeling fancy. If you put sugar in your greets you’re a hood booger and that’s ok",2020-09-05 23:47:38+00:00,0,0,,,,Dallas_Fort_Worth
2600,1302392977487286272,walk it like u talk it bitch ,2020-09-05 23:47:37+00:00,0,3,,,,Dallas_Fort_Worth
2601,1302392976820391937,Of course! He's Puertorrican ,2020-09-05 23:47:37+00:00,0,5,,,,Dallas_Fort_Worth
2602,1302392976610598912,这种葡萄英文叫什么？,2020-09-05 23:47:37+00:00,0,1,,,,Dallas_Fort_Worth
2603,1302392975142649856,today i found out the kid i nannied when i lived in LA wrote his college app essay about wanting to be a doctor because of the way *i* took care of him when he had a concussion FOUR YEARS AGO. i honestly don’t have words for the feeling that gives me ,2020-09-05 23:47:37+00:00,0,14,,,,Dallas_Fort_Worth
2604,1302392974504910849,"Imma wear a mask, but when shots start flying, that mask gone fly right off",2020-09-05 23:47:37+00:00,1,1,,,,Dallas_Fort_Worth
2605,1302392974244970496,The shot meter on 2k is the worst one yet,2020-09-05 23:47:37+00:00,0,0,,,,Dallas_Fort_Worth
2606,1302392972542119936,Esse Ifood de Macaé é só derrota,2020-09-05 23:47:36+00:00,0,1,,,,Dallas_Fort_Worth
2607,1302392972391182336,"Often the stories in the Bible can have much greater meaning if you think about them in relation to your own life. Think about how groups like ANTIFA and BLM have, as one of their goals, the destruction of the nuclear family. What does that say about them?",2020-09-05 23:47:36+00:00,0,0,,,,Dallas_Fort_Worth
2608,1302392972164595713,27+8=35+40=75,2020-09-05 23:47:36+00:00,0,0,,,,Dallas_Fort_Worth
2609,1302392971841675265,So your tweet about being a Democrat was a lie. Thanks for admitting that at least. Racist too?,2020-09-05 23:47:36+00:00,0,0,,,,Dallas_Fort_Worth
2610,1302392971258716161,my nigga ,2020-09-05 23:47:36+00:00,0,2,,,,Dallas_Fort_Worth
2611,1302392970268860417,https://twitter.com/i/lists/1302392681759485958,2020-09-05 23:47:36+00:00,1,2,,,,Dallas_Fort_Worth
2612,1302392969723629575,The truth always comes to light. When it does hopefully Joe Biden will be held accountable for this.,2020-09-05 23:47:35+00:00,1,1,,,,Dallas_Fort_Worth
2613,1302392969480331267,Yes,2020-09-05 23:47:35+00:00,0,4,,,,Dallas_Fort_Worth
2614,1302392969341829123,Look at one of my best frienddddd she’s fucking hot ,2020-09-05 23:47:35+00:00,0,2,,,,Dallas_Fort_Worth
2615,1302392968154943488,My friend/ is not replying to me ,2020-09-05 23:47:35+00:00,0,2,,,,Dallas_Fort_Worth
2616,1302392966498136065,Cuz he’s old. Lol. Just stay home.,2020-09-05 23:47:35+00:00,0,0,,,,Dallas_Fort_Worth
2617,1302392964367486976, well damn!,2020-09-05 23:47:34+00:00,0,0,,,,Dallas_Fort_Worth
2618,1302392964317089798,"It's Groot! A ""naked"" half vanilla, half chocolate birthday cake. Let us bake for you! Call us at 972-668-0222 or email us at smallcakesfrisco@gmail.com. #smallcakesfrisco #smallcakes #grootcake #friscocakes… https://www.instagram.com/p/CExhnGEnMG2/?igshid=h9awrtoq7yw4",2020-09-05 23:47:34+00:00,0,0,,#smallcakesfrisco #smallcakes #grootcake #friscocakes,,Dallas_Fort_Worth
2619,1302392962257625088,She’s fake. It’s a scam account. They will just send you a link to a fake dating site and steal your personal information. The person running @olivayoung21 account is a man using stolen photos from real women. Don’t get scammed.,2020-09-05 23:47:34+00:00,0,0,@Olivayoung21,,,Dallas_Fort_Worth
2620,1302392960269549569,my coworker said im so fascinated by Hisoka because im fucking evil ... and i just feel like ... ,2020-09-05 23:47:33+00:00,0,0,,,,Dallas_Fort_Worth
2621,1302392960005349376,SMU really in a dog fight with Texas St. ,2020-09-05 23:47:33+00:00,1,1,,,,Dallas_Fort_Worth
2622,1302392959330136066,yes satan burn her at the stake have y'all lost it?,2020-09-05 23:47:33+00:00,0,0,,,,Dallas_Fort_Worth
2623,1302392959195852806,Losers with nothing better to do,2020-09-05 23:47:33+00:00,0,0,,,,Dallas_Fort_Worth
2624,1302392958579286017,Do not tell me Serena Williams dated all them black dudes ... & then dated a white Boii & had a baby with him.... thats not true right,2020-09-05 23:47:33+00:00,0,0,,,,Dallas_Fort_Worth
2625,1302392954431115264,Keeping it honest with MY people: When I CHANGED my LAST NAME I immediately STOPPED feeling OPPRESSED... WHEN I finally gave up my SLAVE MASTER'S SIR NAME I no longer felt like a SLAVE #BrownSkinForTheWin,2020-09-05 23:47:32+00:00,1,0,,#BrownSkinForTheWin,,Dallas_Fort_Worth
2626,1302392953718046720,Cool can,2020-09-05 23:47:32+00:00,0,0,,,,Dallas_Fort_Worth
2627,1302392953508376577,Questions from reporters: What is your name? Do you live in a basement? Are you having red or blue jello for dinner?,2020-09-05 23:47:32+00:00,1,2,,,,Dallas_Fort_Worth
2628,1302392951918690304,#JusticeForBreonnaTaylor,2020-09-05 23:47:31+00:00,0,0,,#JusticeForBreonnaTaylor,,Dallas_Fort_Worth
2629,1302392950207512578,Welcome to your new home!,2020-09-05 23:47:31+00:00,0,45,,,,Dallas_Fort_Worth
2630,1302392949532241921,#DemocratsAreDestroyingAmerica #EnoughIsEnough #VoteRedToSaveAmerica2020 #AntifaBLMDomesticTerrorists,2020-09-05 23:47:31+00:00,0,0,,#DemocratsAreDestroyingAmerica #EnoughIsEnough #VoteRedToSaveAmerica2020 #AntifaBLMDomesticTerrorists,,Dallas_Fort_Worth
2631,1302392947414097921,Cash app me 500 and I will ,2020-09-05 23:47:30+00:00,0,1,,,,Dallas_Fort_Worth
2632,1302392946814222338,Thats Just Sad lol,2020-09-05 23:47:30+00:00,0,0,,,,Dallas_Fort_Worth
2633,1302392946013208581,Thems’ a winner baby! Just in time for my gay ass fall vibes to kick in https://twitter.com/rowansrose/status/1294720442029297664,2020-09-05 23:47:30+00:00,0,5,,,,Dallas_Fort_Worth
2634,1302392945216311296,There you are...,2020-09-05 23:47:30+00:00,0,2,,,,Dallas_Fort_Worth
2635,1302392944813576193,"As someone else mentioned, metric measurements aren't something Americans use in daily life. It just never caught on in the US outside of specific occupations and tasks that not everyone does.",2020-09-05 23:47:29+00:00,0,0,,,,Dallas_Fort_Worth
2636,1302392943701942272,Oh. Spoke too soon about this. Looks like it’s not a done deal yet.,2020-09-05 23:47:29+00:00,0,4,,,,Dallas_Fort_Worth
2637,1302392942888353793,So I just remembered it was Labor Day weekend yesterday. Where has the year gone?? 2020 has been a weird one that is for sure. We only have 3 1/2 months left of this year and then I say we hit the reset button and… https://www.instagram.com/p/CExfpTkH9n-/?igshid=8p22mt3p5yzg,2020-09-05 23:47:29+00:00,0,0,,,,Dallas_Fort_Worth
2638,1302392940992565251,High heels (Hiiiiigh heels) Red dress (RED DREEEeeEeEESS),2020-09-05 23:47:29+00:00,0,4,,,,Dallas_Fort_Worth
2639,1302392938819923968,Trump doesn’t care about this country at all.,2020-09-05 23:47:28+00:00,0,0,,,,Dallas_Fort_Worth
2640,1302392938564145156, ,2020-09-05 23:47:28+00:00,0,0,,,,Dallas_Fort_Worth
2641,1302392937792311298,I think we flew in to San Antonio and hit this spot the night before the big day vs the Bobcats. I think.,2020-09-05 23:47:28+00:00,0,9,,,,Dallas_Fort_Worth
2642,1302392936550862850, ,2020-09-05 23:47:28+00:00,0,0,,,,Dallas_Fort_Worth
2643,1302392935623856129,"They even warned the state a year in advance that it would be a problem, so yeah, a little “more creativity” and action might have helped instead of scapegoating alternative energy. https://www.eia.gov/todayinenergy/detail.php?id=36593",2020-09-05 23:47:27+00:00,0,0,,,,Dallas_Fort_Worth
2644,1302392933358985216,"Actually, that’s not right. His actions taught me how to NOT treat your children. So there’s that at least.",2020-09-05 23:47:27+00:00,0,3,,,,Dallas_Fort_Worth
2645,1302392932469821440,Brandi Rhodes,2020-09-05 23:47:27+00:00,0,0,,,,Dallas_Fort_Worth
2646,1302392928913043457, ,2020-09-05 23:47:26+00:00,0,0,,,,Dallas_Fort_Worth
2647,1302392927553904640,I don't know that seemed heart felt.,2020-09-05 23:47:25+00:00,0,0,,,,Dallas_Fort_Worth
2648,1302392926971080705, ,2020-09-05 23:47:25+00:00,1,8,,,,Dallas_Fort_Worth
2649,1302392925788295174,“Whts your build this yr”,2020-09-05 23:47:25+00:00,0,0,,,,Dallas_Fort_Worth
2650,1302392923749744640,Bahahaha!!,2020-09-05 23:47:24+00:00,0,0,,,,Dallas_Fort_Worth
2651,1302392923049332737,thank your Mr. Shy!,2020-09-05 23:47:24+00:00,0,1,,,,Dallas_Fort_Worth
2652,1302392922797637633,Please tell me you didn't cut the parts when you bust out laughing at your own jokes lmfao,2020-09-05 23:47:24+00:00,0,0,,,,Dallas_Fort_Worth
2653,1302392922642567168,Where is @realDonaldTrump Vietnam Card?,2020-09-05 23:47:24+00:00,0,0,@realDonaldTrump,,,Dallas_Fort_Worth
2654,1302392920251695112,it’s $20.99,2020-09-05 23:47:24+00:00,0,0,,,,Dallas_Fort_Worth
2655,1302392920054673410,"Power Come On Tonight, Know Im Stay Up To Watch It lol",2020-09-05 23:47:24+00:00,0,0,,,,Dallas_Fort_Worth
2656,1302392919991648256,Elle m’a eu deh ,2020-09-05 23:47:24+00:00,0,2,,,,Dallas_Fort_Worth
2657,1302392917953253377,Ngl. Someone would die in the gas mask probs. Restricts breathing as is. ;;,2020-09-05 23:47:23+00:00,0,1,,,,Dallas_Fort_Worth
2658,1302392917668106245,President Biden ruining America. 3.5 years of doing nothing.,2020-09-05 23:47:23+00:00,0,0,,,,Dallas_Fort_Worth
2659,1302392917659717632,yea ik ,2020-09-05 23:47:23+00:00,0,0,,,,Dallas_Fort_Worth
2660,1302392916673994758,I was born on the 8th,2020-09-05 23:47:23+00:00,0,1,,,,Dallas_Fort_Worth
2661,1302392916019744768,Oh nah I see my mans grin he knows what he did ,2020-09-05 23:47:23+00:00,0,1,,,,Dallas_Fort_Worth
2662,1302392914820165639,Why would anyone hire someone who has a proven track record of failing for 47 years in a row? @JoeBiden is not capable or smart enough to accomplish a single thing!,2020-09-05 23:47:22+00:00,9,26,@JoeBiden,,,Dallas_Fort_Worth
2663,1302392914182582272,@txst playing hard this game so far! Sorry I couldn’t attend in person like we did last year @SMU_Football #GoBobcats!,2020-09-05 23:47:22+00:00,0,0,@txst @SMU_Football,#GoBobcats,,Dallas_Fort_Worth
2664,1302392913121476609,"ça existe plu trop ça je trouve, l’écrasante majorité veulent que ça aille trop vite de ce que j'ai observer autour de moi même si des exception existe toujours",2020-09-05 23:47:22+00:00,0,0,,,,Dallas_Fort_Worth
2665,1302392910789455874,Live there 48 hours and already starting trouble....,2020-09-05 23:47:21+00:00,0,2,,,,Dallas_Fort_Worth
2666,1302392909719887872, ,2020-09-05 23:47:21+00:00,0,1,,,,Dallas_Fort_Worth
2667,1302392907257667584,One day My King will take me away from all this bullshit and I cant wait.,2020-09-05 23:47:21+00:00,0,1,,,,Dallas_Fort_Worth
2668,1302392906934702080,SO FULL OF SHIT!! When are Americans going to wake up and see how the Media and DNC are working side-by-side to defeat Trump!!,2020-09-05 23:47:20+00:00,0,0,,,,Dallas_Fort_Worth
2669,1302392905173266432,Love that place!,2020-09-05 23:47:20+00:00,0,0,,,,Dallas_Fort_Worth
2670,1302392904724418560,Easily more than this PPV. ,2020-09-05 23:47:20+00:00,0,1,,,,Dallas_Fort_Worth
2671,1302392903545884672,I told you jimmy was cold since the Rose days .,2020-09-05 23:47:20+00:00,1,1,,,,Dallas_Fort_Worth
2672,1302392901293441025,How about we listen to black conservatives for real solutions instead of Marxist anti American Leftist BLM and Antifa. Are conservative black voices worth less on the topic than liberal black voices. How is this guy on a college football broadcast. Send him over to the View.,2020-09-05 23:47:19+00:00,0,0,,,,Dallas_Fort_Worth
2673,1302392899783589888,Check out the latest foreclosed properties for sale near you. https://trib.al/GHEfyA1,2020-09-05 23:47:19+00:00,0,0,,,,Dallas_Fort_Worth
2674,1302392899536130049,#walkaway!!,2020-09-05 23:47:19+00:00,0,0,,#walkaway,,Dallas_Fort_Worth
2675,1302392895765446656,There’s a crowd gathering here at the Dallas Police headquarters of people protesting the detainment of next generation action network president Dominque Alexander. From what we understand so far no formal charges have been filed. @CBSDFW,2020-09-05 23:47:18+00:00,16,21,@CBSDFW,,,Dallas_Fort_Worth
2676,1302392894167359488,Our Open house today was a success! If you are a home buyer looking to buy in the beautiful Viridian community in Arlington TX reach out to us today to set up your private tour! Richard Blanton | Realtor 972-346-0815 #OpenHouse #Viridian #ArlingtonTX,2020-09-05 23:47:17+00:00,0,0,,#OpenHouse #Viridian #ArlingtonTX,,Dallas_Fort_Worth
2677,1302392893232087040,I asked Shawn if we could get matching wallpapers and he says no because he doesn’t know why he would do that. This is the boy I just spent $127 on yesterday ,2020-09-05 23:47:17+00:00,0,2,,,,Dallas_Fort_Worth
2678,1302392892879765504,Facts!,2020-09-05 23:47:17+00:00,0,2,,,,Dallas_Fort_Worth
2679,1302392892321869824,What kinda telephone bill is 20k,2020-09-05 23:47:17+00:00,0,2,,,,Dallas_Fort_Worth
2680,1302392888555376642,PRETTY IN PINK ALL DAY BABY #lashes,2020-09-05 23:47:16+00:00,1,3,,#lashes,,Dallas_Fort_Worth
2681,1302392888287014913,Q1 | A big pass play gives HBU a 1st and 10 from the North Texas 25. #GMG | #BeatHBU,2020-09-05 23:47:16+00:00,0,2,,#GMG #BeatHBU,,Dallas_Fort_Worth
2682,1302392887791857666,"We think Andrea either hates Rudy or is in love with him. It’s a fine line. The world sees Andrea posting a funny drawing, I see this.",2020-09-05 23:47:16+00:00,1,2,,,,Dallas_Fort_Worth
2683,1302392886974087172,Our Oligarchy gained the $to buy our politicians via the tax cuts they've received since 1981. Some semblance of a Democracy's only possible if they're heavily taxed again. Not a coincidence the Dem Party was its most Progressive when tax rates were at historical highs. 1/2,2020-09-05 23:47:16+00:00,1,5,,,,Dallas_Fort_Worth
2684,1302392881383182337,"GFK - All That I Got Is U, Cormega - Live Ya Life, Royce Da 5’9 - Tabernacle",2020-09-05 23:47:14+00:00,0,0,,,,Dallas_Fort_Worth
2685,1302392881332850690,"No I don’t, which is why we should’ve traded for him when we had the chance",2020-09-05 23:47:14+00:00,0,1,,,,Dallas_Fort_Worth
2686,1302392879474708480,shyguy,2020-09-05 23:47:14+00:00,1,21,,,,Dallas_Fort_Worth
2687,1302392877721489408, ,2020-09-05 23:47:13+00:00,0,1,,,,Dallas_Fort_Worth
2688,1302392877587234816,Hakeem was stupid af for breaking up with that older woman. Moesha was hating hard. #moesha,2020-09-05 23:47:13+00:00,0,1,,#moesha,,Dallas_Fort_Worth
2689,1302392876945608706,I grew up watching you. This is legendary ,2020-09-05 23:47:13+00:00,5,207,,,,Dallas_Fort_Worth
2690,1302392875603329025,Gay,2020-09-05 23:47:13+00:00,0,0,,,,Dallas_Fort_Worth
2691,1302392875225878529,The girl in front of me is a talkative drunk...,2020-09-05 23:47:13+00:00,0,0,,,,Dallas_Fort_Worth
2692,1302392873522991104,I was the CD burning PLUG in middle school,2020-09-05 23:47:12+00:00,0,5,,,,Dallas_Fort_Worth
2693,1302392873489510401,Not. Once he gets more comfortable with his back to the basket it’s going to be scary.,2020-09-05 23:47:12+00:00,0,1,,,,Dallas_Fort_Worth
2694,1302392872344399872,I'm hit this this six hr drive but im ready to tow up with friends n fam,2020-09-05 23:47:12+00:00,0,1,,,,Dallas_Fort_Worth
2695,1302392871644000258,Lfg klarkito,2020-09-05 23:47:12+00:00,0,0,,,,Dallas_Fort_Worth
2696,1302392870360375296,"So it going come down to a coin toss? Lmfaoooo a coin toss going decide, that cya right",2020-09-05 23:47:12+00:00,1,0,,,,Dallas_Fort_Worth
2697,1302392867533524993,Trump 2020,2020-09-05 23:47:11+00:00,0,0,,,,Dallas_Fort_Worth
2698,1302392867214761987,Now playing Creep by TLC!,2020-09-05 23:47:11+00:00,0,0,,,,Dallas_Fort_Worth
2699,1302392864631074823,Maldito mil veces maldito,2020-09-05 23:47:10+00:00,0,0,,,,Dallas_Fort_Worth
2700,1302392863200813062,This ice cream kinda weak tbh,2020-09-05 23:47:10+00:00,0,1,,,,Dallas_Fort_Worth
2701,1302392862705954816,"@AguinagaNate You killed it last night, Nate! Great job on both sides of the ball!",2020-09-05 23:47:10+00:00,2,3,@AguinagaNate,,,Dallas_Fort_Worth
2702,1302392861799911424,I'd say that's fair. I'm sure he'd much rather @Reuters just watch from a distance. ,2020-09-05 23:47:10+00:00,0,1,@Reuters,,,Dallas_Fort_Worth
2703,1302392859757350914,Maybe but that shouldn’t turn on notifications,2020-09-05 23:47:09+00:00,0,0,,,,Dallas_Fort_Worth
2704,1302392858704408576,Such an amazing concept. Ugh..,2020-09-05 23:47:09+00:00,0,0,,,,Dallas_Fort_Worth
2705,1302392858662633472,Captain Hook with the map ,2020-09-05 23:47:09+00:00,0,1,,,,Dallas_Fort_Worth
2706,1302392856989097984,on day day 6 without bussin dat ,2020-09-05 23:47:09+00:00,0,0,,,,Dallas_Fort_Worth
2707,1302392855235883009,Touchdown North Texas! Jason Bean finds Jaelon Darden from 33 yards out to give the Mean Green a 7-0 lead early in the 1st. LISTEN: http://tinyurl.com/MGSNFB2020,2020-09-05 23:47:08+00:00,1,0,,,,Dallas_Fort_Worth
2708,1302392854615068672,hope duncan doesnt come home rn to find me unironically listeningn to black beatles alone in our apartment,2020-09-05 23:47:08+00:00,0,8,,,,Dallas_Fort_Worth
