,id,text,date,retweets,favorites,mentions,hashtags,geo,region
1286,1302394525676195847,"Desculpe Tenente, é mais fácil uma tartaruga abdicar do casco e treinar para competir com Usain Bolt! Esse povo acha que está acima do bem e do mal!!!",2020-09-05 23:53:46+00:00,0,0,,,,Dallas_Fort_Worth
1287,1302394525059608576,CLEARED: CRASH: DNT NB @WESTGROVE AFFECTING THE RIGHT AND CENTER LANES 9/5/2020 6:53 PM,2020-09-05 23:53:46+00:00,1,0,,,,Dallas_Fort_Worth
1288,1302394524602433537,,2020-09-05 23:53:46+00:00,0,1,,,,Dallas_Fort_Worth
1289,1302394524199718912,Yo mama guys,2020-09-05 23:53:46+00:00,0,20,,,,Dallas_Fort_Worth
1290,1302394521741914114,Totally didn't buy this just to eat it out of the container by the spoonful.,2020-09-05 23:53:45+00:00,0,13,,,,Dallas_Fort_Worth
1291,1302394520739274752,He needs a home,2020-09-05 23:53:45+00:00,0,1,,,,Dallas_Fort_Worth
1292,1302394520571703297,"Texas can give Florida a run for their money! Gov Greg Abbott Let Gov Dan Patrick Senators: Ted Cruz & John Cornyn House: Louis Gohmert, Dan Crenshaw Chip Roy, Kevin Brady",2020-09-05 23:53:45+00:00,1,7,,,,Dallas_Fort_Worth
1293,1302394520164864008,Doubt he has liquid cash like that. Most of it is in stock or other deals,2020-09-05 23:53:45+00:00,0,0,,,,Dallas_Fort_Worth
1294,1302394520022192128,on me,2020-09-05 23:53:45+00:00,0,1,,,,Dallas_Fort_Worth
1295,1302394519946702848,"And NRG argued that it was poor management from ERCOT that caused the power and pricing crunch. Seems to be quite a few causes that are entirely unrelated to the expansion of alternative energy. If anything, it seems more alternative energy would help.",2020-09-05 23:53:45+00:00,0,0,,,,Dallas_Fort_Worth
1296,1302394517648277509,Be careful,2020-09-05 23:53:44+00:00,0,0,,,,Dallas_Fort_Worth
1297,1302394516931051520,Exactly Sharyl!,2020-09-05 23:53:44+00:00,0,0,,,,Dallas_Fort_Worth
1298,1302394516901691393,"The #IUIC #MensConference 2020 has been a breathtaking experience! #Knowledge, #Wisdom and #Understanding from the Experienced #MenOfGod! Learn more at http://Israelunite.org #IUICMC #UsAgainstTheWorld #GodsArmy #IUICATL",2020-09-05 23:53:44+00:00,0,2,,#IUIC #MensConference #Knowledge #Wisdom #Understanding #MenOfGod #IUICMC #UsAgainstTheWorld #GodsArmy #IUICATL,,Dallas_Fort_Worth
1299,1302394516146712581,Why 3 qbs,2020-09-05 23:53:44+00:00,0,0,,,,Dallas_Fort_Worth
1300,1302394515018448901,"If I had the money, I’d just drive to Colorado tonight...",2020-09-05 23:53:44+00:00,0,8,,,,Dallas_Fort_Worth
1301,1302394511147044864,BEAST!!!!!,2020-09-05 23:53:43+00:00,1,14,,,,Dallas_Fort_Worth
1302,1302394509771317254,"More and more, I realize it is rigged. It is all rigged - against the working class. We are the suckers. We do, in fact, need a revolution to establish a government that works for us - not us for it.",2020-09-05 23:53:43+00:00,0,0,,,,Dallas_Fort_Worth
1303,1302394509641355267,Very thankful my president is taking time for himself since he works such long hours! MAGA ,2020-09-05 23:53:43+00:00,0,0,,,,Dallas_Fort_Worth
1304,1302394509356077057,Looks like a lot of big blue waves ,2020-09-05 23:53:43+00:00,0,2,,,,Dallas_Fort_Worth
1305,1302394506977910791,Bring back Korean bbq,2020-09-05 23:53:42+00:00,0,1,,,,Dallas_Fort_Worth
1306,1302394506202034176,It may or may not come. No idea tbh ,2020-09-05 23:53:42+00:00,0,1,,,,Dallas_Fort_Worth
1307,1302394504918511616,"How about just, ""I love you, Yvette!""",2020-09-05 23:53:41+00:00,0,0,,,,Dallas_Fort_Worth
1308,1302394503739965441,OUI,2020-09-05 23:53:41+00:00,0,1,,,,Dallas_Fort_Worth
1309,1302394502112518144,i forgive people too much.,2020-09-05 23:53:41+00:00,0,0,,,,Dallas_Fort_Worth
1310,1302394501714059267,He going to golden state ,2020-09-05 23:53:41+00:00,0,5,,,,Dallas_Fort_Worth
1311,1302394499948310531,Lmfaoooo nahhhhh bro ,2020-09-05 23:53:40+00:00,0,0,,,,Dallas_Fort_Worth
1312,1302394499633762304, ,2020-09-05 23:53:40+00:00,0,0,,,,Dallas_Fort_Worth
1313,1302394498715090944,"PRINCE PAUL'S CASIO RZ-1, USED FOR DE LA SOUL, BIG DADDY KANE, & OTHERS",2020-09-05 23:53:40+00:00,0,2,,,,Dallas_Fort_Worth
1314,1302394497884663810,"PRINCE PAUL'S ALESIS HR-16 DRUM MACHINE, USED ON DE LA SOUL, BIG DADDY KANE, AND OTHERS",2020-09-05 23:53:40+00:00,1,3,,,,Dallas_Fort_Worth
1315,1302394497112903681,"SCHOOLLY D | ""PORTRAIT"", 1987.",2020-09-05 23:53:40+00:00,0,1,,,,Dallas_Fort_Worth
1316,1302394496341213189,where I’m at with it,2020-09-05 23:53:39+00:00,0,0,,,,Dallas_Fort_Worth
1317,1302394496240541696,"Here are some crazy things you can bid on in the Sotheby's ""hip hop"" auction. Considering starting a GoFundMe.",2020-09-05 23:53:39+00:00,2,3,,,,Dallas_Fort_Worth
1318,1302394493413588995,@2018Sonic @r4hl4n1f,2020-09-05 23:53:39+00:00,0,0,@2018Sonic @r4hl4n1f,,,Dallas_Fort_Worth
1319,1302394488887877633,Who trying to go half on a simpson’s dome during these troubling times?,2020-09-05 23:53:38+00:00,2,10,,,,Dallas_Fort_Worth
1320,1302394487549853696,"Run, throw, catch (2tds) @Max_Mcada7 @FootballSvale @SVRaiderBooster",2020-09-05 23:53:37+00:00,5,22,@Max_Mcada7 @FootballSvale @SVRaiderBooster,,,Dallas_Fort_Worth
1321,1302394487340228608,“How did you get a flat tire?” I had an entanglement with a curb.,2020-09-05 23:53:37+00:00,0,9,,,,Dallas_Fort_Worth
1322,1302394483749933058,This is far and away the funniest bullshit I have ever heard in my life.,2020-09-05 23:53:36+00:00,0,0,,,,Dallas_Fort_Worth
1323,1302394483321995266,We can donate to their opponents,2020-09-05 23:53:36+00:00,0,1,,,,Dallas_Fort_Worth
1324,1302394482973868033,I know this is hard but please please listen. Yes he said those things about McCain. Some of y’all don’t remember because your too young I only know because I was told and did my research. Had it not been for Nixon the Military was going to court martial McCain for treason...,2020-09-05 23:53:36+00:00,0,0,,,,Dallas_Fort_Worth
1325,1302394482860666884,Familia...Good times.,2020-09-05 23:53:36+00:00,0,9,,,,Dallas_Fort_Worth
1326,1302394481883394048,"Really aint neva gotta fuck fa a thing, he already made his mind up before he came",2020-09-05 23:53:36+00:00,0,0,,,,Dallas_Fort_Worth
1327,1302394479467532289,this a good game ngl,2020-09-05 23:53:35+00:00,0,2,,,,Dallas_Fort_Worth
1328,1302394479106838528,AMG- ,2020-09-05 23:53:35+00:00,0,1,,,,Dallas_Fort_Worth
1329,1302394478599208960,Wood fireplaces. And it should take up a whole wall to be used for nothing else.,2020-09-05 23:53:35+00:00,0,1,,,,Dallas_Fort_Worth
1330,1302394476271370246,But just like the “redskins” the shit is offense but cause it was use to put black ppl down y’all did it as a job,2020-09-05 23:53:35+00:00,0,0,,,,Dallas_Fort_Worth
1331,1302394475252244480,Booker. i already said Butler under the post,2020-09-05 23:53:34+00:00,1,1,,,,Dallas_Fort_Worth
1332,1302394475201925121,i was sleep on SZA at first but she is most definitely fine as hell,2020-09-05 23:53:34+00:00,0,10,,,,Dallas_Fort_Worth
1333,1302394474480439298,@KirkHerbstreit Let’s be clear Kirk... I want equality for EVERYONE. I want the same treatment for EVERYONE. I DO NOT want spirts figures selling me a White car and telling me it’s Black. Stop lecturing people who’ve never been racist on their racism. It’s nonsense,2020-09-05 23:53:34+00:00,0,0,@KirkHerbstreit,,,Dallas_Fort_Worth
1334,1302394474207875072,Aaron Donald.,2020-09-05 23:53:34+00:00,2,89,,,,Dallas_Fort_Worth
1335,1302394474082037761,You seen wht Mack said lol,2020-09-05 23:53:34+00:00,0,0,,,,Dallas_Fort_Worth
1336,1302394473742315522,Spirit is not it they be disrespectful with it ,2020-09-05 23:53:34+00:00,0,0,,,,Dallas_Fort_Worth
1337,1302394471691309058,From eating steaks to eating tuna after buying my Caddy ,2020-09-05 23:53:34+00:00,0,2,,,,Dallas_Fort_Worth
1338,1302394471489904646,Read it again. Nothing but fax,2020-09-05 23:53:33+00:00,0,0,,,,Dallas_Fort_Worth
1339,1302394470428803072,I felt this ,2020-09-05 23:53:33+00:00,0,12,,,,Dallas_Fort_Worth
1340,1302394469082427393,Wait- JUSTICE IS UP?!,2020-09-05 23:53:33+00:00,0,4,,,,Dallas_Fort_Worth
1341,1302394468277125120,It's either that or you could hold it out of your eyes with a couple of barrettes or a headband. ,2020-09-05 23:53:33+00:00,0,0,,,,Dallas_Fort_Worth
1342,1302394468163825665,Oh how the tables have turned this is in North Texas,2020-09-05 23:53:33+00:00,0,4,,,,Dallas_Fort_Worth
1343,1302394467291406337,SHIIIINEEE SPONGEBOBU,2020-09-05 23:53:32+00:00,0,0,,,,Dallas_Fort_Worth
1344,1302394466754584576,Bam ,2020-09-05 23:53:32+00:00,0,0,,,,Dallas_Fort_Worth
1345,1302394466511343616,#NewProfilePic,2020-09-05 23:53:32+00:00,0,3,,#NewProfilePic,,Dallas_Fort_Worth
1346,1302394463944351744,"Life has been kicking my ass as well, but I’m also built for this too",2020-09-05 23:53:32+00:00,3,5,,,,Dallas_Fort_Worth
1347,1302394463147483138,"I don't think they are ""forgetting"" about them.",2020-09-05 23:53:31+00:00,0,0,,,,Dallas_Fort_Worth
1348,1302394462581088256,됐어. 왜 굳이 인어야?. 아무튼. 좋은아침,2020-09-05 23:53:31+00:00,0,0,,,,Dallas_Fort_Worth
1349,1302394462132416512,Please excuse me while my heart explodes ,2020-09-05 23:53:31+00:00,0,25,,,,Dallas_Fort_Worth
1350,1302394458978344960,Someone is in attention mode. And a bit insistent about it,2020-09-05 23:53:30+00:00,0,0,,,,Dallas_Fort_Worth
1351,1302394458886074368,I was having rlly bad anxiety too but it rlly wasn’t bad promise:),2020-09-05 23:53:30+00:00,0,0,,,,Dallas_Fort_Worth
1352,1302394458512728072,Come and chat with me in #LiveMe:Is everyone drunks ? https://lm.ink/JqW8VVZmDnPNp,2020-09-05 23:53:30+00:00,0,0,,#LiveMe,,Dallas_Fort_Worth
1353,1302394455589302273, ,2020-09-05 23:53:30+00:00,0,0,,,,Dallas_Fort_Worth
1354,1302394453336956928,Easily actually,2020-09-05 23:53:29+00:00,0,0,,,,Dallas_Fort_Worth
1355,1302394447955668993,Ask him what color of jello he’s having tonight.,2020-09-05 23:53:28+00:00,0,8,,,,Dallas_Fort_Worth
1356,1302394446688989184,This is contractual agreement to do this handshake with me next time we see eachother Joey. #TroyandAbedInTheMorning,2020-09-05 23:53:28+00:00,0,1,,#TroyandAbedInTheMorning,,Dallas_Fort_Worth
1357,1302394444927377409,"Deut 27:19 says, ““‘Cursed be anyone who perverts the justice due to the sojourner, the fatherless, and the widow.’ And all the people shall say, ‘Amen.’” Apparently those whose families have been broken up have a special place in God’s heart. How important must family be to God?",2020-09-05 23:53:27+00:00,1,2,,,,Dallas_Fort_Worth
1358,1302394444239564800,I really would love for my son to have a teacher like you. ,2020-09-05 23:53:27+00:00,0,0,,,,Dallas_Fort_Worth
1359,1302394443300040704,أنا وياك خل نلعب نتراهن منو اليغلب من بوسه احنا نتراهن يلا يعجبك نجرب؟,2020-09-05 23:53:27+00:00,0,1,,,,Dallas_Fort_Worth
1360,1302394441383239680,Good.,2020-09-05 23:53:26+00:00,0,0,,,,Dallas_Fort_Worth
1361,1302394440955375617,wait deadass?,2020-09-05 23:53:26+00:00,0,2,,,,Dallas_Fort_Worth
1362,1302394434450083841,lmfao mind ya biness,2020-09-05 23:53:25+00:00,1,0,,,,Dallas_Fort_Worth
1363,1302394434366169089,@MurdaMookez vs @hollowdadon #Summermadness10,2020-09-05 23:53:25+00:00,0,0,@MurdaMookez @hollowdadon,#Summermadness10,,Dallas_Fort_Worth
1364,1302394433292374016,This is why I Stan Dorathy. My queen always gives me peace of mind,2020-09-05 23:53:24+00:00,0,3,,,,Dallas_Fort_Worth
1365,1302394432579424257, ,2020-09-05 23:53:24+00:00,0,0,,,,Dallas_Fort_Worth
1366,1302394431916650498,Mf be like “ y’all help y’all friends before me “ like ........ you always need help. Gone. Now I’m really not looking out because you rather be shady than just come on out and ask. Stupid.,2020-09-05 23:53:24+00:00,0,0,,,,Dallas_Fort_Worth
1367,1302394431887290370,Spread the word,2020-09-05 23:53:24+00:00,0,1,,,,Dallas_Fort_Worth
1368,1302394431576961026,2 likes bitch,2020-09-05 23:53:24+00:00,0,0,,,,Dallas_Fort_Worth
1369,1302394430155108352,يخوووففف كيف متى شلون توني افكر اني في السنه الثالثه جايش خليش مكانش,2020-09-05 23:53:24+00:00,0,0,,,,Dallas_Fort_Worth
1370,1302394428989026304,W,2020-09-05 23:53:23+00:00,0,1,,,,Dallas_Fort_Worth
1371,1302394427617488896,Thank you Sarge! ,2020-09-05 23:53:23+00:00,2,3,,,,Dallas_Fort_Worth
1372,1302394426527014913,.,2020-09-05 23:53:23+00:00,0,0,,,,Dallas_Fort_Worth
1373,1302394426283753472,"Going live in one hour! 8pm CST: Beatles and Byrds! ‘63 Epiphone Texan, ‘66 Rickenbacker 330 12 string, ATZ100. @thebeatles @RogerMcGuinn @ibanezofficial @RickenbackerInt @GeorgeHarrison https://www.stageit.com/andy_timmons/acoustic_beatles_night/87746",2020-09-05 23:53:23+00:00,7,52,@thebeatles @RogerMcGuinn @ibanezofficial @RickenbackerInt @GeorgeHarrison,,,Dallas_Fort_Worth
1374,1302394424098459648,Go get that money baby we gon run it up .,2020-09-05 23:53:22+00:00,0,0,,,,Dallas_Fort_Worth
1375,1302394423205134338,The term “balk move” is just another beautiful nuance of the game. Or at least I hope so as and this doesn’t turn into another Astro hate fest.,2020-09-05 23:53:22+00:00,0,0,,,,Dallas_Fort_Worth
1376,1302394423150604290,I said what I said champ,2020-09-05 23:53:22+00:00,0,1,,,,Dallas_Fort_Worth
1377,1302394421720371200,"Always...It’s their MO. Will scream & curse F You to the police (& every other horrible thing you can think of), give them the finger with both hands....then when they’re caught they wail & scream like babies for sympathy points...kinda funny, really.",2020-09-05 23:53:22+00:00,0,1,,,,Dallas_Fort_Worth
1378,1302394420726239232, ,2020-09-05 23:53:21+00:00,0,0,,,,Dallas_Fort_Worth
1379,1302394419438649344,That allergy nose be hitting different when I go for a breath of fresh air,2020-09-05 23:53:21+00:00,0,1,,,,Dallas_Fort_Worth
1380,1302394419212177410,No. These are not militia. These are armed street gangs.,2020-09-05 23:53:21+00:00,0,1,,,,Dallas_Fort_Worth
1381,1302394418742398977,We only eat ass a round here,2020-09-05 23:53:21+00:00,0,0,,,,Dallas_Fort_Worth
1382,1302394418314518529,I haven’t a watched it on #DisneyPlus until now. This transfer is fucking impressive. Best this film has looked.,2020-09-05 23:53:21+00:00,1,19,,#DisneyPlus,,Dallas_Fort_Worth
1383,1302394417794502657,Lol nice try bucko,2020-09-05 23:53:21+00:00,0,0,,,,Dallas_Fort_Worth
1384,1302394417706340352,the Fullness of the Truth Is Found In Love,2020-09-05 23:53:21+00:00,0,0,,,,Dallas_Fort_Worth
1385,1302394416397725696,"LMAO! The ""Trump fleet"" is sinking...",2020-09-05 23:53:20+00:00,0,0,,,,Dallas_Fort_Worth
1386,1302394416380993539,It look like her shoes on the wrong feet,2020-09-05 23:53:20+00:00,0,1,,,,Dallas_Fort_Worth
1387,1302394415391150081,Such fake news!,2020-09-05 23:53:20+00:00,0,0,,,,Dallas_Fort_Worth
1388,1302394415336615938,ily ,2020-09-05 23:53:20+00:00,0,0,,,,Dallas_Fort_Worth
1389,1302394414212448257,His IQ has improve incredibly since he gotten in the league. He always was a big time energy player.,2020-09-05 23:53:20+00:00,0,1,,,,Dallas_Fort_Worth
1390,1302394413570764801,"I used to like ""Creep"" until ""Reckoner"" came along. What I like about the Radiohead guys? They play bridge. ",2020-09-05 23:53:20+00:00,0,0,,,,Dallas_Fort_Worth
1391,1302394410810961922,Nie,2020-09-05 23:53:19+00:00,0,1,,,,Dallas_Fort_Worth
1392,1302394409770717184,"Yeah I do think season 2 is much more engaging, it is my favourite of the two",2020-09-05 23:53:19+00:00,0,1,,,,Dallas_Fort_Worth
1393,1302394409720459270,Thanks!,2020-09-05 23:53:19+00:00,0,0,,,,Dallas_Fort_Worth
1394,1302394409535901696,#UFCVegas9 Araujo is just faster,2020-09-05 23:53:19+00:00,0,2,,#UFCVegas9,,Dallas_Fort_Worth
1395,1302394409347145730,God bless you unless you disrespect the architect,2020-09-05 23:53:19+00:00,0,0,,,,Dallas_Fort_Worth
1396,1302394407786864642,STEPHEN... BOY WTF @stephenasmith,2020-09-05 23:53:18+00:00,0,0,@stephenasmith,,,Dallas_Fort_Worth
1397,1302394406192979971,"got back 12,760.963344 $sushi amazing gift !!! thanks again",2020-09-05 23:53:18+00:00,0,0,,,,Dallas_Fort_Worth
1398,1302394405417037825, ,2020-09-05 23:53:18+00:00,0,1,,,,Dallas_Fort_Worth
1399,1302394404678893568,you should elect a dolphin as your governor,2020-09-05 23:53:18+00:00,0,1,,,,Dallas_Fort_Worth
1400,1302394403835858944,Tru,2020-09-05 23:53:17+00:00,0,0,,,,Dallas_Fort_Worth
1401,1302394402552393729,You can't choose your family but you can choose your opinions and sometimes both are just... really bad.,2020-09-05 23:53:17+00:00,0,6,,,,Dallas_Fort_Worth
1402,1302394401700933632,If you limit to edge maybe. At least I’m betting the rams don’t move Donald to over the RT. What’s Terrell Lewis going to do? But the best duo is Takk and Fowler which isn’t all that daunting.,2020-09-05 23:53:17+00:00,0,0,,,,Dallas_Fort_Worth
1403,1302394401319198722,Instead of acknowledging this match... The real neverending nightmare is an ifunny watermark.,2020-09-05 23:53:17+00:00,0,4,,,,Dallas_Fort_Worth
1404,1302394401310863361,Antifa and BLM are core components of @JoeBiden's grassroots supporters.,2020-09-05 23:53:17+00:00,0,0,@JoeBiden,,,Dallas_Fort_Worth
1405,1302394401210224647,You really aren’t that good at Twitter are you?,2020-09-05 23:53:17+00:00,0,0,,,,Dallas_Fort_Worth
1406,1302394400492978176,"But you still arrested the victims, right? The ones that were sprayed by the others?",2020-09-05 23:53:17+00:00,1,9,,,,Dallas_Fort_Worth
1407,1302394400287395843,Get to buy more fishing equipment,2020-09-05 23:53:17+00:00,0,0,,,,Dallas_Fort_Worth
1408,1302394399092023296,License and registration please,2020-09-05 23:53:16+00:00,2,4,,,,Dallas_Fort_Worth
1409,1302394396688740352,Wow.,2020-09-05 23:53:16+00:00,0,0,,,,Dallas_Fort_Worth
1410,1302394395992428545,Damian finna go hunt w his dad this weekend and ima cry being away from him ,2020-09-05 23:53:15+00:00,0,0,,,,Dallas_Fort_Worth
1411,1302394395300425729,Finna ink my whole body ,2020-09-05 23:53:15+00:00,0,2,,,,Dallas_Fort_Worth
1412,1302394389361233921,cuddling to crystal castles hehe,2020-09-05 23:53:14+00:00,0,3,,,,Dallas_Fort_Worth
1413,1302394388555862016,Fishsticks are on the board!,2020-09-05 23:53:14+00:00,0,1,,,,Dallas_Fort_Worth
1414,1302394387553488896,I’m rooting for Gritty.,2020-09-05 23:53:13+00:00,0,1,,,,Dallas_Fort_Worth
1415,1302394387352223745,I am glad you did !,2020-09-05 23:53:13+00:00,0,1,,,,Dallas_Fort_Worth
1416,1302394387251580928,I see your point but I upgraded from the 11 pro max and yes there ir a huge difference. Saying that there is no difference because ios is smooth it's ridiculous. Yes ios is smooth but you can definitely see the refresh rate difference. The iphone looks behind to be honest.,2020-09-05 23:53:13+00:00,0,6,,,,Dallas_Fort_Worth
1417,1302394384034430976,I love Fall.,2020-09-05 23:53:13+00:00,0,1,,,,Dallas_Fort_Worth
1418,1302394383896018944,Yes ma’am ,2020-09-05 23:53:13+00:00,1,1,,,,Dallas_Fort_Worth
1419,1302394383296233472,"Come on mane. Sho u rite. Stay safe man. And if you ever need anything, I'm here.",2020-09-05 23:53:12+00:00,0,1,,,,Dallas_Fort_Worth
1420,1302394380091826176,"Every time CNN does something good, they then right the balances by publishing something by Cillizza. He's their g-d albatross.",2020-09-05 23:53:12+00:00,3,14,,,,Dallas_Fort_Worth
1421,1302394379710148608,DFAd? I assume because the owners don’t want to eat the salary. He should have been DFAd long ago. He’s terrible.,2020-09-05 23:53:12+00:00,0,1,,,,Dallas_Fort_Worth
1422,1302394379349491712,@AmyBhatia4 @justteachinmath @MsOndrey @mollykateisgr8 found our house shirts #HouseofFas #WHOOOWHOOO,2020-09-05 23:53:12+00:00,0,0,@AmyBhatia4 @justteachinmath @MsOndrey @mollykateisgr8,#HouseofFas #WHOOOWHOOO,,Dallas_Fort_Worth
1423,1302394375788531712,SMU HAS THE BEST UNIs AND HELMET COMBO IN THE GAME!,2020-09-05 23:53:11+00:00,2,33,,,,Dallas_Fort_Worth
1424,1302394373854900224,Homily: 23rd Sunday of Ordinary Time (A) – 2020,2020-09-05 23:53:10+00:00,0,0,,,,Dallas_Fort_Worth
1425,1302394373846507520,I enjoyed the game until i got to the problems that started off small and later became very major and the main story could be longer the combat is amazing but this game itself definitely needs further bug fixes and stability updates,2020-09-05 23:53:10+00:00,0,0,,,,Dallas_Fort_Worth
1426,1302394373632557056,"Does anyone still use #X10 controlled lights? Should I gut this and install a Sonoff or something? It’s huge because it has all those knobs and switches. It’s been in my garage for ages, along with a bunch of other X10 stuff that never really worked.",2020-09-05 23:53:10+00:00,0,1,,#X10,,Dallas_Fort_Worth
1427,1302394373334859777,Cor just lost to a rookie why they wanna see you finish the kill,2020-09-05 23:53:10+00:00,0,0,,,,Dallas_Fort_Worth
1428,1302394373020282881,Sounds spicy,2020-09-05 23:53:10+00:00,0,1,,,,Dallas_Fort_Worth
1429,1302394372496011266,Feelin’ pretty ‘wholesome’ in this new shirt from @HarrisHeller ,2020-09-05 23:53:10+00:00,0,11,@HarrisHeller,,,Dallas_Fort_Worth
1430,1302394371732647936,"Thanks for sharing, Colleen. This is wild. “Luciferase?!?!”",2020-09-05 23:53:10+00:00,0,1,,,,Dallas_Fort_Worth
1431,1302394366389035010,Smt3,2020-09-05 23:53:08+00:00,0,0,,,,Dallas_Fort_Worth
1432,1302394366309392384,Ur so beautiful ,2020-09-05 23:53:08+00:00,1,1,,,,Dallas_Fort_Worth
1433,1302394364833026048,Right‽ I have no idea. And I feel like the entire show could have been avoided with a little communication. So much manly posturing.,2020-09-05 23:53:08+00:00,0,1,,,,Dallas_Fort_Worth
1434,1302394364707188740,you can punch when you go trough holes?,2020-09-05 23:53:08+00:00,0,1,,,,Dallas_Fort_Worth
1435,1302394363876605952,Nba 2k21 Ep.1. :Youtube: Moro,2020-09-05 23:53:08+00:00,0,0,,,,Dallas_Fort_Worth
1436,1302394362450636800,"Container Gardening Ideas If you’re looking for new & improved or just cute and fun ways to display the plants in your garden, these picks are for you! Click through NOW to see them… https://dianfarmer.com/container-gardening-ideas/",2020-09-05 23:53:07+00:00,0,0,,,,Dallas_Fort_Worth
1437,1302394362081562624,That she don’t give head....,2020-09-05 23:53:07+00:00,0,1,,,,Dallas_Fort_Worth
1438,1302394361729241090,And hi,2020-09-05 23:53:07+00:00,0,0,,,,Dallas_Fort_Worth
1439,1302394360781250560,America’s foundation is not inherently racist. That statement just shows me you know nothing about America’s founding,2020-09-05 23:53:07+00:00,0,0,,,,Dallas_Fort_Worth
1440,1302394360009555969, ,2020-09-05 23:53:07+00:00,0,11,,,,Dallas_Fort_Worth
1441,1302394359615234051,That’s more than Trump,2020-09-05 23:53:07+00:00,0,0,,,,Dallas_Fort_Worth
1442,1302394358856060928,Indica or IN DA BED because your ass needs to go to sleep. Shit! I don’t feel like doing shit now.,2020-09-05 23:53:07+00:00,0,0,,,,Dallas_Fort_Worth
1443,1302394358667382784,LMAOOO,2020-09-05 23:53:07+00:00,0,0,,,,Dallas_Fort_Worth
1444,1302394357891424257, ,2020-09-05 23:53:06+00:00,0,0,,,,Dallas_Fort_Worth
1445,1302394355794272260,Vamos para arriba no hay ninguna prisa ,2020-09-05 23:53:06+00:00,0,0,,,,Dallas_Fort_Worth
1446,1302394353890078720,History will remember...,2020-09-05 23:53:05+00:00,0,1,,,,Dallas_Fort_Worth
1447,1302394352568807425,Tomorrow is @DominDallas_TX's B-Day. Let's celebrate today! – at McKinney &amp; Olive,2020-09-05 23:53:05+00:00,1,38,@DominDallas_TX,,,Dallas_Fort_Worth
1448,1302394351197106177,The neighbors think I’m selling dope,2020-09-05 23:53:05+00:00,0,0,,,,Dallas_Fort_Worth
1449,1302394349666402306,"Por gusto estudiaste tonto. Mira tus comentarios , creyendo lo que el PAQUIN del Faro dijo. Eso es basura",2020-09-05 23:53:04+00:00,0,0,,,,Dallas_Fort_Worth
1450,1302394349544787970,Ass,2020-09-05 23:53:04+00:00,0,0,,,,Dallas_Fort_Worth
1451,1302394349368610816,jail,2020-09-05 23:53:04+00:00,0,0,,,,Dallas_Fort_Worth
1452,1302394349246803970,come to TX!,2020-09-05 23:53:04+00:00,0,0,,,,Dallas_Fort_Worth
1453,1302394346499715072, ,2020-09-05 23:53:04+00:00,0,1,,,,Dallas_Fort_Worth
1454,1302394345971163137,@mayaatgy damso ???,2020-09-05 23:53:04+00:00,0,0,@mayaatgy,,,Dallas_Fort_Worth
1455,1302394345211998209,Yep and no mask. Not drinking or eating either. So far it’s a total failure. @wrenbaker,2020-09-05 23:53:03+00:00,0,0,@wrenbaker,,,Dallas_Fort_Worth
1456,1302394342187900928,yes it is,2020-09-05 23:53:03+00:00,0,3,,,,Dallas_Fort_Worth
1457,1302394341059510273,"...@BTS_twt Namjoon I’ll never forgive you for this, your pink hair was/is the supreme cut/colour",2020-09-05 23:53:02+00:00,0,0,@BTS_twt,,,Dallas_Fort_Worth
1458,1302394340656939010,"I’m still baffled as to how they can blatantly lie when there’s video evidence disproving everything they say. Or worse, plenty of people believe them.",2020-09-05 23:53:02+00:00,0,15,,,,Dallas_Fort_Worth
1459,1302394340442927104,Microsoft will reportedly sell the Surface Duo only in the US until 2021 | Pocketnow http://dlvr.it/Rg3Mrs #technology #digital #transformation,2020-09-05 23:53:02+00:00,0,0,,#technology #digital #transformation,,Dallas_Fort_Worth
1460,1302394339448979457,New Tings On The Way! Get This Look! Shop Now!!!! http://beexquisitefashions.com Sale Going on Now!! Use Coupon Code: STIM25 to receive 25% Off Your Entire Order #exquisiteattireforeveryoccasion #shinebrightlikeadiamond ,2020-09-05 23:53:02+00:00,0,0,,#exquisiteattireforeveryoccasion #shinebrightlikeadiamond,,Dallas_Fort_Worth
1461,1302394339327385600,Do we have anyone in our organization that can play 3B? My lord. #stlcards,2020-09-05 23:53:02+00:00,0,2,,#stlcards #stlcards,,Dallas_Fort_Worth
1462,1302394337028956161,"@icecube “Dead Homiez”. When that cat said: “They say ""Be Strong"" and you're tryin', But how strong can you be when you see your Pops cryin'?” I heard that and I was BOO-HOOING.",2020-09-05 23:53:01+00:00,0,0,@icecube,,,Dallas_Fort_Worth
1463,1302394335762288642,I’m not! I’m impressed,2020-09-05 23:53:01+00:00,0,1,,,,Dallas_Fort_Worth
