,id,text,date,retweets,favorites,mentions,hashtags,geo,region
3616,1302391779988307973,When the interview is over.,2020-09-05 23:42:52+00:00,0,0,,,,Dallas_Fort_Worth
3617,1302391779166126081,could you please review my company website site. We are a start-up technology company i started at the beginning of 2020 and we are doing outstanding job delivering cutting edge technology - savings on quality high-speed internet service cost,2020-09-05 23:42:52+00:00,0,1,,,,Dallas_Fort_Worth
3618,1302391774682451975,"If the Leafs could learn to finish a series they’d be scary but until then, a healthy Avs team can outskate almost anyone.",2020-09-05 23:42:51+00:00,0,1,,,,Dallas_Fort_Worth
3619,1302391774082723843, ,2020-09-05 23:42:50+00:00,1,2,,,,Dallas_Fort_Worth
3620,1302391772094623751,"If the #Cowboys were looking like a dumpster fire, I wouldn’t have a single one. What you see as homerism — I see as having an inside track. Team is loaded. Not my fault nobody else believes it. ",2020-09-05 23:42:50+00:00,0,4,,#Cowboys,,Dallas_Fort_Worth
3621,1302391771985514504,Bout to rock and roll solo at @legacywestplano! Come say hi! Im here until 9p! #legacywest #qmooremusic #dallasmusic #planotx @Legacy West https://www.instagram.com/p/CExhEHHp86k/?igshid=1dfz9ilt725k0,2020-09-05 23:42:50+00:00,0,0,@LegacyWestPlano,#legacywest #qmooremusic #dallasmusic #planotx,,Dallas_Fort_Worth
3622,1302391770588774400,MARI10 20 minutes y’all! http://www.bows-4-kassi.myshopify.com/discount/MARI10,2020-09-05 23:42:50+00:00,1,1,,,,Dallas_Fort_Worth
3623,1302391766532980738,"No context game of mario party. The highlighted column is lucky spaces I won, barely",2020-09-05 23:42:49+00:00,0,1,,,,Dallas_Fort_Worth
3624,1302391763299184642,"got back 12,760.5573 $sushi amazing gift !!! thanks again",2020-09-05 23:42:48+00:00,0,0,,,,Dallas_Fort_Worth
3625,1302391761931612160,*#49 Zach Williams for North Texas on the successful extra-point attempt,2020-09-05 23:42:47+00:00,0,1,,,,Dallas_Fort_Worth
3626,1302391761097109506,That lavender purple is HEAT,2020-09-05 23:42:47+00:00,0,0,,,,Dallas_Fort_Worth
3627,1302391758886703105,I don’t have my workplace all over my IG but I bust my ass. Tre is amazing!,2020-09-05 23:42:47+00:00,0,1,,,,Dallas_Fort_Worth
3628,1302391758626709507, ,2020-09-05 23:42:47+00:00,0,0,,,,Dallas_Fort_Worth
3629,1302391756542087169,19 & libra,2020-09-05 23:42:46+00:00,0,0,,,,Dallas_Fort_Worth
3630,1302391755015421952,I like to warn folks before they give into idiotic posts...,2020-09-05 23:42:46+00:00,0,0,,,,Dallas_Fort_Worth
3631,1302391754595983360,bu goruntu sana kurban olsun,2020-09-05 23:42:46+00:00,0,0,,,,Dallas_Fort_Worth
3632,1302391753560010753,Thank you! Let me order them!!!,2020-09-05 23:42:45+00:00,0,0,,,,Dallas_Fort_Worth
3633,1302391752607830017,And use the best ammo..,2020-09-05 23:42:45+00:00,0,10,,,,Dallas_Fort_Worth
3634,1302391750431039488,AAAAAAAAAAAAAAAAAAAAAAAAAAAAAAAAAAAAAAAAAAAAAAAAAAAAAAAAAAAAAAAAAAAAAAAAAAAAAAAAAAAAAAAAAAA,2020-09-05 23:42:45+00:00,0,0,,,,Dallas_Fort_Worth
3635,1302391750254891008,WE ARE ROOTING WITH YOU MY GUY,2020-09-05 23:42:45+00:00,0,2,,,,Dallas_Fort_Worth
3636,1302391749705424896,I agree!!,2020-09-05 23:42:45+00:00,0,1,,,,Dallas_Fort_Worth
3637,1302391749680279553,No lol,2020-09-05 23:42:45+00:00,0,0,,,,Dallas_Fort_Worth
3638,1302391749210443779,It’s crazy to me that the people who live there continue to tear up their own city. For what?,2020-09-05 23:42:44+00:00,0,0,,,,Dallas_Fort_Worth
3639,1302391747830517773,It really is!,2020-09-05 23:42:44+00:00,0,0,,,,Dallas_Fort_Worth
3640,1302391744328335360,I don't know why but the thing that stood out to me was that everthing is hardwood but the floors.,2020-09-05 23:42:43+00:00,0,0,,,,Dallas_Fort_Worth
3641,1302391744114438148,Solid character. I really enjoyed his role in the manga and his interactions with everyone.,2020-09-05 23:42:43+00:00,0,1,,,,Dallas_Fort_Worth
3642,1302391743883677698, #kimptonlove,2020-09-05 23:42:43+00:00,0,2,,#kimptonlove,,Dallas_Fort_Worth
3643,1302391742839353344,Praying vigilantly for this baby. Please keep us posted.,2020-09-05 23:42:43+00:00,0,2,,,,Dallas_Fort_Worth
3644,1302391740649951234,Nashville Music Clubs Get Emergency Relief Funding – Rolling Stone,2020-09-05 23:42:42+00:00,1,0,,,,Dallas_Fort_Worth
3645,1302391739714613248,Hatsune Miku binder Gilgamesh,2020-09-05 23:42:42+00:00,0,1,,,,Dallas_Fort_Worth
3646,1302391739408416769,Fuck it lol,2020-09-05 23:42:42+00:00,0,1,,,,Dallas_Fort_Worth
3647,1302391738573750272,@ToBeMiro,2020-09-05 23:42:42+00:00,0,0,@ToBeMiro,,,Dallas_Fort_Worth
3648,1302391738431143937,When the Raptors go cold on offense they go real cold.,2020-09-05 23:42:42+00:00,0,1,,,,Dallas_Fort_Worth
3649,1302391737659404294,Me: *trying to get laundry day on my face*,2020-09-05 23:42:42+00:00,0,1,,,,Dallas_Fort_Worth
3650,1302391737441234950,They can come to my cookout then. Fuck your cookout. I’ll gladly welcome them,2020-09-05 23:42:42+00:00,0,0,,,,Dallas_Fort_Worth
3651,1302391737059389440,I've been using the original Ridge wallet for years and years and years now and it's perfect and I can't imagine using anything else.,2020-09-05 23:42:42+00:00,0,0,,,,Dallas_Fort_Worth
3652,1302391736212140032,Sometimes the only explanation is you’re trying to lose,2020-09-05 23:42:41+00:00,0,0,,,,Dallas_Fort_Worth
3653,1302391735411240960,"E é saci, saci é.. ",2020-09-05 23:42:41+00:00,0,1,,,,Dallas_Fort_Worth
3654,1302391734983417856,@FallinMason MIND YO DAMN BUSINESS,2020-09-05 23:42:41+00:00,0,0,@FallinMason,,,Dallas_Fort_Worth
3655,1302391733771173889,,2020-09-05 23:42:41+00:00,0,0,,,,Dallas_Fort_Worth
3656,1302391733209174016,@ufc change ur ads between fights pls im bored,2020-09-05 23:42:41+00:00,0,0,@ufc,,,Dallas_Fort_Worth
3657,1302391729631395840,Hope it meets our expectations. ,2020-09-05 23:42:40+00:00,0,1,,,,Dallas_Fort_Worth
3658,1302391729451081728,Still no details about what happened. Probably Texas sudden wind or rain. But all dems are very happy. How can you be happy when somebody gets hurt or some accident happen?,2020-09-05 23:42:40+00:00,0,0,,,,Dallas_Fort_Worth
3659,1302391729375588352,"Even if you aren’t interested in joining the team/don’t attend UNT, we would still love to have you! Time/dates are subject to change. More information will be available once we get closer to the event date! #UNT20 #UNT21 #UNT22 #UNT23 #UNT24 @UNTsocial",2020-09-05 23:42:40+00:00,0,0,@UNTsocial,#UNT20 #UNT21 #UNT22 #UNT23 #UNT24,,Dallas_Fort_Worth
3660,1302391728339595266,why does Oregon have an insta spawnpeak still after two seasons? Literally cost the entire round for no drawback from the defenders,2020-09-05 23:42:39+00:00,0,1,,,,Dallas_Fort_Worth
3661,1302391727098130432,It was Darwin Day on the lake.,2020-09-05 23:42:39+00:00,0,2,,,,Dallas_Fort_Worth
3662,1302391726800330752,Join me for this My Voice My Power event in Houston!,2020-09-05 23:42:39+00:00,1,3,,,,Dallas_Fort_Worth
3663,1302391726036918272,thought this was some extremely goth boxed wine at first glance,2020-09-05 23:42:39+00:00,0,0,,,,Dallas_Fort_Worth
3664,1302391725470683136,"Un miedo, una de gentee",2020-09-05 23:42:39+00:00,0,1,,,,Dallas_Fort_Worth
3665,1302391725328142338,Hey UNT! As the recruitment officer for the Women’s Rugby team I’m going to be hosting a few virtual events this semester for anyone who is looking for something fun to do!,2020-09-05 23:42:39+00:00,5,4,,,,Dallas_Fort_Worth
3666,1302391723390365703,You know what it is bro,2020-09-05 23:42:38+00:00,0,0,,,,Dallas_Fort_Worth
3667,1302391721666412544,Will be giving all my friends my personal art works let me know,2020-09-05 23:42:38+00:00,3,18,,,,Dallas_Fort_Worth
3668,1302391718784823297,You are welcome kind lady!,2020-09-05 23:42:37+00:00,0,0,,,,Dallas_Fort_Worth
3669,1302391717388259332,So why didn't he go and fight with you?,2020-09-05 23:42:37+00:00,0,0,,,,Dallas_Fort_Worth
3670,1302391714624217089,dance with me in my backyard boi,2020-09-05 23:42:36+00:00,0,2,,,,Dallas_Fort_Worth
3671,1302391713797939200,Me logging on to Twitter every morning,2020-09-05 23:42:36+00:00,2,4,,,,Dallas_Fort_Worth
3672,1302391711377895425,Stan Dorathy for peace of mind ,2020-09-05 23:42:35+00:00,0,0,,,,Dallas_Fort_Worth
3673,1302391710534840321,,2020-09-05 23:42:35+00:00,0,1,,,,Dallas_Fort_Worth
3674,1302391708878016513,Haters ignorants & arrogants are so blind and they just have built hatred from nowhere on individuals who ever they think oppose or stand against their political ideology,2020-09-05 23:42:35+00:00,0,0,,,,Dallas_Fort_Worth
3675,1302391708764827648,"@KaiserNeko fair warning, I'm going to show this to you 2-3 years from now when you least expect it.",2020-09-05 23:42:35+00:00,0,0,@KaiserNeko,,,Dallas_Fort_Worth
3676,1302391708257263616,,2020-09-05 23:42:35+00:00,0,1,,,,Dallas_Fort_Worth
3677,1302391707191914496,My husband would love to suck on those. #beautiful,2020-09-05 23:42:34+00:00,0,2,,#beautiful,,Dallas_Fort_Worth
3678,1302391705463934977,I’m sorry.. what!?,2020-09-05 23:42:34+00:00,0,0,,,,Dallas_Fort_Worth
3679,1302391704079798277,Nope. Gotta watch the first fleet drop then watch them make their tweaks and adjustments then *maybe* just *maybe* I’ll consider it!,2020-09-05 23:42:34+00:00,0,0,,,,Dallas_Fort_Worth
3680,1302391703324762112,He is lost,2020-09-05 23:42:33+00:00,0,0,,,,Dallas_Fort_Worth
3681,1302391700623626241,Greatness...this is how you roll! Hats off to The Red Raiders ,2020-09-05 23:42:33+00:00,0,0,,,,Dallas_Fort_Worth
3682,1302391699411546112,"Yeah Florida win competition for ""Worst State."" I guess, Texas will have to settle for ""Worst Smelling"".",2020-09-05 23:42:33+00:00,0,2,,,,Dallas_Fort_Worth
3683,1302391699226923008,“502 Come Up” shoulda been outta here like Wheezy.,2020-09-05 23:42:33+00:00,0,0,,,,Dallas_Fort_Worth
3684,1302391691731701761,The best people.,2020-09-05 23:42:31+00:00,0,0,,,,Dallas_Fort_Worth
3685,1302391688632176646,Lmao it’s gonna make people roll they eyes and agree ,2020-09-05 23:42:30+00:00,0,1,,,,Dallas_Fort_Worth
3686,1302391688283987968,Mary Jane stay doing my nigga Peter wrong,2020-09-05 23:42:30+00:00,0,0,,,,Dallas_Fort_Worth
3687,1302391687428308994,4 boats sank in supposedly rough waters. Does that water look rough?,2020-09-05 23:42:30+00:00,0,0,,,,Dallas_Fort_Worth
3688,1302391683506552835,Reagor Dykes >> Sonny Dykes,2020-09-05 23:42:29+00:00,0,0,,,,Dallas_Fort_Worth
3689,1302391683372511234,MARI10 saves at checkout y’all!! 20 minutes until the site is live! http://www.bows-4-kassi.myshopify.com/discount/MARI10,2020-09-05 23:42:29+00:00,0,0,,,,Dallas_Fort_Worth
3690,1302391683162804224,,2020-09-05 23:42:29+00:00,1,4,,,,Dallas_Fort_Worth
3691,1302391683108212736,Wow,2020-09-05 23:42:29+00:00,0,0,,,,Dallas_Fort_Worth
3692,1302391681464008704,"@mainecabinmstrs watching A-Frame cabin episode for 2nd time Amazed u accomplished what u did for $20,000! You deserved 5 K for the location alone! Is there additional charge when location is as precarious as this one/the barge et all?That tent! Hoping for another season!",2020-09-05 23:42:28+00:00,0,0,@mainecabinmstrs,,,Dallas_Fort_Worth
3693,1302391680885313536,OMG THIS IS NOW STUCK IN MY HEAD,2020-09-05 23:42:28+00:00,0,1,,,,Dallas_Fort_Worth
3694,1302391680289603587,"Alright, were just going in circles lol have a goodnight my man, good luck this season!",2020-09-05 23:42:28+00:00,0,1,,,,Dallas_Fort_Worth
3695,1302391679924797440,mf same ,2020-09-05 23:42:28+00:00,0,1,,,,Dallas_Fort_Worth
3696,1302391678096019457,@TxStateBobcats,2020-09-05 23:42:27+00:00,0,1,@TxStateBobcats,,,Dallas_Fort_Worth
3697,1302391677815001088,"I think I know which part this was, lol",2020-09-05 23:42:27+00:00,0,0,,,,Dallas_Fort_Worth
3698,1302391676237905920,Naaa,2020-09-05 23:42:27+00:00,0,1,,,,Dallas_Fort_Worth
3699,1302391675873001472,,2020-09-05 23:42:27+00:00,0,0,,,,Dallas_Fort_Worth
3700,1302391674207862785,i don’t know about this,2020-09-05 23:42:27+00:00,0,1,,,,Dallas_Fort_Worth
3701,1302391672056221701,"Another Trump-Related Nonprofit, Another Problem https://nonprofitquarterly.org/another-trump-related-nonprofit-another-problem/ via @npquarterly",2020-09-05 23:42:26+00:00,0,0,@npquarterly,,,Dallas_Fort_Worth
3702,1302391670747529216,That and being able to stay up as late as you want and play video games and watch whatever movie you want. Not to mention running around the house just wearing 3 socks.,2020-09-05 23:42:26+00:00,0,0,,,,Dallas_Fort_Worth
3703,1302391669778767872,"Bad bitch down , I ain’t feeling it",2020-09-05 23:42:25+00:00,0,1,,,,Dallas_Fort_Worth
3704,1302391665349419008,No,2020-09-05 23:42:24+00:00,0,0,,,,Dallas_Fort_Worth
3705,1302391664544276480,J’aime trop oups c le seul qui me manque je l’es est tous ..,2020-09-05 23:42:24+00:00,0,0,,,,Dallas_Fort_Worth
3706,1302391663885717510,Da baby was the only one who shoulda been on it. Period.,2020-09-05 23:42:24+00:00,0,0,,,,Dallas_Fort_Worth
3707,1302391652791791616,I have one green eye ,2020-09-05 23:42:21+00:00,0,2,,,,Dallas_Fort_Worth
3708,1302391651617460226,“Keep politics out of....” NOTHING. Politics is a part of everything.,2020-09-05 23:42:21+00:00,13,197,,,,Dallas_Fort_Worth
3709,1302391650870800388,"What you name mamacita So sexy , muy bonita ",2020-09-05 23:42:21+00:00,8,37,,,,Dallas_Fort_Worth
3710,1302391650858270720,So you’re a white woman?,2020-09-05 23:42:21+00:00,0,3,,,,Dallas_Fort_Worth
3711,1302391649872408576,the two most important factors in a football program imo,2020-09-05 23:42:21+00:00,0,4,,,,Dallas_Fort_Worth
3712,1302391649126023170,Apparently to suit their Whiteness,2020-09-05 23:42:21+00:00,0,0,,,,Dallas_Fort_Worth
3713,1302391649016963074,I’d say about the most American thing you could do.,2020-09-05 23:42:21+00:00,0,2,,,,Dallas_Fort_Worth
3714,1302391646475223040,"I knew about it. @sarahkendzior knew it. Lots if people knew it, y’all are late.",2020-09-05 23:42:20+00:00,0,2,@sarahkendzior,,,Dallas_Fort_Worth
3715,1302391645699219456,The “Reverse Atkins”,2020-09-05 23:42:20+00:00,0,1,,,,Dallas_Fort_Worth
3716,1302391643920793600, ,2020-09-05 23:42:19+00:00,0,0,,,,Dallas_Fort_Worth
3717,1302391643602128899,"I missed those 80ish style movies, I did really like it good vibes",2020-09-05 23:42:19+00:00,2,2,,,,Dallas_Fort_Worth
3718,1302391643367243776,Following,2020-09-05 23:42:19+00:00,0,1,,,,Dallas_Fort_Worth
3719,1302391641936924674,Omg He is so handsome!,2020-09-05 23:42:19+00:00,0,0,,,,Dallas_Fort_Worth
3720,1302391641827835904,My situation is that I owe $106k in student loans and I work as a teacher and mental health isn’t covered by my insurance.,2020-09-05 23:42:19+00:00,0,0,,,,Dallas_Fort_Worth
3721,1302391638824640513,.@JDFlash1x with an opening drive TD catch from Jason Bean. 33 yards. 7-0 @MeanGreenFB with 12:31 left in first quarter. Nice start. #GMG @NBCDFWSports,2020-09-05 23:42:18+00:00,0,0,@JDFlash1x @MeanGreenFB @NBCDFWSports,#GMG,,Dallas_Fort_Worth
3722,1302391638728364032,Check out jon_dawson's video! #TikTok,2020-09-05 23:42:18+00:00,0,0,,#TikTok,,Dallas_Fort_Worth
3723,1302391638438883329,"the spelling of “hamburger” tricked this dude once upon a time, so",2020-09-05 23:42:18+00:00,0,0,,,,Dallas_Fort_Worth
3724,1302391638287880192,I received my shirts the other day. Thanks so much!,2020-09-05 23:42:18+00:00,0,0,,,,Dallas_Fort_Worth
3725,1302391637906198531,"“Sir, please use the hand sanitizer before entering the store.” Says the store employee whose WHOLE nose is not covered by his mask.",2020-09-05 23:42:18+00:00,13,384,,,,Dallas_Fort_Worth
3726,1302391633640595459,I’ll back these Republican lawmakers over the idiots in California who legalized pedophilia!,2020-09-05 23:42:17+00:00,0,0,,,,Dallas_Fort_Worth
3727,1302391631681814531, ,2020-09-05 23:42:16+00:00,0,0,,,,Dallas_Fort_Worth
3728,1302391630541004802,"Well, one of those is good news.",2020-09-05 23:42:16+00:00,0,0,,,,Dallas_Fort_Worth
3729,1302391629911740423,ong,2020-09-05 23:42:16+00:00,0,0,,,,Dallas_Fort_Worth
3730,1302391627504332802,Puse en mute el nombre del MMB ese. Yo no lo soporto y ahora esta por todos los posts ,2020-09-05 23:42:15+00:00,0,1,,,,Dallas_Fort_Worth
3731,1302391627479224321,A brother can change,2020-09-05 23:42:15+00:00,0,0,,,,Dallas_Fort_Worth
3732,1302391626992619520,"If it ever came up, I’d say we hold different beliefs on how to approach race topic. I’m requesting you to move on from the topic, or I will seek a schedule change. CC, the principal. For real change, attend board meetings, communicate w superintendent, get other parents involved",2020-09-05 23:42:15+00:00,0,0,,,,Dallas_Fort_Worth
3733,1302391622689329153,"I'm watching The Joy Luck Club, love this movie!",2020-09-05 23:42:14+00:00,0,0,,,,Dallas_Fort_Worth
3734,1302391619879145473,Happy g day,2020-09-05 23:42:14+00:00,0,1,,,,Dallas_Fort_Worth
3735,1302391619782692866,get da BAGGG,2020-09-05 23:42:14+00:00,0,3,,,,Dallas_Fort_Worth
3736,1302391611595292676,Just insanely funny thinking that Carl Beijer is going to be triggered and go to therapy because a guy who calls himself a class reductionist assumed his gender. Really a delight to see,2020-09-05 23:42:12+00:00,0,34,,,,Dallas_Fort_Worth
3737,1302391611125624837,Amazing you blocked yourself ,2020-09-05 23:42:12+00:00,0,1,,,,Dallas_Fort_Worth
3738,1302391608420306946,Nun but level ups,2020-09-05 23:42:11+00:00,0,0,,,,Dallas_Fort_Worth
3739,1302391607967309824,I want next,2020-09-05 23:42:11+00:00,0,0,,,,Dallas_Fort_Worth
3740,1302391606377697282,I love these sorts of questions. And as I’m learning about machine learning - any idea how it could help with this kind of project?,2020-09-05 23:42:10+00:00,0,0,,,,Dallas_Fort_Worth
3741,1302391605756821504,She has a clause in the prenuptial that states she must eat shit publicly 4 times during the presidency. This is #3.,2020-09-05 23:42:10+00:00,0,0,,,,Dallas_Fort_Worth
3742,1302391605677166593,"HBU almost got a 4th down stop, but UNT got the first down... few plays later, the Mean Green went up top for the long TD pass. UNT leads HBU 7-0",2020-09-05 23:42:10+00:00,0,0,,,,Dallas_Fort_Worth
3743,1302391604876111873,"Yes to the first question, no to the second",2020-09-05 23:42:10+00:00,0,1,,,,Dallas_Fort_Worth
3744,1302391604246913027,"""You know what's not cool, Bobby..."" #kingofthehill",2020-09-05 23:42:10+00:00,0,0,,#kingofthehill,,Dallas_Fort_Worth
3745,1302391604171464704,The way to get started is to quit talking and begin doing. --Walt Disney,2020-09-05 23:42:10+00:00,0,0,,,,Dallas_Fort_Worth
3746,1302391601789128704,Birthday tomorrow. Grubhub all meals. Video games? Maybe Netflix party thing. Idk idk idk.,2020-09-05 23:42:09+00:00,0,11,,,,Dallas_Fort_Worth
3747,1302391600723746817,Black ppl really only check their mail like once a week unless they are expecting something. I am black ppl ,2020-09-05 23:42:09+00:00,0,0,,,,Dallas_Fort_Worth
3748,1302391599629045763,might fuck around and delete all my socials real quick,2020-09-05 23:42:09+00:00,0,0,,,,Dallas_Fort_Worth
3749,1302391598991507456,i should right hmmm I’m really thinking bout it!,2020-09-05 23:42:09+00:00,0,0,,,,Dallas_Fort_Worth
3750,1302391597036982272,https://youtu.be/6jWF2-PQ4BU,2020-09-05 23:42:08+00:00,0,0,,,,Dallas_Fort_Worth
3751,1302391595434741762,"500 would make 1 persons' day, but 100 to 5 people would make 5x that many people happy. I ain't greedy, 100 is more than I woulda had to start the day, so no complaints here.",2020-09-05 23:42:08+00:00,0,2,,,,Dallas_Fort_Worth
3752,1302391592905584643,I also had his child but he has been non existent,2020-09-05 23:42:07+00:00,0,0,,,,Dallas_Fort_Worth
3753,1302391592154615808,"Ya it’s just kind of hard to define that with the current state of Warzone events. I agree with you 100%. But ya, at its core, I think that should be purely tied to community/charity events.",2020-09-05 23:42:07+00:00,0,2,,,,Dallas_Fort_Worth
3754,1302391591307563008,Here's to peace. ,2020-09-05 23:42:07+00:00,6,23,,,,Dallas_Fort_Worth
3755,1302391590367965185,So you will call out religious holidays but not protests? Seems strange,2020-09-05 23:42:07+00:00,0,10,,,,Dallas_Fort_Worth
3756,1302391590191849472,"Hello Twitter Friends, A simple retweet would mean a lot to me. I opened up an Ice Cream shop here in Dallas and I know Twitter has a way of helping local businesses If you could help mw out with a retweet, that would be great Its 2711 S buckner Blvd Ste 300 Dallas Tx 75227",2020-09-05 23:42:07+00:00,9,3,,,,Dallas_Fort_Worth
3757,1302391587390054400,"Sales/Marketing - 1223 - Ripon, CA https://placingit.catsone.com/careers/43650-General/jobs/13582511-SalesMarketing--1223/",2020-09-05 23:42:06+00:00,0,0,,,,Dallas_Fort_Worth
3758,1302391586387615746,"Willie Cauley-Stein continúa trabajando en casa como lo hizo desde el comienzo de la burbuja, al tener que ausentarse por asuntos familiares, sigue intentando desarrollar un tiro confiable. Tiene Player Option por 2.2M de cara a la próxima temporada.",2020-09-05 23:42:06+00:00,1,9,,,,Dallas_Fort_Worth
3759,1302391583468408832,Na gangsters don't smell like shit ,2020-09-05 23:42:05+00:00,0,0,,,,Dallas_Fort_Worth
3760,1302391582755303426,What a stop on 4th down by the Bobcats. They have life yet again... @CoachDykesSMU decided to pass on the FG attempt and it backfired. @SMU_Football still leads 28-21. 9:35 remaining in the 4Q. Now back to the @MeanGreenFB game... ,2020-09-05 23:42:05+00:00,0,0,@CoachDykesSMU @SMU_Football @MeanGreenFB,,,Dallas_Fort_Worth
3761,1302391577520865280,Dime si es verdd q te traigo mal,2020-09-05 23:42:04+00:00,0,0,,,,Dallas_Fort_Worth
3762,1302391577474748421,Great minds.,2020-09-05 23:42:03+00:00,0,0,,,,Dallas_Fort_Worth
3763,1302391577105625089,"I bought 11 shares of BSV this week. Yeah, I’m totally the next Bill Ackman, guys. https://finance.yahoo.com/quote/BSV?p=BSV",2020-09-05 23:42:03+00:00,0,0,,,,Dallas_Fort_Worth
3764,1302391576874885120,why not use a commercial grade paper spray to disperse those who protests for thugs . #NoMoreProtests4Thugs,2020-09-05 23:42:03+00:00,0,0,,#NoMoreProtests4Thugs,,Dallas_Fort_Worth
3765,1302391573578215426,,2020-09-05 23:42:03+00:00,0,1,,,,Dallas_Fort_Worth
3766,1302391572630310913,"Jonas Q. - 2_6_20, 9.48 PM",2020-09-05 23:42:02+00:00,0,0,,,,Dallas_Fort_Worth
3767,1302391571074166786,It was an act of GOD,2020-09-05 23:42:02+00:00,0,0,,,,Dallas_Fort_Worth
3768,1302391570642210816,Usher's vocals are really unmatched.,2020-09-05 23:42:02+00:00,0,0,,,,Dallas_Fort_Worth
3769,1302391568293339136,"Pusj jsjajs!!!y còmo no ,te va a caer “mal”13 empanadas!!! ",2020-09-05 23:42:01+00:00,0,0,,,,Dallas_Fort_Worth
3770,1302391567383232513,y más delicioso jajajaja ,2020-09-05 23:42:01+00:00,0,1,,,,Dallas_Fort_Worth
3771,1302391563897757696,what do you do,2020-09-05 23:42:00+00:00,0,0,,,,Dallas_Fort_Worth
3772,1302391561586696192,Lmaoo stop it bro. If it was a chemistry or biology exam then you got it but THIS IS NOT IT ,2020-09-05 23:42:00+00:00,0,0,,,,Dallas_Fort_Worth
3773,1302391559481163776,Wonderful family friendly event happening till 8pm at the Midlothian Community Park. (Kick-off to National Night Out) - y’all come on out! – at Midlothian City Park,2020-09-05 23:41:59+00:00,1,9,,,,Dallas_Fort_Worth
3774,1302391555618111489,Looks like they got swamped by a blue wave.,2020-09-05 23:41:58+00:00,1,30,,,,Dallas_Fort_Worth
3775,1302391555039387649,I have Chinese food ,2020-09-05 23:41:58+00:00,0,2,,,,Dallas_Fort_Worth
3776,1302391551646027776,अब तो अंधभक्त भी समझ चुके हैं बहुत अच्छी तरह ! यहां तक ​​की अंधा समर्थन भी छोड़ दिया अन्धभक्तो ने ! और एक यह बेशर्म @sambitswaraj है की अभी तक इस्की समझ में नहीं आया कि ये चीजें नहीं चलेंगी अब !,2020-09-05 23:41:57+00:00,0,0,@sambitswaraj,,,Dallas_Fort_Worth
3777,1302391550702428160,"""God in MY image""???? i lost u... forget i exist.... lets Talk God Truth & His Living Word...sorry it takes me over here to do that otherwise i wouldn't",2020-09-05 23:41:57+00:00,0,0,,,,Dallas_Fort_Worth
3778,1302391550685700098,,2020-09-05 23:41:57+00:00,0,0,,,,Dallas_Fort_Worth
3779,1302391549486039041,I think the ball security is phenomenal,2020-09-05 23:41:57+00:00,0,1,,,,Dallas_Fort_Worth
3780,1302391548815048704,Those who shackled me down...,2020-09-05 23:41:57+00:00,0,0,,,,Dallas_Fort_Worth
3781,1302391544146800642,Imma always choose her over y’all,2020-09-05 23:41:56+00:00,0,2,,,,Dallas_Fort_Worth
3782,1302391544067100673,"Added a slides called ""What's Happening Today"" to my Today topic in #googleclassroom. It is posted as a view only material, so I can update presentation each night for the next day. No need to make new slides each day. Need this because 1/2 will be online and 1/2 f2f. #teaching",2020-09-05 23:41:56+00:00,0,2,,#googleclassroom #teaching,,Dallas_Fort_Worth
3783,1302391543878254598,"Two extremely important questions: Any pets that shed white fur and if so, what is the fabric texture?",2020-09-05 23:41:55+00:00,0,0,,,,Dallas_Fort_Worth
3784,1302391543173709825, ,2020-09-05 23:41:55+00:00,0,0,,,,Dallas_Fort_Worth
3785,1302391542108303360,No salían más gendarmes. Qué anuncio el Presidente..,2020-09-05 23:41:55+00:00,0,2,,,,Dallas_Fort_Worth
3786,1302391538832609283,need that water,2020-09-05 23:41:54+00:00,0,0,,,,Dallas_Fort_Worth
3787,1302391537880436737,Me next,2020-09-05 23:41:54+00:00,0,0,,,,Dallas_Fort_Worth
3788,1302391536227885056,Same lol.,2020-09-05 23:41:54+00:00,0,1,,,,Dallas_Fort_Worth
3789,1302391535531692032,"Everybody was at the mall, wtf.",2020-09-05 23:41:53+00:00,0,3,,,,Dallas_Fort_Worth
3790,1302391533522628610,"Not if he keeps taking strike three, he won't ",2020-09-05 23:41:53+00:00,0,0,,,,Dallas_Fort_Worth
