,id,text,date,retweets,favorites,mentions,hashtags,geo,region
0,1300219206454128647,Hiiii :)) – at Angelo State University,2020-08-30 23:49:50+00:00,1,27,,,,San Angelo
1,1300218835178586118,Deadass don’t @lopezisauraa,2020-08-30 23:48:21+00:00,0,1,@lopezisauraa,,,San Angelo
2,1300218517980090373,Congrats man!,2020-08-30 23:47:06+00:00,0,2,,,,San Angelo
3,1300216386497716226,Ik we fight 24/7 but I don’t want nobody else ,2020-08-30 23:38:38+00:00,0,0,,,,San Angelo
4,1300215299938058241,can i be good at english already ,2020-08-30 23:34:18+00:00,0,3,,,,San Angelo
5,1300213998412083203,Hats off to Rahm! ,2020-08-30 23:29:08+00:00,0,1,,,,San Angelo
6,1300213905843683341,You know I got you famo ,2020-08-30 23:28:46+00:00,1,0,,,,San Angelo
7,1300210748992425984,Closed cell in this metal building in Wall. #sprayfoam #mancave #homegym #portablebuilding #storagebuilding #seacontainer #conex #metalbuilding #steelbuilding #barn #shop #barndominium #barndo #barndolife #barndoliving #customhome #construction #farm #ranch #oilfield #oil #gas,2020-08-30 23:16:13+00:00,0,2,,#sprayfoam #mancave #homegym #portablebuilding #storagebuilding #seacontainer #conex #metalbuilding #steelbuilding #barn #shop #barndominium #barndo #barndolife #barndoliving #customhome #construction #farm #ranch #oilfield #oil #gas,,San Angelo
8,1300210199597322242,,2020-08-30 23:14:02+00:00,0,0,,,,San Angelo
9,1300209718720421888,LMFAO NO WAY,2020-08-30 23:12:08+00:00,0,1,,,,San Angelo
10,1300209074882187264,https://twitter.com/Chinesekittyy/status/1300200338553810960,2020-08-30 23:09:34+00:00,0,0,,,,San Angelo
11,1300208795067523073,"Man, gym bag the best pillow ever , headphones in. It’s a wrap",2020-08-30 23:08:28+00:00,0,8,,,,San Angelo
12,1300208508953137161,Free u ,2020-08-30 23:07:19+00:00,0,0,,,,San Angelo
13,1300208495908794370,I haven’t watched the game but listening. It’s not impossible if they get their asses in gear. I’m sick of catch up hockey.,2020-08-30 23:07:16+00:00,0,1,,,,San Angelo
14,1300207480803393542,I drink away my pain honey,2020-08-30 23:03:14+00:00,0,7,,,,San Angelo
15,1300206999141904385,I pray for this one day!,2020-08-30 23:01:19+00:00,0,3,,,,San Angelo
16,1300206481225199618,Well Rockies are doing any better than the Avs today . Hope the Avs adjust themselves and play like they want to win.,2020-08-30 22:59:16+00:00,0,2,,,,San Angelo
17,1300205924930457603,I heard it was cool.,2020-08-30 22:57:03+00:00,0,1,,,,San Angelo
18,1300205880546295811,happy birthday to my loves @mamiimorgz &amp;&amp; @MeaganKae_ i love y’all babes!,2020-08-30 22:56:53+00:00,1,1,@mamiimorgz @MeaganKae_,,,San Angelo
19,1300205179401392128,"Two must hear podcasts: The Wind and The Rain, Episode 5 AND Black History for White People. Both are on multiple podcasting platforms.",2020-08-30 22:54:06+00:00,0,0,,,,San Angelo
20,1300203267549528065,It sounds like it! So disappointed that we show no grit with all our depth. Catch-up hockey is not a good recipe for playoff hockey.,2020-08-30 22:46:30+00:00,0,0,,,,San Angelo
21,1300202522376896514,Not watching but listening... horrible.,2020-08-30 22:43:32+00:00,0,0,,,,San Angelo
22,1300200863684755456,You know you made a good playlist when you don’t hit skip even once,2020-08-30 22:36:57+00:00,0,0,,,,San Angelo
23,1300198460814168066,The Temptations will forever be my fav movie. ,2020-08-30 22:27:24+00:00,0,0,,,,San Angelo
24,1300197799166963712,Do cute maroon dresses even exist?,2020-08-30 22:24:46+00:00,0,9,,,,San Angelo
25,1300197171640311811,Happy birthday to the prettiest twinnies I know @MeaganKae_ @mamiimorgz damn y’all are old ,2020-08-30 22:22:16+00:00,1,4,@MeaganKae_ @mamiimorgz,,,San Angelo
26,1300194945031176197,Hope y’all had a blessed Sunday,2020-08-30 22:13:26+00:00,0,13,,,,San Angelo
27,1300194489110335495,Big facts,2020-08-30 22:11:37+00:00,0,0,,,,San Angelo
28,1300193693325053952,Bitches be trippen ,2020-08-30 22:08:27+00:00,0,4,,,,San Angelo
29,1300193205904912392,103 degrees #currentlymelting,2020-08-30 22:06:31+00:00,0,1,,#currentlymelting,,San Angelo
30,1300190793735565315,So smoooooooth,2020-08-30 21:56:56+00:00,0,0,,,,San Angelo
31,1300190338276040706,"peyton: ""I LOVE WHEN CAMBRY GOES TO THE STORE"" all because I find things and make the best snacks",2020-08-30 21:55:07+00:00,0,0,,,,San Angelo
32,1300190136056021004,Go off Kawhi,2020-08-30 21:54:19+00:00,0,0,,,,San Angelo
33,1300188985856270337,That girl is too young to have a phone that old,2020-08-30 21:49:45+00:00,1,22,,,,San Angelo
34,1300188940130025474,#AvsTwitterPsychic Mikko,2020-08-30 21:49:34+00:00,0,4,,#AvsTwitterPsychic,,San Angelo
35,1300187037333684224,This thread right here is what we in retail have to deal with on a daily basis all because some people are so ignorant and can’t follow simple rules HAHA,2020-08-30 21:42:00+00:00,0,3,,,,San Angelo
36,1300186723801067521,It’s a tough one but both sides played they asses off,2020-08-30 21:40:45+00:00,0,0,,,,San Angelo
37,1300184457681481728,grind in silence......,2020-08-30 21:31:45+00:00,2,25,,,,San Angelo
38,1300184038137827328,That just show the game tackling ass ,2020-08-30 21:30:05+00:00,0,0,,,,San Angelo
39,1300183403606798341,I’m really about to get a bottle of wine and drink it all in bed and forget everything ,2020-08-30 21:27:34+00:00,0,5,,,,San Angelo
40,1300180602591883264,I just got done making jalapeño poppers and watch me forgot and rub my hands over my eyes,2020-08-30 21:16:26+00:00,0,0,,,,San Angelo
41,1300176211541450753,Pandemic?,2020-08-30 20:58:59+00:00,0,4,,,,San Angelo
42,1300175572329549826,rings*,2020-08-30 20:56:27+00:00,0,3,,,,San Angelo
43,1300175485033484288,Praying for you..,2020-08-30 20:56:06+00:00,0,2,,,,San Angelo
44,1300172108723560449,PS5,2020-08-30 20:42:41+00:00,0,0,,,,San Angelo
45,1300171500952092672,someone take one for the team and date me ok thanks,2020-08-30 20:40:16+00:00,5,54,,,,San Angelo
46,1300171333473628160,You can't have both of your teams win in the same deal.,2020-08-30 20:39:36+00:00,0,1,,,,San Angelo
47,1300169966923247620,I did that. shanksjimmy angeloaxehouse jennie1013 #angeloaxehouse #axehole #allmyaxesliveintexas @Angelo Axe House https://www.instagram.com/p/CEhukCagaYW/?igshid=9ph6etprxd9,2020-08-30 20:34:10+00:00,0,0,,#angeloaxehouse #axehole #allmyaxesliveintexas,,San Angelo
48,1300167293314445314,"so we’re at the nail salon and i was joking around donovan telling him to suck my toes when we get home, this guy says OUT LOUD “ you want me to suck your toes” this mf is so embarrassing i’m never bringing him again ",2020-08-30 20:23:33+00:00,0,12,,,,San Angelo
49,1300166718736732160,are you this isn’t you ? ,2020-08-30 20:21:16+00:00,0,1,,,,San Angelo
50,1300166563169959943,Zaza Pachuila and Marcus Morris’s only quality skill in the NBA is attempting to hurt your best player ,2020-08-30 20:20:39+00:00,0,0,,,,San Angelo
51,1300163797114642436,some people just wanna have something to talk about ,2020-08-30 20:09:39+00:00,0,0,,,,San Angelo
52,1300163040873197573,Life was easier when all you had to choose was Team Edward or Team Jacob,2020-08-30 20:06:39+00:00,0,0,,,,San Angelo
53,1300161495448379393,sos still need a @Browns bucket hat,2020-08-30 20:00:31+00:00,0,0,@Browns,,,San Angelo
54,1300161398933258241,,2020-08-30 20:00:07+00:00,0,1,,,,San Angelo
55,1300160584453939206,Happy birthday @kris10eleven12 HAVE THE BEST DAY EVERRR ,2020-08-30 19:56:53+00:00,0,1,@kris10eleven12,,,San Angelo
56,1300160497526988804,i love when my bf get pedis with me ,2020-08-30 19:56:33+00:00,0,0,,,,San Angelo
57,1300159135418327040,"i really don’t see what’s so wrong in someone wanting to post about there issues on social media, it’s THEIR platform, and if you don’t like it why go and complain about it? people really love starting shit that don’t pertain to them. unfollow and move on.",2020-08-30 19:51:08+00:00,0,10,,,,San Angelo
58,1300156178392121345,"For people with a lot of guns, y'all are certainly terrified.",2020-08-30 19:39:23+00:00,0,0,,,,San Angelo
59,1300155080868540418,We got 3 more months left of this shit #fuck2020,2020-08-30 19:35:01+00:00,0,1,,#fuck2020,,San Angelo
60,1300153967230488576,the queen of queens!!!,2020-08-30 19:30:36+00:00,1,1,,,,San Angelo
61,1300153784056901632,mama H>>>>,2020-08-30 19:29:52+00:00,0,0,,,,San Angelo
62,1300151298256494595,There’s 1 day left to get your fall 2020 rush shirt! Buy yours today! https://stores.inksoft.com/kdr_fall_2020/shop/home #RushKDR #ΚΔΡ,2020-08-30 19:19:59+00:00,6,14,,#RushKDR,,San Angelo
63,1300150671367430144,This account is now a #SlamDiego account. Let's go @Padres @johnemoore3 what have I done?,2020-08-30 19:17:30+00:00,1,1,@Padres @johnemoore3,#SlamDiego,,San Angelo
64,1300150396938268672,Congratulations to the winner of our contest @brimatlock! Please DM us with what size and color shirt you would like! https://twitter.com/AngeloStateKDR/status/1296256853047939072,2020-08-30 19:16:24+00:00,2,7,@brimatlock,,,San Angelo
65,1300149932888911873,Man I’m blessed,2020-08-30 19:14:34+00:00,0,1,,,,San Angelo
66,1300149096230121473,Seems like a lot.,2020-08-30 19:11:14+00:00,0,0,,,,San Angelo
67,1300148727974440960,Closed cell in this metal building in Wall. #sprayfoam #mancave #homegym #portablebuilding #storagebuilding #seacontainer #conex #metalbuilding #steelbuilding #barn #shop #barndominium #barndo #barndolife #barndoliving #customhome #construction #farm #ranch #oilfield #oil #gas,2020-08-30 19:09:47+00:00,0,1,,#sprayfoam #mancave #homegym #portablebuilding #storagebuilding #seacontainer #conex #metalbuilding #steelbuilding #barn #shop #barndominium #barndo #barndolife #barndoliving #customhome #construction #farm #ranch #oilfield #oil #gas,,San Angelo
68,1300147637597941760,THE LINK CLOSES TOMORROW BUY YOUR DZ RECRUITMENT SHIRTS NOW ,2020-08-30 19:05:27+00:00,0,2,,,,San Angelo
69,1300147287251968001,"Are you slow in the head, no we don’t need the military/ national guard. That literally will make the situation worse",2020-08-30 19:04:03+00:00,0,2,,,,San Angelo
70,1300145915924221954,,2020-08-30 18:58:36+00:00,0,1,,,,San Angelo
71,1300145398825340929,A PSA from the Liggy Boys! Stay healthy and safe everyone! #StayHealthy #WearAMask #Wereallinthistogether #lifewithliggy,2020-08-30 18:56:33+00:00,2,5,,#StayHealthy #WearAMask #Wereallinthistogether #lifewithliggy,,San Angelo
72,1300143153404616704,why can't we jus be who we want and like who we want w out being put in categories?,2020-08-30 18:47:37+00:00,0,6,,,,San Angelo
73,1300142795487948805,"No, Bill. YOU are what’s wrong with America. The only hate I have is what you and your ilk are doing to the greatest country in the world. Your willingness to cower down to every idea that goes against this country is what is tearing this country apart. #GrowSomeBalls",2020-08-30 18:46:12+00:00,0,0,,#GrowSomeBalls,,San Angelo
74,1300142449705332737,Wow this is one of the quietest 1.47 ERA starts...Yu still got it,2020-08-30 18:44:50+00:00,0,2,,,,San Angelo
75,1300142065100222464,"Nah, I’m just thankful to be learning from the best",2020-08-30 18:43:18+00:00,0,1,,,,San Angelo
76,1300141402140147713,Caucasians do weird shit ,2020-08-30 18:40:40+00:00,0,1,,,,San Angelo
77,1300141240558784513,My brother really at the top ,2020-08-30 18:40:01+00:00,1,1,,,,San Angelo
78,1300141069271797767,You make me proud ,2020-08-30 18:39:21+00:00,0,0,,,,San Angelo
79,1300140889302536192,Fuckkk ,2020-08-30 18:38:38+00:00,0,0,,,,San Angelo
80,1300138598856118281,LMFAOOOOOOO bro I would’ve lit shorty ass up,2020-08-30 18:29:32+00:00,0,0,,,,San Angelo
81,1300138468903989250,falling all over again,2020-08-30 18:29:01+00:00,0,0,,,,San Angelo
82,1300137362702426114,i wish people would mind their business and not tell mine,2020-08-30 18:24:37+00:00,1,7,,,,San Angelo
83,1300136607689961474,"@Rangers what is on @drofdefense ‘s tie? It looks great, just couldn’t figure it out! #BTHO @Dodgers !#SanAngelo #Texas",2020-08-30 18:21:37+00:00,0,0,@Rangers @drofdefense @Dodgers,#BTHO #SanAngelo #Texas,,San Angelo
84,1300134173651472392,Congrats!,2020-08-30 18:11:56+00:00,0,2,,,,San Angelo
85,1300132079242485760,lana del rey,2020-08-30 18:03:37+00:00,0,3,,,,San Angelo
86,1300130262186168320,@ASURamFootball @ASUrams_hoops @RamsASUbaseball @Belles_Tennis @BellesSoccer @Belle_Hoops the #ramsforchrist is having a FREE bbq this evening at the Christian campus center. We would love to see you guys,2020-08-30 17:56:24+00:00,1,1,@ASURamFootball @ASUrams_hoops @RamsASUbaseball @Belles_Tennis @BellesSoccer @Belle_Hoops,#ramsforchrist,,San Angelo
87,1300126439031926786,Golden hour,2020-08-30 17:41:12+00:00,4,26,,,,San Angelo
88,1300125535461347330,Who knew meal prepping’ could look so good!,2020-08-30 17:37:37+00:00,0,8,,,,San Angelo
89,1300123860617101316,,2020-08-30 17:30:58+00:00,0,0,,,,San Angelo
90,1300122638791180288,Joy is found in Jesus!,2020-08-30 17:26:06+00:00,0,13,,,,San Angelo
91,1300122160032350209,I just need to get all this hate out of me & being so mad at the world but I just miss my grandpa .,2020-08-30 17:24:12+00:00,1,4,,,,San Angelo
92,1300121535651475456,,2020-08-30 17:21:43+00:00,0,0,,,,San Angelo
93,1300121469662441472,Sunday slow jams and homework type of day,2020-08-30 17:21:28+00:00,0,2,,,,San Angelo
94,1300115195403137024,Keeping smiling at his texts. People are allowed to bring you joy whether you’re together or not.,2020-08-30 16:56:32+00:00,0,2,,,,San Angelo
95,1300114979530604545,It’s officially that time of year where all the good people enjoy fall/Halloween and all the miserable people complain about it being to early. Like it’s going to change anything.,2020-08-30 16:55:40+00:00,0,1,,,,San Angelo
96,1300111556584386563,THIIS IS THE TWEET ,2020-08-30 16:42:04+00:00,0,0,,,,San Angelo
97,1300111029649768450,Lil Wayne,2020-08-30 16:39:59+00:00,1,0,,,,San Angelo
98,1300109990393532417,@valdez_michael watching every Bears game ,2020-08-30 16:35:51+00:00,0,0,@valdez_michael,,,San Angelo
99,1300109254070808577,Pinches mamónes,2020-08-30 16:32:55+00:00,0,0,,,,San Angelo
100,1300109177105387522,I don’t even know why I trip anymore ,2020-08-30 16:32:37+00:00,0,1,,,,San Angelo
101,1300108045364719620,I’m tired of being tired .,2020-08-30 16:28:07+00:00,0,2,,,,San Angelo
102,1300107610218213376,Lmk when you want to,2020-08-30 16:26:23+00:00,0,0,,,,San Angelo
103,1300107081303941120,What a great way to end a great first full week! Y’all are awesome ,2020-08-30 16:24:17+00:00,0,2,,,,San Angelo
104,1300106093667004416,daily thing – at San Angelo Country Club,2020-08-30 16:20:22+00:00,0,19,,,,San Angelo
105,1300105463187623937,It’s crazy how you do a favor for someone and then they act like they don’t know you ,2020-08-30 16:17:51+00:00,0,0,,,,San Angelo
106,1300105137936105474,Shiii my bartender skills can come out let’s do,2020-08-30 16:16:34+00:00,0,1,,,,San Angelo
107,1300104731508047873,"I thought you meant like a breakfast with them, but making them works as well",2020-08-30 16:14:57+00:00,0,1,,,,San Angelo
108,1300104399734345733, ,2020-08-30 16:13:38+00:00,0,0,,,,San Angelo
109,1300104338690527232,And thats how you get shot. If they would stop trying to assault the police that would help.,2020-08-30 16:13:23+00:00,0,0,,,,San Angelo
110,1300103672341368832,Loved him so much,2020-08-30 16:10:44+00:00,0,0,,,,San Angelo
111,1300103557476163586, lol you’re good imma get there,2020-08-30 16:10:17+00:00,0,0,,,,San Angelo
112,1300103303683092480,That’s ok I appreciate that you try to help people.,2020-08-30 16:09:17+00:00,0,0,,,,San Angelo
113,1300102421142802434,Me reading this w not even 1000 followers lol ,2020-08-30 16:05:46+00:00,0,0,,,,San Angelo
114,1300101938126696452,Andres Galaraga,2020-08-30 16:03:51+00:00,0,0,,,,San Angelo
115,1300101512157442048,@Starbucks get your shit together and move this drive thru lines faster!,2020-08-30 16:02:09+00:00,0,0,@Starbucks,,,San Angelo
116,1300101367520989184,"Might of been drunk enough last night to respond to “are you trying to F*** me?” With “No, I need someone to Pokémon battle with” I went to sleep alone last night ",2020-08-30 16:01:35+00:00,0,3,,,,San Angelo
117,1300100130012573696,https://twitter.com/JFNYC1/status/1299922507563257859,2020-08-30 15:56:40+00:00,1,4,,,,San Angelo
118,1300097122449199104,Wear your masks so I won’t have to smell y’all’s stank ass breath ,2020-08-30 15:44:43+00:00,0,3,,,,San Angelo
119,1300096723621158914,"Liam and I got some great stuff at the independent book store sale yesterday. At first my son was being shy and trying to tell me he didn't want anything, so I began to wonder whose child he was and made him Casey… https://www.instagram.com/p/CEhNZhVJ_6f/?igshid=1fjrw87h5wubt",2020-08-30 15:43:08+00:00,0,0,,,,San Angelo
120,1300092924848463874,Your service comes from your belonging Son-ship and abiding in Christ is first priority,2020-08-30 15:28:02+00:00,0,2,,,,San Angelo
121,1300086690292301827,Let’s goooo ,2020-08-30 15:03:16+00:00,1,1,,,,San Angelo
122,1300086148551913472,,2020-08-30 15:01:06+00:00,7,21,,,,San Angelo
123,1300080545456586752,"Bitch what, Lmao ",2020-08-30 14:38:51+00:00,0,3,,,,San Angelo
124,1300080424488710156,i wanna move,2020-08-30 14:38:22+00:00,0,3,,,,San Angelo
125,1300074753613537284, ,2020-08-30 14:15:50+00:00,0,0,,,,San Angelo
126,1300070300411981824,Thank you God for another 24 ,2020-08-30 13:58:08+00:00,0,0,,,,San Angelo
127,1300066738969739264,RIP,2020-08-30 13:43:59+00:00,0,0,,,,San Angelo
128,1300030417962258433,Not really only had 1 body,2020-08-30 11:19:39+00:00,0,0,,,,San Angelo
129,1300030342691254273,"Ah yes, iced coffee time yet again",2020-08-30 11:19:21+00:00,1,8,,,,San Angelo
130,1300016917235851265,So does every bar in Texas,2020-08-30 10:26:00+00:00,0,2,,,,San Angelo
131,1300013347660869633,"I have a uniform, I’ve given up my rights to fight for this country and I can say myself this country, justice system, even military is racist.",2020-08-30 10:11:49+00:00,0,88,,,,San Angelo
132,1300006156438560768,Smfh ,2020-08-30 09:43:15+00:00,0,0,,,,San Angelo
133,1299996598336991237,Good*,2020-08-30 09:05:16+00:00,0,0,,,,San Angelo
134,1299994757431783424, ,2020-08-30 08:57:57+00:00,0,1,,,,San Angelo
135,1299993474968756229,I meant hear*****,2020-08-30 08:52:51+00:00,0,2,,,,San Angelo
136,1299991572533186560,"Wow, my neighbors said they could here @_ItsAbellyca snoring",2020-08-30 08:45:18+00:00,0,3,@_ItsAbellyca,,,San Angelo
137,1299987070082060290,Karma a bitch fr... it’ll be god though ig,2020-08-30 08:27:24+00:00,0,2,,,,San Angelo
138,1299962080133558272,"Speak Lord, your servant is listening..",2020-08-30 06:48:06+00:00,0,1,,,,San Angelo
139,1299961977293484033,I still really believe there will be a huge spiritual breakthrough before 2020 is over. The outpouring is already happening. Revival is coming to the hearts of God’s people ,2020-08-30 06:47:42+00:00,0,2,,,,San Angelo
140,1299958389213147136,WHAT IN THE ROCKSPRINGS I cant with @_ItsAbellyca ,2020-08-30 06:33:26+00:00,1,2,@_ItsAbellyca,,,San Angelo
141,1299947312412790784,"Again, this, raccoons, or hedgehogs. I’m fine with either ",2020-08-30 05:49:25+00:00,0,3,,,,San Angelo
142,1299946900871958530,Wait till the full metamorphosis takes place at Halloween....HalloScream,2020-08-30 05:47:47+00:00,0,1,,,,San Angelo
143,1299944078302478336,"Oh hey, friend. ",2020-08-30 05:36:34+00:00,0,0,,,,San Angelo
144,1299943169086423041,It’s the official beer of the Dallas Cowboys. F the haters.,2020-08-30 05:32:57+00:00,0,0,,,,San Angelo
145,1299943143429865474,For Frodo – at Double Dave's,2020-08-30 05:32:51+00:00,0,0,,,,San Angelo
146,1299942747550474241,,2020-08-30 05:31:17+00:00,0,0,,,,San Angelo
147,1299942452338491392,BEST VIDEO EVER.,2020-08-30 05:30:07+00:00,0,1,,,,San Angelo
148,1299939465587298304,I need a beer ,2020-08-30 05:18:14+00:00,0,1,,,,San Angelo
149,1299938799594725376,Unpopular opinion: I don’t buy eyeshadow palettes for the shimmers or glitters.,2020-08-30 05:15:36+00:00,1,2,,,,San Angelo
150,1299933937846890496,"Also, idk. He really put emphasis on “your.” ",2020-08-30 04:56:17+00:00,0,0,,,,San Angelo
151,1299932954542694400,Welp now it’s time to waste 3 hrs of my life on tik tok before i get tired and go to sleep ,2020-08-30 04:52:22+00:00,0,1,,,,San Angelo
152,1299932847579557889,"Need this. But, ya know, not a guy.",2020-08-30 04:51:57+00:00,0,1,,,,San Angelo
153,1299928622329925633,I cleaned and did homework and in bed on a Saturday night??? Love that for me,2020-08-30 04:35:09+00:00,0,3,,,,San Angelo
154,1299928360269877248,.,2020-08-30 04:34:07+00:00,0,0,,,,San Angelo
155,1299927112195997696,I’m 4 ranch waters deep and half a box of cheez its in. Full af....bout to go to sleep. I’m really enjoying the vibes I’ve created for myself this Saturday evening.,2020-08-30 04:29:09+00:00,0,13,,,,San Angelo
156,1299924560951881728,Lmao same I forgot you even snapped me,2020-08-30 04:19:01+00:00,0,1,,,,San Angelo
157,1299923349670371328,Pretty witty AF ... (A)vs (F)am,2020-08-30 04:14:12+00:00,0,1,,,,San Angelo
158,1299923002994446336,Can I get that in an IV please?,2020-08-30 04:12:49+00:00,0,1,,,,San Angelo
159,1299922835742363648, Air Force AF ,2020-08-30 04:12:10+00:00,0,1,,,,San Angelo
160,1299922620687749120, ,2020-08-30 04:11:18+00:00,0,1,,,,San Angelo
161,1299922547702730753,Loooove this,2020-08-30 04:11:01+00:00,0,0,,,,San Angelo
162,1299921130975891456,When Sam doesn’t respond to your tweet ,2020-08-30 04:05:23+00:00,0,1,,,,San Angelo
163,1299919993488969729,I’m here at home,2020-08-30 04:00:52+00:00,0,1,,,,San Angelo
164,1299916030781857792,"Do you ever feel like you will never be good enough for anyone? Like good enough for your friends or a significant other? Because, I do...",2020-08-30 03:45:07+00:00,1,2,,,,San Angelo
165,1299913364240568326,I said i was getting A tattoo this weekend but decided to get TWO tattoos ,2020-08-30 03:34:31+00:00,2,2,,,,San Angelo
166,1299913230983233541,Getting drunk w my ol lady tn ,2020-08-30 03:34:00+00:00,0,0,,,,San Angelo
167,1299913156228263938,There’s no better feeling than taking out dry contacts at the end of a long day,2020-08-30 03:33:42+00:00,2,3,,,,San Angelo
168,1299912557671706624,"If he don’t say “go, drink have fun, I’m playing the game” Then I don’t want him ",2020-08-30 03:31:19+00:00,0,1,,,,San Angelo
169,1299912136844476419,@lanceDholmquest,2020-08-30 03:29:39+00:00,0,2,@lanceDholmquest,,,San Angelo
170,1299912093995421696,Me to and from work,2020-08-30 03:29:29+00:00,0,2,,,,San Angelo
171,1299911822045335557,"If you’re talking about that TE from Central Arkansas...yeah, that’s a big ol boy.",2020-08-30 03:28:24+00:00,0,0,,,,San Angelo
172,1299911730076749826, https://twitter.com/theonlyRNA/status/1282859547938488321,2020-08-30 03:28:02+00:00,0,0,,,,San Angelo
173,1299911576925941760,,2020-08-30 03:27:25+00:00,3,32,,,,San Angelo
174,1299911047915212807,Me too! I only use cast iron. In fact I used to only cook on a wood stove. Mountain girl.,2020-08-30 03:25:19+00:00,0,2,,,,San Angelo
175,1299910532980506624,Came up on 3 Black Panther pops today Going into the vault ,2020-08-30 03:23:16+00:00,0,3,,,,San Angelo
176,1299910339371372545,Welp this is where we die ,2020-08-30 03:22:30+00:00,0,4,,,,San Angelo
177,1299909410135977984,I’m such a light weight now... 2 shots and 1 drink in and I’m feelin drunk ,2020-08-30 03:18:49+00:00,0,3,,,,San Angelo
178,1299905504488108034,We need a based foreign policy crowd in DC.,2020-08-30 03:03:18+00:00,5,38,,,,San Angelo
179,1299904453282336768,IDK HOW @_ItsAbellyca DRINKS JACK AND COKE ,2020-08-30 02:59:07+00:00,1,2,@_ItsAbellyca,,,San Angelo
180,1299904194174947335,When your bff doesn’t know your birthday >>>>>>>> @briannaatt,2020-08-30 02:58:05+00:00,1,1,@briannaatt,,,San Angelo
181,1299903847142486017, hes ALWAYS channeling his inner power pose,2020-08-30 02:56:42+00:00,0,0,,,,San Angelo
182,1299901591978475520,Acting a fool bc new clothes came in the mail today,2020-08-30 02:47:45+00:00,0,0,,,,San Angelo
183,1299901015022542849,Love seeing some football tonight!,2020-08-30 02:45:27+00:00,2,20,,,,San Angelo
184,1299900287906447361,Mercury is in Gatorade,2020-08-30 02:42:34+00:00,4,82,,,,San Angelo
185,1299900110403506178,"Well yup, I knew that everything was going to good for me....",2020-08-30 02:41:51+00:00,0,1,,,,San Angelo
186,1299896668133957636,There’s a lot of shady people out there,2020-08-30 02:28:11+00:00,1,2,,,,San Angelo
187,1299895201599717382,"Don’t know the context, but it sure seems fitting of the current political climate. So here’s a RT. ",2020-08-30 02:22:21+00:00,0,0,,,,San Angelo
188,1299892487650242562,Surely he should make that call for #Season18 https://twitter.com/dans_nld/status/1299890436878864387,2020-08-30 02:11:34+00:00,0,1,,#Season18,,San Angelo
189,1299891255787302912,We stay up thereee,2020-08-30 02:06:40+00:00,1,4,,,,San Angelo
190,1299889464282624001,"I can't anymore with this shit...these people with their outright lies and their POS pres right beside lying his ass off. Outright lying at the convention and when you fact check them they come back with, ""everyone knows that's a left wing site"" ",2020-08-30 01:59:33+00:00,0,1,,,,San Angelo
191,1299887394586603521,Just realizing that Jake Ricky and Josh are the last ones in our family for a long time ,2020-08-30 01:51:20+00:00,0,8,,,,San Angelo
192,1299887231109398533, ,2020-08-30 01:50:41+00:00,0,0,,,,San Angelo
193,1299887187236978691,"I will never understand why it still exists...the ""it"" referring to racism and the racist motherfuckers who perpetuate it.",2020-08-30 01:50:30+00:00,0,1,,,,San Angelo
