,id,text,date,retweets,favorites,mentions,hashtags,geo,region
138,1300759717925523457,Go #Nuggets! So proud of #jamalmurray &amp; this team! #TrueGritBasketball If the Nuggets can come back being down 3-1 in a series so can the @Avalanche ! #GoAvsGo #GoNuggetsGo #TrueGritHockey,2020-09-01 11:37:38+00:00,0,1,@Avalanche,#Nuggets #jamalmurray #TrueGritBasketball #GoAvsGo #GoAvsGo #GoNuggetsGo #TrueGritHockey,,San Angelo
139,1300758562868793344,Nope it doesn’t actually surprise me. It says something for the Islanders & Varly that he’s healthy. A better question is “Why are Avs goalies always injured?”,2020-09-01 11:33:02+00:00,0,2,,,,San Angelo
140,1300754466468253698,Epic! #BlackExcellence,2020-09-01 11:16:46+00:00,0,0,,#BlackExcellence,,San Angelo
141,1300753711241867271,On Me! ,2020-09-01 11:13:46+00:00,0,0,,,,San Angelo
142,1300753552919465984,#TickTock,2020-09-01 11:13:08+00:00,0,0,,#TickTock,,San Angelo
143,1300737776195960832,Rate my professor but for our ex boyfriends,2020-09-01 10:10:27+00:00,2,1,,,,San Angelo
144,1300737272262819840,,2020-09-01 10:08:26+00:00,0,2,,,,San Angelo
145,1300735328668528641,Bro what type of cheating shit am I watching,2020-09-01 10:00:43+00:00,0,0,,,,San Angelo
146,1300734590886313984,Where’s the lie though? ,2020-09-01 09:57:47+00:00,0,0,,,,San Angelo
147,1300709473938534401,Guess I can try and sleep :/,2020-09-01 08:17:59+00:00,0,0,,,,San Angelo
148,1300704071528198145,Spam memories really be trying to fuck with me ,2020-09-01 07:56:31+00:00,0,0,,,,San Angelo
149,1300685648282529792,8roses for 8 months ,2020-09-01 06:43:18+00:00,0,4,,,,San Angelo
150,1300680983956598785,it’s the being forced out of the womb without being asked for me,2020-09-01 06:24:46+00:00,0,1,,,,San Angelo
151,1300678677999636481,Anybody wanna message ? ,2020-09-01 06:15:36+00:00,0,0,,,,San Angelo
152,1300677719915728898,just went down a rabbit hole of..... ice skating videos? Shits underrated,2020-09-01 06:11:48+00:00,0,0,,,,San Angelo
153,1300677083778211840, ,2020-09-01 06:09:16+00:00,0,2,,,,San Angelo
154,1300676898461229056,Douche move Comeau,2020-09-01 06:08:32+00:00,0,5,,,,San Angelo
155,1300676885156958208,Wow he decided go to go Houston we I’m not there ,2020-09-01 06:08:29+00:00,0,0,,,,San Angelo
156,1300676655011246080,"YES! I can sit here and love my body one day but there’s other days where I feel like it’s not good enough and I need to do more for it be good. So before you tell someone “shut up you look fine” think about how maybe, just maybe, body dysmorphia is REAL in the mind of others.",2020-09-01 06:07:34+00:00,26,79,,,,San Angelo
157,1300676412333002753,Those announcers are ridiculous. They couldn’t quit yaking the whole last 5 minutes about a Dallas come back. And the lady announcer is tied with Pee-Air for being the most ANNOYING. Had to turn the sound down! ,2020-09-01 06:06:36+00:00,0,1,,,,San Angelo
158,1300676261312901120,"I’m wide awake , not gonna be able to sleep tn wish I had someone to talk to :/",2020-09-01 06:06:00+00:00,0,0,,,,San Angelo
159,1300674706165690368,Chile.. anyway so...,2020-09-01 05:59:49+00:00,0,1,,,,San Angelo
160,1300672808746471424,Happy birthday to my girl @lunacasidie I love you bby!!!! ,2020-09-01 05:52:17+00:00,2,2,@lunacasidie,,,San Angelo
161,1300671897579986945, ,2020-09-01 05:48:40+00:00,0,0,,,,San Angelo
162,1300668571337592834,I hear too damn much,2020-09-01 05:35:27+00:00,0,1,,,,San Angelo
163,1300667505166430208,Waiting on a lady that loves to go have target runs together ,2020-09-01 05:31:13+00:00,0,0,,,,San Angelo
164,1300667329756487680,I’m just so mentally exhausted it’s crazy how everything feels so numb,2020-09-01 05:30:31+00:00,1,7,,,,San Angelo
165,1300665661627211776,Facts :/,2020-09-01 05:23:53+00:00,0,0,,,,San Angelo
166,1300664696811540481,I really have the greatest people around me and it makes me so happy,2020-09-01 05:20:03+00:00,0,8,,,,San Angelo
167,1300664622194851842,I’m going to get through this,2020-09-01 05:19:45+00:00,2,5,,,,San Angelo
168,1300662725459181573,Why doesn’t the baby have a gun? Unacceptable. They need to arm everyone,2020-09-01 05:12:13+00:00,0,11,,,,San Angelo
169,1300662710984736769,Stargazing is one of my fav things to do... just need a boo to take with me :/,2020-09-01 05:12:10+00:00,0,0,,,,San Angelo
170,1300661393016926210,if i looked like this i wouldn’t know what to do with myself,2020-09-01 05:06:55+00:00,1,15,,,,San Angelo
171,1300659285492404225,I swear!,2020-09-01 04:58:33+00:00,0,1,,,,San Angelo
172,1300658954503151619,Covid doesn’t want me to go home ,2020-09-01 04:57:14+00:00,0,1,,,,San Angelo
173,1300658721698328577,I miss youuuuu!!! I’m tryinggg ,2020-09-01 04:56:18+00:00,0,1,,,,San Angelo
174,1300658479359815685,No shame I would if I could find ppl to buy them. I got $60 once for a belly ring pic and haven’t found anyone since,2020-09-01 04:55:21+00:00,1,4,,,,San Angelo
175,1300657496756023296,Every*,2020-09-01 04:51:26+00:00,0,1,,,,San Angelo
176,1300654741303762950,It’s hard for me to trust anymore.,2020-09-01 04:40:29+00:00,1,6,,,,San Angelo
177,1300652139879034881,Couldn’t decide which one I liked best ,2020-09-01 04:30:09+00:00,0,2,,,,San Angelo
178,1300650965310279681,Hoodie szn wya ,2020-09-01 04:25:29+00:00,6,14,,,,San Angelo
179,1300649421982642177,Facts because Mariah ain’t got it like she used to. Beyoncé definitely winning,2020-09-01 04:19:21+00:00,0,1,,,,San Angelo
180,1300648802416721925,Lion King,2020-09-01 04:16:54+00:00,0,1,,,,San Angelo
181,1300647400579764227,Sitting here wishing I would have gotten the 6 chicken strips instead of 3 earlier .. my only regret today lol,2020-09-01 04:11:19+00:00,0,8,,,,San Angelo
182,1300645920674066433,I’m sick of them! I think I’ve said shut up 5 times in 4 minutes!,2020-09-01 04:05:26+00:00,0,0,,,,San Angelo
183,1300644253014650882, love youuuu,2020-09-01 03:58:49+00:00,0,1,,,,San Angelo
184,1300641085702787072,Damn ,2020-09-01 03:46:14+00:00,0,0,,,,San Angelo
185,1300640629261766657,I wonder if you’re bi,2020-09-01 03:44:25+00:00,0,0,,,,San Angelo
186,1300640143079018497,Bro my nose ring won’t go back in ,2020-09-01 03:42:29+00:00,0,0,,,,San Angelo
187,1300639151155544064,Blue Powerade at Rosas be hitting too,2020-09-01 03:38:32+00:00,0,2,,,,San Angelo
188,1300638959379382273,How I wanna be,2020-09-01 03:37:47+00:00,0,1,,,,San Angelo
189,1300638458910855169,,2020-09-01 03:35:47+00:00,0,0,,,,San Angelo
190,1300637946110935040,Think I’m drunk. I should go to bed,2020-09-01 03:33:45+00:00,0,1,,,,San Angelo
191,1300637900812541952,Pee-air,2020-09-01 03:33:34+00:00,0,4,,,,San Angelo
192,1300636286202634240,"true, guys i’m ok now",2020-09-01 03:27:09+00:00,0,0,,,,San Angelo
193,1300634892921901056,sometimes i be forgetting @monicasoriaa01 has other friends. i can’t breathe ,2020-09-01 03:21:37+00:00,0,2,@monicasoriaa01,,,San Angelo
194,1300634690253139968,Let me pay for your nails ,2020-09-01 03:20:49+00:00,0,0,,,,San Angelo
195,1300633986184761348,@_taylorhopkins,2020-09-01 03:18:01+00:00,1,2,@_taylorhopkins,,,San Angelo
196,1300633157822185472,I can’t wait for the Halloween party but I want someone to dress up with ,2020-09-01 03:14:44+00:00,0,1,,,,San Angelo
197,1300632037188153345,Aww congrats josue !! ,2020-09-01 03:10:16+00:00,0,1,,,,San Angelo
198,1300631366556692481,If yall see me blasting Doja cat with a case of coors and 2 shotguns. Leave me alone. It’s opening day,2020-09-01 03:07:37+00:00,1,7,,,,San Angelo
199,1300626371182579718,So Stars will win 7-5 just so y’all know,2020-09-01 02:47:46+00:00,0,1,,,,San Angelo
200,1300626303922700289,"We love Halloween, especially for our HalloScream each year.",2020-09-01 02:47:29+00:00,0,3,,,,San Angelo
201,1300626023936135168,#TrueGritHockey #GoAvsGo,2020-09-01 02:46:23+00:00,0,6,,#TrueGritHockey #GoAvsGo #GoAvsGo,,San Angelo
202,1300625226120802304,Lmao facts ,2020-09-01 02:43:13+00:00,0,0,,,,San Angelo
203,1300625137377607680,Rand said today the Willard and the W hotels are $500 to $600 a night. And some rioters are staying there...,2020-09-01 02:42:51+00:00,0,0,,,,San Angelo
204,1300624982217809930,“Cant wait for rainy weather” *starts raining * ,2020-09-01 02:42:14+00:00,0,0,,,,San Angelo
205,1300624902773444609,"Love the Diplomats, @MAJTOURE . Pun intended on the Heatmakerz?",2020-09-01 02:41:55+00:00,0,0,@MAJTOURE,,,San Angelo
206,1300624769327472640,Bihhhh just fine ,2020-09-01 02:41:24+00:00,0,0,,,,San Angelo
207,1300624412484526080,I truly believe that the government needs to step in to Portland and start jailing some of these thugs. If they kill someone out of stupidity then the death penalty should be imposed. Governors should give approval for President Trump to step in and bring piece to these cities.,2020-09-01 02:39:59+00:00,0,0,,,,San Angelo
208,1300624276257730565,This is just an outright lie.,2020-09-01 02:39:26+00:00,0,0,,,,San Angelo
209,1300624263267876865,Which show? Lour? Big Suey? National show? Post-game? Mystery Crate? South Beach Sessions? Miked Up?,2020-09-01 02:39:23+00:00,0,10,,,,San Angelo
210,1300623216155787267,Not after the polls on it didn’t go his way...,2020-09-01 02:35:13+00:00,0,0,,,,San Angelo
211,1300620864430526464,Closed cell in this metal building in Wall. #sprayfoam #mancave #homegym #portablebuilding #storagebuilding #seacontainer #conex #metalbuilding #steelbuilding #barn #shop #barndominium #barndo #barndolife #barndoliving #customhome #construction #farm #ranch #oilfield #oil #gas,2020-09-01 02:25:53+00:00,0,1,,#sprayfoam #mancave #homegym #portablebuilding #storagebuilding #seacontainer #conex #metalbuilding #steelbuilding #barn #shop #barndominium #barndo #barndolife #barndoliving #customhome #construction #farm #ranch #oilfield #oil #gas,,San Angelo
212,1300618796244316160,This intense thunderstorm is everything!!!!! ,2020-09-01 02:17:40+00:00,0,0,,,,San Angelo
213,1300618509169422338, ,2020-09-01 02:16:31+00:00,0,0,,,,San Angelo
214,1300618139726745600, ,2020-09-01 02:15:03+00:00,0,1,,,,San Angelo
215,1300616851723091968,When @woahlalura gma gets scared of the thunder and sits in the middle of the hall way &gt;&gt;&gt; ,2020-09-01 02:09:56+00:00,0,1,@woahlalura,,,San Angelo
216,1300616674123669504,,2020-09-01 02:09:14+00:00,0,1,,,,San Angelo
217,1300616185067843586,Tell that to my dog,2020-09-01 02:07:17+00:00,0,1,,,,San Angelo
218,1300614236809428997,"I wish my baby was still newborn, now he's all over the house ",2020-09-01 01:59:32+00:00,4,3,,,,San Angelo
219,1300613813960572930,Is she like Texas rain or west Texas rain?,2020-09-01 01:57:52+00:00,0,6,,,,San Angelo
220,1300613807849517056,"If I knew how 2020 was gunna play out, I would’ve finished it https://twitter.com/DJSteezyD1/status/1300607293915041794",2020-09-01 01:57:50+00:00,0,19,,,,San Angelo
221,1300613028661153792,Just had a surprise visit from rito. He drove all the way to angelo to come see me (and get frozen yogurt ) and it’s about to storm! Lol love you though ,2020-09-01 01:54:44+00:00,0,15,,,,San Angelo
222,1300612551101865984,love the way you smell i’m addicted to your fragrance.,2020-09-01 01:52:51+00:00,3,16,,,,San Angelo
223,1300612406012411906,True that!,2020-09-01 01:52:16+00:00,0,0,,,,San Angelo
224,1300611658709114881,It’s true grit hockey tonight,2020-09-01 01:49:18+00:00,0,0,,,,San Angelo
225,1300610328833785856,i love this. ,2020-09-01 01:44:01+00:00,0,1,,,,San Angelo
226,1300610259644448768,To all my AP residents make sure your devices are charged and you got candles because I’m sure we’ll loose power again tonight,2020-09-01 01:43:44+00:00,0,1,,,,San Angelo
227,1300610138244624384,nighas be cap asf ...,2020-09-01 01:43:15+00:00,0,0,,,,San Angelo
228,1300609744244178944,"Same, I’m ready for a new car",2020-09-01 01:41:41+00:00,0,1,,,,San Angelo
229,1300609257419796482,I said you could have whatever you like,2020-09-01 01:39:45+00:00,0,1,,,,San Angelo
230,1300609155200417795,,2020-09-01 01:39:21+00:00,0,2,,,,San Angelo
231,1300606158261096450,Golf ball size hail too.,2020-09-01 01:27:26+00:00,0,3,,,,San Angelo
232,1300606095065600002,Jimmy G Buckets,2020-09-01 01:27:11+00:00,0,0,,,,San Angelo
233,1300605826449760262,It would make my week 1000% better,2020-09-01 01:26:07+00:00,0,0,,,,San Angelo
234,1300605465584435204,Ask and you shall receive!!,2020-09-01 01:24:41+00:00,0,1,,,,San Angelo
235,1300604995944013832,Some rain and cooler weather would be nice right about now,2020-09-01 01:22:49+00:00,10,29,,,,San Angelo
236,1300603548607156224,LGTM heat,2020-09-01 01:17:04+00:00,0,1,,,,San Angelo
237,1300602911412621313,so you’re telling me .... it’s ... abt ... to ... HAIL.... bye,2020-09-01 01:14:32+00:00,0,0,,,,San Angelo
238,1300602340232368129,"wine, travel and new carl. who's carl?",2020-09-01 01:12:16+00:00,0,2,,,,San Angelo
239,1300599924053041152,Severe Thunderstorm Warning including San Angelo TX until 8:45 PM CDT,2020-09-01 01:02:40+00:00,0,1,,,,San Angelo
240,1300596237654089728,"Severe Thunderstorm Warning including Irion County, TX, Tom Green County, TX until 8:15 PM CDT",2020-09-01 00:48:01+00:00,0,0,,,,San Angelo
241,1300593003065729025,You gonna beast mode!!!! Congratulations! Let’s get this party started!! ,2020-09-01 00:35:10+00:00,0,6,,,,San Angelo
242,1300587775587221505,Ima keep trying until I get a message back ,2020-09-01 00:14:24+00:00,0,0,,,,San Angelo
0,1302395951508852744,Wait what ,2020-09-05 23:59:26+00:00,0,13,,,,San Angelo
1,1302395625313624065,"Holy shit, either @SMU_Football or @TxStateBobcats might break the regular season turnover record in one game.",2020-09-05 23:58:09+00:00,0,0,@SMU_Football @TxStateBobcats,,,San Angelo
2,1302395609350123523,Says the globetrotter kmsl what you got cooked up sis?,2020-09-05 23:58:05+00:00,0,0,,,,San Angelo
3,1302395593818546176,"Congress has made themselves nonessential by every definition of the word that includes ALL congress critters. @SpeakerPelosi @GOPLeader @GOPChairwoman Wasn’t that long ago, republicans would have stayed, worked and demanded action. kabuki theatre, 100% corruption cross board",2020-09-05 23:58:01+00:00,1,1,@SpeakerPelosi @GOPLeader @GOPChairwoman,,,San Angelo
4,1302395435303219200,Test drive a Cadillac today at Randall Motors! Schedule your test drive online: https://bit.ly/32ePCdK,2020-09-05 23:57:23+00:00,0,1,,,,San Angelo
5,1302395274577444866,"If I knew, they be done blocked me by now kmsl shit don’t make no sense! It would give these Brazilian women a break, it would last longer, AND be cheaper. So many Ws!",2020-09-05 23:56:45+00:00,0,0,,,,San Angelo
6,1302395003059269632,"Spotty showers will linger for this weekend, hot and dry for any Labor Day plans.",2020-09-05 23:55:40+00:00,0,0,,,,San Angelo
7,1302394750939561984,"I just need to know, like they done fucked around and cloned sheep but I can’t get a cheap synthetic bundle of 613 hair that’s better than expensive ass human hair? It ain’t sitting right with me smh",2020-09-05 23:54:40+00:00,1,1,,,,San Angelo
8,1302394640147066881,#JusticeForBreonnaTaylor,2020-09-05 23:54:14+00:00,0,0,,#JusticeForBreonnaTaylor,,San Angelo
9,1302393624399880194,WWE IS GONNA BE MAD AT HER ! idk if shes even affiliated with them ,2020-09-05 23:50:12+00:00,0,1,,,,San Angelo
10,1302393395638345728,"yeah we know, no need to say the name",2020-09-05 23:49:17+00:00,0,0,,,,San Angelo
11,1302393323538321410,Congratulations ! Keep it up! Worth every second of every day ,2020-09-05 23:49:00+00:00,0,0,,,,San Angelo
12,1302393076476977152,no thanks excalibur can go,2020-09-05 23:48:01+00:00,0,0,,,,San Angelo
13,1302393050036133896,Jr bringing the ,2020-09-05 23:47:55+00:00,0,0,,,,San Angelo
14,1302392905210957824,Not right now (sold out) but it’ll be back 9/19,2020-09-05 23:47:20+00:00,0,0,,,,San Angelo
15,1302392587920322560,NO SHE WASNT ,2020-09-05 23:46:04+00:00,0,0,,,,San Angelo
16,1302392440616353792,"God Bless and we all need to come together and support @POTUS , defend our country, laws and history. We are all Americans ",2020-09-05 23:45:29+00:00,0,0,@POTUS,,,San Angelo
17,1302392414267756544,Everyday,2020-09-05 23:45:23+00:00,0,0,,,,San Angelo
18,1302392336354246656,Fucking LAWLZ ,2020-09-05 23:45:04+00:00,0,0,,,,San Angelo
19,1302392050579636225,Good for her,2020-09-05 23:43:56+00:00,0,0,,,,San Angelo
20,1302391742893703168,"SJT issues Area Forecast Discussion (AFD) at Sep 5, 6:42 PM CDT ...New AVIATION...",2020-09-05 23:42:43+00:00,0,0,,,,San Angelo
21,1302391243826171907,Getting my wisdom teeth pulled on Friday so this week I am eating real good got wings today let’s see what else I eat this week,2020-09-05 23:40:44+00:00,0,1,,,,San Angelo
22,1302391113605697536,Gotta watch the time cause it’s flyin right by,2020-09-05 23:40:13+00:00,0,4,,,,San Angelo
23,1302390922639020032,Yakuza 4 really has the stupidest story in the series,2020-09-05 23:39:27+00:00,0,0,,,,San Angelo
24,1302390890451939328,COVID-19 sidelines legendary Brownwood broadcaster Dallas Huston -- at least for one week https://www.gosanangelo.com/story/sports/high-school/2020/09/05/covid-19-sidelines-legendary-brownwood-broadcaster-dallas-huston/5732024002/ via @gosanangelo,2020-09-05 23:39:20+00:00,0,0,@gosanangelo,,,San Angelo
25,1302390808809799680,"Dallas Huston, who has been broadcasting Brownwood football games for 58 seasons, had to take a rare night off Friday after testing positive for COVID-19 recently. https://www.gosanangelo.com/story/sports/high-school/2020/09/05/covid-19-sidelines-legendary-brownwood-broadcaster-dallas-huston/5732024002/",2020-09-05 23:39:00+00:00,1,2,,,,San Angelo
26,1302390763641335810,You are a loser dear god smh,2020-09-05 23:38:49+00:00,0,0,,,,San Angelo
27,1302390613070024706,He just says something that raises folks ire to take attention away from what he previously said,2020-09-05 23:38:14+00:00,0,0,,,,San Angelo
28,1302390545227173895,"even your family can put you in the middle of stressful, overwhelming situations without considering checking up on your mental health.",2020-09-05 23:37:57+00:00,0,1,,,,San Angelo
29,1302390409071652864,roadhouse af ,2020-09-05 23:37:25+00:00,0,1,,,,San Angelo
30,1302390362892308480,Holding up the line behind you ,2020-09-05 23:37:14+00:00,0,0,,,,San Angelo
31,1302390177319522304,All of the above ,2020-09-05 23:36:30+00:00,0,3,,,,San Angelo
32,1302389739950088194,The Veribest Falcons opened up their 2020 season with a 42-32 win over the Zephyr Bulldogs,2020-09-05 23:34:45+00:00,0,1,,,,San Angelo
33,1302389697151459329,The Veribest Falcons opened up their 2020 season with a 42-32 win over the Zephyr Bulldogs https://trib.al/YuobjBe,2020-09-05 23:34:35+00:00,0,1,,,,San Angelo
34,1302389663219486722,"Also, not about Way lol.",2020-09-05 23:34:27+00:00,0,3,,,,San Angelo
35,1302389575881555973,The D-O Double G,2020-09-05 23:34:06+00:00,0,1,,,,San Angelo
36,1302389133457977346,"Also before y'all come for me, i didn't know he was doin the dirty with the rest of the town until after (:",2020-09-05 23:32:21+00:00,0,8,,,,San Angelo
37,1302388978264530955,HAHA my HS bf balled when i broke up with him like he didn't cheat on me for 4 years. They just cry babies for no reason.,2020-09-05 23:31:44+00:00,2,34,,,,San Angelo
38,1302388288309919746,Someone teach me how to do make up the right way. I just throw stuff on and hope it looks decent with filters lmaooo,2020-09-05 23:28:59+00:00,1,4,,,,San Angelo
39,1302388210295803904,"Ok, I feel better now.",2020-09-05 23:28:41+00:00,1,6,,,,San Angelo
40,1302387868388777984,Ya think he will call the boat owners that lost their boats losers,2020-09-05 23:27:19+00:00,0,1,,,,San Angelo
41,1302387479065042944,Sometimes IGN updates their review scores with live service or heavily updated games right? Is something like this worth another look at a review score for UFC4?,2020-09-05 23:25:46+00:00,0,0,,,,San Angelo
42,1302387463709691906,You blew it with the military.,2020-09-05 23:25:43+00:00,0,0,,,,San Angelo
43,1302387326912540674,"You mean how Sherman, Irvin and Browner who all helped us win a SB cheated? Those dudes took PEDs. Or how Pete breaks the rules all the time on illegal practices. CHEATERS!!! come on every team breaks the rules",2020-09-05 23:25:10+00:00,0,0,,,,San Angelo
44,1302387323250913283,,2020-09-05 23:25:09+00:00,0,0,,,,San Angelo
45,1302387211913101312,Liv feels the same way,2020-09-05 23:24:43+00:00,0,0,,,,San Angelo
46,1302387128031047680,,2020-09-05 23:24:23+00:00,0,0,,,,San Angelo
47,1302386664292188172,I trust they shouldn’t have signed Clowney. I’m still shocked how smart they were about Earl Thomas. Like wow! They knew more then the fans that he wasn’t as good as he was and wasn’t worth a big contract. Blows my mind fans destroyed Pete over Thomas.,2020-09-05 23:22:32+00:00,0,1,,,,San Angelo
48,1302386624257556482,Wonder how much money he owes her family,2020-09-05 23:22:23+00:00,0,2,,,,San Angelo
49,1302386308820725760,Let’s take a shot fool!,2020-09-05 23:21:07+00:00,1,1,,,,San Angelo
50,1302386308497768448,He won't apologize. That means admitting he said it.,2020-09-05 23:21:07+00:00,0,0,,,,San Angelo
51,1302386095712333829,I like how when I turn a corner I see a bunch of dumb sophomores in my way then realize that’s how I was,2020-09-05 23:20:17+00:00,0,0,,,,San Angelo
52,1302385948395810818,"Started watching this morning, we are 3 episodes in and really enjoying it. Love the 80s music.",2020-09-05 23:19:41+00:00,0,0,,,,San Angelo
53,1302385866883690496,Shut up,2020-09-05 23:19:22+00:00,1,10,,,,San Angelo
54,1302385837976551425,Mcdobalds work : sorry our ice cream machine ain’t working Normal person : ahh it ain’t ever working Trump supporters : this is what Biden’s America gonna look like,2020-09-05 23:19:15+00:00,1,1,,,,San Angelo
55,1302385450116624390,A loaded bank account and a comfortable life*,2020-09-05 23:17:43+00:00,0,1,,,,San Angelo
56,1302385228871356417,Beautiful!,2020-09-05 23:16:50+00:00,0,1,,,,San Angelo
57,1302385101834248192,Magic ,2020-09-05 23:16:20+00:00,0,0,,,,San Angelo
58,1302384990920024065,Love these!,2020-09-05 23:15:53+00:00,0,0,,,,San Angelo
59,1302384986172149761,El Paso is bomb af,2020-09-05 23:15:52+00:00,0,0,,,,San Angelo
60,1302384274822311937,Stupid asshats,2020-09-05 23:13:02+00:00,0,0,,,,San Angelo
61,1302384271852789761,That man is my hero.,2020-09-05 23:13:02+00:00,0,1,,,,San Angelo
62,1302384187140431874,Beast,2020-09-05 23:12:41+00:00,1,23,,,,San Angelo
63,1302383978872270849,Oh shit Couts is for sure in and on the ice a warmups.,2020-09-05 23:11:52+00:00,0,1,,,,San Angelo
64,1302383935272484865,I popped a blister helping Steph paint and oof it fooking hurts,2020-09-05 23:11:41+00:00,0,1,,,,San Angelo
65,1302383672927178752,Seattle mAde the right decision on Earl and you all bashed them. I promise you they know more about Clowney then you. Don’t play GM,2020-09-05 23:10:39+00:00,0,0,,,,San Angelo
66,1302383509055701026,Don’t give a shit. Not watching anyway. You allowed politics to ruin one of the only diversions we have. Protesting does not do shit. Get involved you make a difference and just go back to doing what we pay you to do. Play a friggin football game.,2020-09-05 23:10:00+00:00,0,2,,,,San Angelo
67,1302383295213326338,Noted religion of peace,2020-09-05 23:09:09+00:00,0,0,,,,San Angelo
68,1302383078187372545,"2 people throwing up otw back to Ds, had people tryna throw ass .. idk how D drove with all of that going on ",2020-09-05 23:08:17+00:00,0,1,,,,San Angelo
69,1302382663064588290,I know yall felt this one,2020-09-05 23:06:38+00:00,0,2,,,,San Angelo
70,1302382648472596487,"That looked like a mini-stroke, not a full swing!",2020-09-05 23:06:35+00:00,0,0,,,,San Angelo
71,1302382617095008257,"That is the key right there. All voters vote in person on Election Day, period, full stop.",2020-09-05 23:06:27+00:00,0,0,,,,San Angelo
72,1302382526053396485,It was 8 of us in one car LMAO,2020-09-05 23:06:05+00:00,1,2,,,,San Angelo
73,1302382481405026304,"I had the chance to watch Streveler in the first round of the 2017 FCS Playoffs against Sam Houston State... very impressive athlete. Streveler in that game: 33-54, 520 passing yards, 6 total touchdowns, 2 INTs",2020-09-05 23:05:55+00:00,0,3,,,,San Angelo
74,1302382114185392128,Dig those pipes!,2020-09-05 23:04:27+00:00,0,0,,,,San Angelo
75,1302382112222449664,You have approximately 5 minutes to cry and be said then you gotta thug that shit out.,2020-09-05 23:04:27+00:00,0,3,,,,San Angelo
76,1302381824526688256,"True. He's like that old scrubbing bubbles commercial ""He's doing all the work so you won't have to"".",2020-09-05 23:03:18+00:00,0,0,,,,San Angelo
77,1302381734563123201,"""The number one thing we have to do is make sure our hearts are tender and open.""",2020-09-05 23:02:57+00:00,0,0,,,,San Angelo
78,1302381542434574339,I can’t even get excited about football season cause I feel like I’m just waiting for it to get canceled,2020-09-05 23:02:11+00:00,0,4,,,,San Angelo
79,1302381328365768705,"Girl, you are beautiful and so is your soul no need to be insecure!",2020-09-05 23:01:20+00:00,1,1,,,,San Angelo
80,1302381249101811712,idk about y’all but i’m ready for the season to start,2020-09-05 23:01:01+00:00,0,0,,,,San Angelo
81,1302380687362846720,Me neither! Sunday afternoon naps are more fun.,2020-09-05 22:58:47+00:00,0,1,,,,San Angelo
82,1302380668215865356, ,2020-09-05 22:58:43+00:00,0,0,,,,San Angelo
83,1302380602075885568,Subscribe to the Locker Room Rewind podcast feed for expanded high school football coverage in the Concho Valley. A look back at Week 2 with Eldorado Head Coach @Coach_Long is available now. #txhsfb APPLE PODCASTS: http://trib.al/uqpUrOr SPOTIFY: http://trib.al/j10CmMJ,2020-09-05 22:58:27+00:00,3,6,@Coach_Long,#txhsfb,,San Angelo
84,1302380530386731008,"Think it’s safe to say that on this day last year, everyone got fucked up @tailgate ",2020-09-05 22:58:10+00:00,1,10,,,,San Angelo
