,id,text,date,retweets,favorites,mentions,hashtags,geo,region
465,1302324276264161286,@SatMornPod captain planet is my favorite show,2020-09-05 19:14:38+00:00,0,1,@SatMornPod,,,San Angelo
466,1302324232404242437,and fuck @SvintJhn,2020-09-05 19:14:27+00:00,0,2,@SvintJhn,,,San Angelo
467,1302324205132886017,Buffalos is such ass,2020-09-05 19:14:21+00:00,0,1,,,,San Angelo
468,1302324191476158464,"SJT issues Hazardous Weather Outlook (HWO) at Sep 5, 2:14 PM CDT",2020-09-05 19:14:17+00:00,0,0,,,,San Angelo
469,1302324181481041921,I forgot what it was like to be at over 100 degrees before 10am.,2020-09-05 19:14:15+00:00,0,1,,,,San Angelo
470,1302324166260121606,I just keep looking at that heart in his head and how it’s uneven ,2020-09-05 19:14:11+00:00,0,0,,,,San Angelo
471,1302324120508661761,XFL!,2020-09-05 19:14:00+00:00,0,0,,,,San Angelo
472,1302323905475080192,@SatMornPod just eat some snacks and listen to Saturday morning podcast,2020-09-05 19:13:09+00:00,0,1,@SatMornPod,,,San Angelo
473,1302323772029054982,"Easily 10-6, 11-5",2020-09-05 19:12:37+00:00,0,0,,,,San Angelo
474,1302323466373419019,Good ,2020-09-05 19:11:25+00:00,0,0,,,,San Angelo
475,1302323062885552129,My life working from home,2020-09-05 19:09:48+00:00,0,1,,,,San Angelo
476,1302322824468729856,"This home has so much of what you're looking for. 2 bed, 1 bath home in beautiful San Angelo. #sellingsanangelo #realtor #homesforsalesanangelo #realestate",2020-09-05 19:08:51+00:00,0,0,,#sellingsanangelo #realtor #homesforsalesanangelo #realestate,,San Angelo
477,1302322767489007616,"Be cool, be cool to everybody. Don’t be a hating ass bitch",2020-09-05 19:08:38+00:00,10,39,,,,San Angelo
478,1302322751445905409,HAHAGAG,2020-09-05 19:08:34+00:00,0,0,,,,San Angelo
479,1302322417340239879,Zoey has really started to understand that she is adopted & has started asking questions like “why didn’t my 1st mom want me” and “why did she just give me to y’all” and it’s the hardest thing cause how do you tell a perfect little girl that her mom just wouldn’t get it together.,2020-09-05 19:07:14+00:00,0,33,,,,San Angelo
480,1302321909510488064,"SJT issues Area Forecast Discussion (AFD) at Sep 5, 2:04 PM CDT ...First Strong Cold Front of The Season Tuesday Night...",2020-09-05 19:05:13+00:00,0,0,,,,San Angelo
481,1302321830238322688,The orange juice!!,2020-09-05 19:04:54+00:00,0,0,,,,San Angelo
482,1302321768246501378,Long story. Short is. My friend has the modem across the hall. WiFi is best here.,2020-09-05 19:04:40+00:00,0,2,,,,San Angelo
483,1302321744561098752,"In case you missed it, plus I've added some since last night. Reports from Junction, Reagan County, Brady, Christoval, Mason, Sterling City, Eden, Irion County, Robert Lee, Ozona, Sonora, Richland Springs and Veribest #SASTSports",2020-09-05 19:04:34+00:00,0,0,,#SASTSports,,San Angelo
484,1302321291513528322,Crimes against humanity-Brian Fitz,2020-09-05 19:02:46+00:00,0,0,,,,San Angelo
485,1302320892052148227, if you don’t chill ,2020-09-05 19:01:11+00:00,0,2,,,,San Angelo
486,1302320860674420737,AREA ROUNDUP: No. 7 San Saba avoids upset with last-minute field goal https://www.gosanangelo.com/story/sports/high-school/2020/09/04/no-7-san-saba-avoids-upset-last-minute-field-goal-rogers/5719706002/ via @gosanangelo #SASTSports,2020-09-05 19:01:03+00:00,0,0,@gosanangelo,#SASTSports,,San Angelo
487,1302320747247960066,Hey Angie! Welcome to the family!,2020-09-05 19:00:36+00:00,0,0,,,,San Angelo
488,1302320645204774915,"Daniel Prude, a 41-year-old Black man from Chicago, died after an encounter with Rochester police back in March.",2020-09-05 19:00:12+00:00,0,0,,,,San Angelo
489,1302320644458151936,"Daniel Prude, a 41-year-old Black man from Chicago, died after an encounter with Rochester police back in March. https://trib.al/IZ1hsWx",2020-09-05 19:00:12+00:00,0,0,,,,San Angelo
490,1302320638170984449,Your current temperatures for the Concho Valley. #TXwx #KLSTwx,2020-09-05 19:00:10+00:00,0,2,,#TXwx #KLSTwx,,San Angelo
491,1302320613470728210,What he said.,2020-09-05 19:00:04+00:00,1,1,,,,San Angelo
492,1302320594684321792,"It may be September, but it still feels like summertime in San Angelo. Cool off with a Caramel Coconut from Stango's Coffee Shop. Where is your favorite San Angelo ice cream destination? #sanangelosweets #icecream #texastreats #sanangelove #eattexas #texaseatsandtreats",2020-09-05 19:00:00+00:00,0,0,,#sanangelosweets #icecream #icecream #texastreats #sanangelove #eattexas #texaseatsandtreats,,San Angelo
493,1302320522290696192,"This is true, lol",2020-09-05 18:59:43+00:00,0,1,,,,San Angelo
494,1302320480729337857,You goin be wearing a dress soon,2020-09-05 18:59:33+00:00,0,0,,,,San Angelo
495,1302320293810262019,I’m getting there. I’m having to job hunt so upgrading shit isn’t really an option lol,2020-09-05 18:58:48+00:00,0,1,,,,San Angelo
496,1302320200612806658,All my Canes smh,2020-09-05 18:58:26+00:00,0,1,,,,San Angelo
497,1302320172141875202,For your safety we are going to make it significantly harder to be a student by making it harder to use the library and by making online classes confusing as hell because each prof. Does it completely different,2020-09-05 18:58:19+00:00,0,3,,,,San Angelo
498,1302320116810633220,anyone need any ideas on what to get me for my birthday? Lmk ,2020-09-05 18:58:06+00:00,0,2,,,,San Angelo
499,1302320063589101569,i would certainly like to,2020-09-05 18:57:53+00:00,0,0,,,,San Angelo
500,1302319587002929152,Aww i love you ,2020-09-05 18:56:00+00:00,0,1,,,,San Angelo
501,1302319433805946881,Why do I feel uglier when I do my hair and make up than I do when I don’t? Like I’m pretty sure it’s supposed to be opposite,2020-09-05 18:55:23+00:00,0,5,,,,San Angelo
502,1302319322971475974,Badddie out heree,2020-09-05 18:54:57+00:00,0,1,,,,San Angelo
503,1302319167991930880,Seems a little aggressive Brit,2020-09-05 18:54:20+00:00,0,0,,,,San Angelo
504,1302319020163633153, ,2020-09-05 18:53:44+00:00,0,0,,,,San Angelo
505,1302318787732164611,"Excuses are like assholes, everyone has one.",2020-09-05 18:52:49+00:00,0,0,,,,San Angelo
506,1302318600582295559,Appreciate it big bro ,2020-09-05 18:52:04+00:00,0,1,,,,San Angelo
507,1302318543304884226,Appreciate it coach !!,2020-09-05 18:51:51+00:00,0,1,,,,San Angelo
508,1302318516192894983,YES YES YES @JackieFeldman21,2020-09-05 18:51:44+00:00,0,1,@JackieFeldman21,,,San Angelo
509,1302318487218647040,It’s a dresser and a TV tray . I just need a real second monitor and now a 32 inch tv from 2009,2020-09-05 18:51:37+00:00,0,1,,,,San Angelo
510,1302318415957364736,"Damn, you hate to see it smh",2020-09-05 18:51:20+00:00,0,0,,,,San Angelo
511,1302318003611148288,This is my setup lol,2020-09-05 18:49:42+00:00,0,2,,,,San Angelo
512,1302317988855656451,One of the new sweet glass pieces we just got. Stay tuned we’re bringing in so many new products/glass this is just the beginning! #staytuned #liftedsmokeandvape #newproductseveryweek #staylifted,2020-09-05 18:49:39+00:00,2,1,,#staytuned #liftedsmokeandvape #newproductseveryweek #staylifted,,San Angelo
513,1302317725814083585,"I dont think rewriting history is a good attack point. You could say she would want to make educational history a little more inclusive. There are a lot of problems with the Texas Education System, but also a lot of good things. We need legislation to weed out opportunists.",2020-09-05 18:48:36+00:00,0,1,,,,San Angelo
514,1302317482674446337,I promise it is hopeful!,2020-09-05 18:47:38+00:00,0,1,,,,San Angelo
515,1302317424147136513,VOTE!,2020-09-05 18:47:24+00:00,0,0,,,,San Angelo
516,1302317085725544449,"And the peace of God, which passeth all understanding, shall keep your hearts and minds through Christ Jesus.",2020-09-05 18:46:03+00:00,0,0,,,,San Angelo
517,1302316833815625728,It’s 2020 and I’m just now finding out the beauty of having a second monitor connected to your PC,2020-09-05 18:45:03+00:00,0,7,,,,San Angelo
518,1302316740374863873,,2020-09-05 18:44:41+00:00,0,0,,,,San Angelo
519,1302316654983032838,Fav ,2020-09-05 18:44:21+00:00,1,0,,,,San Angelo
520,1302316524519256065,#NewProfilePic,2020-09-05 18:43:49+00:00,0,4,,#NewProfilePic,,San Angelo
521,1302316497000423427,Who tryna be like this? ,2020-09-05 18:43:43+00:00,0,16,,,,San Angelo
522,1302316333204410369,what goes through my mind daily: “there’s some hoes in this house”,2020-09-05 18:43:04+00:00,0,1,,,,San Angelo
523,1302316226459426816,Yessir,2020-09-05 18:42:38+00:00,0,1,,,,San Angelo
524,1302316102224171015,"You're awesome too, my guy! :D Thank you as well!",2020-09-05 18:42:09+00:00,0,0,,,,San Angelo
525,1302315783683530758,De nada,2020-09-05 18:40:53+00:00,0,1,,,,San Angelo
526,1302314462549028864,See y’all at chimys,2020-09-05 18:35:38+00:00,0,0,,,,San Angelo
527,1302314309381509120,Vamos,2020-09-05 18:35:01+00:00,0,2,,,,San Angelo
528,1302314308420988931,Thinking about that one time a cicada smacked me in the face and I thought my life was ending.,2020-09-05 18:35:01+00:00,0,2,,,,San Angelo
529,1302314221619810314,Celebrating my mother's 70th birthday. @RiverView Restaurant at River Terrace https://www.instagram.com/p/CEw9zVNj785/?igshid=1ee4o7s3jlgf8,2020-09-05 18:34:40+00:00,0,0,,,,San Angelo
530,1302314106666594310,I just want to go to a Trump boat parade ,2020-09-05 18:34:13+00:00,1,4,,,,San Angelo
531,1302314080741412864,"SJT issues Short-term Forecast (NOW) at Sep 5, 1:33 PM CDT",2020-09-05 18:34:07+00:00,0,0,,,,San Angelo
532,1302313681955545088,Me too!,2020-09-05 18:32:32+00:00,0,1,,,,San Angelo
533,1302313346650247172,I just looked at it and knew the answer. Numbers are like a language to me I don’t really have to think about them they just kind of visualize in my head.,2020-09-05 18:31:12+00:00,1,3,,,,San Angelo
534,1302313247601811457,I have friends there and I didn’t see any under water on snap lol but I’d be hot if my shit sank,2020-09-05 18:30:48+00:00,0,0,,,,San Angelo
535,1302313194782887939,It is even a worse thing when a President can only tell lies. SAD!,2020-09-05 18:30:36+00:00,0,0,,,,San Angelo
536,1302313177296908289,so proud of you!!,2020-09-05 18:30:31+00:00,0,1,,,,San Angelo
537,1302313122850656265,@CrypticNoOne,2020-09-05 18:30:18+00:00,0,0,@CrypticNoOne,,,San Angelo
538,1302313102252351491,"I like when it touches that lil dangly thing in the back of my throat, so refreshing",2020-09-05 18:30:14+00:00,2,8,,,,San Angelo
539,1302313086452465667,"While lawmakers can't seem to work out the details of another coronavirus relief package many hope includes another round of stimulus checks, President Donald Trump tossed out the idea of utilizing unused funds to pay for additional direct payments.",2020-09-05 18:30:10+00:00,0,0,,,,San Angelo
540,1302313084699189249,"While lawmakers can't seem to work out the details of another coronavirus relief package many hope includes another round of stimulus checks, President Donald Trump tossed out the idea of utilizing unused funds to pay for additional direct payments.",2020-09-05 18:30:09+00:00,0,0,,,,San Angelo
541,1302313006353846275,mom : you need a good man Me: I need a good liquor bottle,2020-09-05 18:29:51+00:00,1,9,,,,San Angelo
542,1302312981196406785,Enter the Chronicles of the Stone Veil Series Reveal #giveaway from Sawyer Bennett for your chance to win a signed paperback &amp; $50 Gift Card! https://kingsumo.com/g/mwevon/chronicles-of-the-stone-veil-reveal-giveaway/nl270vp,2020-09-05 18:29:45+00:00,0,0,,#giveaway,,San Angelo
543,1302312831329730560,Facctttssss ,2020-09-05 18:29:09+00:00,2,16,,,,San Angelo
544,1302312826149703680,Definitely a psychopath because I like pulp in my orange juice,2020-09-05 18:29:08+00:00,0,0,,,,San Angelo
545,1302312646297948160,So excited for my three day weekend getting paid to get drunk and float the river,2020-09-05 18:28:25+00:00,0,5,,,,San Angelo
546,1302312335734902785,"Coahoma wins the 2nd set over Grape Creek, 25-23, to even the match at one set a piece.",2020-09-05 18:27:11+00:00,0,1,,,,San Angelo
547,1302312172408709120,Kidding i couldn't even take myself serious saying that,2020-09-05 18:26:32+00:00,1,1,,,,San Angelo
548,1302312147326840834,Finally a Saturday where I’m not wearing scrubs ,2020-09-05 18:26:26+00:00,0,6,,,,San Angelo
549,1302312071078596610,I'm scarier,2020-09-05 18:26:08+00:00,0,1,,,,San Angelo
550,1302311916841381888,And I don't like other bitches. So it works out ,2020-09-05 18:25:31+00:00,0,1,,,,San Angelo
551,1302311905336401921,I swear it's a gentle post-apocalyptic book ,2020-09-05 18:25:28+00:00,0,0,,,,San Angelo
552,1302311468977860610,"Momma said take what you want, I took heed.",2020-09-05 18:23:44+00:00,0,0,,,,San Angelo
553,1302311425348644865,summer walker never fails me,2020-09-05 18:23:34+00:00,0,0,,,,San Angelo
554,1302311091666587648,Effort is easy when it’s sum u actually wanna do,2020-09-05 18:22:14+00:00,1,1,,,,San Angelo
555,1302310587490283521, ,2020-09-05 18:20:14+00:00,0,0,,,,San Angelo
556,1302310538316316676,Literally wrote this tweet as I was pulling up late to work ,2020-09-05 18:20:02+00:00,0,1,,,,San Angelo
557,1302310103098568705,I just entered to win a Blessed and Fall Obsessed 3-Wick Scented Candle Giveaway. Wanna win? You can enter too! #win #giveaway #yourdailygiveaway,2020-09-05 18:18:18+00:00,0,1,,#win #giveaway #yourdailygiveaway,,San Angelo
558,1302310016872075266,Wow!,2020-09-05 18:17:58+00:00,0,0,,,,San Angelo
559,1302309908629594112,Boutta destroy this 7 hour shift,2020-09-05 18:17:32+00:00,0,6,,,,San Angelo
560,1302309631650418689,@afflixtions,2020-09-05 18:16:26+00:00,0,2,@afflixtions,,,San Angelo
561,1302309326405668870, ,2020-09-05 18:15:13+00:00,0,1,,,,San Angelo
562,1302308875232780288,"@realDonaldTrump There’s always a video. There’s always a picture. There’s always a reliable source (or two). This ring any bells with you, Donnie? You always say you didn’t do it, don’t know them, it’s fake news. We will remember everything on November 3! Vote @JoeBiden !!",2020-09-05 18:13:26+00:00,0,1,@realDonaldTrump @JoeBiden,,,San Angelo
563,1302308594113744896, ,2020-09-05 18:12:19+00:00,0,0,,,,San Angelo
564,1302308456167288835,Gonna tag you in something go watch it,2020-09-05 18:11:46+00:00,0,1,,,,San Angelo
565,1302308320322162690,That scene from Hereditary. The actual scene was spooky but it's more about how it just popped up and stayed on screen for a long time.,2020-09-05 18:11:13+00:00,0,0,,,,San Angelo
566,1302308256547831808,Lmao,2020-09-05 18:10:58+00:00,0,0,,,,San Angelo
567,1302308142076907521,Take a look at this home! Does it have everything you're looking for? #sellingsanangelo #realtor #homesforsalesanangelo #realestate,2020-09-05 18:10:31+00:00,0,0,,#sellingsanangelo #realtor #homesforsalesanangelo #realestate,,San Angelo
568,1302307877613457408,Sharing 2 cats and a dog with @ThadCantrell2 is the best decision I ever made ,2020-09-05 18:09:28+00:00,0,1,@ThadCantrell2,,,San Angelo
569,1302307858323771392,Thank you!,2020-09-05 18:09:23+00:00,0,0,,,,San Angelo
570,1302307752321089542,6 percent people. 6 percent. Wake up!!!,2020-09-05 18:08:58+00:00,0,0,,,,San Angelo
571,1302307232080629769,Turnip,2020-09-05 18:06:54+00:00,0,0,,,,San Angelo
572,1302307226778992643,@Cantguardrob__ @KerryJr_ join chat,2020-09-05 18:06:53+00:00,0,0,@Cantguardrob__ @KerryJr_,,,San Angelo
573,1302307187092590595,Check out Stephen Garcia's story...San Angelo Lake View -Sweetwater game back on as Mustangs quarantine https://www.gosanangelo.com/story/sports/high-school/lake-view/2020/09/05/san-angelo-lake-view-vs-sweetwater-back-mustangs-quarantine/5729560002/ via @gosanangelo #SASTsports,2020-09-05 18:06:43+00:00,0,0,@gosanangelo,#SASTsports,,San Angelo
574,1302307076551704576,Durand Jones & The Indications ,2020-09-05 18:06:17+00:00,0,0,,,,San Angelo
575,1302306695440289793,I like you ,2020-09-05 18:04:46+00:00,0,1,,,,San Angelo
576,1302306666705235973,Fuck em ,2020-09-05 18:04:39+00:00,1,1,,,,San Angelo
577,1302306648137105408,What up Milk Man,2020-09-05 18:04:35+00:00,0,0,,,,San Angelo
578,1302306466452443137,this break down is wild ,2020-09-05 18:03:51+00:00,0,3,,,,San Angelo
579,1302306249862676481,"SAISD is hiring Custodians! Interested applicants are invited to a Sidewalk Job Fair at the SAISD Admin building this Wed, Sep 9 from 8:30-10:00am. Other available positions include Cooks, Bus Drivers, Instructional Aides, Substitutes, and more. https://www.saisd.org/news-item/~board/news/post/sidewalk-job-fair-september-2020",2020-09-05 18:03:00+00:00,2,5,,,,San Angelo
580,1302305998510739457,Will you get the vaccine when it's ready?,2020-09-05 18:02:00+00:00,0,0,,,,San Angelo
581,1302305734105980930,I waited all summer for football season and I get this ass whooping of a Marshall game? Totally worth it.,2020-09-05 18:00:57+00:00,0,1,,,,San Angelo
582,1302305550613377024,This attorney general doesn’t ever try to hide his corruption. He is Trumps #1 enabler.,2020-09-05 18:00:13+00:00,0,0,,,,San Angelo
583,1302305539410587649,The only vibes to have,2020-09-05 18:00:10+00:00,0,1,,,,San Angelo
584,1302305512206237697,"As of 1:00 P.M. September 5, 2020, there are 15 new cases of COVID-19 and 1 new death reported by Tom Green County.",2020-09-05 18:00:04+00:00,0,0,,,,San Angelo
585,1302305510201470976,"As of 1:00 P.M. September 5, 2020, there are 15 new cases of COVID-19 and 1 new death reported by Tom Green County. https://trib.al/Gif7mmy",2020-09-05 18:00:03+00:00,0,0,,,,San Angelo
586,1302305491184386048,he’s having the time of his life fr bet it’s gonna make a good story in prison,2020-09-05 17:59:59+00:00,0,0,,,,San Angelo
587,1302305044390440960,"Grape Creek hosting Coahoma today! The Lady Eagles won the first set, 25-13.",2020-09-05 17:58:12+00:00,1,5,,,,San Angelo
588,1302304998030745600,Actins speak louder than words.,2020-09-05 17:58:01+00:00,0,0,,,,San Angelo
589,1302304298102140928,the thought of men- ,2020-09-05 17:55:14+00:00,0,1,,,,San Angelo
590,1302304142103379969, ,2020-09-05 17:54:37+00:00,0,0,,,,San Angelo
591,1302303997987106817,Mood for the rest of the year @BarstoolClemson,2020-09-05 17:54:03+00:00,1,8,@BarstoolClemson,,,San Angelo
592,1302303986314366976,Honestly bruh,2020-09-05 17:54:00+00:00,0,1,,,,San Angelo
593,1302303773533011968,Dak white,2020-09-05 17:53:09+00:00,0,0,,,,San Angelo
594,1302303669459783684,Yeah and then I’d throw it in reverse for good measure,2020-09-05 17:52:45+00:00,0,39,,,,San Angelo
595,1302303614942281729,Yes!,2020-09-05 17:52:32+00:00,0,0,,,,San Angelo
596,1302303476744097792,Very cool,2020-09-05 17:51:59+00:00,0,1,,,,San Angelo
597,1302303374801596418,XL,2020-09-05 17:51:34+00:00,0,0,,,,San Angelo
598,1302303357197975552,Nothing like a one handed set to the pin for the kill. #shortylife #baybayballer #makingplays @ucavball https://www.instagram.com/p/CEw4oBBgvxt/?igshid=crxirensucsa,2020-09-05 17:51:30+00:00,0,32,@ucavball,#shortylife #baybayballer #makingplays,,San Angelo
599,1302303338919149569,"lavendar essential oil, take deep breaths, tell yourself, “I are worthy, I am strong, I am beautiful 5 times, music, call a friend, take your dog on a walk, TED Talks. i love you laurn and i’m here for you always mama. ",2020-09-05 17:51:26+00:00,0,2,,,,San Angelo
600,1302302922269696006, ,2020-09-05 17:49:46+00:00,0,0,,,,San Angelo
601,1302302905773568000,"Keep Lamar cut, sign Adrian Peterson",2020-09-05 17:49:43+00:00,0,0,,,,San Angelo
602,1302302905685422081,"THATS OUR FRIEND!! She’s happy, she deserves this & much more! We’ve been through it all with her! We love you Liana ",2020-09-05 17:49:42+00:00,1,3,,,,San Angelo
603,1302302756972179456,Loooove it,2020-09-05 17:49:07+00:00,0,0,,,,San Angelo
604,1302302720104124416,"Thanks, Ella! ",2020-09-05 17:48:58+00:00,0,0,,,,San Angelo
605,1302302659102339077,Oh wow! I didn't know that!,2020-09-05 17:48:44+00:00,0,1,,,,San Angelo
606,1302302650856341504,Absolutely! Saw them open for Amon Amarth and they were incredible. Classy and true to metal. Love the Wolf God album!,2020-09-05 17:48:42+00:00,0,1,,,,San Angelo
607,1302302310966722562,,2020-09-05 17:47:21+00:00,1,15,,,,San Angelo
608,1302302210341113857,Maybe I should have a bot tweet it all out lol - a new way to book!,2020-09-05 17:46:57+00:00,0,1,,,,San Angelo
609,1302301935857553408,Awesome!!,2020-09-05 17:45:51+00:00,0,1,,,,San Angelo
610,1302301706634563586,Balls on my face,2020-09-05 17:44:57+00:00,1,16,,,,San Angelo
611,1302301686363566081,"5 de septiembre de 2020 Total de casos positivos: 3,331 Casos activos: 643 Actualmente hospitalizado: 22 Hay 15 nuevos casos positivos de COVID-19 para informar hoy: 9 casos PCR y 6 casos de antígeno. http://cosatx.us/covid19",2020-09-05 17:44:52+00:00,1,2,,,,San Angelo
612,1302301666595811334,I love this energy Lindsay ,2020-09-05 17:44:47+00:00,0,1,,,,San Angelo
613,1302301635054653448,"September 5, 2020 Total positive cases: 3,331 Active cases: 643 Currently hospitalized: 22 There are 15 new positive cases of COVID-19 to report today: 9 PCR cases and 6 antigen cases. http://cosatx.us/covid19",2020-09-05 17:44:40+00:00,2,5,,,,San Angelo
614,1302301533988626433,My nephews 2 years old today ,2020-09-05 17:44:15+00:00,1,4,,,,San Angelo
615,1302301453541933058,Gay,2020-09-05 17:43:56+00:00,0,0,,,,San Angelo
616,1302301222892781568,Permian Mitsubishi great sale hail damage $6000 off amy new car in stock on lot - come see us today 8th Street-Odessa Tx call for info 432-332-5344 - get pre-approved for auto loan in 30 seconds CALL NOW - say… https://www.instagram.com/p/CEw35B8ACFE/?igshid=11jtfenpxtmpd,2020-09-05 17:43:01+00:00,0,0,,,,San Angelo
617,1302301009600024576,"Well lucky for you I have it Around his neck, the boy hung the binoculars the scouts used and headed for the shore.",2020-09-05 17:42:10+00:00,0,2,,,,San Angelo
618,1302300963437522944,This Marshall QB ,2020-09-05 17:41:59+00:00,0,0,,,,San Angelo
619,1302300910534754304,I've named it Henry,2020-09-05 17:41:47+00:00,0,0,,,,San Angelo
620,1302300787700379649,I give my dog Zyrtec. Works well!,2020-09-05 17:41:18+00:00,0,0,,,,San Angelo
621,1302300775524245505,They don’t care or bitch like all,2020-09-05 17:41:15+00:00,0,0,,,,San Angelo
622,1302300688890966016,Tell me about it,2020-09-05 17:40:54+00:00,0,0,,,,San Angelo
623,1302300611115966464,,2020-09-05 17:40:35+00:00,0,1,,,,San Angelo
624,1302300576424787971,People never complained years ago. Why now?,2020-09-05 17:40:27+00:00,0,2,,,,San Angelo
625,1302300465535877120,Zingbot better draaagggg these idiots this year #bb22,2020-09-05 17:40:01+00:00,0,6,,#bb22,,San Angelo
626,1302300382325084168,I love that,2020-09-05 17:39:41+00:00,0,0,,,,San Angelo
627,1302300151298613248,"I hate the idea there are people who will read this and think ""hell no...""",2020-09-05 17:38:46+00:00,0,2,,,,San Angelo
628,1302300128477417474,Just a man and his pup.,2020-09-05 17:38:40+00:00,0,70,,,,San Angelo
629,1302299997451452418,Kip Dwyer (listen I tweet for the 5 people who read my book!),2020-09-05 17:38:09+00:00,0,14,,,,San Angelo
630,1302299714478657538,"Here’s another truth, he also inherited the cages that kept kids away from families",2020-09-05 17:37:02+00:00,0,0,,,,San Angelo
631,1302299604734611456,It's Saturday so no one is here and also my book isn't out for a year and a half but I wanna share the first line,2020-09-05 17:36:35+00:00,0,44,,,,San Angelo
632,1302299177146343424,I really need a squad for 2K,2020-09-05 17:34:54+00:00,0,0,,,,San Angelo
633,1302299139762511872,Stone’d,2020-09-05 17:34:45+00:00,0,0,,,,San Angelo
634,1302298980072779784,"Y’all be tweeting out y’all’s ass omm, y’all tweetin this but moving way different ",2020-09-05 17:34:07+00:00,1,5,,,,San Angelo
635,1302298314952581121,"El Departamento de Salud de San Angelo ha confirmado otra muerte relacionada con el COVID-19 en el condado de Tom Green: • Hombre, 70s, Concho County Esto lleva el total de muertes relacionado con el COVID-19 en el condado de Tom Green a 62: 44 de TGC y 18 de otros condados.",2020-09-05 17:31:28+00:00,1,0,,,,San Angelo
636,1302298224225550337,"The San Angelo Health Department has confirmed another COVID-19-related death in Tom Green County: •Male, 70s, Concho County This brings the total COVID-19-related death count in Tom Green County to 62: 44 from Tom Green County and 18 from other counties.",2020-09-05 17:31:06+00:00,0,7,,,,San Angelo
637,1302298008038576138,You know Pete and John don’t like tweet that stuff out? And the front office can’t just relay all the roster moves to every employee. Like do you wanna win a championship or have a feel good story. It’s a business,2020-09-05 17:30:15+00:00,0,0,,,,San Angelo
638,1302297986240851968,Your help is needed to honor the oldest living American to serve in World War II as he turns 111 years old next week.,2020-09-05 17:30:10+00:00,0,0,,,,San Angelo
639,1302297985464885253,Your help is needed to honor the oldest living American to serve in World War II as he turns 111 years old next week. https://trib.al/JflVz6N,2020-09-05 17:30:09+00:00,0,1,,,,San Angelo
640,1302297800907075589,people should know that being treated how you deserve to be treated should be the base minimum. we need to stop normalizing that being treated like you should be is the highest form of respect when in reality it should be standard.,2020-09-05 17:29:25+00:00,0,7,,,,San Angelo
641,1302297799493640193,i need a marg,2020-09-05 17:29:25+00:00,0,0,,,,San Angelo
642,1302297220742557698,Do you all want to field a great roster and win a championship. Or do you want some feel good stories on the team and some players you like. The NFL is a business. My job doesn’t keep feel good stories. We keep the most productive workers who will provide the best results,2020-09-05 17:27:07+00:00,0,1,,,,San Angelo
