,id,text,date,retweets,favorites,mentions,hashtags,geo,region
730,1301597804025073664,Open cell at Williams Equestrian Center in Midland. #sprayfoam #sprayfoaminsulation #metalbuilding #steelbuilding #barn #shop #barndominium #barndo #barndominiumliving #metalhome #metalhouse #customhome #construction #farm #ranch #oil #gas #energy #PermianBasin #Midland #Texas – at Midland Polo Grounds,2020-09-03 19:07:53+00:00,0,2,,#sprayfoam #sprayfoaminsulation #metalbuilding #steelbuilding #barn #shop #barndominium #barndo #barndominiumliving #metalhome #metalhouse #customhome #construction #farm #ranch #oil #gas #energy #PermianBasin #Midland #Texas,,Midland
731,1301597085305909251,Ranch on my pizza is a must!,2020-09-03 19:05:02+00:00,0,0,,,,Midland
732,1301595841254371328,I remember the old Easton!,2020-09-03 19:00:05+00:00,0,0,,,,Midland
733,1301595161500188672,Happy w my boo but this is still me when Bad Bunny comes on ,2020-09-03 18:57:23+00:00,1,1,,,,Midland
734,1301593274478743554,"I'm not saying, but I'm just saying! #ToNewness #FindYourOwnHappy @Midland, Texas https://www.instagram.com/p/CEr19EThe1AWFN1KxyXBlBiEOM1oHyg16AdecE0/?igshid=26j33vx7koy6",2020-09-03 18:49:53+00:00,0,0,,#ToNewness #FindYourOwnHappy,,Midland
735,1301592952154750977, and then mad that everyone is in their business,2020-09-03 18:48:36+00:00,0,0,,,,Midland
736,1301592827722444800,"Imma keep adding... Bishop, Shard, Rocket, Icon Add your own! @Midland, Texas https://www.instagram.com/p/CEr1wDZB6GCQVp-HtJAccAZIMSnEO9AJEhHAZo0/?igshid=1dj01e6qnepl3",2020-09-03 18:48:07+00:00,0,0,,,,Midland
737,1301592585757220864,Future Kraken Mat Barzal is gonna score an OT winner to clinch the series,2020-09-03 18:47:09+00:00,0,0,,,,Midland
738,1301592389102923776," I swear this should have been me because I live for this!!! @Midland, Texas https://www.instagram.com/p/CEr1jWwh33R-Wnfv2lHGTDFxB_RDEMdEJ8WOm80/?igshid=1wdlkuyckhxdu",2020-09-03 18:46:22+00:00,0,0,,,,Midland
739,1301592176951021568,"Admittedly, I don’t know who that is but I feel like this is good for me #GOMS",2020-09-03 18:45:32+00:00,0,0,,#GOMS,,Midland
740,1301589254720704513,I wish I I had my taste buds back,2020-09-03 18:33:55+00:00,0,1,,,,Midland
741,1301589208713265157,"I've given it '2 weeks and you'll see' for the 16th set of 2 weeks. Everything is trending down, survivability rate is increasing (99.77%), and yet the US is continuing to say 'give it 2 weeks, you'll see, a second wave is coming'...? #DemocratsHateAmerica #suckitupbuttercup",2020-09-03 18:33:44+00:00,1,0,,#DemocratsHateAmerica #suckitupbuttercup,,Midland
742,1301582165164122112,Esse sabe muito! Tem meu total respeito e pra mim é um honra ler isso desse cara que muito admiro e sabe muito da vida ,2020-09-03 18:05:45+00:00,1,1,,,,Midland
743,1301581670634618880,@CiscoNoChains,2020-09-03 18:03:47+00:00,0,0,@CiscoNoChains,,,Midland
744,1301581184284209154,@CiscoNoChains,2020-09-03 18:01:51+00:00,0,0,@CiscoNoChains,,,Midland
745,1301580166548852736,Cuz at this point I think mfs b tryna fight me when my back turnt ,2020-09-03 17:57:48+00:00,0,0,,,,Midland
746,1301578838699323397,,2020-09-03 17:52:31+00:00,0,0,,,,Midland
747,1301578834752438272,"I exclusively address groups as “girls, gays, and theys” and someone told me that I shouldn’t because it excludes straight men and honestly I’m not upset about it, they’ve had their time in the sun",2020-09-03 17:52:31+00:00,0,3,,,,Midland
748,1301577827180056578,Ooo okay ,2020-09-03 17:48:30+00:00,0,0,,,,Midland
749,1301576938767765507,you mfs don’t b tough fr ,2020-09-03 17:44:58+00:00,1,1,,,,Midland
750,1301575955769688064,"“Ter um bom emprego, ser independente, ter o próprio carro, o próprio apartamento e morar fora do país.” Antes era apenas uma frase clichê... hoje em dia é a minha realidade Abençoado de mais! #CegaElesVovó",2020-09-03 17:41:04+00:00,3,14,,#CegaElesVov,,Midland
751,1301575442567180290,JUST IN TIME!!,2020-09-03 17:39:02+00:00,0,0,,,,Midland
752,1301574570487484416,Y’all I’ve had the BIGGEST head ache from caffeine withdraws just gonna drink a cafecito para que se quite ,2020-09-03 17:35:34+00:00,0,1,,,,Midland
753,1301574244091006980,My turn!! Mamma’s heart!,2020-09-03 17:34:16+00:00,0,1,,,,Midland
754,1301574037957742593,Thank you coach!,2020-09-03 17:33:27+00:00,0,2,,,,Midland
755,1301573924749221889,Esse é o segredo ,2020-09-03 17:33:00+00:00,0,0,,,,Midland
756,1301573848660402176,Forever my greatest blessing ,2020-09-03 17:32:42+00:00,1,11,,,,Midland
757,1301573535513575424,"It’s already September... which means my next vacation is just 3 1/2 months away, I cannot wait ",2020-09-03 17:31:27+00:00,0,0,,,,Midland
758,1301573511052394498,I love you so much baby ,2020-09-03 17:31:21+00:00,0,1,,,,Midland
759,1301573451191386114,Ohhhh rapaaaah! Tá de mancada já ,2020-09-03 17:31:07+00:00,0,0,,,,Midland
760,1301572202085724163,"The Darkest Nights Produce the Brightest Stars Nighttime Photography for The Bird Book Me, Help My Business Grow ",2020-09-03 17:26:09+00:00,0,2,,,,Midland
761,1301568505431691264,SOOO PRETTY,2020-09-03 17:11:28+00:00,0,0,,,,Midland
762,1301566203891200001,I’m giving Elijah’s teachers Clorox wipes & Lysol they better not take it home for themselves it betta stay in that classroom lol,2020-09-03 17:02:19+00:00,0,0,,,,Midland
763,1301565647164301314,The Weeknd Trilogy type of day,2020-09-03 17:00:06+00:00,1,3,,,,Midland
764,1301564942726967297,I need friends who are down to book trips to cabo or cancun getting really antsy for some “unlimited drinks” lmao #randomurges,2020-09-03 16:57:18+00:00,0,9,,#randomurges,,Midland
765,1301563445238730766,Rape mine ,2020-09-03 16:51:21+00:00,0,0,,,,Midland
766,1301561687254933511,Loaded with permit in hand... 15'8 high is ready to go.,2020-09-03 16:44:22+00:00,2,59,,,,Midland
767,1301557390446272513,Anyone know any good jobs to have as a 2nd job or any ways to make money?,2020-09-03 16:27:18+00:00,0,0,,,,Midland
768,1301557250297917441,Y’all don’t know stress til you forget your wallet in a Chick-Fil-A drive thru,2020-09-03 16:26:44+00:00,1,29,,,,Midland
769,1301555292790980609, @TAPPSBaseball @TAPPSbiz @LSCSN @VYPEDFW,2020-09-03 16:18:58+00:00,0,1,@TAPPSBaseball @TAPPSbiz @LSCSN @VYPEDFW,,,Midland
770,1301554470803959810,Big bro ,2020-09-03 16:15:42+00:00,1,9,,,,Midland
771,1301552717953929216,,2020-09-03 16:08:44+00:00,0,0,,,,Midland
772,1301552254558908417,This turned out to be an awful mistake. My body is betraying me.,2020-09-03 16:06:53+00:00,0,0,,,,Midland
773,1301551465115377664,Find people who want to go where you are going!,2020-09-03 16:03:45+00:00,0,1,,,,Midland
774,1301550976789291009,Facts!!!!!!,2020-09-03 16:01:49+00:00,0,3,,,,Midland
775,1301549374992838656,Also I passed someone wearing a black lives matter shirt,2020-09-03 15:55:27+00:00,0,1,,,,Midland
776,1301548418309828608,I just schooled a white boy on socialism ITS A GOOD DAY,2020-09-03 15:51:39+00:00,0,4,,,,Midland
777,1301547720096833537,Some people’s apologies will never satisfy others. Some people will nitpick every single thing someone does when they issue out an apology. Annoying.,2020-09-03 15:48:52+00:00,0,10,,,,Midland
778,1301546967126900736,When you talking about my God make sure you put a capital “G” ,2020-09-03 15:45:53+00:00,1,10,,,,Midland
779,1301545497371357187,This man just got divorced and is already about to get remarried. When I say men ain’t I reallyyyyyyy mean it from the bottom of my heart.,2020-09-03 15:40:02+00:00,0,6,,,,Midland
780,1301543602116534273,Yeah yeah ,2020-09-03 15:32:30+00:00,0,0,,,,Midland
781,1301539863922126850,YES!!!,2020-09-03 15:17:39+00:00,0,0,,,,Midland
782,1301539800898572288, ,2020-09-03 15:17:24+00:00,0,0,,,,Midland
783,1301539060243079176,I’m in the mood to watch ponyo,2020-09-03 15:14:28+00:00,0,1,,,,Midland
784,1301538848774725633,All good! I figured when I saw another response to the post. Thanks for the clarification. Have a great day!,2020-09-03 15:13:37+00:00,0,1,,,,Midland
785,1301538256430018564,Melissa KNOWS how much hereditary freaked me out and how creepy that little girl is .. AND SHE CONTINUES TO SEND ME MEMES OF IT. Hate her ,2020-09-03 15:11:16+00:00,1,5,,,,Midland
786,1301538089844834306,Pretty girl shit ,2020-09-03 15:10:36+00:00,2,2,,,,Midland
787,1301537425660010496,love you lil brother ,2020-09-03 15:07:58+00:00,0,1,,,,Midland
788,1301537379552047111,The physical health of US is certainly a factor of why we are higher risk than some counties. Definitely agree there.,2020-09-03 15:07:47+00:00,0,0,,,,Midland
789,1301536711416197120,Was this directed at my tweets? I’m so confused because of all the responses im tagged in. Apologies if it isn’t.,2020-09-03 15:05:08+00:00,0,0,,,,Midland
790,1301536517572177921,"Thank you Ambassador Johnson for everything that you do for our country El Salvador, deeply appreciated.",2020-09-03 15:04:21+00:00,0,0,,,,Midland
791,1301536319659741184,I only said that because 94% of the other death certs are with multiple lines with Covid as the underlying cause. Maybe I’m being too harsh saying they are lazy. Might be rushed considering the circumstances. I appologize if I offended med examiners. Their job is TOUGH right now,2020-09-03 15:03:34+00:00,0,0,,,,Midland
792,1301534390120574976,Sos un desquiciado mental Tom !! Que insolencia y que mal agradecido sos !!!,2020-09-03 14:55:54+00:00,0,0,,,,Midland
793,1301533413204258816,No demostréis la ignorancia que aún existe en algunos de nosotros los Salvadoreños! Esa duda ya se aclaró decenas de veces...,2020-09-03 14:52:01+00:00,0,3,,,,Midland
794,1301530931807899648,Connecting users electronically -...#educationtechnologyinsights via @edtechh http://distance-and-remote-learning.educationtechnologyinsights.com/cxoinsights/connecting-users-electronically-efficiently-and-conveniently-at-a-distance-nid-1180.html #connectingusers #distancelearning2020 #highered,2020-09-03 14:42:10+00:00,0,0,@edtechh,#educationtechnologyinsights #connectingusers #distancelearning2020 #highered,,Midland
795,1301528483101892609,Like this: https://twitter.com/gidmk/status/1300321551468785665?s=21,2020-09-03 14:32:26+00:00,0,0,,,,Midland
796,1301528296455368706,"I don’t have any expertise in anything medical. But I do have the ability to read charts, numbers, and look up to individuals who do have expertise in these fields.",2020-09-03 14:31:41+00:00,0,0,,,,Midland
797,1301527270700400640,"ITS NOT FAIR, I WANT ED, NOT TED",2020-09-03 14:27:37+00:00,0,0,,,,Midland
798,1301524922028654593,Was this response projected at me? This doesn’t change anything I expelled in my previous tweets. Blunt force trauma has no bearing on prior comorbities. This is apples to oranges comparison.,2020-09-03 14:18:17+00:00,0,2,,,,Midland
799,1301524655459631104,Congratulations corazón!! ,2020-09-03 14:17:13+00:00,0,1,,,,Midland
800,1301523028229193729,Why am I getting Jason Kidd flashbacks,2020-09-03 14:10:45+00:00,0,1,,,,Midland
801,1301522162826842112,"If anything, having Covid-19 as the ONLY thing written on a death certificate is complete laziness on the part of the medical examiner since there are multiple effects from Covid.",2020-09-03 14:07:19+00:00,0,1,,,,Midland
802,1301522058954895361,I be having dreams that make me wake up in my feelings n shit,2020-09-03 14:06:54+00:00,4,7,,,,Midland
803,1301521948275544070,"The true comorbities like Asthma, Diabetes, HBP, and other diseases are the real comorbities that exacerbated the effects of Covid. The 2.6 comorbities number makes sense as many who entered critical stages had ARDS and Renal Failure before passing.",2020-09-03 14:06:28+00:00,0,1,,,,Midland
804,1301521470108184576,"It’s hasn’t been debunked, but the 6% comes from Death Certs only having CV listed as the ONLY thing. What people fail to realize looking at the chart is many of these “Comorbities” are also direct outcomes from CV (ARDS, Renal Failure, Stroke, Cardiac Arrest, etc).",2020-09-03 14:04:34+00:00,0,4,,,,Midland
805,1301520726558748677,"We've had measurable precip three times! Totaling 0.59"" during that span",2020-09-03 14:01:36+00:00,0,0,,,,Midland
806,1301518650827038721, To passando mal ,2020-09-03 13:53:22+00:00,0,1,,,,Midland
807,1301517122456125444,@Hernandez14Lizz,2020-09-03 13:47:17+00:00,1,2,@Hernandez14Lizz,,,Midland
808,1301516912338272257,I get an air fryer and go off and tell everyone else to get one. ,2020-09-03 13:46:27+00:00,0,3,,,,Midland
809,1301516025071046658,I legit had a dream I was eating at Thanksgiving. With all the good foods lined up.,2020-09-03 13:42:56+00:00,0,3,,,,Midland
810,1301513131835953164,"I do own Mahomes in two leagues, but one is Super Flex Dynasty and other is life long keeper. I can’t own Ravens cuz I’m legit terrible luck. So I’ll be watching Jackson on someone else’s squad forever lol",2020-09-03 13:31:26+00:00,0,1,,,,Midland
811,1301512588501700608,Truth. I think the one thing I know for certain is waiting on QB. I’ve seen guys like Stafford fall into round 11/12. I’ll be doing some mocks later today and see what kind of value I can get in those mid rounds and any surprise falls.,2020-09-03 13:29:16+00:00,0,1,,,,Midland
812,1301512491466448899,I need to learn how to sew ,2020-09-03 13:28:53+00:00,2,5,,,,Midland
813,1301511611715383302,"That’s probably the area I’d focus him too is towards flex. WR so damn deep this year, I might go 3-4 RB’s and a WR in first 4/5 rounds. The drop off between RB15 to RB20 is ugly this year.",2020-09-03 13:25:23+00:00,0,1,,,,Midland
814,1301510660019417088,"Wow. I actually didn’t realize he caught that many balls. Where the hell was I last year? Lol In that case, I should probably look more into him for fantasy purposes. I got 3 drafts this weekend. I’ll give him more credance in DFS too.",2020-09-03 13:21:36+00:00,0,0,,,,Midland
815,1301509527171403776,You got me there. Never thought of it that way. I’m too one sided on backs being more multi-faceted nowadays. Thinking of the Barkley’s and CMC’s of the world and less of the traditional back. I do respect his power and vision. That is a huge plus for Fournette.,2020-09-03 13:17:06+00:00,0,0,,,,Midland
816,1301508601379520513,Maybe his skill set just wasn’t being utilized properly in Jax. God only knows that offense hasn’t be a jug in recent years. Ground and pound back in 2018. Perhaps I’m being too harsh. He should be good fit with the Bucs offense.,2020-09-03 13:13:26+00:00,0,0,,,,Midland
817,1301507675201572864,Exactly haha,2020-09-03 13:09:45+00:00,0,0,,,,Midland
818,1301506119446204419,"Straight up. I’ll be damned if I mask up during sex. If that’s how I go, it’s how I go. Going down happy ",2020-09-03 13:03:34+00:00,0,2,,,,Midland
819,1301502776518815746,This is something I need to do but I’m tempted to just make a new one because it’ll take me forever ,2020-09-03 12:50:17+00:00,0,0,,,,Midland
820,1301501901910007808,Lmao chill culo chat,2020-09-03 12:46:48+00:00,0,1,,,,Midland
821,1301490587447767040,"It’s pretty sad that I have to say this, but if I expire from this earth, I want you to write on my headstone, “Great friend, Great family member, Decent ball player, Passionate Official and Coach, and, He Did not Comply!” Thank you.",2020-09-03 12:01:51+00:00,0,3,,,,Midland
822,1301486034077863936,The last thing I wrote in cursive that wasn’t a signature was in 2001 lol It’s cool that some people still do it. I just can’t get into it.,2020-09-03 11:43:45+00:00,0,1,,,,Midland
823,1301477838978035715,"Have a wonderful day. It's going to be awesome! @Midland, Texas https://www.instagram.com/p/CErBddDBKY-QELI-ImSW-eFMI60X-QQH1bynAo0/?igshid=2bi1za5wq79v",2020-09-03 11:11:11+00:00,0,0,,,,Midland
824,1301458651698343938,get me tf outta hurrrr,2020-09-03 09:54:57+00:00,1,0,,,,Midland
825,1301456729478254592,That Magic Johnson! Such a great number. I need to order one.,2020-09-03 09:47:18+00:00,0,1,,,,Midland
826,1301421002753179649,Oooo. I might have to crank some 90s music during the end of the shift when I go on balloon duty. Good idea. We can do this ,2020-09-03 07:25:20+00:00,0,1,,,,Midland
827,1301413481246339072,You’re our cloud leader Mr GOES-16. Is the membership to the cloud cult still 10% earnings?,2020-09-03 06:55:27+00:00,0,4,,,,Midland
828,1301413108976701440,"The thing that’s crazy is I heard about all of these through the media. The, “If I didn’t hear it from ________, they must be hiding something...” gang is really annoying. Also, they’ve been doing this for years but they must not have been paying any attention.",2020-09-03 06:53:58+00:00,0,5,,,,Midland
829,1301412818869194752,Y’all ever turn on the Weather Channel and they’re not talking about weather?,2020-09-03 06:52:49+00:00,0,3,,,,Midland
830,1301410069066723332,Got really high and ate all of Moe’s ice cream. I feel like a fatass.,2020-09-03 06:41:54+00:00,0,1,,,,Midland
831,1301399765695987712,"Anyone else annoyed that we took 3+ years to learn cursive in school and now have almost no use for it anymore, outside a signature?",2020-09-03 06:00:57+00:00,0,3,,,,Midland
832,1301396017397391360,"Also, to all the articles saying these are the first trans characters in Star Trek, The Next Generation had an entire episode of season 5 about a trans alien and the evils of conversion therapy, no I’m not kidding this was in 1989",2020-09-03 05:46:03+00:00,0,1,,,,Midland
833,1301395945729544195," i just do what I do, saves como? All I ask is that you Don’t SHAVE or forget to exfoliate Hydrate Moisturize Can’t wait to meet you, see you, &amp; service you! &gt;&gt; #WaxedByJan &lt;&lt; #BAREBADDIES #waxer… https://www.instagram.com/p/CEqcN82BluF/?igshid=1bqrl56lzed3y",2020-09-03 05:45:46+00:00,0,0,,#WaxedByJan #BAREBADDIES #waxer,,Midland
834,1301395502861365248, https://twitter.com/andyholloway/status/1301159360660267009,2020-09-03 05:44:01+00:00,0,2,,,,Midland
835,1301393638858067968,This set was !!! The Guys took the SCMF cake tho! Fucking journey! ,2020-09-03 05:36:36+00:00,0,2,,,,Midland
836,1301391238034321408,Tiller album coming in the fall ,2020-09-03 05:27:04+00:00,0,4,,,,Midland
837,1301391217251450880,Heuuuuuurm Xico Maria 3x,2020-09-03 05:26:59+00:00,0,1,,,,Midland
838,1301391144627187713,Aiiii não né tartaruga ninja ,2020-09-03 05:26:42+00:00,0,1,,,,Midland
839,1301391060967530496,Realidade! Vai aprender que 10 reais de lanche Uber no final do mês vira 800 ,2020-09-03 05:26:22+00:00,0,1,,,,Midland
840,1301390378319450112,"Just a heads up for all that work in the government to start saving up money in an emergency fund. My wife and I have been doing that since the last shutdown and will continue to do so. I know it’s hard, but if it happens, we will work together to make sure everyone is okay ",2020-09-03 05:23:39+00:00,0,4,,,,Midland
841,1301389522706472961, look at that growth. If you’re a wax-pert you need to hop on &amp; try ezeecosmetics !! I’m currently obsessed with the Turmerika formula. I have other brands but I literally only need one Use WAXEDBYJAN_2020… https://www.instagram.com/p/CEqZS7RBuv5/?igshid=9ohpx6xkho27,2020-09-03 05:20:15+00:00,0,0,,,,Midland
842,1301387964954501120,12 year old me is QUAKING right now,2020-09-03 05:14:04+00:00,0,1,,,,Midland
843,1301387844871544832,“Star Trek Discovery Season 3 will feature the Star Trek canons first trans and non-binary characters” Me:,2020-09-03 05:13:35+00:00,0,1,,,,Midland
844,1301384526149693442,00z GFS run still holding firm. Euro...not so much. I need this front like a fish needs water. Like humans need air. Like Steelers fans need to relive the past. GIVE ME COLD FRONT OR GIVE ME DEATH (or at least some rain) ,2020-09-03 05:00:24+00:00,0,2,,,,Midland
845,1301382844883689473,This is despicable lol,2020-09-03 04:53:43+00:00,0,2,,,,Midland
846,1301381504736559104,"I can’t wait for the real sport to start in 7 days. MLB has been entertaining to watch, but I’m dying for football. #NFL",2020-09-03 04:48:23+00:00,0,2,,#NFL #NFL,,Midland
847,1301372270573768717, ,2020-09-03 04:11:42+00:00,0,0,,,,Midland
848,1301368682359160835,"where do the girls with 1,000,000 belong too!?? @777jorgeivan yellow brick road?",2020-09-03 03:57:26+00:00,0,0,@777jorgeivan,,,Midland
849,1301368016005820417,"Me in Middle School: I’m not bi, no way My Spotify top 100 with girls/girls/boys and many French songs: Okay, whatever you want to believe sweetie",2020-09-03 03:54:47+00:00,0,0,,,,Midland
850,1301367432955793408,Bruh if the thunder pull this hoe out ima know something,2020-09-03 03:52:28+00:00,0,1,,,,Midland
851,1301367408666476544,This is the longest 2.6 seconds of my life,2020-09-03 03:52:23+00:00,0,2,,,,Midland
852,1301364938573832193,Transform your “demons” let ego go,2020-09-03 03:42:34+00:00,1,3,,,,Midland
853,1301363888965988358,"Dallas, Texas",2020-09-03 03:38:23+00:00,0,0,,,,Midland
854,1301362486579527680,Jaja se le mamaron al chelseeeeeea,2020-09-03 03:32:49+00:00,0,0,,,,Midland
855,1301362437736878085,Holy prefect,2020-09-03 03:32:37+00:00,0,0,,,,Midland
856,1301360959471091715,i'm going to marry this girl.,2020-09-03 03:26:45+00:00,2,11,,,,Midland
857,1301360006835601411,thinking about turning off this mans playstation rn ,2020-09-03 03:22:58+00:00,0,6,,,,Midland
858,1301357689180762112,my dream is to get my dad his DREAM truck. cant wait to live this moment too,2020-09-03 03:13:45+00:00,0,0,,,,Midland
859,1301353389796864001,,2020-09-03 02:56:40+00:00,0,0,,,,Midland
860,1301353100666642433,Vai acabar se fdd,2020-09-03 02:55:31+00:00,0,1,,,,Midland
861,1301352655432962048,So Sick!!!,2020-09-03 02:53:45+00:00,0,2,,,,Midland
862,1301352419541094400, ,2020-09-03 02:52:49+00:00,8,100,,,,Midland
863,1301352230864338944,@NYGovCuomo https://nypost.com/2020/09/02/cuomo-trump-better-have-an-army-to-protect-him-if-he-comes-to-nyc/ Have you lost your fucking mind,2020-09-03 02:52:04+00:00,0,0,@NYGovCuomo,,,Midland
864,1301351916954439682,I’ll have to say... Stella was one of the best cooks I know...you come by it pretty honestly!,2020-09-03 02:50:49+00:00,0,2,,,,Midland
865,1301351317949108227,Go to jail and do not pass go.,2020-09-03 02:48:26+00:00,0,0,,,,Midland
866,1301351118459539457,I’m celebrating when that gavel is taking out of her hand. This might even call for a drink.,2020-09-03 02:47:39+00:00,0,0,,,,Midland
867,1301350832840101893,Yes we are!,2020-09-03 02:46:31+00:00,0,0,,,,Midland
868,1301350705719119872,Yes! I agree. Reminded me of a kid making up a lie.,2020-09-03 02:46:00+00:00,0,0,,,,Midland
869,1301350332992237568,Lol Love this analogy.,2020-09-03 02:44:31+00:00,0,0,,,,Midland
870,1301349116170121216,"Ate at @LandrysInc @SaltgrassSteak tonight. It was a big #mistake. #SocialDistancing was not being observed by the #restaurant and staff did not #WearMasks properly. So much for their #COVID__19 ""preventative measures"" – at Saltgrass Steakhouse",2020-09-03 02:39:41+00:00,1,0,@LandrysInc @SaltgrassSteak,#mistake #SocialDistancing #restaurant #WearMasks #COVID__19,,Midland
871,1301348828625489921,"I'm at Midland International Airport (MAF) in Midland, TX",2020-09-03 02:38:33+00:00,0,0,,,,Midland
872,1301345582489927682,"I need a fat ass shoulder tatt ,maybe a rib tatt also",2020-09-03 02:25:39+00:00,1,5,,,,Midland
873,1301344881068175364,#SexIsGreatButHaveYou Been on a mucusless diet to build your immune system? #SomeGoodNews,2020-09-03 02:22:52+00:00,0,0,,#SexIsGreatButHaveYou #SomeGoodNews,,Midland
874,1301344355123367937,Inveja,2020-09-03 02:20:46+00:00,0,0,,,,Midland
875,1301344179931549697,Sem duvidas ,2020-09-03 02:20:04+00:00,0,1,,,,Midland
876,1301343951618703363,"Rest in Peace the greatest @mets ever ..... Dad named me after you now both are watching the games in heaven. #RIP41 #riptomseaver #riptomterrific #RIPTheFranchise @Citi Field, Queens NY https://www.instagram.com/p/CEqEkwjjR0C/?igshid=cm7nmm1jghj2",2020-09-03 02:19:10+00:00,0,0,@Mets,#RIP41 #riptomseaver #riptomterrific #RIPTheFranchise,,Midland
877,1301343110895669254,OH MY GOODNESS RICHARD,2020-09-03 02:15:50+00:00,0,0,,,,Midland
878,1301342474120687617,What just happened lol.,2020-09-03 02:13:18+00:00,0,1,,,,Midland
879,1301337622128844801,No es sano pensar que las personas van a cambiar.,2020-09-03 01:54:01+00:00,0,0,,,,Midland
880,1301337023719124992,Me gustaría ver a @TigresOficial con NIKE,2020-09-03 01:51:38+00:00,0,1,@TigresOficial,,,Midland
881,1301336879124619265,He wasn’t wrong and I’m very glad he brought attention to it. You should hear the snide conversations about “the hoax that will be gone in November” in relation to the re-entry plan for our students coming back in-person next week. ,2020-09-03 01:51:04+00:00,0,0,,,,Midland
882,1301325864303579138,anxiety stays kicking my asss,2020-09-03 01:07:18+00:00,2,4,,,,Midland
883,1301325159572402176,Light gray just Incase you decide to make it a guest room later and you don’t have to paint it again!,2020-09-03 01:04:30+00:00,0,1,,,,Midland
884,1301323603447885826,I just got my nose pierced and let’s just say... I nearly passed out.,2020-09-03 00:58:19+00:00,0,3,,,,Midland
885,1301323421608030209,Salu2 crack,2020-09-03 00:57:35+00:00,0,0,,,,Midland
886,1301322597867683844,"Soy alguien bastante selectivo. Sé estar solo, y si te elijo es porque quiero estar contigo, no por necesidad.",2020-09-03 00:54:19+00:00,1,3,,,,Midland
887,1301321497672404996, ,2020-09-03 00:49:57+00:00,0,1,,,,Midland
888,1301318180380585985,I wanna be this talented,2020-09-03 00:36:46+00:00,0,0,,,,Midland
889,1301314638978650112,This video got better and better,2020-09-03 00:22:41+00:00,0,1,,,,Midland
0,1302033588909682689,Me and my dad can talk about the game all day.,2020-09-04 23:59:32+00:00,2,2,,,,Midland
