,id,text,date,retweets,favorites,mentions,hashtags,geo,region
459,1302343444984197120,Ready to pick up or ship!! Orange Spice smells amazing!! $11 ,2020-09-05 20:30:48+00:00,0,7,,,,Midland
460,1302343375690100738,My ride height is damn near airred out. 40psi in the front and 22 in the rear.,2020-09-05 20:30:31+00:00,0,0,,,,Midland
461,1302343361052004355,"Sending people to forced labor camps or possibly even have their organs harvested simply for speaking out against the government is not rule of law. It's authoritarianism, that's what China does",2020-09-05 20:30:28+00:00,0,1,,,,Midland
462,1302343249366077441,"This is some cool shit... I thought Austin was a liberal shithole but come 2 find out, patriots were(past tense) hiding away in droves over there! I'm so proud of my fellow Texans. #Trump2020 !",2020-09-05 20:30:01+00:00,0,1,,#Trump2020,,Midland
463,1302343120617705472,Hoping the love is shared with legal dreamers too - kids who have aged-out in country due to employment visa backlog.,2020-09-05 20:29:30+00:00,0,0,,,,Midland
464,1302343031186653186,Shrooms or what lol,2020-09-05 20:29:09+00:00,0,0,,,,Midland
465,1302343017928458245,Have Hong kongers attacked businesses homes or civilians? No they have not at all. Sending people to prison who are willing burn loot assault and murder their way across the United States and terrorize the civilian population is called rule of law.,2020-09-05 20:29:06+00:00,0,1,,,,Midland
466,1302342898118275083,i wanna be this drunk tonight ,2020-09-05 20:28:37+00:00,0,1,,,,Midland
467,1302342884742619138,Awful decision,2020-09-05 20:28:34+00:00,0,0,,,,Midland
468,1302342712868380672,Me rn,2020-09-05 20:27:53+00:00,0,1,,,,Midland
469,1302342709978501120,WE LOVE TO SEE IT,2020-09-05 20:27:53+00:00,0,0,,,,Midland
470,1302342425537581056,happy birthday! ,2020-09-05 20:26:45+00:00,0,1,,,,Midland
471,1302342296839610369,I can’t seem to load into my story mode,2020-09-05 20:26:14+00:00,0,2,,,,Midland
472,1302342283736555525, ,2020-09-05 20:26:11+00:00,0,0,,,,Midland
473,1302342193454223370,,2020-09-05 20:25:49+00:00,0,0,,,,Midland
474,1302341959328116737,Lol who can swim ?,2020-09-05 20:24:54+00:00,0,0,,,,Midland
475,1302341957239410691,:(,2020-09-05 20:24:53+00:00,0,1,,,,Midland
476,1302341934258753538,I want a cool planner so I can write down & stop forgetting everything,2020-09-05 20:24:48+00:00,0,3,,,,Midland
477,1302341857502998531,Yeah because one bad thing immediately erases every good thing you've done and brands you as a bad person,2020-09-05 20:24:29+00:00,0,3,,,,Midland
478,1302341622995333128,New baby @evilink in odessa ask for lil tweety ! https://twitter.com/asaptammss/status/1302299419413557249,2020-09-05 20:23:33+00:00,2,20,,,,Midland
479,1302341571657035782,"Hey ESPN, Texas state is not in San Marcos CA",2020-09-05 20:23:21+00:00,0,1,,,,Midland
480,1302341234485334017,Honestly the catharsis of telling a middle aged white woman to shut up is equivalent to like 3 years of therapy,2020-09-05 20:22:01+00:00,0,1,,,,Midland
481,1302341207629197315,been becoming a better me and I couldn’t be happier ,2020-09-05 20:21:54+00:00,0,0,,,,Midland
482,1302341183511826433,"Midland, TX",2020-09-05 20:21:49+00:00,0,1,,,,Midland
483,1302340985230364672,Nope,2020-09-05 20:21:01+00:00,0,0,,,,Midland
484,1302340917970558976,Nn mais les tweets n'avaient aucun sens,2020-09-05 20:20:45+00:00,0,0,,,,Midland
485,1302340900530597902,"“No hay pedo, hay peda”has become my fav thing to say ",2020-09-05 20:20:41+00:00,0,9,,,,Midland
486,1302340258860806145,LOL,2020-09-05 20:18:08+00:00,0,0,,,,Midland
487,1302340150412947456,If I was a millionaire.. I don’t want a Mansion. Give me a high floor condo near the beach and you got me there,2020-09-05 20:17:42+00:00,0,2,,,,Midland
488,1302340016346103811,NO DRUGS FOUND IN HER HOME! #JusticeForBreonnaTaylor,2020-09-05 20:17:10+00:00,2,4,,#JusticeForBreonnaTaylor,,Midland
489,1302339959257550848,"News from #FortStockton, #Texas via @CBS7News ... ""Pop-up art installation hopes to inspire healing and more in this on-going #pandemic"" https://westexmissioner.blogspot.com/2020/09/in-news-pop-up-art-installation-hopes.html Going on TODAY, closes at 9 pm",2020-09-05 20:16:57+00:00,0,0,@CBS7News,#FortStockton #Texas #pandemic,,Midland
490,1302339570332205056,I hate yes men y’all can’t eva bee roun me ,2020-09-05 20:15:24+00:00,0,0,,,,Midland
491,1302339456427528195,?,2020-09-05 20:14:57+00:00,0,0,,,,Midland
492,1302339431693717510,No thanks Mr. Asthma so I can’t serve,2020-09-05 20:14:51+00:00,0,0,,,,Midland
493,1302339395228499973,Hopefully ET is on that list soon,2020-09-05 20:14:42+00:00,0,2,,,,Midland
494,1302339316019068928,I totally love this pic,2020-09-05 20:14:23+00:00,1,1,,,,Midland
495,1302339223564017665,De hecho.. yo soy ciudadano.. y no votaria por correo.. pa mi es una estafa.. y por lo menos mi voto lo tiene trump,2020-09-05 20:14:01+00:00,0,2,,,,Midland
496,1302339199362912256,"Yes, sir! Can I get a Venti Strawberry Lemonade açaí refreshener?",2020-09-05 20:13:56+00:00,0,2,,,,Midland
497,1302339167024680960,if someone white tells me to go back to my country i will simply say no u ,2020-09-05 20:13:48+00:00,0,14,,,,Midland
498,1302339049848475648,Stop lying!!!!!... 2000 babies didnt even watch my wife and kids,2020-09-05 20:13:20+00:00,0,0,,,,Midland
499,1302338864254726147,De tes rt,2020-09-05 20:12:36+00:00,0,0,,,,Midland
500,1302338713863815176,Sitting here between my okra and tomato plants and about to cry because it is going to be in the 50s on Wednesday. I am not ready to say goodbye to these plants I've kept alive all summer.,2020-09-05 20:12:00+00:00,0,3,,,,Midland
501,1302338696327426049,I just hope GTA 6 uses the same engine as RDR2,2020-09-05 20:11:56+00:00,0,0,,,,Midland
502,1302338646503305216,That’s a no from me. Trump 2020,2020-09-05 20:11:44+00:00,0,1,,,,Midland
503,1302338622868385800,Here is the video of Mr. Howell being beaten to death by Ector County Deputies! No medical attention given to him as he died alone in his cell! https://www.oaoa.com/wallace-howell-bodycam-footage-part-1/video_d4aebc8c-eeda-11ea-b5ef-031192b2ec6b.html?mode=jqm.,2020-09-05 20:11:38+00:00,4,2,,,,Midland
504,1302338500709224448,Require showers before riots,2020-09-05 20:11:09+00:00,0,0,,,,Midland
505,1302338494040363009,"Some little kid just ran up, head butted my leg and ran off. Kids birthday parties are weird.",2020-09-05 20:11:07+00:00,0,2,,,,Midland
506,1302338484577894400,You got on an airplane in April at the height of this pandemic so who the hell are you to be calling out anyone else hypocrite.,2020-09-05 20:11:05+00:00,0,2,,,,Midland
507,1302338273126371329,lets go,2020-09-05 20:10:15+00:00,0,1,,,,Midland
508,1302338197691740160,J'ai absolument rien compris,2020-09-05 20:09:57+00:00,0,0,,,,Midland
509,1302338049519636482,Etsitante,2020-09-05 20:09:21+00:00,0,0,,,,Midland
510,1302338017881972738,"You didnt get it when he said ""my acting days are over ""huh??.",2020-09-05 20:09:14+00:00,0,0,,,,Midland
511,1302337977776037888, ,2020-09-05 20:09:04+00:00,0,0,,,,Midland
512,1302337975775309825,Actually you are,2020-09-05 20:09:04+00:00,0,0,,,,Midland
513,1302337848675270662,,2020-09-05 20:08:34+00:00,306,1593,,,,Midland
514,1302337615199436800,No Drugs Were Found In Her Apartment!!!! #JusticeForBreonnaTaylor,2020-09-05 20:07:38+00:00,4,9,,#JusticeForBreonnaTaylor,,Midland
515,1302337328178962433,You would think so but Max Payne 3 had better graphics than GTA V and it was released prior to GTA,2020-09-05 20:06:29+00:00,0,1,,,,Midland
516,1302337215578673154,You don’t have to wait until you’re at church to worship. Start singing to God this evening. Set your heart toward Him. #mygathering,2020-09-05 20:06:03+00:00,0,0,,#mygathering,,Midland
517,1302337067045842951,"I feel u !! I try to alternate between a chicken or beef meal, and have two sides - either two veggies, or a veggie and rice w sombal! Trying to expand ,, but those meals are usually pretty easy to meal prep a week ahead or whatever!",2020-09-05 20:05:27+00:00,0,1,,,,Midland
518,1302336982245351426,coger,2020-09-05 20:05:07+00:00,0,1,,,,Midland
519,1302336904063524866,Tu sais si t’écrivais mon prénom normalement ce serais plus rapide ça te ferais économiser du temps,2020-09-05 20:04:48+00:00,0,0,,,,Midland
520,1302336687226466310,unliked bestie,2020-09-05 20:03:57+00:00,0,0,,,,Midland
521,1302336644482301953,Shot five times and struggled with her last breaths for twenty minutes before medical aid was given to her! #JusticeForBreonnaTaylor,2020-09-05 20:03:46+00:00,139,203,,#JusticeForBreonnaTaylor,,Midland
522,1302336617378656256,Wow! I’m on my way to Dallas as we speak ,2020-09-05 20:03:40+00:00,1,5,,,,Midland
523,1302336594091937795,"Do you know who is @Nasty_CSA and have you heard someof his tracks?, #AskBigSean",2020-09-05 20:03:34+00:00,0,2,@Nasty_CSA,#AskBigSean #AskBigSean,,Midland
524,1302336467860164610,Et toi ta une pp deku x Bakugo,2020-09-05 20:03:04+00:00,0,0,,,,Midland
525,1302336466912260096,"This whole episode has me thinking back to the final scene of Godfather II. Where Sonny says only a sucker sacrifices his life for his country. Maybe he didn't use the word ""sucker,"" but that was the sentiment.",2020-09-05 20:03:04+00:00,0,0,,,,Midland
526,1302336462910902273,yup,2020-09-05 20:03:03+00:00,0,0,,,,Midland
527,1302336324641398786,"If there was any doubt we are in the upside down, it has been dispelled...",2020-09-05 20:02:30+00:00,0,2,,,,Midland
528,1302336319239204865,@FortStocktonISD @Andrews_ISD,2020-09-05 20:02:29+00:00,0,2,@FortStocktonISD @Andrews_ISD,,,Midland
529,1302336252264493064,C’était un coup de pression j’ai rien à balancer,2020-09-05 20:02:13+00:00,0,0,,,,Midland
530,1302336227899777026,I think it's time for a BrisketCoin.,2020-09-05 20:02:07+00:00,0,0,,,,Midland
531,1302336168843816960,"@mcsga1 @MCsports1972 Coach Williams and our Men's Golf Team showing their Chap's Pride and promoting proper safety by wearing their masks. Their first competition takes place at the Andrews College/Amateur Invitational, September 12-13 in Andrews, TX. http://gochaps.com/chapgolf/index.php",2020-09-05 20:01:53+00:00,0,0,@mcsga1 @MCsports1972,,,Midland
532,1302336043140685824,"Most banks, credit unions, and other lenders don’t want to see you default on your loan or face repossession. It destroys customer relationships, it’s expensive, and it takes a lot of everyone’s time. ",2020-09-05 20:01:23+00:00,0,0,,,,Midland
533,1302336005991813120,Type 2 diabetes is almost always preventable and often reversible through diet and lifestyle changes. Learn more by registering for this Thursday's FREE Zoom class: https://loom.ly/5YBh9hw #PlantBasedEducation #PlantBasedWestTexas #PlantBased #PlantBasedClasses #PlantBasedDiet,2020-09-05 20:01:14+00:00,0,0,,#PlantBasedEducation #PlantBasedWestTexas #PlantBased #PlantBasedClasses #PlantBasedDiet,,Midland
534,1302336003131179009,J’ai une envie soudaine de te donnais une bonne raison de chialer,2020-09-05 20:01:14+00:00,0,0,,,,Midland
535,1302335949028945920,BRUH ,2020-09-05 20:01:01+00:00,0,10,,,,Midland
536,1302335788831485952,"@mcsga1 @MCsports1972 @mc Luis A. Martínez is from Caracas, Venezuela and Adam Coull is from Sydney, Australia. Their first tournament takes place September 12-13 in Andrews, TX http://www.gochaps.com/chapgolf/roster.php",2020-09-05 20:00:22+00:00,0,0,@mcsga1 @MCsports1972 @mc,,,Midland
537,1302335743919034368,Non stp,2020-09-05 20:00:12+00:00,0,0,,,,Midland
538,1302335712809938945,Vote here ,2020-09-05 20:00:04+00:00,2,1,,,,Midland
539,1302335683575586818,Mejor estudien que mal verde no puede andar cuidando a tanto malandro!,2020-09-05 19:59:57+00:00,0,0,,,,Midland
540,1302335614298267654,,2020-09-05 19:59:41+00:00,0,1,,,,Midland
541,1302335532568109056,Honestly fuck @DanielCameronAG. I hope he loses his debit card and then forgets his new PIN number every day for the rest of his life.,2020-09-05 19:59:21+00:00,0,0,@DanielCameronAG,,,Midland
542,1302335484979548162,"Do u have any restrictions or anything? Vegan, dairy, gluten etc?",2020-09-05 19:59:10+00:00,0,0,,,,Midland
543,1302335439584538624,Merci ,2020-09-05 19:58:59+00:00,0,0,,,,Midland
544,1302335160248160258,Inoue haceme tu mujerrrrrrrrrrrrrrrr,2020-09-05 19:57:53+00:00,0,0,,,,Midland
545,1302335141629571072,Burgermeister is my personal favorite,2020-09-05 19:57:48+00:00,0,1,,,,Midland
546,1302334965875642368,"You have made your own version of 4 cousins???, help me understand",2020-09-05 19:57:06+00:00,0,0,,,,Midland
547,1302334962444701697,Last night was a fuknn movie!,2020-09-05 19:57:05+00:00,0,0,,,,Midland
548,1302334785340272646,je m’ennuie purée,2020-09-05 19:56:23+00:00,0,1,,,,Midland
549,1302334759159373830,*détraquée,2020-09-05 19:56:17+00:00,0,0,,,,Midland
550,1302334687386402817,Sale détraqué,2020-09-05 19:56:00+00:00,0,0,,,,Midland
551,1302334630109106176,I appreciate you so much baby ,2020-09-05 19:55:46+00:00,0,1,,,,Midland
552,1302334552657006598,You succeeded on that baby ,2020-09-05 19:55:28+00:00,0,1,,,,Midland
553,1302334508805632002,Committed to the train.,2020-09-05 19:55:17+00:00,0,0,,,,Midland
554,1302334442162262016,These pre-period cramps really tryna take me out,2020-09-05 19:55:01+00:00,0,4,,,,Midland
555,1302334359773556738,UFFFFFFFFFFFFFFFFFFFF,2020-09-05 19:54:42+00:00,1,8,,,,Midland
556,1302334272519499776,I be mad af when the girl i like got a bf... smh can you believe it ,2020-09-05 19:54:21+00:00,1,0,,,,Midland
557,1302334160254664704,Flawless victory here ,2020-09-05 19:53:54+00:00,1,2,,,,Midland
558,1302334085159890944,He did say he would be back by week 1 ,2020-09-05 19:53:36+00:00,0,1,,,,Midland
559,1302333872223420421,“i GoT yOuR liCeNsE pLaTE” okay ?? And “i GoT yOuR gIrLfIeNd oN sPeEd DiAl” ,2020-09-05 19:52:45+00:00,0,1,,,,Midland
560,1302333845757480964,my heart hurts ,2020-09-05 19:52:39+00:00,0,2,,,,Midland
561,1302333663858884608, ,2020-09-05 19:51:56+00:00,1,1,,,,Midland
562,1302333578022285312, ,2020-09-05 19:51:35+00:00,3,22,,,,Midland
563,1302333493494648832, ,2020-09-05 19:51:15+00:00,0,0,,,,Midland
564,1302333481306017794, ,2020-09-05 19:51:12+00:00,1,7,,,,Midland
565,1302333454634319880,Its so funny,2020-09-05 19:51:06+00:00,0,1,,,,Midland
566,1302333327244963840,@vaaleriesubia yeah,2020-09-05 19:50:36+00:00,0,0,@vaaleriesubia,,,Midland
567,1302333049011666944,Click FOLLOW for The Gang: Cpl Harper Lilly ( #irishwolfhound #sheepdog ) #chewbacca ( #chiuahua #poodle ) Bruhounee ( #chihuahua ) #Midnight ( #shitzu #chihuahua ) #Bodacious ( #toychihuahua #americanpitbull ) #labordayweekend #Texas #Peace #Love #Dogs,2020-09-05 19:49:29+00:00,0,1,,#irishwolfhound #sheepdog #chewbacca #chiuahua #poodle #chihuahua #Midnight #shitzu #chihuahua #Bodacious #toychihuahua #americanpitbull #labordayweekend #Texas #Peace #Love #Dogs,,Midland
568,1302332973652508674,I taught a group of kids Maths and Science at my home in free time on Sundays through 5 years. The knowledge base as well as adaptability surprised me on many days. I don't and won't underestimate young people.,2020-09-05 19:49:11+00:00,0,0,,,,Midland
569,1302332834594590724,More questionnaires received! Thanks @jpiihsbaseball @BaseballApaches @GraceTylerHS @Coach_KHay @coachkhope,2020-09-05 19:48:38+00:00,0,1,@jpiihsbaseball @BaseballApaches @GraceTylerHS @Coach_KHay @coachkhope,,,Midland
570,1302332832904347652,I take it we’re no longer throwing shade at Trump? Instead we’re throwing soup ,2020-09-05 19:48:38+00:00,0,2,,,,Midland
571,1302332828894588928,"I don’t think my father, the inventor of toaster strudels would be too pleased to hear about this.",2020-09-05 19:48:37+00:00,9,46,,,,Midland
572,1302332763207540736,Love it,2020-09-05 19:48:21+00:00,0,0,,,,Midland
573,1302332521494048769,Koi?,2020-09-05 19:47:23+00:00,0,0,,,,Midland
574,1302332429877882880,Coming from the Atlantic news source... If he really said that then I wouldn’t agree with him on that one. I still wouldn’t vote for Joe Hidin. Fuck that socialist bullshit.,2020-09-05 19:47:02+00:00,0,0,,,,Midland
575,1302332340962762752,La même,2020-09-05 19:46:40+00:00,0,0,,,,Midland
576,1302332338463027200,"I mean, not far away ",2020-09-05 19:46:40+00:00,0,1,,,,Midland
577,1302332255407398922,"Or a Peruvian Beer I had while in Lima on my residency called Cusqueña. Literally had this with every meal while there. If you find it in the states, pick me up a case!!!",2020-09-05 19:46:20+00:00,0,1,,,,Midland
578,1302332243990458370,Thank you! But be careful what u wish for. That also means you’re stuck w me for many years to come ,2020-09-05 19:46:17+00:00,0,1,,,,Midland
579,1302332221542617088,I’ve been craving it lately,2020-09-05 19:46:12+00:00,0,1,,,,Midland
580,1302332115539853314,"Please read my blog, A Simple Solution at http://joewillisblog.wordpress.com Teaching in the middle of a pandemic is no joke. @UEATexas @Ed_Reform @Ed4Excellence @txeduchat @educator",2020-09-05 19:45:47+00:00,0,0,@UEATexas @Ed_Reform @Ed4Excellence @txeduchat @educator,,,Midland
581,1302332020325060609,Color me shocked. Most overrated DB in UT football history.,2020-09-05 19:45:24+00:00,0,0,,,,Midland
582,1302331951060258819,Why is everything surrounded around food? Why can’t we celebrate with tea and cookies like in the old days?,2020-09-05 19:45:07+00:00,0,4,,,,Midland
583,1302331885855617024,I ate earlier. now im going to get something to eat. later I will probably eat something again. this is traditionally referred to as breakfast lunch and dinner. who else will do this?,2020-09-05 19:44:52+00:00,2,5,,,,Midland
584,1302331681806876678,,2020-09-05 19:44:03+00:00,0,2,,,,Midland
585,1302331582578135040,"Special thanks to some of the people I’ve interacted with the most on here. @KyleSchumann08 of course!!! @status_culture @JeffOnTheRight @SpencerKlavan @DanAncona @DougSloan. We may not always agree, but I know you will all challenge me and make me better. And I appreciate it.",2020-09-05 19:43:40+00:00,0,4,@KyleSchumann08 @status_culture @JeffOnTheRight @SpencerKlavan @DanAncona @DougSloan,,,Midland
586,1302331580325781505,"Little past due, but I recently topped 1k followers. Given how little time I’ve been on this platform and my relative unknown status, I would like to thank you all for following and hope that we can continue to converse and learn together.",2020-09-05 19:43:39+00:00,1,3,,,,Midland
587,1302331460259545093,Lmao this shit is hysterical to me ,2020-09-05 19:43:10+00:00,0,5,,,,Midland
588,1302331097003376640,,2020-09-05 19:41:44+00:00,0,1,,,,Midland
589,1302330984919113728,"@awfulannouncing Oh, and Tony Timpa (google him)",2020-09-05 19:41:17+00:00,0,0,@awfulannouncing,,,Midland
590,1302330980901040128,75,2020-09-05 19:41:16+00:00,0,0,,,,Midland
591,1302330936453984262,ñiqui ñiqui= coger en idioma sims,2020-09-05 19:41:06+00:00,0,1,,,,Midland
592,1302330829436342275,"James Harden, literally a professional at drawing fouls/flopping in a league with this soft officiating, averages 11.5 FTA per game. And he drives 2x as often as reggie would. I’m not necessarily saying reggie is wrong, but you saying he would average 12-16 FTA per game is wrong.",2020-09-05 19:40:40+00:00,0,0,,,,Midland
593,1302330782782980096,"Hmm, that’s about how I do it too...",2020-09-05 19:40:29+00:00,0,0,,,,Midland
594,1302330777770831872,Y VOS NO?,2020-09-05 19:40:28+00:00,0,0,,,,Midland
595,1302330774885105664,Breonna Taylor was shot 5 times by police and laid struggling to breathe as she was given no medical attention for twenty minutes! #JusticeForBreonnaTaylor,2020-09-05 19:40:27+00:00,97,152,,#JusticeForBreonnaTaylor,,Midland
596,1302330633042132997,Now your just being Kinky ,2020-09-05 19:39:53+00:00,0,1,,,,Midland
597,1302330551752437762,Or this!!! Had it at a local Beer Garden and got hooked. Beer garden closed due to #COVID though so not sure where to buy it now .,2020-09-05 19:39:34+00:00,0,1,,#COVID,,Midland
598,1302330345673682948,I presume he is talking about the Uighurs and the slave labor that made the athletic equipment he practiced in.,2020-09-05 19:38:45+00:00,2,9,,,,Midland
599,1302330298571649031,"if you really cared, you wouldn’t have acted like that.",2020-09-05 19:38:33+00:00,0,2,,,,Midland
600,1302330171417079809,PUTA,2020-09-05 19:38:03+00:00,0,0,,,,Midland
601,1302330145630498816,tu trolo jiij,2020-09-05 19:37:57+00:00,0,1,,,,Midland
602,1302330100592017409,Merci,2020-09-05 19:37:46+00:00,0,0,,,,Midland
603,1302329997642944512,"Want to know how many guys average 12-16 free throw attempts per game? Zero. Reggie didn’t go to the rack anyway, no chance he averages 12 attempts a game shooting J’s.",2020-09-05 19:37:22+00:00,0,0,,,,Midland
604,1302329980035137537,@SamuelAdamsBeer Oktoberfest or @ZiegenBockBeer. Both are great choices.,2020-09-05 19:37:18+00:00,0,1,@SamuelAdamsBeer @ZiegenBockBeer,,,Midland
605,1302329796492324865,Erin Casey Richardson and Katherine Prementine reminding all of us to remain vigilant and safe. ,2020-09-05 19:36:34+00:00,0,2,,,,Midland
606,1302329739353391110, ,2020-09-05 19:36:20+00:00,0,0,,,,Midland
607,1302329737247961088,And brain dead,2020-09-05 19:36:20+00:00,0,0,,,,Midland
608,1302329701474668552,tortas de mierda todas putas,2020-09-05 19:36:11+00:00,0,0,,,,Midland
609,1302329580221607936,Hell no - ship them back from where they came,2020-09-05 19:35:42+00:00,1,33,,,,Midland
610,1302329568020312065, ,2020-09-05 19:35:39+00:00,0,1,,,,Midland
611,1302329520381480965,"Por cierto pichon de claria.. el che era un singao asesino hijo de puta.. mato a cientos en la cabana, en africa y en bolivia",2020-09-05 19:35:28+00:00,0,1,,,,Midland
612,1302329470834147331,We also need Justice for Wallace Howell in Odessa Texas. He died after this beating alone in his cell no medical attention given ! https://www.oaoa.com/wallace-howell-bodycam-footage-part-1/video_d4aebc8c-eeda-11ea-b5ef-031192b2ec6b.html?mode=jqm #JusticeForBreonnaTaylor,2020-09-05 19:35:16+00:00,10,8,,#JusticeForBreonnaTaylor,,Midland
613,1302329453289394177,Holy shit does this make me miss grandma and her homemade fried chicken!!,2020-09-05 19:35:12+00:00,0,5,,,,Midland
614,1302329231465209857,RN stands for Refreshments and Narcotics #Nursing #ortho #NurseLife,2020-09-05 19:34:19+00:00,0,0,,#Nursing #ortho #NurseLife,,Midland
615,1302329184027578368,QUE NO WATNO CERRA EL ORTO,2020-09-05 19:34:08+00:00,0,1,,,,Midland
616,1302329133565915136,JAASJKAJKSJASJKASJASJASJASJASSAJSAJSAJASJJAS,2020-09-05 19:33:56+00:00,0,0,,,,Midland
617,1302329086950465536, tienen a todas estas clarias boca arriba jajajaja,2020-09-05 19:33:45+00:00,0,2,,,,Midland
618,1302329048664858630,"Herschel bout to dance in the endzone on Biden. I formation, 11 lead. You ain’t stopping it, can only try to limit the damage.",2020-09-05 19:33:35+00:00,1,0,,,,Midland
619,1302328834415644674,va entonces perfe,2020-09-05 19:32:44+00:00,0,0,,,,Midland
620,1302328760675467266,We’re gonna have to take a girls trip ,2020-09-05 19:32:27+00:00,0,1,,,,Midland
621,1302328730187112450,10 2 4 - on the way,2020-09-05 19:32:20+00:00,0,4,,,,Midland
622,1302328720406052864,C’est la vérité,2020-09-05 19:32:17+00:00,0,0,,,,Midland
623,1302328673572474880,No,2020-09-05 19:32:06+00:00,0,0,,,,Midland
624,1302328670250557441,Serena Williams looks slow and old for the first time in her life,2020-09-05 19:32:05+00:00,0,2,,,,Midland
625,1302328642295521280,JAJAJSJSAJASAJ COGER PERO EN EL IDIOMA DE LOS SIMS,2020-09-05 19:31:59+00:00,0,0,,,,Midland
626,1302328526343942144,pero si hacemos ñiki ñiki antes no importa,2020-09-05 19:31:31+00:00,0,0,,,,Midland
627,1302328398988050434,"For real though, Favorite NFL and College football team. Wrong answers will lead to fake unfollows.",2020-09-05 19:31:01+00:00,0,1,,,,Midland
628,1302328194071228416,Thank you Midland for submitting your Thank A Hero messages. Please take the time to share your uplifting messages at http://midlandhealth.org/ThankAHero,2020-09-05 19:30:12+00:00,0,0,,,,Midland
629,1302327967712972801,quien para ñiqui ñiqui,2020-09-05 19:29:18+00:00,0,5,,,,Midland
630,1302327954253455366,How do you calculate standard deviations?,2020-09-05 19:29:15+00:00,0,1,,,,Midland
631,1302327890403565571,Congratulations!!!! ,2020-09-05 19:28:59+00:00,0,1,,,,Midland
632,1302327843259584513,"Like it’s supposed to be stereotypical black culture to eat fried chicken and greens, yet my family went to grandmas every Sunday after church and that was our meal. Whiter than snow. It’s just what we ate. Or BBQ. We can celebrate our differences and our similarities.",2020-09-05 19:28:48+00:00,0,5,,,,Midland
633,1302327759667159041,when I have a kid I’ll make him listen to indie music so when ppl ask what his fav song is it’ll be some underground shit and everyone will be impressed,2020-09-05 19:28:28+00:00,1,1,,,,Midland
634,1302327619770351617, ,2020-09-05 19:27:55+00:00,0,0,,,,Midland
635,1302327501725880326,HELP YES,2020-09-05 19:27:27+00:00,0,0,,,,Midland
636,1302327429453807616,"One of the favorite things we do at work (multinational corp, people from everywhere) is bring food that is from our childhood. It’s amazing to see the differences and similarities across cultures with food. And then sharing stories about eating with family.",2020-09-05 19:27:09+00:00,0,9,,,,Midland
637,1302327282816647171,2 or 3,2020-09-05 19:26:34+00:00,0,0,,,,Midland
638,1302326921750085632,instalate amongas,2020-09-05 19:25:08+00:00,0,0,,,,Midland
639,1302326784604725248,They don’t like subcultures they can’t control to create a narrative.,2020-09-05 19:24:36+00:00,0,1,,,,Midland
640,1302326502994980864,"Imagine what it’s like when you’re white Seriously though, be proud of who you are and where you came from, and be proud of where you are now. 1 doesn’t eliminate the other. I’m proud of my family legacy, in this country and others.",2020-09-05 19:23:29+00:00,1,6,,,,Midland
